,Incident Number,Incident Types,Reported Date,Nearest Populated Centre,Company,Status,Latitude,Approximate Volume Released (m3),Substance,Release Type,Significant,Year,Occurrence Date and Time,Discovered Date and Time,Duration of interruption of pipeline operations,Pipeline or Facility Type,Activity being performed at time of incident,How the incident was discovered,Closed Date,Pipeline or facility equipment involved,Rupture,Released substance type,Released volume (m3),Pipe body release,Residual effects on the environment,Source of Explosion,Source of Fire,Activity at time of fatality,Number of fatalities,Type of Injury,Number of individuals injured,Workdays lost,Work restricted by injury,Conditions that resulted in the operation beyond  limits,Conditions that resulted in adverse effects on the environment,Number of people evacuated,Regulation,Pipeline Name,Pipeline outside diameter (NPS),Pipeline length (km),Substance carried,Facility Name,Facility Type,Facility latitude,Facility longitude,Country,Affects Company Property,Off Company Property,Affects Pipeline right-of-way,Affects off Pipeline right-of-way,Population Density,Kilometre post,Emergency Level,Investigation Type,Was NEB Staff Deployed,Related NEB event number,Equipment or component involved,Design standard,Nominal pipe size,Material,Material grade,Schedule,Design wall thickness (mm),Custom design wall thickness (mm),Actual wall thickness (mm),Licensed maximum operating pressure (kPa),Restricted operating pressure (kPa),Actual operating pressure at time of failure (kPa),Designed depth of cover (m),Actual depth of cover (m),Year of manufacture,Year of installation,Year when put into service,Most recent cathodic protection reading at incident site (mV vs. Cu/CuSO4),Weld type ,Seam type,Seam joining method,Seam clock position,Coating location,Coating type,Coating condition,Application method,Year when the coating was applied,Insulation installed,Repair type,Repair date,Equipment or component has never been inspected,Most recent inspection date for the failed equipment or component,Type of most recent inspection,Most recent inspection part of the routine inspection program,No maintenance done on this equipment or component,Date of the most recent maintenance work for the failed equipment or component,Most recent maintenance Type,Most recent maintenance work part of the routine maintenance program,Longitude,Release of substance,Alberta,Manitoba,British Columbia,Saskatchewan,Ontario,New Brunswick,Nova Scotia,Quebec,Northwest Territories,Natural,Unknown Land,Forests,Industrial,Agricultural Cropland,Shrub Land,Vegetative Barren,Tundra / Native Prairie / Parks,Barren Land,Small Commeicial,Water / Wetlands,Residential,Frost heave,Freeze-thaw,Frozen components,Soil/Slope,High winds,Rains/Floods,Adverse weather,Month of occurrence,Spring,Summer,Fall,Winter
0,INC2008-001,Release of Substance,1/2/2008,Cromer,Enbridge Pipelines Inc.,Closed,49.73135,8,Crude Oil - Sweet,Liquid,No,2008,2008-01-02,2008/01/02 11:30:00 AM Central,,,Operation,Employee / Contractor (Onsite),1/11/2011,Yes,No,Crude Oil - Sweet,8,No,No,,,,,,,,,,,0,OPR,EPI - Cromer Terminal,,,,,,,,Canada,Yes,No,No,No,0,,Level I,Standard Review - 168 days,No,,"Station/Facility, Pumping, Flange, Gasket/O-ring",,,,,,,,,,,,,,,,,,,,,,,,,,,No,Type B Sleeve (Pressure Containing),1/11/2008,No,,,No,No,1/11/2008,Repair,No,-101.23557,1,0,1,0,0,0,0,0,0,0,0,1,0,0,0,0,0,0,0,0,0,0,0,0,0,0,0,0,0,1,0,0,0,1
1,INC2008-004,Release of Substance,1/23/2008,Cromer,Enbridge Pipelines Inc.,Closed,49.73135,100,Crude Oil - Sweet,Liquid,No,2008,2008-01-23,2008/01/23 06:05:00 AM Mountain,,,Operation,Employee / Contractor (Onsite),8/10/2011,Yes,No,Crude Oil - Sweet,100,No,No,,,,,,,,,,,0,OPR,EPI - Cromer Terminal,,,,,,,,Canada,Yes,No,No,No,0,Mile Post 595.8,Level I,Standard Review - 168 days,No,,"Station/Facility, Pumping, Flange, Gasket/O-ring",,NPS 30,,,,,,,0,,,,,,,,,,,,,,,,,,No,Replacement,1/24/2008,No,,,No,No,,Replacement,No,-101.23557,1,0,1,0,0,0,0,0,0,0,0,1,0,0,0,0,0,0,0,0,0,0,0,0,0,0,0,0,0,1,0,0,0,1
2,INC2008-008,Release of Substance,1/29/2008,Fort Nelson,"Westcoast Energy Inc., carrying on business as Spectra Energy Transmission",Closed,58.012,0,Natural Gas - Sweet,Gas,No,2008,2008-01-26,2008/01/26 10:45:00 AM Pacific,,,Operation,Employee / Contractor (Onsite),7/27/2012,Yes,No,Natural Gas - Sweet,0,No,No,,,,,,,,,,,0,OPR,,,,,,,,,Canada,Yes,No,No,No,0,,Level I,Standard Review - 168 days,No,,"Station/Facility, Compression, Flange",,,,,,,,,0,,,,1.2,,,,,,,,,,,,,,No,,,No,,,No,No,,,No,-122.694333,1,0,0,1,0,0,0,0,0,0,0,1,0,0,0,0,0,0,0,0,0,0,0,0,0,0,0,0,0,1,0,0,0,1
3,INC2008-009,"Release of Substance, Adverse Environmental Effects",1/29/2008,Taylor,"Westcoast Energy Inc., carrying on business as Spectra Energy Transmission",Closed,56.14377,0,Potassium Hydroxide (caustic solution),Miscellaneous,Yes,2008,2008-01-27,2008/01/27 12:01:00 AM Mountain,,,Operation,,11/13/2012,Yes,No,Potassium Hydroxide (caustic solution),0,No,Yes,,,,,,,,,,,0,PPR,,,,,,,,,Canada,No,No,No,No,0,,Level I,Standard Review - 168 days,No,,,,,,,,,,,,,,,,,,,,,,,,,,,,,No,,,No,,,No,No,,,No,-120.51605,1,0,0,1,0,0,0,0,0,0,0,1,0,0,0,0,0,0,0,0,0,0,0,0,0,0,0,0,0,1,0,0,0,1
4,INC2008-016,Release of Substance,2/23/2008,Beiseker,Foothills Pipe Lines Ltd.,Closed,51.385029,0,Natural Gas - Sweet,Gas,No,2008,2008-02-22,2008/02/23 12:00:00 AM Mountain,,,Operation,Employee / Contractor (Onsite),7/27/2012,Yes,No,Natural Gas - Sweet,0,No,No,,,,,,,,,,,0,OPR,,,,,,,,,Canada,No,No,Yes,No,0,Mainline Valve + Offset (km) MLV 61-121-NC,Level I,Standard Review - 168 days,No,,"Pipeline, Valve, Ball, Bonnet",,NPS 30,,,,,,,0,,,,,,,,,,,,,,,,,,No,Rebuilt,3/25/2008,No,,,No,No,3/25/2008,Repair,No,-113.535263,1,1,0,0,0,0,0,0,0,0,0,1,0,0,0,0,0,0,0,0,0,0,0,0,0,0,0,0,0,2,0,0,0,1
5,INC2008-018,Release of Substance,2/25/2008,Moosomin,TransCanada PipeLines Limited,Closed,50.20739,100,Natural Gas - Sweet,Gas,No,2008,2008-02-25,2008/02/25 08:09:00 AM Mountain,,,Construction,Employee / Contractor (Onsite),1/19/2011,Yes,No,Natural Gas - Sweet,100,No,No,,,,,,,,,,,0,OPR,LINE 100-1,"508.00000000, 762.00000000, 863.60000000",2595.724534,Natural Gas,,,,,Canada,Yes,No,No,No,0,,Level I,Standard Review - 168 days,No,,"Pipeline, Fitting, Tee, Body",,NPS 1/4,,,,,,,0,,,,,,,,,,,,,,,,,,No,,,No,,,No,No,,,No,-101.48731,1,0,0,0,1,0,0,0,0,0,0,1,0,0,0,0,0,0,0,0,0,0,0,0,0,0,0,0,0,2,0,0,0,1
6,INC2008-020,Release of Substance,3/3/2008,Dryden,TransCanada PipeLines Limited,Closed,49.7894,0,Natural Gas - Sweet,Gas,No,2008,2008-03-02,2008/03/02 10:30:00 AM Eastern,,,Operation,Employee / Contractor (Onsite),7/27/2012,Yes,No,Natural Gas - Sweet,0,No,No,,,,,,,,,,,0,OPR,TCPL - Station 55 (Dryden Compressor Station),,,,,,,,Canada,Yes,No,No,No,0,,Level I,Standard Review - 168 days,No,,"Station/Facility, Compression, Compressor",,,,,,,,,0,,,,,,,,,,,,,,,,,,No,Replacement,3/13/2008,No,,,No,No,3/13/2008,Replacement,No,-92.76549,1,0,0,0,0,1,0,0,0,0,0,1,0,0,0,0,0,0,0,0,0,0,0,0,0,0,0,0,0,3,1,0,0,0
7,INC2008-021,Release of Substance,3/3/2008,Smooth Rock Falls,TransCanada PipeLines Limited,Closed,49.30391,18,Natural Gas - Sweet,Gas,No,2008,2008-03-01,2008/03/01 04:45:00 PM Mountain,,,Operation,Public,1/19/2011,No,No,Natural Gas - Sweet,18,No,No,,,,,,,,,,,0,OPR,TCPL - MLV 97,,,,,,,,Canada,No,No,Yes,No,0,,Level I,Standard Review - 168 days,No,,,,,,,,,,,,,,,,,,,,,,,,,,,,,No,Replacement,,No,,,No,No,,Replacement,No,-82.04386,1,0,0,0,0,1,0,0,0,0,0,1,0,0,0,0,0,0,0,0,0,0,0,0,0,0,0,0,0,3,1,0,0,0
8,INC2008-027,Release of Substance,3/14/2008,Rapid City,TransCanada PipeLines Limited,Closed,50.07673,0,Natural Gas - Sweet,Gas,No,2008,2008-03-14,2008/03/14 01:30:00 PM Central,,,Operation,Employee / Contractor (Onsite),7/23/2012,Yes,No,Natural Gas - Sweet,0,No,No,,,,,,,,,,,0,OPR,MLV 30-4,,,,,,,,Canada,Yes,No,No,No,0,Mainline Valve + Offset (km) 30-4,Level I,Standard Review - 168 days,No,,"Pipeline, Pipe, Body;Station/Facility, Compression, Piping, Weld",,NPS 2,,,,,,,0,,,,,,,,,,,,,,,,,,No,Replacement,,No,,,No,No,,Replacement,No,-99.99864,1,0,1,0,0,0,0,0,0,0,0,1,0,0,0,0,0,0,0,0,0,0,0,0,0,0,0,0,0,3,1,0,0,0
9,INC2008-034,Release of Substance,4/1/2008,Haileybury,TransCanada PipeLines Limited,Closed,47.44678,0,Natural Gas - Sweet,Gas,No,2008,,2008/03/31 01:17:00 AM Mountain,,Transmission,Construction,,7/23/2012,No,No,Natural Gas - Sweet,0,No,No,,,,,,,,,,,0,OPR,LINE 100-1,"508.00000000, 762.00000000, 863.60000000",2595.724534,Natural Gas,,,,,Canada,No,No,No,No,0,,Level I,Standard Review - 168 days,No,,"Station/Facility, Compression, Fitting, Other (please explain)",,NPS 1,,,,,,,0,,,,,,,,,,,,,,,,,,No,Replacement,9/21/2008,No,,,No,No,9/21/2008,Replacement,No,-79.76267,1,0,0,0,0,1,0,0,0,0,0,1,0,0,0,0,0,0,0,0,0,0,0,0,0,0,0,0,0,3,1,0,0,0
10,INC2008-030,Fatality,3/24/2008,Kerrobert,Enbridge Pipelines Inc.,Closed,51.92095,0,Not Applicable,Not Applicable,Yes,2008,2008-03-24,2008/03/24 09:50:00 AM Mountain,,Transmission,Maintenance,Employee / Contractor (Onsite),12/15/2010,No,No,,,,No,,,Construction,1,,,,,,,0,OPR,Line 4,"1219.00000000, 864.00000000, 914.00000000",1248.909872,Crude Oil,,,,,Canada,Yes,No,No,No,0,,Level I,Standard Review - 168 days,No,,,,,,,,,,,,,,,,,,,,,,,,,,,,,No,,,No,,,No,No,,,No,-109.17023,0,0,0,0,1,0,0,0,0,0,0,1,0,0,0,0,0,0,0,0,0,0,0,0,0,0,0,0,0,3,1,0,0,0
11,INC2008-037,Release of Substance,4/18/2008,Kenora,TransCanada PipeLines Limited,Closed,49.80823,0,Natural Gas - Sweet,Gas,No,2008,2008-04-16,2008/04/16 02:30:00 PM Eastern,,,Maintenance,Employee / Contractor (Onsite),7/27/2012,Yes,No,Natural Gas - Sweet,0,No,No,,,,,,,,,,,0,OPR,,,,,,,,,Canada,Yes,No,No,No,0,Mainline Valve + Offset (km) 50-2,Level I,Standard Review - 168 days,No,,"Pipeline, Fitting, Nipple, Thread",,,,,,,,,,,,,,,,,,,,,,,,,,,No,Replacement,,No,,,No,No,,Replacement,No,-94.18954,1,0,0,0,0,1,0,0,0,0,0,1,0,0,0,0,0,0,0,0,0,0,0,0,0,0,0,0,0,4,1,0,0,0
12,INC2008-039,Release of Substance,4/21/2008,Regina,"Plains Marketing Canada, L.P.",Closed,50.48057,4,Crude Oil - Sweet,Liquid,No,2008,2008-04-21,2008/04/21 07:00:00 AM Mountain,,,Operation,Employee / Contractor (Onsite),7/23/2012,Yes,No,Crude Oil - Sweet,4,No,No,,,,,,,,,,,0,OPR,,,,,,,,,Canada,Yes,No,No,No,0,Legal Subdivision NW-33-17-19 W2,Level I,Standard Review - 168 days,No,,,,,,,,,,,,,,,,,,,,,,,,,,,,,No,,,No,,,No,No,,,No,-104.56646,1,0,0,0,1,0,0,0,0,0,0,1,0,0,0,0,0,0,0,0,0,0,0,0,0,0,0,0,0,4,1,0,0,0
13,INC2008-040,Release of Substance,4/25/2008,Charlie Lake,"Westcoast Energy Inc., carrying on business as Spectra Energy Transmission",Closed,56.27973,0,Natural Gas - Sour,Gas,Yes,2008,2008-04-24,2008/04/24 07:00:00 PM Pacific,,,Operation,Employee / Contractor (Onsite),1/19/2011,Yes,No,Natural Gas - Sour,0,No,No,,,,,,,,,,,0,OPR,,,,,,,,,Canada,Yes,No,No,No,0,Kilometer Post 24.5,Level I,Standard Review - 168 days,No,,"Pipeline, Fitting, Nipple, Body",,,,,,,,,,,,,,,,,,,,,,,,,,,No,Replacement,4/24/2008,No,,,No,No,4/24/2008,Replacement,No,-120.96341,1,0,0,1,0,0,0,0,0,0,0,1,0,0,0,0,0,0,0,0,0,0,0,0,0,0,0,0,0,4,1,0,0,0
14,INC2008-041,Release of Substance,4/25/2008,Chetwynd,"Westcoast Energy Inc., carrying on business as Spectra Energy Transmission",Closed,55.33867,0,Natural Gas - Sour,Gas,Yes,2008,2008-04-15,2008/04/15 12:00:00 PM Pacific,,,Maintenance,Employee / Contractor (Onsite),8/15/2012,Yes,No,Natural Gas - Sour,0,No,No,,,,,,,,,,,0,OPR,,,,,,,,,Canada,No,No,Yes,No,0,Kilometer Post 12,Level I,Standard Review - 168 days,No,,"Pipeline, Valve, Ball, Other (please explain)",,,,,,,,,,,,,,,,,,,,,,,,,,,No,Replacement,,No,,,No,No,,Replacement,No,-121.87115,1,0,0,1,0,0,0,0,0,0,0,1,0,0,0,0,0,0,0,0,0,0,0,0,0,0,0,0,0,4,1,0,0,0
15,INC2008-043,Fire,5/1/2008,Cromer,Enbridge Pipelines Inc.,Closed,49.73115,0,Not Applicable,Not Applicable,No,2008,2008-05-01,2008/05/01 02:00:00 PM Mountain,,,Maintenance,Employee / Contractor (Onsite),7/23/2012,No,No,,,,No,,Equipment & Electrical,,,,,,,,,0,OPR,EPI - Cromer Terminal,,,,,,,,Canada,Yes,No,No,No,0,Mile Post 595.8,Level I,Standard Review - 168 days,No,,,,,,,,,,,,,,,,,,,,,,,,,,,,,No,,,No,,,No,No,,,No,-101.2355,0,0,1,0,0,0,0,0,0,0,0,1,0,0,0,0,0,0,0,0,0,0,0,0,0,0,0,0,0,5,1,0,0,0
16,INC2008-045,Release of Substance,5/6/2008,Herschel,Enbridge Pipelines Inc.,Closed,51.63826,9.4,Crude Oil - Sweet,Liquid,No,2008,2008-05-06,2008/05/06 11:45:00 AM Mountain,,,Operation,Employee / Contractor (Onsite),7/23/2012,Yes,No,Crude Oil - Sweet,9.4,No,No,,,,,,,,,,,0,OPR,EPI - Herschel Pump Station,,,,,,,,Canada,Yes,No,No,No,0,Mile Post 257,Level I,Standard Review - 168 days,No,,"Station/Facility, Pumping, Piping",,NPS 3/4,,,,,,,0,,,,,,,,,,,,,,,,,,No,Replacement,,No,,,No,No,,Replacement,No,-108.3544,1,0,0,0,1,0,0,0,0,0,0,1,0,0,0,0,0,0,0,0,0,0,0,0,0,0,0,0,0,5,1,0,0,0
17,INC2008-048,Release of Substance,5/12/2008,Regina,Enbridge Pipelines Inc.,Closed,50.48386,7,Crude Oil - Sweet,Liquid,No,2008,2008-05-11,2008/05/11 11:30:00 PM Mountain,,,Operation,Employee / Contractor (Onsite),8/10/2011,Yes,No,Crude Oil - Sweet,7,No,No,,,,,,,,,,,0,OPR,EPI - Regina Terminal,,,,,,,,Canada,Yes,No,No,No,0,,Level I,Standard Review - 168 days,No,,"Station/Facility, Metering, Receiving, Valve, Pressure relief, Other (please explain)",,,,,,,,,,,,,,,,,,,,,,,,,,,No,Replacement,5/12/2008,No,,,No,No,5/12/2008,Replacement,No,-104.61447,1,0,0,0,1,0,0,0,0,0,0,1,0,0,0,0,0,0,0,0,0,0,0,0,0,0,0,0,0,5,1,0,0,0
18,INC2008-052,Fire,5/21/2008,Emerson,TransCanada PipeLines Limited,Closed,49.00106,0,Not Applicable,Not Applicable,No,2008,2008-05-18,2008/05/18 01:35:00 PM Mountain,,,Operation,Employee / Contractor (Onsite),3/27/2009,Yes,No,,,,No,,Under Investigation or Unknown,,,,,,,,,0,OPR,,,,,,,,,Canada,Yes,No,No,No,0,Mainline Valve + Offset (km),Level I,Standard Review - 168 days,No,,"Station/Facility, Compression, Auxiliary power unit",,,,,,,,,0,,,,,,,,,,,,,,,,,,No,Replacement,,No,,,No,No,,Replacement,No,-97.05547,0,0,1,0,0,0,0,0,0,0,0,1,0,0,0,0,0,0,0,0,0,0,0,0,0,0,0,0,0,5,1,0,0,0
19,INC2008-055,Adverse Environmental Effects,5/31/2008,Fort St. John,"Westcoast Energy Inc., carrying on business as Spectra Energy Transmission",Closed,56.47564,0,Not Applicable,Not Applicable,Yes,2008,2008-05-31,2008/05/31 01:15:00 PM Mountain,,,Operation,3rd Party / Other Company,11/13/2012,No,No,,,,No,,,,,,,,,,Release of Toxic Substance,0,OPR,,,,,,,,,Canada,Yes,Yes,No,No,3,Kilometer Post,Level I,Standard Review - 168 days,No,,,,,,,,,,,,,,,,,,,,,,,,,,,,,No,,,No,,,No,No,,,No,-120.37265,0,0,0,1,0,0,0,0,0,0,0,1,0,0,0,0,0,0,0,0,0,0,0,0,0,0,0,0,0,5,1,0,0,0
20,INC2008-056,Release of Substance,6/5/2008,Edmonton,Enbridge Pipelines Inc.,Closed,53.5431,8,Crude Oil - Sweet,Liquid,No,2008,2008-06-05,2008/06/05 07:20:00 PM Mountain,,,Operation,Employee / Contractor (Onsite),7/23/2012,Yes,No,Crude Oil - Sweet,8,No,No,,,,,,,,,,,0,OPR,EPI - Edmonton Terminal,,,,,,,,Canada,Yes,No,No,No,3,Mile Post 0,Level I,Standard Review - 168 days,No,,"Storage, Tank, Aboveground",,,,,,,,,,,,,,,,,,,,,,,,,,,No,Removal,6/5/2008,No,,,No,No,6/5/2008,Repair,No,-113.35401,1,1,0,0,0,0,0,0,0,0,0,1,0,0,0,0,0,0,0,0,0,0,0,0,0,0,0,0,0,6,0,1,0,0
21,INC2008-057,Release of Substance,6/6/2008,Maple,TransCanada PipeLines Limited,Closed,43.87378,270,Natural Gas - Sweet,Gas,No,2008,2008-06-06,2008/06/06 11:23:00 AM Eastern,,,Operation,Employee / Contractor (Onsite),7/23/2012,Yes,No,Natural Gas - Sweet,270,No,No,,,,,,,,,,,0,OPR,TCPL - Station 130 (Maple Compressor Station),,,,,,,,Canada,Yes,No,No,No,3,Kilometer Post,Level I,Standard Review - 168 days,No,,,,,,,,,,,,,,,,,,,,,,,,,,,,,No,,,No,,,No,No,,,No,-79.57985,1,0,0,0,0,1,0,0,0,0,0,1,0,0,0,0,0,0,0,0,0,0,0,0,0,0,0,0,0,6,0,1,0,0
22,INC2008-058,Adverse Environmental Effects,6/9/2008,Not specified,Emera Brunswick Pipeline Company Ltd.,Closed,45.21594,0,Not Applicable,Not Applicable,Yes,2008,2008-06-09,2008/06/09 03:20:00 PM Atlantic,,,Construction,Employee / Contractor (Onsite),7/27/2012,Yes,No,,,,No,,,,,,,,,,,0,OPR,,,,,,,,,Canada,No,No,No,Yes,0,Kilometer Post 141+765,Level I,Standard Review - 168 days,No,,Vehicle / mobile equipment,,,,,,,,,,,,,,,,,,,,,,,,,,,No,,,No,,,No,No,,,No,-66.71029,0,0,0,0,0,0,1,0,0,0,0,1,0,0,0,0,0,0,0,0,0,0,0,0,0,0,0,0,0,6,0,1,0,0
23,INC2008-060,Release of Substance,6/12/2008,Portage La Prairie,TransCanada PipeLines Limited,Closed,49.91204,0,Natural Gas - Sweet,Gas,No,2008,2008-06-12,2008/06/12 05:20:00 AM Central,,,Operation,Public,7/15/2015,Yes,No,Natural Gas - Sweet,0,No,No,,,,,,,,,,,0,OPR,,,,,,,,,Canada,Yes,No,No,No,0,,Level I,Standard Review - 168 days,No,,"Station/Facility, Compression, Valve, Pressure relief, Other (please explain)",,,,,,,,,,,,,,,,,,,,,,,,,,,No,Rebuilt,6/12/2008,No,,,No,No,6/12/2008,Repair,No,-98.51757,1,0,1,0,0,0,0,0,0,0,0,1,0,0,0,0,0,0,0,0,0,0,0,0,0,0,0,0,0,6,0,1,0,0
24,INC2008-062,Fire,6/24/2008,Moyie,TransCanada PipeLines Limited,Closed,49.28795,0,Not Applicable,Not Applicable,No,2008,2008-06-23,2008/06/23 08:06:00 PM Pacific,,,Operation,Employee / Contractor (Onsite),7/27/2012,Yes,No,,,,No,,Equipment & Electrical,,,,,,,,,0,OPR,"TCPL, BC - Station 2B (Moyie Compressor Station)",,,,,,,,Canada,Yes,No,No,No,0,,Level I,Standard Review - 168 days,No,,"Station/Facility, Compression, Compressor",,,,,,,,,,,,,,,,,,,,,,,,,,,No,Replacement,,No,,,No,No,,Replacement,No,-115.83383,0,0,0,1,0,0,0,0,0,0,0,1,0,0,0,0,0,0,0,0,0,0,0,0,0,0,0,0,0,6,0,1,0,0
25,INC2008-063,Fatality,6/25/2008,Herschel,Enbridge Pipelines Inc.,Closed,51.63833,0,Not Applicable,Not Applicable,Yes,2008,2008-06-24,2008/06/24 04:30:00 PM Mountain,,,Construction,Employee / Contractor (Onsite),12/15/2010,No,No,,,,No,,,Vehicle Accident,1,,,,,,,0,OPR,Hershel Sask,,,,,,,,Canada,No,Yes,No,Yes,0,,Level III,Category C,No,,,,,,,,,,,,,,,,,,,,,,,,,,,,,No,,,No,,,No,No,,,No,-108.35487,0,0,0,0,1,0,0,0,0,0,0,1,0,0,0,0,0,0,0,0,0,0,0,0,0,0,0,0,0,6,0,1,0,0
26,INC2008-067,Release of Substance,7/6/2008,Edmonton,Enbridge Pipelines Inc.,Closed,53.54745,40,Crude Oil - Synthetic,Liquid,No,2008,2008-07-06,2008/07/06 09:00:00 AM Mountain,,,Operation,Employee / Contractor (Onsite),7/27/2012,Yes,No,Crude Oil - Synthetic,40,No,No,,,,,,,,,,,0,OPR,Edmonton Terminal,,,,,,,,Canada,Yes,No,No,No,0,,Level I,Standard Review - 168 days,No,,"Storage, Tank, Aboveground",,,,,,,,,,,,,,,,,,,,,,,,,,,No,Removal,,No,,,No,No,,Repair,No,-113.35577,1,1,0,0,0,0,0,0,0,0,0,1,0,0,0,0,0,0,0,0,0,0,0,0,0,0,0,0,0,7,0,1,0,0
27,INC2008-070,Release of Substance,7/17/2008,Moosomin,TransCanada PipeLines Limited,Closed,50.20731,0,Natural Gas - Sweet,Gas,No,2008,2008-07-16,2008/07/16 09:40:00 AM Mountain,,,Operation,Employee / Contractor (Onsite),7/23/2012,Yes,No,Natural Gas - Sweet,0,No,No,,,,,,,,,,,0,OPR,TCPL - Station 25 (Moosomin Compressor Station),,,,,,,,Canada,Yes,No,No,No,0,,Level I,Standard Review - 168 days,No,,"Station/Facility, Compression, Compressor",,NPS 3/8,Carbon Steel,,,,,,0,,,,0,,,,,,,,,,,,,,No,Replacement,7/16/2008,No,,,No,No,7/16/2008,Replacement,No,-101.48747,1,0,0,0,1,0,0,0,0,0,0,1,0,0,0,0,0,0,0,0,0,0,0,0,0,0,0,0,0,7,0,1,0,0
28,INC2008-072,Release of Substance,7/18/2008,Alameda,Alliance Pipeline Ltd.,Closed,49.31834,800,Natural Gas - Sweet,Gas,No,2008,2008-07-09,2008/07/09 03:30:00 PM Mountain,,,Operation,Employee / Contractor (Onsite),7/15/2015,Yes,No,Natural Gas - Sweet,800,No,No,,,,,,,,,,,0,OPR,Alliance - Alameda Compressor Station,,,,,,,,Canada,Yes,No,No,No,0,,Level I,Standard Review - 168 days,No,,"Station/Facility, Compression, Valve",,,,,,,,,,,,,,,,,,,,,,,,,,,No,Rebuilt,7/9/2008,No,,,No,No,7/9/2008,Repair,No,-102.28983,1,0,0,0,1,0,0,0,0,0,0,1,0,0,0,0,0,0,0,0,0,0,0,0,0,0,0,0,0,7,0,1,0,0
29,INC2008-075,Release of Substance,7/23/2008,Edmonton,Enbridge Pipelines Inc.,Closed,53.5416,2,Diesel Fuel,Liquid,No,2008,2008-07-23,2008/07/23 08:30:00 AM Mountain,,,Operation,Employee / Contractor (Onsite),8/1/2012,Yes,No,Diesel Fuel,2,No,No,,,,,,,,,,,0,OPR,EPI - Edmonton Terminal,,,,,,,,Canada,Yes,No,No,No,0,,Level I,Standard Review - 168 days,No,,"Storage, Tank, Aboveground",,,,,,,,,,,,,,,,,,,,,,,,,,,No,Replacement,8/12/2008,No,,,No,No,8/12/2008,Replacement,No,-113.36454,1,1,0,0,0,0,0,0,0,0,0,1,0,0,0,0,0,0,0,0,0,0,0,0,0,0,0,0,0,7,0,1,0,0
30,INC2008-078,Release of Substance,7/31/2008,Hearst,TransCanada PipeLines Limited,Closed,49.79469,0,Natural Gas - Sweet,Gas,No,2008,2008-07-29,2008/07/29 11:00:00 AM Mountain,,,Operation,Employee / Contractor (Onsite),7/27/2012,Yes,No,Natural Gas - Sweet,0,No,No,,,,,,,,,,,0,OPR,,,,,,,,,Canada,Yes,No,No,No,0,Mainline Valve + Offset (km) Station 84,Level I,Standard Review - 168 days,No,,"Station/Facility, Compression, Pipe",,NPS 1/4,,,,,,,0,,,,0,,,,,,,,,,,,,,No,Replacement,,No,,,No,No,,Replacement,No,-85.85655,1,0,0,0,0,1,0,0,0,0,0,1,0,0,0,0,0,0,0,0,0,0,0,0,0,0,0,0,0,7,0,1,0,0
31,INC2008-079,Release of Substance,8/8/2008,Herbert,Spectra Energy Empress Management Inc. as General Partner and Agent for Spectra Energy Empress L.P.,Closed,50.539202,0.5,Propane,Gas,No,2008,2008-07-12,2008/07/12 12:00:00 AM Mountain,,,Operation,Employee / Contractor (Onsite),7/23/2012,Yes,No,Propane,0.5,No,No,,,,,,,,,,,0,OPR,,,,,,,,,Canada,Yes,No,No,No,3,,Level I,Standard Review - 168 days,No,,"Station/Facility, Pumping, Pump",,,,,,,,,0,,,,,,,,,,,,,,,,,,No,Replacement,7/13/2008,No,,,No,No,7/13/2008,Replacement,No,-107.30766,1,0,0,0,1,0,0,0,0,0,0,1,0,0,0,0,0,0,0,0,0,0,0,0,0,0,0,0,0,7,0,1,0,0
32,INC2008-080,Serious Injury (CER or TSB),8/15/2008,Valemount,Trans Mountain Pipeline ULC,Closed,53.024796,0,Not Applicable,Not Applicable,Yes,2008,2008-08-14,2008/08/14 08:00:00 PM Mountain,,,Construction,Employee / Contractor (Onsite),12/15/2010,No,No,,,,No,,,,,Fracture,1,,No,,,0,OPR,TMX Anchor Loop,"762.00000000, 914.00000000",158.1950834,Crude Oil,,,,,Canada,No,No,Yes,No,0,Kilometer Post 439,Level III,Category C,Yes,,,,,,,,,,,,,,,,,,,,,,,,,,,,,No,,,No,,,No,No,,,No,-119.151198,0,0,0,1,0,0,0,0,0,0,0,1,0,0,0,0,0,0,0,0,0,0,0,0,0,0,0,0,0,8,0,1,0,0
33,INC2008-084,Fire,8/26/2008,Not specified,Enbridge Pipelines Inc.,Closed,51.10223,0,Not Applicable,Not Applicable,No,2008,2008-08-25,2008/08/25 02:10:00 PM Central,,,Construction,Employee / Contractor (Onsite),8/15/2012,Yes,No,,,,No,,Equipment & Electrical,,,,,,,,,0,OPR,Line 3,"610.00000000, 864.00000000, 914.00000000, 914.40000000",2334.948756,Crude Oil,,,,,Canada,No,No,Yes,Yes,3,Mile Post 252,Level I,Standard Review - 168 days,No,,Vehicle / mobile equipment,,,,,,,,,0,,,,,,,,,,,,,,,,,,No,,,No,,,No,No,,,No,-106.35299,0,0,0,0,1,0,0,0,0,0,0,1,0,0,0,0,0,0,0,0,0,0,0,0,0,0,0,0,0,8,0,1,0,0
34,INC2008-085,Fire,9/4/2008,Not specified,Enbridge Pipelines Inc.,Closed,51.44373,0,Not Applicable,Not Applicable,No,2008,2008-09-04,2008/09/04 11:43:00 AM Central,,Transmission,Maintenance,Employee / Contractor (Onsite),12/21/2010,No,No,,,,No,,Equipment & Electrical,,,,,,,,,0,OPR,Line 4,"1219.00000000, 864.00000000, 914.00000000",1248.909872,Crude Oil,,,,,Canada,Yes,No,No,No,0,,Level I,Standard Review - 168 days,No,,,,,,,,,,,,,,,,,,,,,,,,,,,,,No,,,No,,,No,No,,,No,-107.37839,0,0,0,0,1,0,0,0,0,0,0,1,0,0,0,0,0,0,0,0,0,0,0,0,0,0,0,0,0,9,0,0,1,0
35,INC2008-086,Release of Substance,8/28/2008,Vermilion Bay,TransCanada PipeLines Limited,Closed,49.85542,0,Natural Gas - Sweet,Gas,No,2008,2008-08-28,2008/08/28 11:30:00 AM Eastern,,,Operation,Employee / Contractor (Onsite),1/19/2011,Yes,No,Natural Gas - Sweet,0,No,No,,,,,,,,,,,0,OPR,,,,,,,,,Canada,No,No,Yes,No,3,Mainline Valve + Offset (km) MLV50 + 11.163,Level I,Standard Review - 168 days,No,,"Pipeline, Pipe, Body",,,,,,,,,,,,,,,,,,,,,6 o'clock,,,,,,No,,,No,,,No,No,,,No,-93.36393,1,0,0,0,0,1,0,0,0,0,0,1,0,0,0,0,0,0,0,0,0,0,0,0,0,0,0,0,0,8,0,1,0,0
36,INC2008-087,Release of Substance,9/5/2008,Taylor,"Westcoast Energy Inc., carrying on business as Spectra Energy Transmission",Closed,56.14631,0.1,Butane,Gas,No,2008,2008-09-05,2008/09/05 07:00:00 AM Pacific,,,Construction,,7/27/2012,Yes,No,Butane,0.1,No,No,,,,,,,,,,,0,PPR,,,,,,,,,Canada,No,No,No,No,0,,Level I,Standard Review - 168 days,No,,Processing Plant,,,,,,,,,,,,,,,,,,,,,,,,,,,No,Replacement,,No,,,No,No,,Replacement,No,-120.6692,1,0,0,1,0,0,0,0,0,0,0,1,0,0,0,0,0,0,0,0,0,0,0,0,0,0,0,0,0,9,0,0,1,0
37,INC2008-091,Serious Injury (CER or TSB),9/16/2008,Pennfield,Emera Brunswick Pipeline Company Ltd.,Closed,45.1982,0,Not Applicable,Not Applicable,Yes,2008,2008-09-15,2008/09/15 12:00:00 AM Mountain,,,Operation,Employee / Contractor (Onsite),7/27/2012,No,No,,,,No,,,,,Fracture,1,,No,,,0,OPR,,,,,,,,,Canada,Yes,No,No,No,0,Off the Right of Way,Level I,Standard Review - 168 days,No,,,,,,,,,,,,,,,,,,,,,,,,,,,,,No,Replacement,,No,,,No,No,,Replacement,No,-66.6422,0,0,0,0,0,0,1,0,0,0,0,1,0,0,0,0,0,0,0,0,0,0,0,0,0,0,0,0,0,9,0,0,1,0
38,INC2008-097,Fire,10/7/2008,Huntsville,TransCanada PipeLines Limited,Closed,45.33806,0,Not Applicable,Not Applicable,No,2008,2008-10-06,2008/10/06 02:30:00 PM Mountain,,,Operation,Employee / Contractor (Onsite),4/14/2010,No,No,,,,No,,Equipment & Electrical,,,,,,,,,0,OPR,,,,,,,,,Canada,No,No,No,Yes,3,Kilometer Post,Level I,Standard Review - 168 days,No,,"Pipeline, Auxiliary device(s) (please explain)",,,,,,,,,,,,,,,,,,,,,,,,,,,No,Replacement,10/13/2008,No,,,No,No,10/13/2008,Replacement,No,-79.24126,0,0,0,0,0,1,0,0,0,0,0,1,0,0,0,0,0,0,0,0,0,0,0,0,0,0,0,0,0,10,0,0,1,0
39,INC2008-092,Serious Injury (CER or TSB),9/16/2008,Valemount,Trans Mountain Pipeline Inc.,Closed,52.83128,0,Not Applicable,Not Applicable,Yes,2008,2008-09-16,2008/09/16 05:00:00 PM Pacific,,,Construction,Employee / Contractor (Onsite),11/4/2008,No,No,,,,No,,,,,Fracture,1,,No,,,0,OPR,,,,,,,,,Canada,No,No,Yes,No,0,Kilometer Post 458.1,Level I,Standard Review - 168 days,No,,,,,,,,,,,,,,,,,,,,,,,,,,,,,No,,,No,,,No,No,,,No,-119.2645,0,0,0,1,0,0,0,0,0,0,1,1,0,0,0,0,0,0,0,0,0,0,0,0,0,0,0,0,1,9,0,0,1,0
40,INC2008-095,Release of Substance,9/26/2008,Falcon Lake,TransCanada PipeLines Limited,Closed,49.68098,0,Natural Gas - Sweet,Gas,No,2008,2008-09-25,2008/09/25 03:35:00 PM Mountain,,,Operation,Employee / Contractor (Onsite),7/27/2012,Yes,No,Natural Gas - Sweet,0,No,No,,,,,,,,,,,0,OPR,LINE 100-1,"508.00000000, 762.00000000, 863.60000000",2595.724534,Natural Gas,,,,,Canada,No,No,Yes,No,0,,Level I,Standard Review - 168 days,No,,"Pipeline, Pipe, Body",,NPS 30,,359 - X52,,9.5 mm = 0.375 in,,,6048,,,,,,1957,,,,,,,External,Asphalt Mastic,,Field Applied,,No,Replacement,10/19/2008,No,,,No,No,10/19/2008,Replacement,No,-95.37458,1,0,1,0,0,0,0,0,0,0,0,1,0,0,0,0,0,0,0,0,0,0,0,0,0,0,0,0,0,9,0,0,1,0
41,INC2008-098,Release of Substance,10/16/2008,Portage La Prairie,TransCanada PipeLines Limited,Closed,49.91211,0,Natural Gas - Sweet,Gas,No,2008,2008-10-16,2008/10/16 02:30:00 PM Mountain,,,Operation,Employee / Contractor (Onsite),7/27/2012,Yes,No,Natural Gas - Sweet,0,No,No,,,,,,,,,,,0,OPR,LINE 100-2,"508.00000000, 609.60000000, 762.00000000, 863.60000000, 914.40000000",3393.42642,Natural Gas,,,,,Canada,Yes,No,No,No,0,Mainline Valve + Offset (km) MLV 34 + 0,Level I,Standard Review - 168 days,No,,"Station/Facility, Compression, Pipe",,NPS 1/2,,,,,,,0,,,,,,,,,,,,,,,,,,No,Replacement,10/18/2008,No,,,No,No,10/18/2008,Replacement,No,-98.51757,1,0,1,0,0,0,0,0,0,0,0,1,0,0,0,0,0,0,0,0,0,0,0,0,0,0,0,0,0,10,0,0,1,0
42,INC2008-103,Release of Substance,11/4/2008,Reynolds,TransCanada PipeLines Limited,Closed,49.65789,0,Natural Gas - Sweet,Gas,No,2008,2008-11-03,2008/11/03 02:00:00 PM Mountain,,,Operation,Employee / Contractor (Onsite),7/27/2012,Yes,No,Natural Gas - Sweet,0,No,No,,,,,,,,,,,0,OPR,TCPL - Station 43 (Spruce Compresor Station),,,,,,,,Canada,Yes,No,No,No,0,,Level I,Standard Review - 168 days,No,,"Station/Facility, Compression, Valve, Pressure relief, Other (please explain)",,NPS 2,,,,,,,0,,,,,,,,,,,,,,,,,,No,Replacement,11/3/2008,No,,,No,No,11/3/2008,Replacement,No,-96.16268,1,0,1,0,0,0,0,0,0,0,0,1,0,0,0,0,0,0,0,0,0,0,0,0,0,0,0,0,0,11,0,0,1,0
43,INC2008-109,"Fire, Release of Substance",11/20/2008,Taylor,"Westcoast Energy Inc., carrying on business as Spectra Energy Transmission",Closed,56.14652,0.005,Mixed HVP Hydrocarbons,Gas,No,2008,2008-11-17,2008/11/17 02:00:00 PM Mountain,,,Operation,,7/27/2012,Yes,No,Mixed HVP Hydrocarbons,0.005,No,No,,Equipment & Electrical,,,,,,,,,0,PPR,,,,,,,,,Canada,No,No,No,No,0,,Level I,Standard Review - 168 days,No,,"Processing Plant, Sulphur plant",,,,,,,,,,,,,,,,,,,,,,,,,,,No,Replacement,,No,,,No,No,,Replacement,No,-120.66937,1,0,0,1,0,0,0,0,0,0,0,1,0,0,0,0,0,0,0,0,0,0,0,0,0,0,0,0,0,11,0,0,1,0
44,INC2008-110,Release of Substance,11/21/2008,Fort Nelson,"Westcoast Energy Inc., carrying on business as Spectra Energy Transmission",Closed,59.20196,10,Condensate,Liquid,No,2008,2008-11-20,2008/11/20 12:00:00 PM Mountain,,,Operation,Employee / Contractor (Onsite),8/15/2012,Yes,No,Condensate,10,No,No,,,,,,,,,,,0,OPR,WEI - Cabin Lake Booster Station,,,,,,,,Canada,Yes,No,No,No,0,,Level I,Standard Review - 168 days,No,,,,,,,,,,,,,,,,,,,,,,,,,,,,,No,,,No,,,No,No,,,No,-121.5963,1,0,0,1,0,0,0,0,0,0,0,1,0,0,0,0,0,0,0,0,0,0,0,0,0,0,0,0,0,11,0,0,1,0
45,INC2008-111,Release of Substance,11/26/2008,Chetwynd,"Westcoast Energy Inc., carrying on business as Spectra Energy Transmission",Closed,55.56932,10,Amine,Miscellaneous,No,2008,2008-11-26,2008/11/26 03:00:00 AM Pacific,,,Operation,,7/30/2012,Yes,No,Amine,10,No,No,,,,,,,,,,,0,PPR,,,,,,,,,Canada,No,No,No,No,3,,Level I,Standard Review - 168 days,No,,"Processing Plant, Sulphur plant",,,,,,,,,,,,,,,,,,,,,,,,,,,No,Replacement,,No,,,No,No,,Replacement,No,-121.94466,1,0,0,1,0,0,0,0,0,0,0,1,0,0,0,0,0,0,0,0,0,0,0,0,0,0,0,0,0,11,0,0,1,0
46,INC2008-112,Fire,11/26/2008,McLeod Lake,"Westcoast Energy Inc., carrying on business as Spectra Energy Transmission",Closed,55.03189,0,Not Applicable,Not Applicable,No,2008,2008-11-26,2008/11/26 04:25:00 PM Eastern,,,Maintenance,Employee / Contractor (Onsite),7/27/2012,Yes,No,,,,No,,Equipment & Electrical,,,,,,,,,0,OPR,WEI - McLeod Lake Compressor Station,,,,,,,,Canada,Yes,No,No,No,3,,Level I,Standard Review - 168 days,No,,"Station/Facility, Compression, Compressor",,,,,,,,,,,,,,,,,,,,,,,,,,,No,,,No,,,No,No,,,No,-123.03117,0,0,0,1,0,0,0,0,0,0,0,1,0,0,0,0,0,0,0,0,0,0,0,0,0,0,0,0,0,11,0,0,1,0
47,INC2008-113,"Release of Substance, Adverse Environmental Effects",12/1/2008,Chetwynd,"Westcoast Energy Inc., carrying on business as Spectra Energy Transmission",Closed,55.5692,2,Glycol,Miscellaneous,Yes,2008,2008-11-30,2008/11/30 08:45:00 PM Mountain,,,Operation,,7/27/2012,Yes,No,Glycol,2,No,No,,,,,,,,,,,0,PPR,,,,,,,,,Canada,No,No,No,No,3,Kilometer Post,Level I,Standard Review - 168 days,No,,,,,,,,,,,,,,,,,,,,,,,,,,,,,No,,,No,,,No,No,,,No,-121.94446,1,0,0,1,0,0,0,0,0,0,0,1,0,0,0,0,0,0,0,0,0,0,0,0,0,0,0,0,0,11,0,0,1,0
48,INC2008-114,Release of Substance,12/2/2008,Winnipeg,TransCanada PipeLines Limited,Closed,49.68017,0,Natural Gas - Sweet,Gas,No,2008,2008-11-28,2008/11/28 04:33:00 PM Central,,,Operation,Employee / Contractor (Onsite),7/27/2012,Yes,No,Natural Gas - Sweet,0,No,No,,,,,,,,,,,0,OPR,LINE 100-1,"508.00000000, 762.00000000, 863.60000000",2595.724534,Natural Gas,,,,,Canada,No,No,Yes,No,3,Mainline Valve + Offset (km),Level I,Standard Review - 168 days,No,,"Station/Facility, Metering, Delivering, Valve, Ball, Other (please explain)",,,,,,,,,,,,,,,,,,,,,,,,,,,No,Rebuilt,11/28/2008,No,,,No,No,11/28/2008,Repair,No,-96.64917,1,0,1,0,0,0,0,0,0,0,0,1,0,0,0,0,0,0,0,0,0,0,0,0,0,0,0,0,0,11,0,0,1,0
49,INC2008-115,Fire,12/2/2008,Charlie Lake,"Westcoast Energy Inc., carrying on business as Spectra Energy Transmission",Closed,56.63822,0,Not Applicable,Not Applicable,No,2008,2008-12-02,2008/12/02 08:45:00 AM Pacific,,,Operation,Employee / Contractor (Onsite),2/12/2015,Yes,No,,,,No,,Equipment & Electrical,,,,,,,,,0,OPR,WEI - Booster Station #3 - Kobes,,,,,,,,Canada,Yes,No,No,No,3,Mile Post,Level I,Standard Review - 168 days,No,,,,,,,,,,,,,,,,,,,,,,,,,,,,,No,,,No,,,No,No,,,No,-121.65102,0,0,0,1,0,0,0,0,0,0,0,1,0,0,0,0,0,0,0,0,0,0,0,0,0,0,0,0,0,12,0,0,0,1
50,INC2008-119,Release of Substance,12/8/2008,McLeod Lake,"Westcoast Energy Inc., carrying on business as Spectra Energy Transmission",Closed,55.032,0,Natural Gas - Sweet,Gas,No,2008,2008-12-05,2008/12/05 04:50:00 PM Pacific,,,Operation,Employee / Contractor (Onsite),7/27/2012,Yes,No,Natural Gas - Sweet,0,No,No,,,,,,,,,,,0,OPR,WEI - McLeod Lake Compressor Station,,,,,,,,Canada,Yes,No,No,No,3,,Level I,Standard Review - 168 days,No,,"Station/Facility, Compression, Fitting",,,,,,,,,,,,,,,,,,,,,,,,,,,No,Replacement,,No,,,No,No,,Replacement,No,-123.03098,1,0,0,1,0,0,0,0,0,0,0,1,0,0,0,0,0,0,0,0,0,0,0,0,0,0,0,0,0,12,0,0,0,1
51,INC2008-120,Release of Substance,12/9/2008,Winnipeg,TransCanada PipeLines Limited,Closed,49.75544,0,Natural Gas - Sweet,Gas,No,2008,2008-12-08,2008/12/08 09:30:00 AM Mountain,,,Operation,Employee / Contractor (Onsite),1/19/2011,Yes,No,Natural Gas - Sweet,0,No,No,,,,,,,,,,,0,OPR,,,,,,,,,Canada,Yes,No,No,No,3,Mainline Valve + Offset (km) 18km West of Winnipeg,Level I,Standard Review - 168 days,No,,"Pipeline, Fitting, Nipple, Body",,NPS 1/2,,,,,,,0,,,,,,,,,,,,,,,,,,No,,,No,,,No,No,,,No,-97.2305,1,0,1,0,0,0,0,0,0,0,0,1,0,0,0,0,0,0,0,0,0,0,0,0,0,0,0,0,0,12,0,0,0,1
52,INC2008-121,Adverse Environmental Effects,12/10/2008,Goldboro,EnCana Corporation,Closed,45.18253,0,Not Applicable,Not Applicable,Yes,2008,2008-12-03,2008/12/03 03:00:00 PM Atlantic,,,Construction,Employee / Contractor (Onsite),7/23/2012,No,No,,,,No,,,,,,,,,,,0,OPR,,,,,,,,,Canada,No,No,No,Yes,3,100meters off shore,Level I,Standard Review - 168 days,No,,"Pipeline, Pipe, Body",,,,,,,,,,,,,,,,,,,,,,,,,,,No,,,No,,,No,No,,,No,-61.65236,0,0,0,0,0,0,0,1,0,0,0,1,0,0,0,0,0,0,0,0,0,0,0,0,0,0,0,0,0,12,0,0,0,1
53,INC2008-123,Fire,12/17/2008,Edmonton,Enbridge Pipelines Inc.,Closed,53.5474,0,Not Applicable,Not Applicable,No,2008,2008-12-15,2008/12/15 10:55:00 AM Mountain,,,Construction,Employee / Contractor (Onsite),7/27/2012,No,No,,,,No,,Under Investigation or Unknown,,,,,,,,,0,OPR,EPI - Edmonton Terminal,,,,,,,,Canada,Yes,No,No,No,6,Kilometer Post,Level I,Standard Review - 168 days,No,,"Station/Facility, Compression, Compressor",,,,,,,,,0,,,,,,,,,,,,,,,,,,No,,,No,,,No,No,,,No,-113.35571,0,1,0,0,0,0,0,0,0,0,0,1,0,0,0,0,0,0,0,0,0,0,0,0,0,0,0,0,0,12,0,0,0,1
54,INC2008-128,Release of Substance,1/13/2009,Hearst,TransCanada PipeLines Limited,Closed,49.76492,0,Natural Gas - Sweet,Gas,No,2009,2008-02-04,2008/12/14 12:00:00 AM Mountain,,,Operation,Employee / Contractor (Onsite),7/23/2012,Yes,No,Natural Gas - Sweet,0,No,No,,,,,,,,,,,0,OPR,TCPL - Station 86 (Hearst Compressor Station),,,,,,,,Canada,Yes,No,No,No,0,,Level I,Standard Review - 168 days,No,,"Station/Facility, Compression, Pipe",,,,,,,,,,,,,,,,,,,,,,,,,,,No,Replacement,12/14/2008,No,,,No,No,12/14/2008,Replacement,No,-84.91824,1,0,0,0,0,1,0,0,0,0,0,1,0,0,0,0,0,0,0,0,0,0,0,0,0,0,0,0,0,2,0,0,0,1
55,INC2009-002,Release of Substance,1/15/2009,Lincoln,TransCanada PipeLines Limited,Closed,43.11405,0,Natural Gas - Sweet,Gas,No,2009,2009-01-14,2009/01/14 11:00:00 PM Eastern,,,Operation,Employee / Contractor (Onsite),7/23/2012,Yes,No,Natural Gas - Sweet,0,No,No,,,,,,,,,,,0,OPR,TCPL - Station 211 (Lincoln Compressor Station),,,,,,,,Canada,Yes,No,No,No,0,Mile Post 211,Level I,Standard Review - 168 days,No,,"Station/Facility, Compression, Pipe",,,,,,,,,0,,,,,,,,,,,,,,,,,,No,Replacement,1/15/2009,No,,,No,No,1/15/2009,Replacement,No,-79.46307,1,0,0,0,0,1,0,0,0,0,0,1,0,0,0,0,0,0,0,0,0,0,0,0,0,0,0,0,0,1,0,0,0,1
56,INC2009-009,Serious Injury (CER or TSB),2/9/2009,White City,Enbridge Pipelines Inc.,Closed,50.44344,0,Not Applicable,Not Applicable,Yes,2009,2009-02-09,2009/02/09 03:30:00 PM Mountain,,,Construction,Employee / Contractor (Onsite),12/22/2010,No,No,,,,No,,,,,Fracture,1,,No,,,0,OPR,,,,,,,,,Canada,Yes,No,No,No,5,Off the Right of Way,Level III,Category C,Yes,,,,,,,,,,,,,,,,,,,,,,,,,,,,,No,,,No,,,No,No,,,No,-104.35655,0,0,0,0,1,0,0,0,0,0,0,1,0,0,0,0,0,0,0,0,0,0,0,0,0,0,0,0,0,2,0,0,0,1
57,INC2009-010,Release of Substance,2/9/2009,Lincoln,TransCanada PipeLines Limited,Closed,43.11368,0,Fuel Gas,Gas,No,2009,2009-02-06,2009/02/06 07:07:00 PM Eastern,,,Operation,Employee / Contractor (Onsite),7/27/2012,Yes,No,Fuel Gas,0,No,No,,,,,,,,,,,0,OPR,,,,,,,,,Canada,Yes,No,No,No,0,Mile Post 211,Level I,Standard Review - 168 days,No,,"Station/Facility, Compression, Pipe",,,,,,,,,,,,,,,,,,,,,,,,,,,No,Replacement,2/6/2009,No,,,No,No,2/6/2009,Replacement,No,-79.46307,1,0,0,0,0,1,0,0,0,0,0,1,0,0,0,0,0,0,0,0,0,0,0,0,0,0,0,0,0,2,0,0,0,1
58,INC2009-019,Release of Substance,3/5/2009,Portage La Prairie,TransCanada PipeLines Limited,Closed,49.91175,2.5,Lube Oil,Liquid,No,2009,2009-03-04,2009/03/04 04:20:00 PM Central,,,Operation,Employee / Contractor (Onsite),7/23/2012,Yes,No,Lube Oil,2.5,No,No,,,,,,,,,,,0,OPR,TCPL - Station 34 (Portage La Prarie Comp. Stn),,,,,,,,Canada,Yes,No,No,No,0,,Level I,Standard Review - 168 days,No,,"Station/Facility, Compression, Pipe",,NPS 1/2,,,,,,,0,,,,,,,,,,,,,,,,,,No,Replacement,,No,,,No,No,,Replacement,No,-98.51757,1,0,1,0,0,0,0,0,0,0,0,1,0,0,0,0,0,0,0,0,0,0,0,0,0,0,0,0,0,3,1,0,0,0
59,INC2009-015,"Serious Injury (CER or TSB), Release of Substance",2/20/2009,Wonowon,"Westcoast Energy Inc., carrying on business as Spectra Energy Transmission",Closed,56.72686,0.0001,Natural Gas - Sour,Gas,Yes,2009,2009-02-20,2009/02/20 09:00:00 AM Mountain,,Transmission,Operation,Employee / Contractor (Onsite),7/23/2012,Yes,Yes,Natural Gas - Sour,0.0001,No,No,,,,,Lost Consciousness,2,,No,,,0,OPR,,,,,,,,,Canada,Yes,No,No,No,3,Kilometer Post,Level III,Category C,Yes,,"Station/Facility, Pigging, Launching, Piping",API,NPS 18,Carbon Steel,290 - X42,,9.5 mm = 0.375 in,,,800,,,,,,,,,,Straight,Electric Resistance Welded,,Internal,,,,,No,Rebuilt,,No,,,No,No,,Repair,No,-121.81832,1,0,0,1,0,0,0,0,0,0,0,1,0,0,0,0,0,0,0,0,0,0,0,0,0,0,0,0,0,2,0,0,0,1
60,INC2009-021,Release of Substance,3/10/2009,Potter,TransCanada PipeLines Limited,Closed,48.87172,0,Natural Gas - Sweet,Gas,No,2009,2009-03-09,2009/03/09 10:43:00 AM Mountain,,,Operation,Employee / Contractor (Onsite),7/27/2012,Yes,No,Natural Gas - Sweet,0,No,No,,,,,,,,,,,0,OPR,TCPL - Station 102 (Potter Compressor Station),,,,,,,,Canada,Yes,No,No,No,0,,Level I,Standard Review - 168 days,No,,"Station/Facility, Compression, Pipe",,,,,,,,,0,,,,,,,,,,,,,,,,,,No,Replacement,3/9/2009,No,,,No,No,3/9/2009,Replacement,No,-80.89396,1,0,0,0,0,1,0,0,0,0,0,1,0,0,0,0,0,0,0,0,0,0,0,0,0,0,0,0,0,3,1,0,0,0
61,INC2009-024,Serious Injury (CER or TSB),3/13/2009,Sarnia,Enbridge Pipelines Inc.,Closed,42.97494,0,Not Applicable,Not Applicable,Yes,2009,2009-03-13,2009/03/13 04:30:00 PM Eastern,,,Maintenance,Employee / Contractor (Onsite),12/22/2010,No,No,,,,No,,,,,Lost Consciousness,1,,No,,,0,OPR,EPI - Sarnia Pump Station,,,,,,,,Canada,No,Yes,No,Yes,0,Off the Right of Way,Level I,Standard Review - 168 days,No,,,,,,,,,,,,,,,,,,,,,,,,,,,,,No,,,No,,,No,No,,,No,-82.40703,0,0,0,0,0,1,0,0,0,0,0,1,0,0,0,0,0,0,0,0,0,0,0,0,0,0,0,0,0,3,1,0,0,0
62,INC2009-026,Release of Substance,3/23/2009,Not specified,"Westcoast Energy Inc., carrying on business as Spectra Energy Transmission",Closed,57.31724,0,Natural Gas - Sour,Gas,Yes,2009,,2009/03/23 04:30:00 PM Mountain,,,Operation,Employee / Contractor (Onsite),7/27/2012,Yes,No,Natural Gas - Sour,0,No,No,,,,,,,,,,,0,OPR,"10"" Dahl Pipeline",273.1,30.95531555,Natural Gas Sour,,,,,Canada,Yes,No,No,No,0,,Level I,Standard Review - 168 days,No,,"Station/Facility, Metering, Delivering, Piping",,NPS 1/4,,,,,,,0,,,,,,,,,,,,,,,,,,No,Replacement,,No,,,No,No,,Replacement,No,-120.82153,1,0,0,1,0,0,0,0,0,0,0,1,0,0,0,0,0,0,0,0,0,0,0,0,0,0,0,0,0,3,1,0,0,0
63,INC2009-032,Release of Substance,4/8/2009,Mattice,TransCanada PipeLines Limited,Closed,49.58574,0,Natural Gas - Sweet,Gas,No,2009,2009-04-08,2009/04/08 09:30:00 AM Mountain,,,Operation,Employee / Contractor (Onsite),12/4/2013,Yes,No,Natural Gas - Sweet,0,No,No,,,,,,,,,,,0,OPR,TCPL - Station 92 (Mattice Compressor Station),,,,,,,,Canada,Yes,No,No,No,0,Mainline Valve + Offset (km),Level I,Standard Review - 168 days,No,,"Station/Facility, Compression, Pipe",,,,,,,,,,,,,,,,,,,,,,,,,,,No,Rebuilt,4/9/2009,No,,,No,No,4/9/2009,Repair,No,-83.16712,1,0,0,0,0,1,0,0,0,0,1,1,0,0,0,0,0,0,0,0,0,0,1,0,0,0,0,0,0,4,1,0,0,0
64,INC2009-031,Release of Substance,4/7/2009,Tumbler Ridge,"Westcoast Energy Inc., carrying on business as Spectra Energy Transmission",Closed,54.97941,0,Natural Gas - Sour,Gas,Yes,2009,2009-04-07,2009/04/07 02:00:00 PM Pacific,,,Operation,Employee / Contractor (Onsite),12/4/2013,Yes,No,Natural Gas - Sour,0,No,No,,,,,,,,,,,0,OPR,,,,,,,,,Canada,Yes,No,No,No,0,,Level I,Standard Review - 168 days,No,,"Pipeline, Valve, Ball, Seal/Packing",,,,,,,,,,,,,,,,,,,,,,,,,,,No,Replacement,,No,,,No,No,,Replacement,No,-121.06074,1,0,0,1,0,0,0,0,0,0,0,1,0,0,0,0,0,0,0,0,0,0,0,0,0,0,0,0,0,4,1,0,0,0
65,INC2009-034,Release of Substance,4/23/2009,Hamilton,TransCanada PipeLines Limited,Closed,43.35064,0,Natural Gas - Sweet,Gas,No,2009,,2009/04/20 03:40:00 PM Eastern,,,Operation,Employee / Contractor (Onsite),7/27/2012,Yes,No,Natural Gas - Sweet,0,No,No,,,,,,,,,,,0,OPR,TCPL - Station 1301 (Kirkwall Compressor Station),,,,,,,,Canada,Yes,No,No,No,0,,Level I,Standard Review - 168 days,No,,"Station/Facility, Compression, Piping, Weld",,NPS 1,Stainless Steel,,,,,,0,,,,,,,,,,,,,,,,,,No,Replacement,,No,,,No,No,,Replacement,No,-80.1193,1,0,0,0,0,1,0,0,0,0,0,1,0,0,0,0,0,0,0,0,0,0,0,0,0,0,0,0,0,4,1,0,0,0
66,INC2009-035,"Fire, Release of Substance",4/23/2009,Fort Nelson,"Westcoast Energy Inc., carrying on business as Spectra Energy Transmission",Closed,58.65325,0.004,Sulphur,Miscellaneous,No,2009,,2009/04/19 10:15:00 AM Mountain,,,Operation,,7/27/2012,Yes,No,Sulphur,0.004,No,No,,Equipment & Electrical,,,,,,,,,0,PPR,WEI - Fort Nelson Gas Plant,,,,,,,,Canada,No,No,No,No,0,,Level I,Standard Review - 168 days,No,,,,,,,,,,,,,,,,,,,,,,,,,,,,,No,,,No,,,No,No,,,No,-122.68501,1,0,0,1,0,0,0,0,0,0,0,1,0,0,0,0,0,0,0,0,0,0,0,0,0,0,0,0,0,4,1,0,0,0
67,INC2009-036,Release of Substance,4/30/2009,Taylor,"Westcoast Energy Inc., carrying on business as Spectra Energy Transmission",Closed,56.14652,0,Natural Gas - Sour,Gas,Yes,2009,2009-04-09,2009/04/09 06:29:00 AM Pacific,,,Operation,,5/29/2009,Yes,No,Natural Gas - Sour,0,No,No,,,,,,,,,,,0,PPR,WEI - McMahon Gas Plant (Taylor Gas Plant),,,,,,,,Canada,No,No,No,No,0,,Level I,Standard Review - 168 days,No,,"Processing Plant, Flare",ASME,,,,,,,,0,,,,,,,,,,,,,,,,,,No,,,No,,,No,No,,,No,-120.66917,1,0,0,1,0,0,0,0,0,0,0,1,0,0,0,0,0,0,0,0,0,0,0,0,0,0,0,0,0,4,1,0,0,0
68,INC2009-037,Release of Substance,5/1/2009,Upsala,TransCanada PipeLines Limited,Closed,49.03329,0,Natural Gas - Sweet,Gas,No,2009,2009-05-01,2009/05/01 08:45:00 AM Mountain,,,Operation,Employee / Contractor (Onsite),7/27/2012,Yes,No,Natural Gas - Sweet,0,No,No,,,,,,,,,,,0,OPR,TCPL - Station 62 (Upsala Compressor Station),,,,,,,,Canada,Yes,No,No,No,0,,Level I,Standard Review - 168 days,No,,"Station/Facility, Compression, Pipe",,,,,,,,,,,,,,,,,,,,,,,,,,,No,Replacement,5/1/2009,No,,,No,No,5/1/2009,Replacement,No,-90.51006,1,0,0,0,0,1,0,0,0,0,0,1,0,0,0,0,0,0,0,0,0,0,0,0,0,0,0,0,0,5,1,0,0,0
69,INC2009-039,Release of Substance,5/7/2009,Vegreville,NOVA Gas Transmission Ltd.,Closed,53.63705,0,Natural Gas - Sweet,Gas,No,2009,2009-05-06,2009/05/06 01:35:00 PM Mountain,,,Operation,Employee / Contractor (Onsite),7/27/2012,Yes,No,Natural Gas - Sweet,0,No,No,,,,,,,,,,,0,OPR,,,,,,,,,Canada,Yes,No,No,No,0,,Level I,Standard Review - 168 days,No,,,,NPS 3/8,,,,,,,0,,,,,,,,,,,,,,,,,,No,Replacement,5/7/2009,No,,,No,No,5/7/2009,Replacement,No,-112.01828,1,1,0,0,0,0,0,0,0,0,0,1,0,0,0,0,0,0,0,0,0,0,0,0,0,0,0,0,0,5,1,0,0,0
70,INC2009-040,Release of Substance,5/7/2009,Burnaby,Trans Mountain Pipeline ULC,Closed,49.26849,305,Crude Oil - Sweet,Liquid,No,2009,2009-05-06,2009/05/06 10:00:00 PM Mountain,,,Maintenance,Employee / Contractor (Onsite),6/3/2011,Yes,No,Crude Oil - Sweet,305,No,No,,,,,,,,,,,0,OPR,,,,,,,,,Canada,Yes,No,No,No,0,,Level III,Category C,Yes,REM-0083,,,,,,,,,,,,,,,,,,,,,,,,,,,,No,,,No,,,No,No,,,No,-122.93134,1,0,0,1,0,0,0,0,0,0,0,1,0,0,0,0,0,0,0,0,0,0,0,0,0,0,0,0,0,5,1,0,0,0
71,INC2009-041,Release of Substance,5/11/2009,Valleyview,NOVA Gas Transmission Ltd.,Closed,54.93272,0,Natural Gas - Sweet,Gas,No,2009,2009-05-11,2009/05/11 08:15:00 AM Mountain,,,Operation,Employee / Contractor (Onsite),7/27/2012,Yes,No,Natural Gas - Sweet,0,No,No,,,,,,,,,,,0,OPR,,,,,,,,,Canada,No,No,Yes,No,0,,Level I,Standard Review - 168 days,No,,,,,,,,,,,,,,,,,,,,,,,,,,,,,No,,,No,,,No,No,,,No,-117.25214,1,1,0,0,0,0,0,0,0,0,0,1,0,0,0,0,0,0,0,0,0,0,0,0,0,0,0,0,0,5,1,0,0,0
72,INC2009-042,Release of Substance,5/14/2009,Not specified,TransCanada PipeLines Limited,Closed,45.31394,0,Natural Gas - Sweet,Gas,No,2009,2009-05-07,2009/05/07 09:15:00 AM Mountain,,,Operation,Employee / Contractor (Onsite),7/23/2012,Yes,No,Natural Gas - Sweet,0,No,No,,,,,,,,,,,0,OPR,TCPL - Station 802 (Candiac Compressor Station),,,,,,,,Canada,Yes,No,No,No,0,,Level I,Standard Review - 168 days,No,,"Station/Facility, Compression, Valve",,,,,,,,,,,,,,,,,,,,,,,,,,,No,,,No,,,No,No,,,No,-73.48289,1,0,0,0,0,0,0,0,1,0,0,1,0,0,0,0,0,0,0,0,0,0,0,0,0,0,0,0,0,5,1,0,0,0
73,INC2009-043,Fire,5/15/2009,Fort Nelson,"Westcoast Energy Inc., carrying on business as Spectra Energy Transmission",Closed,58.65334,0,Not Applicable,Not Applicable,No,2009,2009-05-15,2009/05/15 12:30:00 PM Mountain,,,Operation,,7/23/2012,No,No,,,,No,,Equipment & Electrical,,,,,,,,,0,PPR,WEI - Fort Nelson Gas Plant,,,,,,,,Canada,No,No,No,No,0,,Level I,Standard Review - 168 days,No,,,,,,,,,,,,,,,,,,,,,,,,,,,,,No,,,No,,,No,No,,,No,-122.68482,0,0,0,1,0,0,0,0,0,0,0,1,0,0,0,0,0,0,0,0,0,0,0,0,0,0,0,0,0,5,1,0,0,0
74,INC2009-045,Release of Substance,5/22/2009,Rosetown,Kinder Morgan Cochin ULC,Closed,51.55484,6.36,Propane,Gas,No,2009,2009-05-22,2009/05/22 06:00:00 AM Central,,,Operation,Employee / Contractor (Onsite),7/23/2012,Yes,No,Propane,6.36,No,No,,,,,,,,,,,0,OPR,Cochin Soveriegn Station,,,,,,,,Canada,Yes,No,No,No,0,,Level I,Standard Review - 168 days,No,,"Station/Facility, Compression, Pipe",,,,,,,,,,,,,,,,,,,,,,,,,,,No,Rebuilt,5/22/2009,No,,,No,No,5/22/2009,Repair,No,-107.996,1,0,0,0,1,0,0,0,0,0,0,1,0,0,0,0,0,0,0,0,0,0,0,0,0,0,0,0,0,5,1,0,0,0
75,INC2009-047,Fire,5/24/2009,Chetwynd,"Westcoast Energy Inc., carrying on business as Spectra Energy Transmission",Closed,55.56925,0,Not Applicable,Not Applicable,No,2009,2009-05-24,2009/05/24 10:00:00 AM Mountain,,,Operation,,10/5/2012,Yes,No,,,,No,,Equipment & Electrical,,,,,,,,,0,PPR,WEI - Pine River Gas Plant,,,,,,,,Canada,No,No,No,No,0,,Level I,Standard Review - 168 days,No,,"Processing Plant, Sulphur plant",,,,,,,,,,,,,,,,,,,,,,,,,,,No,,,No,,,No,No,,,No,-121.94485,0,0,0,1,0,0,0,0,0,0,0,1,0,0,0,0,0,0,0,0,0,0,0,0,0,0,0,0,0,5,1,0,0,0
76,INC2009-048,Release of Substance,5/27/2009,Wandering River,NOVA Gas Transmission Ltd.,Closed,55.67738,0,Natural Gas - Sweet,Gas,No,2009,2009-05-25,2009/05/25 12:00:00 AM Mountain,,,Operation,Employee / Contractor (Onsite),7/23/2012,Yes,No,Natural Gas - Sweet,0,No,No,,,,,,,,,,,0,OPR,NGTL - North Duncan Meter Station,,,,,,,,Canada,Yes,No,No,No,0,,Level I,Standard Review - 168 days,No,,"Station/Facility, Metering, Delivering, Valve, Pressure relief, Bonnet",,,,,,,,,,,,,,,,,,,,,,,,,,,No,Replacement,,No,,,No,No,,Replacement,No,-112.18288,1,1,0,0,0,0,0,0,0,0,0,1,0,0,0,0,0,0,0,0,0,0,0,0,0,0,0,0,0,5,1,0,0,0
77,INC2009-049,Release of Substance,6/3/2009,Vegreville,NOVA Gas Transmission Ltd.,Closed,53.63705,0,Natural Gas - Sweet,Gas,No,2009,2009-06-02,2009/06/02 12:00:00 PM Eastern,,,Operation,Employee / Contractor (Onsite),7/23/2012,Yes,No,Natural Gas - Sweet,0,No,No,,,,,,,,,,,0,OPR,NGTL - Ben's Lake Compressor Station,,,,,,,,Canada,Yes,No,No,No,0,,Level I,Standard Review - 168 days,No,,"Station/Facility, Compression, Pipe",,NPS 3/8,Stainless Steel,,,,,,0,,,,,,,,,,,,,,,,,,No,Replacement,,No,,,No,No,,Replacement,No,-112.01829,1,1,0,0,0,0,0,0,0,0,0,1,0,0,0,0,0,0,0,0,0,0,0,0,0,0,0,0,0,6,0,1,0,0
78,INC2009-053,Release of Substance,6/22/2009,Loreburn,Alliance Pipeline Ltd.,Closed,51.2719,0,Natural Gas - Sweet,Gas,No,2009,2009-06-19,2009/06/19 09:15:00 AM Mountain,,,Operation,Employee / Contractor (Onsite),7/27/2012,Yes,No,Natural Gas - Sweet,0,No,No,,,,,,,,,,,0,OPR,Alliance - Loreburn Mainline Compressor Station,,,,,,,,Canada,Yes,No,No,No,0,,Level I,Standard Review - 168 days,No,,"Station/Facility, Compression, Fitting, Nipple, Weld",,NPS 1/2,,,,,,,0,,,,,,,,,,,,,,,,,,No,Rebuilt,6/20/2009,No,,,No,No,6/20/2009,Repair,No,-106.75421,1,0,0,0,1,0,0,0,0,0,0,1,0,0,0,0,0,0,0,0,0,0,0,0,0,0,0,0,0,6,0,1,0,0
79,INC2009-054,Release of Substance,6/28/2009,Falcon Lake,TransCanada PipeLines Limited,Closed,49.68123,0,Natural Gas - Sweet,Gas,No,2009,2009-06-28,2009/06/28 12:35:00 PM Mountain,,,Operation,Employee / Contractor (Onsite),7/27/2012,Yes,No,Natural Gas - Sweet,0,No,No,,,,,,,,,,,0,OPR,TCPL - Station 45 (Falcon Lake Compressor Station),,,,,,,,Canada,Yes,No,No,No,0,Mainline Valve + Offset (km),Level I,Standard Review - 168 days,No,,"Pipeline, Pipe, Body;Station/Facility, Compression, Auxiliary device(s) (please explain)",,NPS 3,,,,,,,0,,,,,,,,,,,,,,,,,,No,Replacement,,No,,,No,No,,Replacement,No,-95.37458,1,0,1,0,0,0,0,0,0,0,0,1,0,0,0,0,0,0,0,0,0,0,0,0,0,0,0,0,0,6,0,1,0,0
80,INC2009-055,Release of Substance,6/29/2009,Colborne,Enbridge Pipelines Inc.,Closed,44.06958,1.8,Crude Oil - Sweet,Liquid,No,2009,2009-06-29,2009/06/29 09:00:00 AM Eastern,,,Operation,Employee / Contractor (Onsite),7/27/2012,Yes,No,Crude Oil - Sweet,1.8,No,No,,,,,,,,,,,0,OPR,Line 9,"508.00000000, 762.00000000",859.7003376,Crude Oil,,,,,Canada,Yes,No,No,No,0,,Level I,Standard Review - 168 days,No,,"Station/Facility, Pumping, Valve",,,,,,,,,,,,,,,,,,,,,,,,,,,No,Replacement,6/29/2009,No,,,No,No,6/29/2009,Replacement,No,-77.92945,1,0,0,0,0,1,0,0,0,0,0,1,0,0,0,0,0,0,0,0,0,0,0,0,0,0,0,0,0,6,0,1,0,0
81,INC2009-056,Release of Substance,7/1/2009,Kobes,"Westcoast Energy Inc., carrying on business as Spectra Energy Transmission",Closed,56.4929924,0,Natural Gas - Sour,Gas,Yes,2009,2009-06-27,2009/06/27 08:30:00 PM Pacific,,,Operation,Employee / Contractor (Onsite),10/4/2012,Yes,No,Natural Gas - Sour,0,No,No,,,,,,,,,,,0,OPR,,,,,,,,,Canada,Yes,No,No,No,0,,Level I,Standard Review - 168 days,No,,"Station/Facility, Compression, Fitting",,,,,,,,,0,,,,,,,,,,,,,,,,,,No,,,No,,,No,No,,,No,-121.335434,1,0,0,1,0,0,0,0,0,0,0,1,0,0,0,0,0,0,0,0,0,0,0,0,0,0,0,0,0,6,0,1,0,0
82,INC2009-057,Operation Beyond Design Limits,7/2/2009,Saint-Eustache,Trans-Northern Pipelines Inc.,Closed,45.55865,0,Not Applicable,Not Applicable,No,2009,2009-07-01,2009/07/01 06:50:00 PM Eastern,,,Operation,Employee / Contractor (Onsite),12/19/2013,Yes,No,,,,No,,,,,,,,,Over Pressure,,0,OPR,Mainline,273.1,635.0188165,Refined Products-Aviation,,,,,Canada,Yes,No,No,No,0,Mile Post 29,Level I,Standard Review - 168 days,No,,"Station/Facility, Pumping, Pump;Station/Facility, Pumping, Instrumentation and controls;Station/Facility, Pumping, Valve, Ball, Other (please explain)",,,,,,,,,,,,,,,,,,,,,,,,,,,No,,,No,,,No,No,,,No,-73.89602,0,0,0,0,0,0,0,0,1,0,0,1,0,0,0,0,0,0,0,0,0,0,0,0,0,0,0,0,0,7,0,1,0,0
83,INC2009-058,"Fire, Release of Substance",7/5/2009,Hanna,NOVA Gas Transmission Ltd.,Closed,51.728528,17000,Natural Gas - Sweet,Gas,No,2009,2009-07-04,2009/07/04 09:04:00 PM Mountain,,Transmission,Operation,Employee / Contractor (Onsite),7/30/2012,Yes,No,Natural Gas - Sweet,17000,No,No,,Under Investigation or Unknown,,,,,,,,,0,OPR,,,,,,,,,Canada,No,No,Yes,No,0,,Level III,Category C,Yes,,"Pipeline, Pipe, Body",,NPS 6,,,,,,,0,,,,,,,,,,,,,,,,,,No,Replacement,7/9/2009,No,,,No,No,7/9/2009,Replacement,No,-111.6805,1,1,0,0,0,0,0,0,0,0,1,1,0,0,0,0,0,0,0,0,0,0,0,0,0,0,0,0,0,7,0,1,0,0
84,INC2009-060,Release of Substance,7/13/2009,Fort Nelson,"Westcoast Energy Inc., carrying on business as Spectra Energy Transmission",Closed,58.93456,4,Natural Gas - Sour,Gas,Yes,2009,2009-07-13,2009/07/13 04:00:00 PM Pacific,,,Operation,Employee / Contractor (Onsite),7/17/2012,Yes,No,Natural Gas - Sour,4,No,No,,,,,,,,,,,0,OPR,,,,,,,,,Canada,Yes,Yes,No,No,0,,Level I,Standard Review - 168 days,No,,,,,,,,,,,,,,,,,,,,,,,,,,,,,No,,,No,,,No,No,,,No,-121.3121,1,0,0,1,0,0,0,0,0,0,0,1,0,0,0,0,0,0,0,0,0,0,0,0,0,0,0,0,0,7,0,1,0,0
85,INC2009-063,Release of Substance,7/15/2009,Smokey Lake,NOVA Gas Transmission Ltd.,Closed,54.09552,0,Natural Gas - Sweet,Gas,No,2009,2009-07-14,2009/07/14 01:15:00 PM Mountain,,,Operation,Employee / Contractor (Onsite),7/30/2012,Yes,No,Natural Gas - Sweet,0,No,No,,,,,,,,,,,0,OPR,NGTL - Smoky Lake Compressor Station,,,,,,,,Canada,Yes,No,No,No,3,,Level I,Standard Review - 168 days,No,,"Station/Facility, Compression, Valve",,,,,,,,,,,,,,,,,,,,,,,,,,,No,Rebuilt,7/14/2009,No,,,No,No,7/14/2009,Repair,No,-112.31043,1,1,0,0,0,0,0,0,0,0,0,1,0,0,0,0,0,0,0,0,0,0,0,0,0,0,0,0,0,7,0,1,0,0
86,INC2009-065,Fire,7/16/2009,Wainwright,NOVA Gas Transmission Ltd.,Closed,52.75424,0,Not Applicable,Not Applicable,No,2009,2009-07-15,2009/07/15 03:20:00 PM Mountain,,,Operation,Employee / Contractor (Onsite),12/22/2010,No,No,,,,No,,Under Investigation or Unknown,,,,,,,,,0,OPR,NGTL - Wainwright Compressor Station,,,,,,,,Canada,Yes,No,No,No,3,,Level I,Standard Review - 168 days,No,,,,,,,,,,,,,,,,,,,,,,,,,,,,,No,,,No,,,No,No,,,No,-110.74467,0,1,0,0,0,0,0,0,0,0,0,1,0,0,0,0,0,0,0,0,0,0,0,0,0,0,0,0,0,7,0,1,0,0
87,INC2009-066,"Fire, Release of Substance",7/20/2009,Hay River,NOVA Gas Transmission Ltd.,Closed,58.208389,1450000,Natural Gas - Sweet,Gas,Yes,2009,2009-07-20,2009/07/20 11:02:00 AM Mountain,,Transmission,Operation,Employee / Contractor (Onsite),8/3/2012,Yes,Yes,Natural Gas - Sweet,1450000,No,No,,Under Investigation or Unknown,,,,,,,,,0,OPR,,,,,,,,,Canada,Yes,No,No,No,0,Legal Subdivision,Level III,Category C,Yes,,"Pipeline, Pipe, Body",CSA,NPS 20,Carbon Steel,359 - X52,,7.1 mm = 0.280 in,,,5650,,,,,1968,1968,1968,,,Straight,Double Submerged Arc Welding,9 o'clock,External,,Disbonded,Field Applied,1968,No,Replacement,8/5/2009,No,,,No,No,8/5/2009,Replacement,No,-118.501722,1,1,0,0,0,0,0,0,0,0,0,1,0,0,0,0,0,0,0,0,0,0,0,0,0,0,0,0,0,7,0,1,0,0
88,INC2009-067,Release of Substance,7/20/2009,Saint John,Emera Brunswick Pipeline Company Ltd.,Closed,45.26269,0,Natural Gas - Sweet,Gas,No,2009,2009-07-11,2009/07/11 02:00:00 PM Mountain,,,Operation,Employee / Contractor (Onsite),8/1/2012,Yes,No,Natural Gas - Sweet,0,No,No,,,,,,,,,,,0,OPR,Emera - Red Head Metre Station,,,,,,,,Canada,Yes,No,No,No,0,,Level I,Standard Review - 168 days,No,,"Station/Facility, Metering, Delivering, Piping",,,,,,,,,,,,,,,,,,,,,,,,,,,No,Replacement,,No,,,No,No,,Replacement,No,-65.98211,1,0,0,0,0,0,1,0,0,0,0,1,0,0,0,0,0,0,0,0,0,0,0,0,0,0,0,0,0,7,0,1,0,0
89,INC2009-068,Release of Substance,7/21/2009,Crowsnest Pass,NOVA Gas Transmission Ltd.,Closed,49.62622,0,Natural Gas - Sweet,Gas,No,2009,2009-07-20,2009/07/20 10:30:00 AM Mountain,,,Operation,Employee / Contractor (Onsite),7/30/2012,Yes,No,Natural Gas - Sweet,0,No,No,,,,,,,,,,,0,OPR,"NGTL - 36"" Western Alberta System Loop",,,,,,,,Canada,No,No,Yes,No,0,,Level I,Standard Review - 168 days,No,,"Pipeline, Pipe, Body;Pipeline, Fitting, Tee, Body",,NPS 36,,,,,,,0,,,,,,,,,,,,,,,,,,No,Rebuilt,7/30/2009,No,,,No,No,7/30/2009,Repair,No,-114.51601,1,1,0,0,0,0,0,0,0,0,0,1,0,0,0,0,0,0,0,0,0,0,0,0,0,0,0,0,0,7,0,1,0,0
90,INC2009-072,Fire,7/24/2009,Not specified,"Westcoast Energy Inc., carrying on business as Spectra Energy Transmission",Closed,56.83306,0,Not Applicable,Not Applicable,No,2009,2009-07-23,2009/07/23 09:00:00 PM Mountain,,,Operation,Employee / Contractor (Onsite),10/4/2012,No,No,,,,No,,Equipment & Electrical,,,,,,,,,0,OPR,WEI - Compressor Station N4,,,,,,,,Canada,Yes,No,No,No,0,,Level I,Standard Review - 168 days,No,,,,,,,,,,,,,,,,,,,,,,,,,,,,,No,,,No,,,No,No,,,No,-122.36517,0,0,0,1,0,0,0,0,0,0,0,1,0,0,0,0,0,0,0,0,0,0,0,0,0,0,0,0,0,7,0,1,0,0
91,INC2009-075,Release of Substance,7/31/2009,Grande Prairie,NOVA Gas Transmission Ltd.,Closed,55.12549,40,Natural Gas - Sweet,Gas,No,2009,2009-07-30,2009/07/30 04:45:00 PM Mountain,,,Operation,Employee / Contractor (Onsite),8/1/2012,Yes,No,Natural Gas - Sweet,40,No,No,,,,,,,,,,,0,OPR,,,,,,,,,Canada,Yes,No,No,No,0,,Level I,Standard Review - 168 days,No,,"Station/Facility, Compression, Auxiliary power unit",,,,,,,,,,,,,,,,,,,,,,,,,,,No,,7/30/2009,No,,,No,No,7/30/2009,,No,-117.83828,1,1,0,0,0,0,0,0,0,0,0,1,0,0,0,0,0,0,0,0,0,0,0,0,0,0,0,0,0,7,0,1,0,0
92,INC2009-076,Release of Substance,8/4/2009,Edson,NOVA Gas Transmission Ltd.,Closed,53.58571,2.9,Natural Gas - Sweet,Gas,No,2009,2009-08-01,2009/08/01 03:52:00 PM Mountain,,,Operation,Employee / Contractor (Onsite),7/23/2012,Yes,No,Natural Gas - Sweet,2.9,No,No,,,,,,,,,,,0,OPR,NGTL - Ansell Meter Station,,,,,,,,Canada,Yes,No,No,No,0,,Level I,Standard Review - 168 days,No,,"Station/Facility, Metering, Delivering, Piping",,,,,,,,,,,,,,,,,,,,,,,,,,,No,Rebuilt,,No,,,No,No,,Repair,No,-116.43392,1,1,0,0,0,0,0,0,0,0,0,1,0,0,0,0,0,0,0,0,0,0,0,0,0,0,0,0,0,8,0,1,0,0
93,INC2009-078,Operation Beyond Design Limits,8/10/2009,Sarnia,Enbridge Pipelines Inc.,Closed,42.97521,0,Not Applicable,Not Applicable,No,2009,2009-08-09,2009/08/09 09:30:00 PM Mountain,,,Operation,Employee / Contractor (Onsite),7/23/2012,Yes,No,,,,No,,,,,,,,,Excessive Vibration,,0,OPR,Enbridge Sarnia Terminal,,,,,,,,Canada,Yes,No,No,No,0,,Level I,Standard Review - 168 days,No,,"Storage, Tank, Aboveground",,,,,,,,,,,,,,,,,,,,,,,,,,,No,,,No,,,No,No,,,No,-82.40666,0,0,0,0,0,1,0,0,0,0,1,1,0,0,0,0,0,0,0,0,0,0,0,0,0,0,1,0,0,8,0,1,0,0
94,INC2009-079,Operation Beyond Design Limits,8/11/2009,Chetwynd,"Westcoast Energy Inc., carrying on business as Spectra Energy Transmission",Closed,55.56925,0,Not Applicable,Not Applicable,No,2009,2009-08-10,2009/08/10 01:00:00 PM Pacific,,,Operation,,8/16/2012,Yes,No,,,,No,,,,,,,,,,,0,PPR,WEI - Pine River Gas Plant,,,,,,,,Canada,No,No,No,No,0,,Level I,Standard Review - 168 days,No,,"Station/Facility, Compression, Auxiliary power unit",,,,,,,,,,,,,,,,,,,,,,,,,,,No,,,No,,,No,No,,,No,-121.94466,0,0,0,1,0,0,0,0,0,0,0,1,0,0,0,0,0,0,0,0,0,0,0,0,0,0,0,0,0,8,0,1,0,0
95,INC2009-080,Fire,8/11/2009,Bowmanville,TransCanada PipeLines Limited,Closed,43.96006,0,Not Applicable,Not Applicable,No,2009,2009-08-11,2009/08/11 11:17:00 AM Mountain,,,Maintenance,Employee / Contractor (Onsite),12/22/2010,Yes,No,,,,No,,Equipment & Electrical,,,,,,,,,0,OPR,TCPL - Station 134 (Bowmanville Compressor Stn),,,,,,,,Canada,Yes,No,No,No,0,,Level I,Standard Review - 168 days,No,,,,,,,,,,,,,,,,,,,,,,,,,,,,,No,,,No,,,No,No,,,No,-78.81933,0,0,0,0,0,1,0,0,0,0,0,1,0,0,0,0,0,0,0,0,0,0,0,0,0,0,0,0,0,8,0,1,0,0
96,INC2009-084,Release of Substance,8/24/2009,Williams Lake,"Westcoast Energy Inc., carrying on business as Spectra Energy Transmission",Closed,52.12922,0,Natural Gas - Sweet,Gas,No,2009,,2009/08/24 02:00:00 PM Mountain,,,Operation,Employee / Contractor (Onsite),8/15/2012,Yes,No,Natural Gas - Sweet,0,No,No,,,,,,,,,,,0,OPR,WEI - Compressor Station 6A,,,,,,,,Canada,Yes,No,No,No,0,,Level I,Standard Review - 168 days,No,,"Station/Facility, Compression, Fitting",,NPS 2,,,,,,,0,,,,,,,,,,,,,,,,,,No,,,No,,,No,No,,,No,-121.94289,1,0,0,1,0,0,0,0,0,0,0,1,0,0,0,0,0,0,0,0,0,0,0,0,0,0,0,0,0,8,0,1,0,0
97,INC2009-086,Release of Substance,9/2/2009,Hanna,NOVA Gas Transmission Ltd.,Closed,51.66911,0.5,Natural Gas - Sweet,Gas,No,2009,2009-08-31,2009/08/31 04:00:00 PM Mountain,,,Operation,Employee / Contractor (Onsite),7/23/2012,Yes,No,Natural Gas - Sweet,0.5,No,No,,,,,,,,,,,0,OPR,NGTl - Hanna South Meter Station,,,,,,,,Canada,Yes,No,No,No,3,,Level I,Standard Review - 168 days,No,,"Station/Facility, Metering, Delivering, Valve",,,,,,,,,0,,,,,,,,,,,,,,,,,,No,Replacement,9/2/2009,No,,,No,No,9/2/2009,Replacement,No,-111.89811,1,1,0,0,0,0,0,0,0,0,0,1,0,0,0,0,0,0,0,0,0,0,0,0,0,0,0,0,0,8,0,1,0,0
98,INC2009-087,Release of Substance,9/2/2009,Zama Lake,NOVA Gas Transmission Ltd.,Closed,59.05953,10,Natural Gas - Sweet,Gas,No,2009,2009-09-01,2009/09/01 10:00:00 AM Mountain,,,Operation,Employee / Contractor (Onsite),7/27/2012,Yes,No,Natural Gas - Sweet,10,No,No,,,,,,,,,,,0,OPR,,,,,,,,,Canada,No,No,Yes,No,3,Legal Subdivision 12-12-116-W6M,Level I,Standard Review - 168 days,No,,"Pipeline, Pipe, Body",,NPS 8,Carbon Steel,359 - X52,,,,,0,,,,,,,,,,,,,,,,,,No,Replacement,9/6/2009,No,,,No,No,9/6/2009,Replacement,No,-119.89276,1,1,0,0,0,0,0,0,0,0,0,1,0,0,0,0,0,0,0,0,0,0,0,0,0,0,0,0,0,9,0,0,1,0
99,INC2009-088,Release of Substance,9/2/2009,Burstall,Foothills Pipe Lines Ltd.,Closed,50.65584,566.3,Natural Gas - Sweet,Gas,No,2009,2009-09-01,2009/09/01 08:00:00 PM Central,,,Operation,Employee / Contractor (Onsite),7/30/2012,Yes,No,Natural Gas - Sweet,566.3,No,No,,,,,,,,,,,0,OPR,Foothills - Empress De/Re Facility,,,,,,,,Canada,Yes,No,No,No,0,,Level I,Standard Review - 168 days,No,,"Station/Facility, Compression, Fitting, Branch connection, Weld",,NPS 1,,,,,,,0,,,,,,,,,,,,,,,,,,No,Replacement,,No,,,No,No,,Replacement,No,-109.90599,1,0,0,0,1,0,0,0,0,0,0,1,0,0,0,0,0,0,0,0,0,0,0,0,0,0,0,0,0,9,0,0,1,0
100,INC2009-089,Release of Substance,9/3/2009,Savona,"Westcoast Energy Inc., carrying on business as Spectra Energy Transmission",Closed,50.74862,12,Fuel Gas,Gas,No,2009,2009-09-02,2009/09/02 08:30:00 PM Pacific,,,Operation,Employee / Contractor (Onsite),12/4/2013,Yes,No,Fuel Gas,12,No,No,,,,,,,,,,,0,OPR,WEI - Compressor Station 7 - Savonna,,,,,,,,Canada,Yes,No,No,No,3,,Level I,Standard Review - 168 days,No,,"Station/Facility, Compression, Valve",,NPS 1,,,,,,,0,,,,,,,,,,,,,,,,,,No,,,No,,,No,No,,,No,-120.8587,1,0,0,1,0,0,0,0,0,0,0,1,0,0,0,0,0,0,0,0,0,0,0,0,0,0,0,0,0,9,0,0,1,0
101,INC2009-090,Release of Substance,9/4/2009,Grande Prairie,NOVA Gas Transmission Ltd.,Closed,54.8308,100,Fuel Gas,Gas,No,2009,2009-09-04,2009/09/04 01:30:00 PM Mountain,,,Operation,Employee / Contractor (Onsite),7/30/2012,Yes,No,Fuel Gas,100,No,No,,,,,,,,,,,0,OPR,NGTL - Gold Creek Compressor Station,,,,,,,,Canada,No,No,Yes,No,0,,Level I,Standard Review - 168 days,No,,"Station/Facility, Compression, Valve, Pressure relief, Diaphragm",,,,,,,,,,,,,,,,,,,,,,,,,,,No,Replacement,9/8/2009,No,,,No,No,9/8/2009,Replacement,No,-118.64572,1,1,0,0,0,0,0,0,0,0,0,1,0,0,0,0,0,0,0,0,0,0,0,0,0,0,0,0,0,9,0,0,1,0
102,INC2009-092,Fire,9/10/2009,Edmonton,Enbridge Pipelines Inc.,Closed,53.54735,0,Not Applicable,Not Applicable,No,2009,2009-09-10,2009/09/10 01:50:00 AM Mountain,,,Operation,Employee / Contractor (Onsite),7/30/2012,Yes,No,,,,No,,Equipment & Electrical,,,,,,,,,0,OPR,Edmonton Terminal,,,,,,,,Canada,Yes,No,No,No,0,,Level I,Standard Review - 168 days,No,,"Station/Facility, Pumping, Auxiliary device(s) (please explain)",,,,,,,,,,,,,,,,,,,,,,,,,,,No,Replacement,,No,,,No,No,,Replacement,No,-113.35571,0,1,0,0,0,0,0,0,0,0,0,1,0,0,0,0,0,0,0,0,0,0,0,0,0,0,0,0,0,9,0,0,1,0
103,INC2009-101,Fire,9/17/2009,Strome,Enbridge Pipelines Inc.,Closed,52.93032,0,Not Applicable,Not Applicable,No,2009,2009-09-17,2009/09/17 02:10:00 AM Mountain,,,Operation,Employee / Contractor (Onsite),7/27/2012,Yes,No,,,,No,,Housekeeping,,,,,,,,,0,OPR,EPI - Strome Pump Station,,,,,,,,Canada,Yes,No,No,No,0,,Level I,Standard Review - 168 days,No,,"Station/Facility, Pumping, Auxiliary power unit",,,,,,,,,,,,,,,,,,,,,,,,,,,No,Rebuilt,9/18/2009,No,,,No,No,9/18/2009,Repair,No,-112.07365,0,1,0,0,0,0,0,0,0,0,0,1,0,0,0,0,0,0,0,0,0,0,0,0,0,0,0,0,0,9,0,0,1,0
104,INC2009-095,"Explosion, Fire, Release of Substance",9/12/2009,Englehart,TransCanada PipeLines Limited,Closed,47.912847,3420000,Natural Gas - Sweet,Gas,Yes,2009,2009-09-12,2009/09/12 01:15:00 PM Central,,,Operation,Employee / Contractor (Onsite),6/29/2012,Yes,Yes,Natural Gas - Sweet,3420000,Yes,No,Under Investigation or Unknown,Under Investigation or Unknown,,,,,,,,,0,OPR,LINE 100-2,"508.00000000, 609.60000000, 762.00000000, 863.60000000, 914.40000000",3393.42642,Natural Gas,,,,,Canada,No,No,Yes,No,0,Kilometer Post 107+5.4km,Level III,Category C,Yes,,"Pipeline, Pipe, Body",,NPS 36,Carbon Steel,,,9.1 mm = 0.358 in,,,6895,,,,0.6,1973,1973,1973,,,,,3 o'clock,External,Polyethylene Tape Wrap,Disbonded,,,No,Replacement,9/26/2009,No,,,No,No,9/26/2009,Replacement,No,-79.987089,1,0,0,0,0,1,0,0,0,0,0,1,0,0,0,0,0,0,0,0,0,0,0,0,0,0,0,0,0,9,0,0,1,0
105,INC2009-096,Release of Substance,9/13/2009,Ste. Anne,TransCanada PipeLines Limited,Closed,49.71929,0,Natural Gas - Sweet,Gas,No,2009,,2009/09/12 05:26:00 PM Mountain,,,Operation,Employee / Contractor (Onsite),12/8/2016,Yes,No,Natural Gas - Sweet,0,No,No,,,,,,,,,,,0,OPR,LINE 100-2,"508.00000000, 609.60000000, 762.00000000, 863.60000000, 914.40000000",3393.42642,Natural Gas,,,,,Canada,No,No,Yes,No,0,Mainline Valve + Offset (km) #41 +22.8 and 22.9,Level I,Standard Review - 168 days,No,,"Pipeline, Pipe, Girth weld",CSA,NPS 36,Carbon Steel,,,11.0 mm = 0.432 in,,,6895,,,,1.2,1972,,,,,,,6 o'clock,External,Asphalt Mastic,Disbonded,,,No,Replacement,,No,,,No,No,,Replacement,No,-96.98281,1,0,1,0,0,0,0,0,0,0,0,1,0,0,0,0,0,0,0,0,0,0,0,0,0,0,0,0,0,9,0,0,1,0
106,INC2009-100,Explosion,9/14/2009,Maple,TransCanada PipeLines Limited,Closed,43.87381,0,Not Applicable,Not Applicable,No,2009,2009-09-13,2009/09/14 12:00:00 PM Eastern,,,Operation,Employee / Contractor (Onsite),2/25/2014,Yes,No,,,,No,Battery Explosion,,,,,,,,,,0,OPR,TCPL - Station 130 (Maple Compressor Station),,,,,,,,Canada,Yes,No,No,No,3,,Level I,Standard Review - 168 days,No,,"Station/Facility, Compression, Auxiliary power unit",,,,,,,,,,,,,,,,,,,,,,,,,,,No,Replacement,,No,,,No,No,,Replacement,No,-79.58002,0,0,0,0,0,1,0,0,0,0,0,1,0,0,0,0,0,0,0,0,0,0,0,0,0,0,0,0,0,9,0,0,1,0
107,INC2009-102,Release of Substance,9/18/2009,Fairview,NOVA Gas Transmission Ltd.,Closed,56.36855,0,Natural Gas - Sweet,Gas,No,2009,2009-09-17,2009/09/17 08:23:00 AM Mountain,,,Operation,Employee / Contractor (Onsite),8/3/2012,Yes,No,Natural Gas - Sweet,0,No,No,,,,,,,,,,,0,OPR,NGTL - Neptune Meter Station,,,,,,,,Canada,Yes,No,No,No,3,,Level I,Standard Review - 168 days,No,,"Station/Facility, Compression, Pipe",,,,,,,,,0,,,,,,,,,,,,,,,,,,No,Replacement,,No,,,No,No,,Replacement,No,-119.92869,1,1,0,0,0,0,0,0,0,0,0,1,0,0,0,0,0,0,0,0,0,0,0,0,0,0,0,0,0,9,0,0,1,0
108,INC2009-103,Release of Substance,9/18/2009,Falcon Lake,TransCanada PipeLines Limited,Closed,49.68123,0.1,Natural Gas - Sweet,Gas,No,2009,2009-09-18,2009/09/18 11:00:00 AM Mountain,,,Maintenance,Employee / Contractor (Onsite),7/23/2012,Yes,No,Natural Gas - Sweet,0.1,No,No,,,,,,,,,,,0,OPR,LINE 100-2,"508.00000000, 609.60000000, 762.00000000, 863.60000000, 914.40000000",3393.42642,Natural Gas,,,,,Canada,No,No,Yes,No,3,,Level I,Standard Review - 168 days,No,,"Station/Facility, Compression, Pipe",,,,,,,,,,,,,,,,,,,,,,,,,,,No,Replacement,,No,,,No,No,,Replacement,No,-95.37477,1,0,1,0,0,0,0,0,0,0,0,1,0,0,0,0,0,0,0,0,0,0,0,0,0,0,0,0,0,9,0,0,1,0
109,INC2009-104,Release of Substance,9/20/2009,Not specified,NOVA Gas Transmission Ltd.,Closed,53.96117,63000,Natural Gas - Sweet,Gas,Yes,2009,2009-09-19,2009/09/19 11:59:00 PM Mountain,,,Operation,Employee / Contractor (Onsite),8/2/2012,Yes,No,Natural Gas - Sweet,63000,No,No,,,,,,,,,,,0,OPR,NGTL - Knight Compressor Station,,,,,,,,Canada,Yes,No,No,No,3,,Level I,Standard Review - 168 days,No,,"Station/Facility, Compression, Valve",,,,,,,,,,,,,,,,,,,,,,,,,,,No,Rebuilt,9/20/2009,No,,,No,No,9/20/2009,Repair,No,-116.46306,1,1,0,0,0,0,0,0,0,0,0,1,0,0,0,0,0,0,0,0,0,0,0,0,0,0,0,0,0,9,0,0,1,0
110,INC2009-106,Release of Substance,9/23/2009,Taylor,"Westcoast Energy Inc., carrying on business as Spectra Energy Transmission",Closed,56.14625,68,Natural Gas - Sour,Gas,Yes,2009,2009-09-22,2009/09/22 02:09:00 PM Mountain,,Processing,Operation,,8/29/2017,Yes,No,Natural Gas - Sour,68,No,No,,,,,,,,,,,0,PPR,WEI - McMahon Gas Plant (Taylor Gas Plant),,,,,,,,Canada,No,No,No,No,0,,Level II,Category B,Yes,,,,,,,,,,,,,,,,,,,,,,,,,,,,,No,,,No,,,No,No,,,No,-120.66917,1,0,0,1,0,0,0,0,0,0,0,1,0,0,0,0,0,0,0,0,0,0,0,0,0,0,0,0,0,9,0,0,1,0
111,INC2009-105,Release of Substance,9/22/2009,Glenboro,Enbridge Pipelines Inc.,Closed,49.544443,4.75,Crude Oil - Sweet,Liquid,No,2009,2009-09-22,2009/09/22 09:57:00 AM Mountain,,Transmission,Operation,Employee / Contractor (Onsite),8/10/2011,No,No,Crude Oil - Sweet,4.75,No,No,,,,,,,,,,,0,OPR,EPI - Glenboro Pump Station,,,,,,,,Canada,Yes,No,No,No,0,,Level I,Standard Review - 168 days,No,,"Station/Facility, Pumping, Fitting",,,Stainless Steel,,,,,,0,,,,,,,,,,,,,,,,,,No,Replacement,9/22/2009,No,,,No,No,9/22/2009,Replacement,No,-99.320678,1,0,1,0,0,0,0,0,0,0,0,1,0,0,0,0,0,0,0,0,0,0,0,0,0,0,0,0,0,9,0,0,1,0
112,INC2009-107,Fire,9/24/2009,Brookdale,TransCanada PipeLines Limited,Closed,50.04208,0,Not Applicable,Not Applicable,No,2009,2009-09-23,2009/09/23 09:15:00 AM Mountain,,Transmission,Construction,Employee / Contractor (Onsite),7/30/2012,No,No,,,,No,,Welding or Cutting,,,,,,,,,0,OPR,,,,,,,,,Canada,Yes,No,No,No,0,Mainline Valve + Offset (km) MLV 31+13.2,Level I,Standard Review - 168 days,No,,"Pipeline, Valve, Ball, Other (please explain)",,,,,,,,,,,,,,,,,,,,,,,,,,,No,,,No,,,No,No,,,No,-99.65931,0,0,1,0,0,0,0,0,0,0,0,1,0,0,0,0,0,0,0,0,0,0,0,0,0,0,0,0,0,9,0,0,1,0
113,INC2009-111,Release of Substance,9/29/2009,Odessa,Enbridge Pipelines Inc.,Closed,50.29138341,175,Crude Oil - Synthetic,Liquid,No,2009,2009-09-29,2009/09/29 06:25:00 AM Mountain,,Transmission,Operation,Landowner,7/5/2012,Yes,No,Crude Oil - Synthetic,175,No,No,,,,,,,,,,,0,OPR,Line 2,"1219.00000000, 609.40000000, 610.00000000",1282.304863,Crude Oil,,,,,Canada,Yes,No,No,No,0,Off the Right of Way NW 25 15 14W2,Level III,Category C,Yes,REM-0084,"Pipeline, Pipe, Body",,NPS 24,,,,,,,0,,,,,,,,,,,,6 o'clock,External,,,,,No,,,No,,,No,No,,,No,-103.8103553,1,0,0,0,1,0,0,0,0,0,0,1,0,0,0,0,0,0,0,0,0,0,0,0,0,0,0,0,0,9,0,0,1,0
114,INC2009-109,Release of Substance,9/26/2009,Marten River,TransCanada PipeLines Limited,Closed,46.89733,1430000,Natural Gas - Sweet,Gas,Yes,2009,2009-09-26,2009/09/26 11:04:00 AM Mountain,,Transmission,Operation,Employee / Contractor (Onsite),6/29/2012,No,Yes,Natural Gas - Sweet,1430000,Yes,No,,,,,,,,,,,0,OPR,LINE 100-1,"508.00000000, 762.00000000, 863.60000000",2595.724534,Natural Gas,,,,,Canada,No,Yes,Yes,No,0,Off the Right of Way 111a +,Level III,Category C,Yes,,"Pipeline, Pipe, Body",CSA,NPS 30,Carbon Steel,359 - X52,,9.5 mm = 0.375 in,,,6895,,,,,1958,1958,1958,,,Straight,,6 o'clock,External,Asphalt Mastic,Disbonded,,,No,Replacement,10/30/2009,No,,,No,No,10/30/2009,Replacement,No,-79.80783,1,0,0,0,0,1,0,0,0,0,0,1,0,0,0,0,0,0,0,0,0,0,0,0,0,0,0,0,0,9,0,0,1,0
115,INC2009-112,"Fire, Release of Substance",9/30/2009,Brampton,2193914 Canada Limited,Closed,43.59893,0,Natural Gas - Sweet,Gas,No,2009,2009-09-30,2009/09/30 10:50:00 AM Eastern,,Distribution,Operation,Employee / Contractor (Onsite),11/29/2012,No,No,Natural Gas - Sweet,0,No,No,,Other Event (Nature or 3rd Party),,,,,,,,,0,OPR,Lisgar Gate Station,,,,,,,,Canada,Yes,No,No,No,0,,Level III,Category C,Yes,,"Pipeline, Fitting, Plug, Body",,NPS 2,Carbon Steel,,,,,,0,,,,,,,,,,,,,,,,,,No,,,No,,,No,No,,,No,-79.776,1,0,0,0,0,1,0,0,0,0,0,1,0,0,0,0,0,0,0,0,0,0,0,0,0,0,0,0,0,9,0,0,1,0
116,INC2009-115,Release of Substance,10/16/2009,Tumbler Ridge,"Westcoast Energy Inc., carrying on business as Spectra Energy Transmission",Closed,54.89349,0,Natural Gas - Sour,Gas,Yes,2009,,2009/10/15 07:25:00 PM Mountain,,,Operation,Employee / Contractor (Onsite),8/13/2012,Yes,No,Natural Gas - Sour,0,No,No,,,,,,,,,,,0,OPR,,,,,,,,,Canada,Yes,No,No,No,0,,Level I,Standard Review - 168 days,No,,"Station/Facility, Pigging, Launching, Fitting",,NPS 1,,,,,,,0,,,,,,,,,,,,,,,,,,No,Replacement,,No,,,No,No,,Replacement,No,-120.66962,1,0,0,1,0,0,0,0,0,0,0,1,0,0,0,0,0,0,0,0,0,0,0,0,0,0,0,0,0,10,0,0,1,0
117,INC2009-113,Release of Substance,10/5/2009,Marionville,Trans-Northern Pipelines Inc.,Closed,45.16297,3,Gasoline,Liquid,Yes,2009,2009-10-05,2009/10/05 04:00:00 PM Eastern,,,Operation,Employee / Contractor (Onsite),8/3/2012,Yes,No,Gasoline,3,No,No,,,,,,,,,,,0,OPR,Ottawa Lateral,323.9,69.18015157,"Refined Products-Aviation, Refined Products-Distillate, Refined Products-Gasoline",,,,,Canada,No,Yes,Yes,No,3,Off the Right of Way,Level III,Category C,Yes,REM-0086,"Pipeline, Pipe, Body",,,Carbon Steel,,,5.2 mm = 0.203 in,,,8274,,,,,,1968,1968,,,,,6 o'clock,External,Coal Tar Enamel Narrow,Intact,Plant Applied,,No,Replacement,10/22/2009,No,,,No,No,10/22/2009,Replacement,No,-75.37183,1,0,0,0,0,1,0,0,0,0,0,1,0,0,0,0,0,0,0,0,0,0,0,0,0,0,0,0,0,10,0,0,1,0
118,INC2009-118,Release of Substance,10/20/2009,Hanna,NOVA Gas Transmission Ltd.,Closed,51.66922,0,Natural Gas - Sweet,Gas,No,2009,2009-10-19,2009/10/20 10:00:00 AM Mountain,,Transmission,Operation,Employee / Contractor (Onsite),12/1/2009,No,No,Natural Gas - Sweet,0,No,No,,,,,,,,,,,0,OPR,NGTL - Hanna South B Sales Meter Station,,,,,,,,Canada,Yes,No,No,No,0,,Level I,Standard Review - 168 days,No,,"Station/Facility, Metering, Delivering, Valve, Pressure relief, Diaphragm",,,,,,,,,0,,,,,,,,,,,,,,,,,,No,Replacement,10/19/2009,No,,,No,No,10/19/2009,Replacement,No,-111.89792,1,1,0,0,0,0,0,0,0,0,0,1,0,0,0,0,0,0,0,0,0,0,0,0,0,0,0,0,0,10,0,0,1,0
119,INC2009-119,Fire,10/22/2009,Camrose,Enbridge Pipelines Inc.,Closed,52.93029,0,Not Applicable,Not Applicable,No,2009,2009-10-22,2009/10/22 11:30:00 AM Mountain,,,Operation,Employee / Contractor (Onsite),1/25/2010,Yes,No,,,,No,,Equipment & Electrical,,,,,,,,,0,OPR,Line 4,"1219.00000000, 864.00000000, 914.00000000",1248.909872,Crude Oil,,,,,Canada,Yes,No,No,No,0,,Level I,Standard Review - 168 days,No,,"Station/Facility, Pumping, Auxiliary power unit",,,,,,,,,,,,,,,,,,,,,,,,,,,No,Replacement,10/26/2009,No,,,No,No,10/26/2009,Replacement,No,-112.07347,0,1,0,0,0,0,0,0,0,0,0,1,0,0,0,0,0,0,0,0,0,0,0,0,0,0,0,0,0,10,0,0,1,0
120,INC2009-120,Release of Substance,10/23/2009,Edson,NOVA Gas Transmission Ltd.,Closed,54.0438,0,Natural Gas - Sweet,Gas,No,2009,2009-10-23,2009/10/23 06:17:00 AM Mountain,,,Operation,Employee / Contractor (Onsite),7/23/2010,Yes,No,Natural Gas - Sweet,0,No,No,,,,,,,,,,,0,OPR,NGTL - Berland River Compressor Station,,,,,,,,Canada,Yes,No,No,No,0,,Level I,Standard Review - 168 days,No,,"Station/Facility, Compression, Auxiliary device(s) (please explain)",,,,,,,,,,,,,,,,,,,,,,,,,,,No,Removal,10/23/2009,No,,,No,No,10/23/2009,Repair,No,-117.42069,1,1,0,0,0,0,0,0,0,0,0,1,0,0,0,0,0,0,0,0,0,0,0,0,0,0,0,0,0,10,0,0,1,0
121,INC2009-121,Release of Substance,10/29/2009,Upsala,TransCanada PipeLines Limited,Closed,49.03334,100,Natural Gas - Sweet,Gas,No,2009,2009-10-28,2009/10/28 10:40:00 AM Mountain,,,Operation,Employee / Contractor (Onsite),2/1/2012,Yes,No,Natural Gas - Sweet,100,No,No,,,,,,,,,,,0,OPR,TCPL - Station 62 (Upsala Compressor Station),,,,,,,,Canada,Yes,No,No,No,0,Station 62,Level I,Standard Review - 168 days,No,,"Pipeline, Fitting, Branch connection, Weld",,NPS 2,,,,,,,0,,,,,,,,,,,,,,,,,,No,Replacement,,No,,,No,No,,Replacement,No,-90.51047,1,0,0,0,0,1,0,0,0,0,0,1,0,0,0,0,0,0,0,0,0,0,0,0,0,0,0,0,0,10,0,0,1,0
122,INC2009-126,Release of Substance,11/4/2009,Fairview,NOVA Gas Transmission Ltd.,Closed,56.03467,0,Natural Gas - Sweet,Gas,No,2009,2009-11-04,2009/11/04 05:00:00 AM Mountain,,,Operation,Employee / Contractor (Onsite),12/17/2009,Yes,No,Natural Gas - Sweet,0,No,No,,,,,,,,,,,0,OPR,NGTL - Cardinal Lake Compressor Station,,,,,,,,Canada,Yes,No,No,No,0,Legal Subdivision 5 23 81 26W5,Level I,Standard Review - 168 days,No,,"Station/Facility, Compression, Fitting",,,,,,,,,,,,,,,,,,,,,,,,,,,No,Replacement,11/4/2009,No,,,No,No,11/4/2009,Replacement,No,-117.96587,1,1,0,0,0,0,0,0,0,0,0,1,0,0,0,0,0,0,0,0,0,0,0,0,0,0,0,0,0,11,0,0,1,0
123,INC2009-123,Release of Substance,11/1/2009,Saint John,Emera Brunswick Pipeline Company Ltd.,Closed,45.30706,0,Natural Gas - Sweet,Gas,No,2009,2009-10-31,2009/10/31 11:30:00 AM Mountain,,,Maintenance,Employee / Contractor (Onsite),12/17/2009,Yes,No,Natural Gas - Sweet,0,No,No,,,,,,,,,,,0,OPR,Emera - Red Head Metre Station,,,,,,,,Canada,Yes,No,No,No,0,Red Head Road,Level I,Standard Review - 168 days,No,,"Station/Facility, Metering, Delivering, Fitting",,NPS 3/8,Stainless Steel,,,,,,0,,,,,,,,,,,,,,,,,,No,,,No,,,No,No,,,No,-66.04267,1,0,0,0,0,0,1,0,0,0,0,1,0,0,0,0,0,0,0,0,0,0,0,0,0,0,0,0,0,10,0,0,1,0
124,INC2009-128,Release of Substance,11/18/2009,Sackville,Maritimes & Northeast Pipeline Management Ltd.,Closed,46.02461,0,Natural Gas - Sweet,Gas,No,2009,2009-11-16,2009/11/16 08:00:00 AM Eastern,,Transmission,Operation,Employee / Contractor (Onsite),2/1/2012,No,No,Natural Gas - Sweet,0,No,No,,,,,,,,,,,0,OPR,MNE - New Brunswick Main line,,,,,,,,Canada,Yes,No,No,No,3,,Level I,Standard Review - 168 days,No,,"Pipeline, Flange, Gasket/O-ring",,,,,,,,,,,,,,,,,,,,,,,,,,,No,Replacement,11/18/2009,No,,,No,No,11/18/2009,Replacement,No,-64.22321,1,0,0,0,0,0,1,0,0,0,0,1,0,0,0,0,0,0,0,0,0,0,0,0,0,0,0,0,0,11,0,0,1,0
125,INC2009-129,Release of Substance,11/23/2009,Saint John,Emera Brunswick Pipeline Company Ltd.,Closed,45.26269,0.1,Natural Gas - Sweet,Gas,No,2009,2009-11-22,2009/11/23 10:00:00 AM Atlantic,,,Operation,Employee / Contractor (Onsite),7/27/2012,Yes,No,Natural Gas - Sweet,0.1,No,No,,,,,,,,,,,0,OPR,Emera - Red Head Metre Station,,,,,,,,Canada,Yes,No,No,No,0,,Level I,Standard Review - 168 days,No,,"Station/Facility, Metering, Delivering, Piping",,,,,,,,,,,,,,,,,,,,,,,,,,,No,Rebuilt,11/23/2009,No,,,No,No,11/23/2009,Repair,No,-65.98211,1,0,0,0,0,0,1,0,0,0,0,1,0,0,0,0,0,0,0,0,0,0,0,0,0,0,0,0,0,11,0,0,1,0
126,INC2009-130,Serious Injury (CER or TSB),10/17/2009,Not specified,Enbridge Pipelines Inc.,Closed,49.19043,0,Not Applicable,Not Applicable,Yes,2009,2009-10-07,2009/10/07 04:43:00 PM Central,,,Construction,Employee / Contractor (Onsite),12/22/2010,No,No,,,,No,,,,,Fracture,1,,Yes,,,0,OPR,,,,,,,,,Canada,No,No,Yes,No,0,,Level I,Standard Review - 168 days,No,,,,,,,,,,,,,,,,,,,,,,,,,,,,,No,,,No,,,No,No,,,No,-98.10794,0,0,1,0,0,0,0,0,0,0,0,1,0,0,0,0,0,0,0,0,0,0,0,0,0,0,0,0,0,10,0,0,1,0
127,INC2009-132,Fire,12/4/2009,Fort Nelson,"Westcoast Energy Inc., carrying on business as Spectra Energy Transmission",Closed,59.63213,0,Not Applicable,Not Applicable,No,2009,2009-12-02,2009/12/02 05:00:00 AM Mountain,,,Construction,Employee / Contractor (Onsite),12/22/2010,Yes,No,,,,No,,Equipment & Electrical,,,,,,,,,0,OPR,,,,,,,,,Canada,No,No,Yes,No,0,,Level I,Standard Review - 168 days,No,,Vehicle / mobile equipment,,,,,,,,,,,,,,,,,,,,,,,,,,,No,,,No,,,No,No,,,No,-123.09505,0,0,0,1,0,0,0,0,0,0,0,1,0,0,0,0,0,0,0,0,0,0,0,0,0,0,0,0,0,12,0,0,0,1
128,INC2009-133,Serious Injury (CER or TSB),11/17/2009,Winkler,Enbridge Pipelines Inc.,Closed,49.10416,0,Not Applicable,Not Applicable,Yes,2009,2009-10-17,2009/10/17 11:40:00 AM Central,,,Construction,Employee / Contractor (Onsite),12/22/2010,No,No,,,,No,,,,,Fracture,1,,No,,,0,OPR,,,,,,,,,Canada,No,Yes,No,Yes,0,,Level I,Standard Review - 168 days,No,,,,,,,,,,,,,,,,,,,,,,,,,,,,,No,,,No,,,No,No,,,No,-97.93104,0,0,1,0,0,0,0,0,0,0,0,1,0,0,0,0,0,0,0,0,0,0,0,0,0,0,0,0,0,10,0,0,1,0
129,INC2009-134,Release of Substance,12/8/2009,Lloydminster,Husky Oil Limited,Closed,53.271222,3,Condensate,Liquid,No,2009,2009-12-08,2009/12/08 06:40:00 PM Central,,Transmission,Operation,Employee / Contractor (Onsite),7/27/2012,No,No,Condensate,3,No,No,,,,,,,,,,,0,OPR,,,,,,,,,Canada,Yes,No,No,No,0,,Level I,Standard Review - 168 days,No,,"Station/Facility, Pumping, Piping",,,,,,,,,,,,,,,,,,,,,,,,,,,No,Replacement,,No,,,No,No,,Replacement,No,-109.943083,1,0,0,0,1,0,0,0,0,0,0,1,0,0,0,0,0,0,0,0,0,0,0,0,0,0,0,0,0,12,0,0,0,1
130,INC2009-135,Fire,12/10/2009,Loreburn,Enbridge Pipelines Inc.,Closed,51.1967,0,Not Applicable,Not Applicable,No,2009,2009-12-10,2009/12/10 07:40:00 AM Mountain,,,Operation,Employee / Contractor (Onsite),11/27/2017,Yes,No,,,,No,,Equipment & Electrical,,,,,,,,,0,OPR,Line 4,"1219.00000000, 864.00000000, 914.00000000",1248.909872,Crude Oil,,,,,Canada,Yes,No,No,No,0,,Level I,Standard Review - 168 days,No,,,,,,,,,,,,,,,,,,,,,,,,,,,,,No,,,No,,,No,No,,,No,-106.57472,0,0,0,0,1,0,0,0,0,0,0,1,0,0,0,0,0,0,0,0,0,0,0,0,0,0,0,0,0,12,0,0,0,1
131,INC2009-136,Release of Substance,12/10/2009,Moyie,TransCanada PipeLines Limited B.C. System,Closed,49.238462,0,Natural Gas - Sweet,Gas,No,2009,2009-12-06,2009/12/08 03:00:00 AM Mountain,,,Operation,Employee / Contractor (Onsite),3/8/2010,Yes,No,Natural Gas - Sweet,0,No,No,,,,,,,,,,,0,OPR,"TCPL, BC - Station 2B (Moyie Compressor Station)",,,,,,,,Canada,Yes,No,No,No,0,,Level I,Standard Review - 168 days,No,,"Station/Facility, Compression, Fitting",,NPS 4,Carbon Steel,,160,,,,0,,,,,,2009,2009,,,,,,,,,,,No,Replacement,12/8/2009,No,,,No,No,12/8/2009,Replacement,No,-115.855313,1,0,0,1,0,0,0,0,0,0,0,1,0,0,0,0,0,0,0,0,0,0,0,0,0,0,0,0,0,12,0,0,0,1
132,INC2009-137,Release of Substance,12/11/2009,Les Cedres,TransCanada PipeLines Limited,Closed,45.37081,69,Natural Gas - Sweet,Gas,No,2009,2009-12-11,2009/12/11 01:30:00 PM Mountain,,Transmission,Operation,Employee / Contractor (Onsite),3/16/2010,No,No,Natural Gas - Sweet,69,No,No,,,,,,,,,,,0,OPR,LINE 100-1,"508.00000000, 762.00000000, 863.60000000",2595.724534,Natural Gas,,,,,Canada,No,No,Yes,No,0,,Level I,Standard Review - 168 days,No,,"Station/Facility, Compression, Valve, Pressure relief, Other (please explain)",,,Carbon Steel,,,,,,0,,,,,,,,,,,,,,,,,,No,Rebuilt,12/11/2009,No,,,No,No,12/11/2009,Repair,No,-74.12582,1,0,0,0,0,0,0,0,1,0,0,1,0,0,0,0,0,0,0,0,0,0,0,0,0,0,0,0,0,12,0,0,0,1
133,INC2009-139,Operation Beyond Design Limits,12/14/2009,Hope,"Westcoast Energy Inc., carrying on business as Spectra Energy Transmission",Closed,49.3825,0,Not Applicable,Not Applicable,No,2009,2009-12-12,2009/12/12 05:38:00 PM Mountain,,,Operation,Employee / Contractor (Onsite),8/15/2012,No,No,,,,No,,,,,,,,,Over Pressure,,0,OPR,WEI - Compressor Station 8B,,,,,,,,Canada,No,No,Yes,No,0,,Level I,Standard Review - 168 days,No,,,,,,,,,,,,,,,,,,,,,,,,,,,,,No,,,No,,,No,No,,,No,-121.36469,0,0,0,1,0,0,0,0,0,0,0,1,0,0,0,0,0,0,0,0,0,0,0,0,0,0,0,0,0,12,0,0,0,1
134,INC2009-140,Fire,12/16/2009,Drayton Valley,NOVA Gas Transmission Ltd.,Closed,53.10063,0,Not Applicable,Not Applicable,No,2009,2009-12-14,2009/12/14 06:00:00 AM Mountain,,,Operation,Employee / Contractor (Onsite),12/22/2010,Yes,No,,,,No,,Under Investigation or Unknown,,,,,,,,,0,OPR,,,,,,,,,Canada,Yes,No,No,No,0,Legal Subdivision 12-35-47-10W5,Level I,Standard Review - 168 days,No,,"Station/Facility, Compression, Auxiliary power unit",,,,,,,,,,,,,,,,,,,,,,,,,,,No,,,No,,,No,No,,,No,-115.3622,0,1,0,0,0,0,0,0,0,0,0,1,0,0,0,0,0,0,0,0,0,0,0,0,0,0,0,0,0,12,0,0,0,1
135,INC2009-141,Operation Beyond Design Limits,12/11/2009,Olds,NOVA Gas Transmission Ltd.,Closed,51.85163,0,Not Applicable,Not Applicable,No,2009,2009-12-02,2009/12/02 10:00:00 AM Mountain,,,Operation,Employee / Contractor (Onsite),4/19/2012,Yes,No,,,,No,,,,,,,,,Inappropriate Product,,0,OPR,NGTL - Netook Meter Station,,,,,,,,Canada,Yes,No,No,No,0,,Level I,Standard Review - 168 days,No,,,,,,,,,,,,,,,,,,,,,,,,,,,,,No,Removal,12/2/2009,No,,,No,No,12/2/2009,Repair,No,-114.07574,0,1,0,0,0,0,0,0,0,0,0,1,0,0,0,0,0,0,0,0,0,0,0,0,0,0,0,0,0,12,0,0,0,1
136,INC2009-143,Release of Substance,12/17/2009,Chetwynd,"Westcoast Energy Inc., carrying on business as Spectra Energy Transmission",Closed,55.56908,0,Sulphur Dioxide,Miscellaneous,No,2009,2009-12-16,2009/12/16 10:00:00 PM Mountain,,,Operation,,7/27/2012,Yes,No,Sulphur Dioxide,0,No,No,,,,,,,,,,,0,PPR,WEI - Pine River Gas Plant,,,,,,,,Canada,No,No,No,No,0,,Level I,Standard Review - 168 days,No,,,,,,,,,,,,,,,,,,,,,,,,,,,,,No,,,No,,,No,No,,,No,-121.94467,1,0,0,1,0,0,0,0,0,0,0,1,0,0,0,0,0,0,0,0,0,0,0,0,0,0,0,0,0,12,0,0,0,1
137,INC2009-144,Operation Beyond Design Limits,12/17/2009,Tieland,NOVA Gas Transmission Ltd.,Closed,54.79071,0,Not Applicable,Not Applicable,No,2009,2009-12-08,2009/12/08 01:00:00 PM Mountain,,,Operation,Employee / Contractor (Onsite),7/23/2012,No,No,,,,No,,,,,,,,,Inappropriate Product,,0,OPR,NGTL - Dancing Lake Meter Station,,,,,,,,Canada,Yes,No,No,No,0,,Level I,Standard Review - 168 days,No,,,,,,,,,,,,,,,,,,,,,,,,,,,,,No,,,No,,,No,No,,,No,-114.04358,0,1,0,0,0,0,0,0,0,0,0,1,0,0,0,0,0,0,0,0,0,0,0,0,0,0,0,0,0,12,0,0,0,1
138,INC2009-145,Release of Substance,12/17/2009,Topland,NOVA Gas Transmission Ltd.,Closed,54.54693,0,Natural Gas - Sour,Gas,Yes,2009,2009-12-12,2009/12/12 06:00:00 AM Mountain,,Gathering,Operation,Employee / Contractor (Onsite),7/27/2012,No,No,Natural Gas - Sour,,No,No,,,,,,,,,,,0,OPR,NGTL - Doris Creek Meter Station,,,,,,,,Canada,Yes,No,No,No,0,,Level I,Standard Review - 168 days,No,,"Station/Facility, Metering, Delivering, Valve",,,,,,,,,,,,,,,,,,,,,,,,,,,No,,,No,,,No,No,,,No,-114.79252,1,1,0,0,0,0,0,0,0,0,0,1,0,0,0,0,0,0,0,0,0,0,0,0,0,0,0,0,0,12,0,0,0,1
139,INC2009-147,Operation Beyond Design Limits,1/4/2010,Rainbow Lake,NOVA Gas Transmission Ltd.,Closed,58.44704,0,Not Applicable,Not Applicable,No,2010,2009-12-31,2009/12/31 01:51:00 PM Mountain,,Gathering,Operation,Employee / Contractor (Onsite),7/30/2012,No,No,,,,No,,,,,,,,,Inappropriate Product,,0,OPR,NGTL - Muskeg Creek M/S,,,,,,,,Canada,Yes,No,No,No,3,,Level I,Standard Review - 168 days,No,,,,,,,,,,,,,,,,,,,,,,,,,,,,,No,,,No,,,No,No,,,No,-119.22409,0,1,0,0,0,0,0,0,0,0,0,1,0,0,0,0,0,0,0,0,0,0,0,0,0,0,0,0,0,12,0,0,0,1
140,INC2009-148,Serious Injury (CER or TSB),12/6/2010,Burnaby,Trans Mountain Pipeline ULC,Closed,49.266235,0,Not Applicable,Not Applicable,Yes,2010,2009-03-10,2009/03/10 10:03:00 AM Pacific,,,Operation,Employee / Contractor (Onsite),5/29/2015,No,No,,,,No,,,,,Fracture,1,,No,,,0,OPR,TMPL - Burnaby Terminal,,,,,,,,Canada,Yes,No,No,No,0,,Level I,Standard Review - 168 days,No,,,,,,,,,,,,,,,,,,,,,,,,,,,,,No,,,No,,,No,No,,,No,-122.928102,0,0,0,1,0,0,0,0,0,0,1,1,0,0,0,0,0,0,0,0,0,0,0,0,0,0,0,0,0,3,1,0,0,0
141,INC2009-149,Operation Beyond Design Limits,11/11/2010,Edmonton,Enbridge Pipelines Inc.,Closed,53.54740278,0,Not Applicable,Not Applicable,No,2010,2009-09-02,2010/11/11 12:00:00 AM Mountain,,,Operation,Employee / Contractor (Onsite),4/13/2015,Yes,No,,,,No,,,,,,,,,Over Pressure,,0,OPR,Line 4,"1219.00000000, 864.00000000, 914.00000000",1248.909872,Crude Oil,,,,,Canada,No,No,Yes,No,0,,Level I,Standard Review - 168 days,No,INC2010-102,,,,,,,,,,,,,,,,,,,,,,,,,,,,No,,,No,,,No,No,,,No,-113.3556944,0,1,0,0,0,0,0,0,0,0,0,1,0,0,0,0,0,0,0,0,0,0,0,0,0,0,0,0,0,9,0,0,1,0
142,INC2009-150,Operation Beyond Design Limits,11/11/2010,Edmonton,Enbridge Pipelines Inc.,Closed,53.54740278,0,Not Applicable,Not Applicable,No,2010,2009-12-09,2010/11/11 12:00:00 AM Mountain,,,Operation,Employee / Contractor (Onsite),4/13/2015,Yes,No,,,,No,,,,,,,,,Over Pressure,,0,OPR,Line 4,"1219.00000000, 864.00000000, 914.00000000",1248.909872,Crude Oil,,,,,Canada,No,No,Yes,No,0,,Level I,Standard Review - 168 days,No,INC2010-102,,,,,,,,,,,,,,,,,,,,,,,,,,,,No,,,No,,,No,No,,,No,-113.3556944,0,1,0,0,0,0,0,0,0,0,0,1,0,0,0,0,0,0,0,0,0,0,0,0,0,0,0,0,0,12,0,0,0,1
143,INC2009-151,Operation Beyond Design Limits,11/11/2010,Edmonton,Enbridge Pipelines Inc.,Closed,53.54740278,0,Not Applicable,Not Applicable,No,2010,2009-12-22,2010/11/11 12:00:00 AM Mountain,,,Operation,Employee / Contractor (Onsite),4/13/2015,Yes,No,,,,No,,,,,,,,,Over Pressure,,0,OPR,Line 4,"1219.00000000, 864.00000000, 914.00000000",1248.909872,Crude Oil,,,,,Canada,No,No,Yes,No,0,,Level I,Standard Review - 168 days,No,INC2010-102,,,,,,,,,,,,,,,,,,,,,,,,,,,,No,,,No,,,No,No,,,No,-113.3556944,0,1,0,0,0,0,0,0,0,0,0,1,0,0,0,0,0,0,0,0,0,0,0,0,0,0,0,0,0,12,0,0,0,1
144,INC2009-152,Operation Beyond Design Limits,11/11/2010,Edmonton,Enbridge Pipelines Inc.,Closed,53.54740278,0,Not Applicable,Not Applicable,No,2010,2009-12-22,2010/11/11 12:00:00 AM Mountain,,,Operation,Employee / Contractor (Onsite),4/13/2015,Yes,No,,,,No,,,,,,,,,Over Pressure,,0,OPR,Line 4,"1219.00000000, 864.00000000, 914.00000000",1248.909872,Crude Oil,,,,,Canada,No,No,Yes,No,0,,Level I,Standard Review - 168 days,No,INC2010-102,,,,,,,,,,,,,,,,,,,,,,,,,,,,No,,,No,,,No,No,,,No,-113.3556944,0,1,0,0,0,0,0,0,0,0,0,1,0,0,0,0,0,0,0,0,0,0,0,0,0,0,0,0,0,12,0,0,0,1
145,INC2010-001,Release of Substance,1/6/2010,Fort St. John,NOVA Gas Transmission Ltd.,Closed,56.367553,125000,Natural Gas - Sweet,Gas,Yes,2010,2010-01-04,2010/01/04 07:28:00 AM Mountain,,,Operation,Employee / Contractor (Onsite),1/6/2011,Yes,No,Natural Gas - Sweet,125000,No,No,,,,,,,,,,,0,OPR,NGTL - Boundary Lake Meter Station,,,,,,,,Canada,Yes,No,No,No,3,,Level I,Standard Review - 168 days,No,,,,,,,,,,,,,,,,,,,,,,,,,,,,,No,,,No,,,No,No,,,No,-119.931713,1,1,0,0,0,0,0,0,0,0,0,1,0,0,0,0,0,0,0,0,0,0,0,0,0,0,0,0,0,1,0,0,0,1
146,INC2009-153,Serious Injury (CER or TSB),4/12/2012,Manitou,Enbridge Pipelines Inc.,Closed,49.316926,0,Not Applicable,Not Applicable,Yes,2012,2009-01-03,2009/01/03 04:15:00 PM Central,,Transmission,Construction,Employee / Contractor (Onsite),11/24/2015,No,No,,,,No,,,,,Fracture,1,,No,,,0,OPR,,,,,,,,,Canada,Yes,No,No,No,0,,Level I,Standard Review - 168 days,No,,,,,,,,,,,,,,,,,,,,,,,,,,,,,No,,,No,,,No,No,,,No,-98.554895,0,0,1,0,0,0,0,0,0,0,0,1,0,0,0,0,0,0,0,0,0,0,0,0,0,0,0,0,0,1,0,0,0,1
147,INC2009-154,Serious Injury (CER or TSB),4/12/2012,Brandon,Enbridge Pipelines Inc.,Closed,49.848471,0,Not Applicable,Not Applicable,Yes,2012,2009-08-07,2009/08/07 10:35:00 AM Central,,Transmission,Construction,Employee / Contractor (Onsite),11/24/2015,No,No,,,,No,,,,,Fracture,1,,No,,,0,OPR,,,,,,,,,Canada,No,No,Yes,No,0,,Level I,Standard Review - 168 days,No,,,,,,,,,,,,,,,,,,,,,,,,,,,,,No,,,No,,,No,No,,,No,-99.95009,0,0,1,0,0,0,0,0,0,0,0,1,0,0,0,0,0,0,0,0,0,0,0,0,0,0,0,0,0,8,0,1,0,0
148,INC2009-155,Serious Injury (CER or TSB),4/12/2012,Winkler,Enbridge Pipelines Inc.,Closed,49.18011,0,Not Applicable,Not Applicable,Yes,2012,2009-10-07,2009/10/07 04:47:00 PM Central,,Transmission,Construction,Employee / Contractor (Onsite),11/24/2015,No,No,,,,No,,,,,Fracture,1,,No,,,0,OPR,,,,,,,,,Canada,No,No,Yes,No,0,,Level I,Standard Review - 168 days,No,,,,,,,,,,,,,,,,,,,,,,,,,,,,,No,,,No,,,No,No,,,No,-97.938947,0,0,1,0,0,0,0,0,0,0,0,1,0,0,0,0,0,0,0,0,0,0,0,0,0,0,0,0,0,10,0,0,1,0
149,INC2010-003,"Release of Substance, Adverse Environmental Effects",1/9/2010,Taylor,"Westcoast Energy Inc., carrying on business as Spectra Energy Transmission",Closed,56.14638,33,Contaminated Water,Miscellaneous,Yes,2010,2010-01-08,2010/01/08 03:30:00 PM Mountain,,Processing,Operation,,8/16/2012,No,No,Contaminated Water,33,No,No,,,,,,,,,,,0,PPR,,,,,,,,,Canada,Yes,Yes,No,No,5,,Level I,Standard Review - 168 days,No,,,,,,,,,,,,,,,,,,,,,,,,,,,,,No,,,No,,,No,No,,,No,-120.66917,1,0,0,1,0,0,0,0,0,0,0,1,0,0,0,0,0,0,0,0,0,0,0,0,0,0,0,0,0,1,0,0,0,1
150,INC2010-004,Adverse Environmental Effects,1/8/2010,Red Earth Creek,NOVA Gas Transmission Ltd.,Closed,56.86338,0,Not Applicable,Not Applicable,Yes,2010,2010-01-03,2010/01/03 12:00:00 AM Mountain,,,Construction,Employee / Contractor (Onsite),2/10/2010,Yes,No,,,,No,,,,,,,,,,,0,OPR,NORTH CENTRAL CORRIDOR,"1067.00000000, 609.60000000",378.5193526,Natural Gas,,,,,Canada,Yes,Yes,No,No,3,,Level I,Standard Review - 168 days,No,,Vehicle / mobile equipment,,,Carbon Steel,,,,,,0,,,,,,,,,,,,,,,,,,No,,,No,,,No,No,,,No,-114.70979,0,1,0,0,0,0,0,0,0,0,0,1,0,0,0,0,0,0,0,0,0,0,0,0,0,0,0,0,0,1,0,0,0,1
151,INC2010-005,Operation Beyond Design Limits,1/16/2010,High Level,NOVA Gas Transmission Ltd.,Closed,57.503,0,Not Applicable,Not Applicable,No,2010,2010-01-14,2010/01/14 04:00:00 PM Mountain,,,Operation,Employee / Contractor (Onsite),6/25/2012,Yes,No,,,,No,,,,,,,,,Inappropriate Product,,0,OPR,,,,,,,,,Canada,Yes,No,No,No,0,,Level I,Standard Review - 168 days,No,,"Pipeline, Valve, Check, Seal/Packing",,,,,,,,,,,,,,,,,,,,,,,,,,,No,,,No,,,No,No,,,No,-116.45,0,1,0,0,0,0,0,0,0,0,0,1,0,0,0,0,0,0,0,0,0,0,0,0,0,0,0,0,0,1,0,0,0,1
152,INC2010-006,Fire,1/18/2010,Belleville,TransCanada PipeLines Limited,Closed,44.23202,0,Not Applicable,Not Applicable,No,2010,2010-01-16,2010/01/16 01:28:00 AM Mountain,,Transmission,Operation,Employee / Contractor (Onsite),6/24/2010,No,No,,,,No,,Equipment & Electrical,,,,,,,,,0,OPR,LINE 100-1,"508.00000000, 762.00000000, 863.60000000",2595.724534,Natural Gas,,,,,Canada,Yes,No,No,No,0,,Level I,Standard Review - 168 days,No,,"Station/Facility, Compression, Auxiliary power unit",,,,,,,,,0,,,,,,,,,,,,,,,,,,No,,,No,,,No,No,,,No,-77.23148,0,0,0,0,0,1,0,0,0,0,0,1,0,0,0,0,0,0,0,0,0,0,0,0,0,0,0,0,0,1,0,0,0,1
153,INC2010-009,Operation Beyond Design Limits,1/27/2010,Oakville,Trans-Northern Pipelines Inc.,Closed,43.46745,0,Not Applicable,Not Applicable,No,2010,,2010/01/21 02:53:00 PM Eastern,,Distribution,Operation,Employee / Contractor (Onsite),3/17/2014,No,No,,,,No,,,,,,,,,Over Pressure,,0,OPR,Mainline,273.1,635.0188165,Refined Products-Aviation,,,,,Canada,No,No,Yes,No,0,,Level I,Standard Review - 168 days,No,,,,,,,,,,,,,,,,,,,,,,,,,,,,,No,,,No,,,No,No,,,No,-79.68767,0,0,0,0,0,1,0,0,0,0,1,1,0,0,0,0,0,0,0,0,0,0,0,0,0,0,0,0,0,1,0,0,0,1
154,INC2010-012,Release of Substance,1/31/2010,Not specified,NOVA Gas Transmission Ltd.,Closed,55.88802,0,Natural Gas - Sweet,Gas,No,2010,2010-01-30,2010/01/30 11:00:00 AM Mountain,,,Operation,Employee / Contractor (Onsite),11/1/2013,No,No,Natural Gas - Sweet,0,No,Yes,,,,,,,,,,,0,OPR,,,,,,,,,Canada,Yes,No,No,No,0,,Level I,Standard Review - 168 days,No,,,,,,,,,,,,,,,,,,,,,,,,,,,,,No,,,No,,,No,No,,,No,-112.12314,1,1,0,0,0,0,0,0,0,0,0,1,0,0,0,0,0,0,0,0,0,0,0,0,0,0,0,0,0,1,0,0,0,1
155,INC2010-014,Fire,2/1/2010,Hardisty,TransCanada Keystone Pipeline GP Ltd.,Closed,52.64172,0,Not Applicable,Not Applicable,No,2010,,2010/01/28 11:00:00 AM Mountain,,,Operation,Employee / Contractor (Onsite),11/1/2013,No,No,,,,Yes,,Equipment & Electrical,,,,,,,,,0,OPR,TCP Keystone - Hardisty PS,,,,,,,,Canada,Yes,No,No,No,0,,Level I,Standard Review - 168 days,No,,,,,,,,,,,,,,,,,,,,,,,,,,,,,No,,,No,,,No,No,,,No,-111.27087,0,1,0,0,0,0,0,0,0,0,0,1,0,0,0,0,0,0,0,0,0,0,0,0,0,0,0,0,0,1,0,0,0,1
156,INC2010-013,Operation Beyond Design Limits,2/1/2010,Not specified,NOVA Gas Transmission Ltd.,Closed,52.09768,0,Not Applicable,Not Applicable,No,2010,2010-01-30,2010/01/30 03:45:00 AM Mountain,Short-term interruption,,Operation,Employee / Contractor (Onsite),4/8/2015,Yes,No,,,,No,,,,,,,,,Over Pressure,,0,OPR,,,,,,,,,Canada,No,No,Yes,No,0,Legal Subdivision 16 18 36 5 W4,Level I,Standard Review - 168 days,No,,"Pipeline, Pipe, Body",,NPS 18,Carbon Steel,359 - X52,,6.3 mm = 0.250 in,,,5550,,6433,,,,1957,,,,,,,,Asphalt Mastic,,,,No,,,No,,,No,No,,,No,-110.69846,0,1,0,0,0,0,0,0,0,0,0,1,0,0,0,0,0,0,0,0,0,0,0,0,0,0,0,0,0,1,0,0,0,1
157,INC2010-016,Release of Substance,2/8/2010,Not specified,NOVA Gas Transmission Ltd.,Closed,54.83034,0,Natural Gas - Sweet,Gas,No,2010,2010-02-06,2010/02/06 01:00:00 PM Mountain,,,Operation,Employee / Contractor (Onsite),9/15/2014,Yes,No,Natural Gas - Sweet,,No,No,,,,,,,,,,,0,OPR,NGTL - Gold Creek Compressor Station,,,,,,,,Canada,Yes,No,No,No,0,,Level I,Standard Review - 168 days,No,,"Station/Facility, Compression, Fitting",,,,,,,,,,,,,,,,,,,,,,,,,,,No,,,No,,,No,No,,,No,-118.64722,1,1,0,0,0,0,0,0,0,0,0,1,0,0,0,0,0,0,0,0,0,0,0,0,0,0,0,0,0,2,0,0,0,1
158,INC2010-019,Release of Substance,2/12/2010,New River Beach,Maritimes & Northeast Pipeline Management Ltd.,Closed,45.18676,300,Natural Gas - Sweet,Gas,No,2010,2010-02-10,2010/02/10 06:00:00 AM Mountain,,,Operation,Employee / Contractor (Onsite),6/16/2010,Yes,No,Natural Gas - Sweet,300,No,No,,,,,,,,,,,0,OPR,,,,,,,,,Canada,Yes,No,No,No,0,,Level I,Standard Review - 168 days,No,,,,,,,,,,,,,,,,,,,,,,,,,,,,,No,,,No,,,No,No,,,No,-66.54595,1,0,0,0,0,0,1,0,0,0,0,1,0,0,0,0,0,0,0,0,0,0,0,0,0,0,0,0,0,2,0,0,0,1
159,INC2010-018,Release of Substance,2/9/2010,Tumbler Ridge,"Westcoast Energy Inc., carrying on business as Spectra Energy Transmission",Closed,55.04188,0,Natural Gas - Sour,Gas,Yes,2010,2009-10-15,2009/10/15 09:30:00 AM Mountain,,,Operation,Employee / Contractor (Onsite),11/4/2010,Yes,No,Natural Gas - Sour,,No,No,,,,,,,,,,,0,OPR,,,,,,,,,Canada,No,No,Yes,No,0,,Level I,Standard Review - 168 days,No,,"Station/Facility, Pigging, Receiving, Fitting",,,,,,,,,,,,,,,,,,,,,,,,,,,No,,,No,,,No,No,,,No,-121.01874,1,0,0,1,0,0,0,0,0,0,0,1,0,0,0,0,0,0,0,0,0,0,0,0,0,0,0,0,0,10,0,0,1,0
160,INC2010-021,Release of Substance,2/12/2010,Grovedale,NOVA Gas Transmission Ltd.,Closed,54.95425,0,Natural Gas - Sweet,Gas,No,2010,2010-02-10,2010/02/10 05:00:00 PM Mountain,,,Operation,Employee / Contractor (Onsite),11/1/2013,No,No,Natural Gas - Sweet,,No,Yes,,,,,,,,,,,0,OPR,NGTL - MLV 90,,,,,,,,Canada,No,No,Yes,No,0,,Level I,Standard Review - 168 days,No,,,,,,,,,,,,,,,,,,,,,,,,,,,,,No,,,No,,,No,No,,,No,-119.19227,1,1,0,0,0,0,0,0,0,0,0,1,0,0,0,0,0,0,0,0,0,0,0,0,0,0,0,0,0,2,0,0,0,1
161,INC2010-022,Release of Substance,2/16/2010,Taylor,Provident Energy Pipeline Inc.,Closed,56.14669,0.25,Mixed HVP Hydrocarbons,Gas,No,2010,2010-02-16,2010/02/16 08:00:00 AM Mountain,,,Operation,Employee / Contractor (Onsite),6/7/2010,Yes,No,Mixed HVP Hydrocarbons,0.25,No,No,,,,,,,,,,,0,OPR,Provident - Taylor Pump Station,,,,,,,,Canada,Yes,No,No,No,3,Legal Subdivision 3-8-83-17 W6M,Level I,Standard Review - 168 days,No,,"Pipeline, Flange, Gasket/O-ring",,,,,,,,,0,,,,0,,,,,,,,,,,,,,No,,2/16/2010,No,,,No,No,2/16/2010,,No,-120.66454,1,0,0,1,0,0,0,0,0,0,0,1,0,0,0,0,0,0,0,0,0,0,0,0,0,0,0,0,0,2,0,0,0,1
162,INC2010-024,Fire,2/19/2010,Chetwynd,"Westcoast Energy Inc., carrying on business as Spectra Energy Transmission",Closed,55.64998,0,Not Applicable,Not Applicable,No,2010,2010-02-19,2010/02/19 05:30:00 PM Mountain,,,Operation,Employee / Contractor (Onsite),9/17/2010,Yes,No,,,,No,,Equipment & Electrical,,,,,,,,,0,OPR,WEI - Compressor Station 2,,,,,,,,Canada,Yes,No,No,No,3,,Level I,Standard Review - 168 days,No,,"Station/Facility, Compression, Compressor",ANSI,,Stainless Steel,,,,,,0,,,,,,,,,,,,,,,,,,No,Replacement,,No,,,No,No,,Replacement,No,-122.20708,0,0,0,1,0,0,0,0,0,0,0,1,0,0,0,0,0,0,0,0,0,0,0,0,0,0,0,0,0,2,0,0,0,1
163,INC2010-025,Release of Substance,2/20/2010,Belleville,TransCanada PipeLines Limited,Closed,44.68365,51.4,Natural Gas - Sweet,Gas,No,2010,2010-02-20,2010/02/20 09:00:00 AM Eastern,,,Operation,Employee / Contractor (Onsite),4/18/2012,Yes,No,Natural Gas - Sweet,51.4,No,No,,,,,,,,,,,0,OPR,TCPL - Station 144 (Brockville Compressor Station),,,,,,,,Canada,Yes,No,No,No,0,,Level I,Standard Review - 168 days,No,,,,,,,,,,,,,,,,,,,,,,,,,,,,,No,,,No,,,No,No,,,No,-75.62111,1,0,0,0,0,1,0,0,0,0,0,1,0,0,0,0,0,0,0,0,0,0,0,0,0,0,0,0,0,2,0,0,0,1
164,INC2010-028,Release of Substance,2/26/2010,Edmonton,Enbridge Pipelines Inc.,Closed,53.54457,150,Crude Oil - Sweet,Liquid,No,2010,2010-02-25,2010/02/25 11:00:00 PM Mountain,,,Operation,Employee / Contractor (Onsite),6/14/2010,Yes,No,Crude Oil - Sweet,150,No,No,,,,,,,,,,,0,OPR,Enbridge Edmonton Booster Station,,,,,,,,Canada,Yes,No,No,No,0,,Level I,Standard Review - 168 days,No,,"Station/Facility, Pumping, Fitting",,,Carbon Steel,,,,,,0,,,,,,,,,,,,,,,,,,No,,,No,,,No,No,,,No,-113.35511,1,1,0,0,0,0,0,0,0,0,0,1,0,0,0,0,0,0,0,0,0,0,0,0,0,0,0,0,0,2,0,0,0,1
165,INC2010-029,Release of Substance,2/27/2010,Laval,Trans-Northern Pipelines Inc.,Closed,45.624393,30,Gasoline,Liquid,Yes,2010,,2010/02/26 03:00:00 PM Eastern,,Transmission,Operation,Public,3/9/2016,Yes,No,Gasoline,30,No,No,,,,,,,,,,,0,OPR,Ste Rose Loop,406.4,26.02431296,"Refined Products-Aviation, Refined Products-Distillate, Refined Products-Gasoline",,,,,Canada,No,No,Yes,Yes,0,,Level II,Category B,Yes,"INC2010-091, REM-0089",,,,,,,,,,,,,,,,,,,,,,,,,,,,No,,,No,,,No,No,,,No,-73.639169,1,0,0,0,0,0,0,0,1,0,0,1,0,0,0,0,0,0,0,0,0,0,0,0,0,0,0,0,0,2,0,0,0,1
166,INC2010-032,Release of Substance,3/3/2010,Fox Creek,NOVA Gas Transmission Ltd.,Closed,54.34669,0,Natural Gas - Sweet,Gas,No,2010,,2010/02/28 10:29:00 AM Mountain,,,Operation,Employee / Contractor (Onsite),11/4/2010,Yes,No,Natural Gas - Sweet,0,No,No,,,,,,,,,,,0,OPR,,,,,,,,,Canada,Yes,No,No,No,0,,Level I,Standard Review - 168 days,No,,"Station/Facility, Metering, Delivering, Valve",,,,,,,,,0,,,,,,,,,,,,,,,,,,No,,,No,,,No,No,,,No,-116.87305,1,1,0,0,0,0,0,0,0,0,0,1,0,0,0,0,0,0,0,0,0,0,0,0,0,0,0,0,0,2,0,0,0,1
167,INC2010-033,Release of Substance,3/12/2010,Not specified,NOVA Gas Transmission Ltd.,Closed,52.75419,0,Natural Gas - Sweet,Gas,No,2010,2010-03-10,2010/03/10 11:00:00 AM Mountain,,,Operation,Employee / Contractor (Onsite),11/1/2013,Yes,No,Natural Gas - Sweet,,No,Yes,,,,,,,,,,,0,OPR,NGTL - Rimbey West Meter Station,,,,,,,,Canada,Yes,No,No,No,0,,Level I,Standard Review - 168 days,No,,,,,,,,,,,,,,,,,,,,,,,,,,,,,No,,,No,,,No,No,,,No,-114.11969,1,1,0,0,0,0,0,0,0,0,0,1,0,0,0,0,0,0,0,0,0,0,0,0,0,0,0,0,0,3,1,0,0,0
168,INC2010-034,Release of Substance,3/16/2010,Oakville,Trans-Northern Pipelines Inc.,Closed,43.406148,90,Gasoline,Liquid,Yes,2010,2010-03-16,2010/03/16 11:30:00 AM Eastern,,,Operation,Employee / Contractor (Onsite),12/20/2016,Yes,No,Gasoline,90,No,No,,,,,,,,,,,0,OPR,,,,,,,,,Canada,No,No,Yes,Yes,5,Mile Post 369.9,Level II,Category B,Yes,REM-0091,"Pipeline, Pipe, Bend, Body",,NPS 10,Carbon Steel,317 - X46,,7.8 mm = 0.307 in,,,,,,,,1952,,,,,,Electric Fusion Welding,,External,Polyethylene Tape Wrap,Disbonded,Field Applied,1982,No,Replacement,,No,5/1/2007,Inline Inspection (ILI),Yes,Yes,,,No,-79.735605,1,0,0,0,0,1,0,0,0,0,0,1,0,0,0,0,0,0,0,0,0,0,0,0,0,0,0,0,0,3,1,0,0,0
169,INC2010-040,Fire,3/26/2010,Edmonton,Enbridge Pipelines Inc.,Closed,53.54756,0,Not Applicable,Not Applicable,No,2010,2010-03-24,2010/03/24 09:00:00 AM Central,,,Construction,Employee / Contractor (Onsite),4/25/2012,No,No,,,,No,,Welding or Cutting,,,,,,,,,0,OPR,EPI - Edmonton Terminal,,,,,,,,Canada,Yes,No,No,No,0,,Level I,Standard Review - 168 days,No,,,,,,,,,,,,,,,,,,,,,,,,,,,,,No,,,No,,,No,No,,,No,-113.35559,0,1,0,0,0,0,0,0,0,0,0,1,0,0,0,0,0,0,0,0,0,0,0,0,0,0,0,0,0,3,1,0,0,0
170,INC2010-041,Fire,3/27/2010,Manning,NOVA Gas Transmission Ltd.,Closed,57.19166,0,Not Applicable,Not Applicable,No,2010,2010-03-27,2010/03/27 03:30:00 PM Mountain,,,Operation,Employee / Contractor (Onsite),7/30/2010,Yes,No,,,,No,,Equipment & Electrical,,,,,,,,,0,OPR,NGTL - Meikle River Compressor Station,,,,,,,,Canada,Yes,No,No,No,0,,Level I,Standard Review - 168 days,No,,"Station/Facility, Compression, Pipe",,,,,,,,,,,,,,,,,,,,,,,,,,,No,Replacement,,No,,,No,No,,Replacement,No,-118.1942,0,1,0,0,0,0,0,0,0,0,0,1,0,0,0,0,0,0,0,0,0,0,0,0,0,0,0,0,0,3,1,0,0,0
171,INC2010-042,Release of Substance,4/12/2010,Caronport,TransCanada PipeLines Limited,Closed,50.48051,0,Natural Gas - Sweet,Gas,No,2010,2010-04-10,2010/04/10 12:00:00 AM Mountain,,,Operation,Employee / Contractor (Onsite),9/14/2010,Yes,No,Natural Gas - Sweet,,No,No,,,,,,,,,,,0,OPR,,,,,,,,,Canada,Yes,No,No,No,0,,Level I,Standard Review - 168 days,No,,"Station/Facility, Compression, Fitting",,NPS 3/8,,,,,,,0,,,,0,,,,,,,,,,,,,,No,Replacement,,No,,,No,No,,Replacement,No,-105.86728,1,0,0,0,1,0,0,0,0,0,0,1,0,0,0,0,0,0,0,0,0,0,0,0,0,0,0,0,0,4,1,0,0,0
172,INC2010-044,Release of Substance,4/21/2010,Chetwynd,"Westcoast Energy Inc., carrying on business as Spectra Energy Transmission",Closed,55.56882,0,Mixed HVP Hydrocarbons,Gas,No,2010,2010-04-20,2010/04/20 04:50:00 PM Mountain,,,Operation,,7/13/2010,Yes,No,Mixed HVP Hydrocarbons,,No,No,,,,,,,,,,,0,PPR,WEI - Pine River Gas Plant,,,,,,,,Canada,No,No,No,No,0,,Level I,Standard Review - 168 days,No,,"Processing Plant, Flare",,,Stainless Steel,,,,,,0,,,,,,,,,,,,,,,,,,No,Replacement,,No,,,No,No,,Replacement,No,-121.94466,1,0,0,1,0,0,0,0,0,0,0,1,0,0,0,0,0,0,0,0,0,0,0,0,0,0,0,0,0,4,1,0,0,0
173,INC2010-045,Release of Substance,4/21/2010,Ancaster,TransCanada PipeLines Limited,Closed,43.18849,100,Natural Gas - Sweet,Gas,No,2010,2010-04-01,2010/04/01 07:00:00 AM Eastern,,,Operation,Employee / Contractor (Onsite),7/23/2012,Yes,No,Natural Gas - Sweet,100,No,No,,,,,,,,,,,0,OPR,TCPL - Station 209 (Ancaster Compressor Station),,,,,,,,Canada,Yes,No,No,No,0,,Level I,Standard Review - 168 days,No,,"Pipeline, Valve, Ball, Seal/Packing",,,,,,,,,,,,,,,,,,,,,,,,,,,No,,,No,,,No,No,,,No,-79.8485,1,0,0,0,0,1,0,0,0,0,0,1,0,0,0,0,0,0,0,0,0,0,0,0,0,0,0,0,0,4,1,0,0,0
174,INC2010-052,Release of Substance,5/25/2010,Brandon,Spectra Energy Empress Management Inc. as General Partner and Agent for Spectra Energy Empress L.P.,Closed,50.04165,0,Propane,Gas,No,2010,,2010/05/03 12:00:00 AM Mountain,,,Maintenance,Employee / Contractor (Onsite),5/23/2017,Yes,No,Propane,0,No,No,,,,,,,,,,,0,OPR,,,,,,,,,Canada,No,No,Yes,No,0,,Level I,Standard Review - 168 days,No,,,,,,,,,,,,,,,,,,,,,,,,,,,,,No,,,No,,,No,No,,,No,-99.66005,1,0,1,0,0,0,0,0,0,0,0,1,0,0,0,0,0,0,0,0,0,0,0,0,0,0,0,0,0,5,1,0,0,0
175,INC2010-047,Release of Substance,5/5/2010,Not specified,TransCanada PipeLines Limited,Closed,48.64904,0,Natural Gas - Sweet,Gas,No,2010,2010-05-04,2010/05/04 01:40:00 PM Mountain,,,Maintenance,Employee / Contractor (Onsite),7/26/2012,Yes,No,Natural Gas - Sweet,0,No,No,,,,,,,,,,,0,OPR,,,,,,,,,Canada,No,No,Yes,No,0,Mainline Valve + Offset (km) 103-2 + 0.447 km,Level I,Standard Review - 168 days,No,,"Pipeline, Pipe, Body",,,,,,,,,,,,,,,,,,,,,,External,Asphalt Mastic,Disbonded,,,No,Replacement,,No,,,No,No,,Replacement,No,-80.69866,1,0,0,0,0,1,0,0,0,0,0,1,0,0,0,0,0,0,0,0,0,0,0,0,0,0,0,0,0,5,1,0,0,0
176,INC2010-048,Fire,5/5/2010,Cobourg,TransCanada PipeLines Limited,Closed,44.04719,0,Not Applicable,Not Applicable,No,2010,2010-05-04,2010/05/04 04:00:00 PM Eastern,,,Maintenance,Employee / Contractor (Onsite),3/14/2011,No,No,,,,No,,Under Investigation or Unknown,,,,,,,,,0,OPR,LINE 100-1,"508.00000000, 762.00000000, 863.60000000",2595.724534,Natural Gas,,,,,Canada,No,No,Yes,No,0,Mainline Valve + Offset (km) 136,Level I,Standard Review - 168 days,No,,,,,,,,,,,,,,,,,,,,,,,,,,,,,No,,,No,,,No,No,,,No,-78.00847,0,0,0,0,0,1,0,0,0,0,0,1,0,0,0,0,0,0,0,0,0,0,0,0,0,0,0,0,0,5,1,0,0,0
177,INC2010-050,Fire,5/11/2010,Sundre,NOVA Gas Transmission Ltd.,Closed,51.943585,0,Not Applicable,Not Applicable,No,2010,2010-05-11,2010/05/11 12:00:00 PM Mountain,,,Maintenance,Employee / Contractor (Onsite),12/15/2010,No,No,,,,No,,Under Investigation or Unknown,,,,,,,,,0,OPR,NGTL - Schrader Creek Compressor Station,,,,,,,,Canada,Yes,No,No,No,0,,Level I,Standard Review - 168 days,No,,,,,,,,,,,,,,,,,,,,,,,,,,,,,No,,,No,,,No,No,,,No,-114.736419,0,1,0,0,0,0,0,0,0,0,0,1,0,0,0,0,0,0,0,0,0,0,0,0,0,0,0,0,0,5,1,0,0,0
178,INC2010-051,Release of Substance,5/22/2010,Manning,NOVA Gas Transmission Ltd.,Closed,57.19361,1,Natural Gas - Sweet,Gas,No,2010,2010-05-22,2010/05/22 02:00:00 PM Mountain,,,Operation,Employee / Contractor (Onsite),2/10/2015,Yes,No,Natural Gas - Sweet,1,No,No,,,,,,,,,,,0,OPR,NGTL - Meikle River Compressor Station,,,,,,,,Canada,Yes,No,No,No,0,,Level I,Standard Review - 168 days,No,,"Station/Facility, Compression, Valve",,,,,,,,,,,,,,,,,,,,,,,,,,,No,,,No,,,No,No,,,No,-118.20534,1,1,0,0,0,0,0,0,0,0,0,1,0,0,0,0,0,0,0,0,0,0,0,0,0,0,0,0,0,5,1,0,0,0
179,INC2010-053,Release of Substance,5/27/2010,Brooks,NOVA Gas Transmission Ltd.,Closed,50.69805,0,Natural Gas - Sweet,Gas,No,2010,2010-05-24,2010/05/24 06:00:00 AM Mountain,,,Operation,Employee / Contractor (Onsite),9/2/2014,Yes,No,Natural Gas - Sweet,,No,No,,,,,,,,,,,0,OPR,,,,,,,,,Canada,Yes,No,No,No,0,,Level I,Standard Review - 168 days,No,,"Processing Plant, Cooling",,,,,,,,,,,,,,,,,,,,,,,,,,,No,,,No,,,No,No,,,No,-111.53063,1,1,0,0,0,0,0,0,0,0,0,1,0,0,0,0,0,0,0,0,0,0,0,0,0,0,0,0,0,5,1,0,0,0
180,INC2010-054,Release of Substance,5/28/2010,Pennant,TransCanada PipeLines Limited,Closed,50.57578,0,Natural Gas - Sweet,Gas,No,2010,2010-05-27,2010/05/27 02:00:00 PM Mountain,,,Maintenance,Employee / Contractor (Onsite),3/17/2014,Yes,No,Natural Gas - Sweet,,No,No,,,,,,,,,,,0,OPR,Line 100-6,1219.2,943.2932103,Natural Gas,,,,,Canada,Yes,No,No,No,0,,Level I,Standard Review - 168 days,No,,"Pipeline, Fitting, Nipple, Thread",,,,,,,,,,,,,,,,,,,,,,,,,,,No,,,No,,,No,No,,,No,-108.36036,1,0,0,0,1,0,0,0,0,0,0,1,0,0,0,0,0,0,0,0,0,0,0,0,0,0,0,0,0,5,1,0,0,0
181,INC2010-055,Release of Substance,6/3/2010,Fox Creek,NOVA Gas Transmission Ltd.,Closed,54.093481,0.1,Natural Gas - Sweet,Gas,No,2010,2010-06-02,2010/06/02 08:00:00 AM Mountain,,,Operation,Employee / Contractor (Onsite),2/10/2015,Yes,No,Natural Gas - Sweet,0.1,No,No,,,,,,,,,,,0,OPR,NGTL - Kaybob South #3 Meter Station,,,,,,,,Canada,Yes,No,No,No,0,,Level I,Standard Review - 168 days,No,,"Station/Facility, Metering, Delivering, Valve",,,,,,,,,,,,,,,,,,,,,,,,,,,No,,,No,,,No,No,,,No,-116.62138,1,1,0,0,0,0,0,0,0,0,0,1,0,0,0,0,0,0,0,0,0,0,0,0,0,0,0,0,0,6,0,1,0,0
182,INC2010-057,Release of Substance,6/17/2010,Not specified,Spectra Energy Empress Management Inc. as General Partner and Agent for Spectra Energy Empress L.P.,Closed,50.65773,0,Mixed HVP Hydrocarbons,Gas,No,2010,2010-06-10,2010/06/10 10:00:00 AM Mountain,,,Operation,Employee / Contractor (Onsite),5/23/2017,Yes,No,Mixed HVP Hydrocarbons,,No,No,,,,,,,,,,,0,OPR,,,,,,,,,Canada,No,No,Yes,No,0,Kilometer Post 35,Level I,Standard Review - 168 days,No,,,,,,,,,,,,,,,,,,,,,,,,,,,,,No,,,No,,,No,No,,,No,-109.53719,1,0,0,0,1,0,0,0,0,0,0,1,0,0,0,0,0,0,0,0,0,0,0,0,0,0,0,0,0,6,0,1,0,0
183,INC2010-058,Release of Substance,6/16/2010,Grande Prairie,NOVA Gas Transmission Ltd.,Closed,54.83027,0,Natural Gas - Sweet,Gas,No,2010,2010-06-16,2010/06/16 09:00:00 AM Mountain,,,Operation,Employee / Contractor (Onsite),11/19/2010,Yes,No,Natural Gas - Sweet,,No,No,,,,,,,,,,,0,OPR,NGTL - Gold Creek Compressor Station,,,,,,,,Canada,No,No,Yes,No,0,,Level I,Standard Review - 168 days,No,,,,,,,,,,,,,,,,,,,,,,,,,,,,,No,,,No,,,No,No,,,No,-118.64709,1,1,0,0,0,0,0,0,0,0,0,1,0,0,0,0,0,0,0,0,0,0,0,0,0,0,0,0,0,6,0,1,0,0
184,INC2010-059,Release of Substance,6/18/2010,Saint John,Emera Brunswick Pipeline Company Ltd.,Closed,45.30724,0,Natural Gas - Sweet,Gas,No,2010,2010-06-18,2010/06/18 10:00:00 AM Atlantic,,,Operation,Employee / Contractor (Onsite),8/11/2014,Yes,No,Natural Gas - Sweet,0,No,No,,,,,,,,,,,0,OPR,Emera - Red Head Metre Station,,,,,,,,Canada,Yes,No,No,No,0,,Level I,Standard Review - 168 days,No,,"Station/Facility, Pumping, Pump",,,,,,,,,,,,,,,,,,,,,,,,,,,No,,,No,,,No,No,,,No,-66.04254,1,0,0,0,0,0,1,0,0,0,0,1,0,0,0,0,0,0,0,0,0,0,0,0,0,0,0,0,0,6,0,1,0,0
185,INC2010-060,"Fire, Release of Substance",6/22/2010,Grenfell,TransCanada PipeLines Limited,Closed,50.28617,100,Natural Gas - Sweet,Gas,No,2010,2010-06-22,2010/06/22 12:27:00 PM Mountain,,,Construction,Employee / Contractor (Onsite),4/18/2012,No,No,Natural Gas - Sweet,100,No,No,,Other Event (Nature or 3rd Party),,,,,,,,,0,OPR,TCPL - Station 21 (Grenfell Compressor Station),,,,,,,,Canada,Yes,No,No,No,3,,Level I,Standard Review - 168 days,No,,,,,,,,,,,,,,,,,,,,,,,,,,,,,No,,,No,,,No,No,,,No,-102.95153,1,0,0,0,1,0,0,0,0,0,0,1,0,0,0,0,0,0,0,0,0,0,0,0,0,0,0,0,0,6,0,1,0,0
186,INC2010-061,Release of Substance,6/22/2010,Cactus Lake,Enbridge Pipelines Inc.,Closed,52.13984,25,Crude Oil - Sour,Liquid,No,2010,2010-06-22,2010/06/22 04:00:00 PM Mountain,,,Operation,Public,3/22/2011,Yes,No,Crude Oil - Sour,25,No,No,,,,,,,,,,,0,OPR,Line 4,"1219.00000000, 864.00000000, 914.00000000",1248.909872,Crude Oil,,Meter,,,Canada,Yes,No,No,No,3,,Level I,Standard Review - 168 days,No,,"Station/Facility, Pigging, Launching, Fitting",,,,,,,,,0,,,,0,,2010,2010,,,,,,,,,,,No,Replacement,,No,,,No,No,,Replacement,No,-109.80493,1,0,0,0,1,0,0,0,0,0,0,1,0,0,0,0,0,0,0,0,0,0,0,0,0,0,0,0,0,6,0,1,0,0
187,INC2010-062,Release of Substance,6/24/2010,Whitecourt,NOVA Gas Transmission Ltd.,Closed,54.1326,0,Natural Gas - Sweet,Gas,No,2010,2010-06-24,2010/06/24 07:30:00 AM Mountain,,,Operation,Employee / Contractor (Onsite),9/2/2014,Yes,No,Natural Gas - Sweet,0,No,No,,,,,,,,,,,0,OPR,NGTL - Greencourt West Meter Station,,,,,,,,Canada,Yes,No,No,No,3,,Level I,Standard Review - 168 days,No,,"Processing Plant, Cooling",,,,,,,,,,,,,,,,,,,,,,,,,,,No,,,No,,,No,No,,,No,-115.2362,1,1,0,0,0,0,0,0,0,0,0,1,0,0,0,0,0,0,0,0,0,0,0,0,0,0,0,0,0,6,0,1,0,0
188,INC2010-063,Fire,6/24/2010,Prince George,"Westcoast Energy Inc., carrying on business as Spectra Energy Transmission",Closed,54.28494,0,Not Applicable,Not Applicable,No,2010,2010-06-24,2010/06/24 04:00:00 PM Pacific,,,Operation,Employee / Contractor (Onsite),3/22/2011,Yes,No,,,,No,,Under Investigation or Unknown,,,,,,,,,0,OPR,WEI - Compressor Station 4A,,,,,,,,Canada,Yes,No,No,No,3,,Level I,Standard Review - 168 days,No,,"Station/Facility, Compression, Compressor",,,,,,,,,0,,,,,,,,,,,,,,,,,,No,Rebuilt,6/30/2010,No,,,No,No,6/30/2010,Repair,No,-122.61215,0,0,0,1,0,0,0,0,0,0,0,1,0,0,0,0,0,0,0,0,0,0,0,0,0,0,0,0,0,6,0,1,0,0
189,INC2010-066,Release of Substance,7/8/2010,Vegreville,NOVA Gas Transmission Ltd.,Closed,53.16727,0.5,Natural Gas - Sweet,Gas,No,2010,,2010/07/06 02:20:00 PM Mountain,,,Operation,Employee / Contractor (Onsite),6/30/2016,Yes,No,Natural Gas - Sweet,0.5,No,No,,,,,,,,,,,0,OPR,,,,,,,,,Canada,Yes,No,No,No,3,,Level I,Standard Review - 168 days,No,,,,,,,,,,,,,,,,,,,,,,,,,,,,,No,,,No,,,No,No,,,No,-112.15003,1,1,0,0,0,0,0,0,0,0,1,1,0,0,0,0,0,0,0,0,0,0,0,0,0,0,0,0,0,7,0,1,0,0
190,INC2010-073,Release of Substance,7/14/2010,Montreal,Trans-Northern Pipelines Inc.,Closed,45.625209,0,Jet Fuel,Liquid,Yes,2010,,2010/07/14 02:20:00 PM Eastern,No pipeline interruption,Transmission,Operation,Employee / Contractor (Onsite),11/7/2017,Yes,No,Jet Fuel,0,No,No,,,,,,,,,,,0,OPR,MONTREAL FEEDER,273.1,1.072838,"Refined Products-Aviation, Refined Products-Distillate, Refined Products-Gasoline",,Meter,,,Canada,No,Yes,Yes,No,0,Mile Post 2.12,Level III,Category C,Yes,REM-0105,"Pipeline, Pipe, Body",,NPS 10,,,,,,,,,,,,,,,,,,,,External,,,,,No,Replacement,7/26/2010,No,,,No,No,,,No,-73.543389,1,0,0,0,0,0,0,0,1,0,0,1,0,0,0,0,0,0,0,0,0,0,0,0,0,0,0,0,0,7,0,1,0,0
191,INC2010-074,Release of Substance,7/15/2010,Cochrane,TransCanada PipeLines Limited,Closed,48.94621,3300,Natural Gas - Sweet,Gas,No,2010,2010-07-10,2010/07/10 10:00:00 PM Mountain,,,Operation,Landowner,8/1/2012,Yes,No,Natural Gas - Sweet,3300,No,No,,,,,,,,,,,0,OPR,LINE 100-1,"508.00000000, 762.00000000, 863.60000000",2595.724534,Natural Gas,,,,,Canada,No,No,Yes,No,0,Mainline Valve + Offset (km),Level I,Standard Review - 168 days,No,,"Pipeline, Valve, Ball, Seal/Packing",,,,,,,,,,,,,,,,,,,,,,,,,,,No,,,No,,,No,No,,,No,-80.99467,1,0,0,0,0,1,0,0,0,0,0,1,0,0,0,0,0,0,0,0,0,0,0,0,0,0,0,0,0,7,0,1,0,0
192,INC2010-079,Release of Substance,7/25/2010,Maple Creek,TransCanada PipeLines Limited,Closed,43.87391,100,Natural Gas - Sweet,Gas,No,2010,,2010/07/24 09:30:00 AM Mountain,,,Operation,Employee / Contractor (Onsite),9/14/2010,Yes,No,Natural Gas - Sweet,100,No,No,,,,,,,,,,,0,OPR,TCPL - Station 130 (Maple Compressor Station),,,,,,,,Canada,Yes,No,No,No,0,,Level I,Standard Review - 168 days,No,,,,,,,,,,,,,,,,,,,,,,,,,,,,,No,,,No,,,No,No,,,No,-79.57983,1,0,0,0,0,1,0,0,0,0,0,1,0,0,0,0,0,0,0,0,0,0,0,0,0,0,0,0,0,7,0,1,0,0
193,INC2010-084,Release of Substance,8/3/2010,Saint John,Emera Brunswick Pipeline Company Ltd.,Closed,45.26269,0,Natural Gas - Sweet,Gas,No,2010,,2010/07/31 10:30:00 PM Atlantic,,,Operation,Employee / Contractor (Onsite),9/25/2013,Yes,No,Natural Gas - Sweet,,No,Yes,,,,,,,,,,,0,OPR,Emera - Red Head Metre Station,,,,,,,,Canada,Yes,No,No,No,0,,Level I,Standard Review - 168 days,No,,,,,,,,,,,,,,,,,,,,,,,,,,,,,No,,,No,,,No,No,,,No,-65.98211,1,0,0,0,0,0,1,0,0,0,0,1,0,0,0,0,0,0,0,0,0,0,0,0,0,0,0,0,0,7,0,1,0,0
194,INC2010-089,Release of Substance,8/16/2010,Grande Prairie,NOVA Gas Transmission Ltd.,Closed,54.83026,0,Natural Gas - Sweet,Gas,No,2010,2010-08-16,2010/08/16 11:41:00 AM Mountain,,,Operation,Employee / Contractor (Onsite),9/2/2014,Yes,No,Natural Gas - Sweet,0,No,No,,,,,,,,,,,0,OPR,NGTL - Gold Creek Compressor Station,,,,,,,,Canada,Yes,No,No,No,3,,Level I,Standard Review - 168 days,No,,"Station/Facility, Compression, Fitting",,,,,,,,,,,,,,,,,,,,,,,,,,,No,,,No,,,No,No,,,No,-118.64722,1,1,0,0,0,0,0,0,0,0,0,1,0,0,0,0,0,0,0,0,0,0,0,0,0,0,0,0,0,8,0,1,0,0
195,INC2010-090,Release of Substance,8/18/2010,Beiseker,NOVA Gas Transmission Ltd.,Closed,51.32247,0,Natural Gas - Sweet,Gas,No,2010,,2010/08/17 12:00:00 AM Mountain,,,Operation,Employee / Contractor (Onsite),8/26/2016,Yes,No,Natural Gas - Sweet,,No,No,,,,,,,,,,,0,OPR,NGTL - Atusis Creek Meter Station,,,,,,,,Canada,Yes,No,No,No,0,,Level I,Standard Review - 168 days,No,,,,,,,,,,,,,,,,,,,,,,,,,,,,,No,,,No,,,No,No,,,No,-113.38195,1,1,0,0,0,0,0,0,0,0,0,1,0,0,0,0,0,0,0,0,0,0,0,0,0,0,0,0,0,8,0,1,0,0
196,INC2010-091,Release of Substance,8/23/2010,Williamstown,Trans-Northern Pipelines Inc.,Closed,45.140221,25.1,Gasoline,Liquid,Yes,2010,,2010/08/23 09:15:00 AM Eastern,,Transmission,Operation,Employee / Contractor (Onsite),2/9/2017,Yes,No,Gasoline,25.1,No,Yes,,,,,,,,,,,0,OPR,Mainline,273.1,635.0188165,Refined Products-Aviation,,,,,Canada,Yes,Yes,Yes,Yes,0,,Level III,Category C,Yes,"INC2010-029, REM-0106","Pipeline, Valve, Pressure relief, Diaphragm;Pipeline, Valve, Pressure relief, Thread",,NPS 16,Carbon Steel,,,,,,,,,,,,,,,,,,,,,,,,No,,,No,8/17/2010,Visual,Yes,Yes,,,No,-74.562991,1,0,0,0,0,1,0,0,0,0,0,1,0,0,0,0,0,0,0,0,0,0,0,0,0,0,0,0,0,8,0,1,0,0
197,INC2010-092,Release of Substance,8/25/2010,Cobourg,TransCanada PipeLines Limited,Closed,44.00638,0,Natural Gas - Sweet,Gas,No,2010,,2010/08/24 02:27:00 PM Mountain,,,Operation,Employee / Contractor (Onsite),12/6/2010,Yes,No,Natural Gas - Sweet,0,No,No,,,,,,,,,,,0,OPR,,,,,,,,,Canada,Yes,No,No,No,0,,Level I,Standard Review - 168 days,No,,"Pipeline, Valve, Ball, Body",,,Carbon Steel,,,,,,0,,,,0,,,1960,,,,,,,,,,,No,Replacement,10/31/2010,No,,,No,No,10/31/2010,Replacement,No,-78.19719,1,0,0,0,0,1,0,0,0,0,0,1,0,0,0,0,0,0,0,0,0,0,0,0,0,0,0,0,0,8,0,1,0,0
198,INC2010-096,Release of Substance,9/7/2010,Carstairs,NOVA Gas Transmission Ltd.,Closed,51.50897,3,Natural Gas - Sweet,Gas,No,2010,2010-09-06,2010/09/06 12:20:00 AM Mountain,,,Operation,Employee / Contractor (Onsite),9/5/2014,Yes,No,Natural Gas - Sweet,3,No,No,,,,,,,,,,,0,OPR,NGTL - Lone Pine South Meter Station,,,,,,,,Canada,Yes,No,No,No,0,,Level I,Standard Review - 168 days,No,,"Station/Facility, Metering, Delivering, Valve",,,,,,,,,,,,,,,,,,,,,,,,,,,No,,,No,,,No,No,,,No,-113.86985,1,1,0,0,0,0,0,0,0,0,0,1,0,0,0,0,0,0,0,0,0,0,0,0,0,0,0,0,0,9,0,0,1,0
199,INC2010-097,Release of Substance,9/8/2010,Whitecourt,Alliance Pipeline Ltd.,Closed,54.31015,0,Natural Gas - Sweet,Gas,No,2010,2010-09-02,2010/09/02 03:00:00 PM Mountain,,,Operation,Employee / Contractor (Onsite),1/6/2011,Yes,No,Natural Gas - Sweet,0,No,No,,,,,,,,,,,0,OPR,Alliance - Carson Creek Compressor Station,,,,,,,,Canada,Yes,No,No,No,0,,Level I,Standard Review - 168 days,No,,,,,,,,,,,,,,,,,,,,,,,,,,,,,No,,,No,,,No,No,,,No,-115.68078,1,1,0,0,0,0,0,0,0,0,0,1,0,0,0,0,0,0,0,0,0,0,0,0,0,0,0,0,0,9,0,0,1,0
200,INC2010-098,Release of Substance,9/11/2010,Grande Prairie,NOVA Gas Transmission Ltd.,Closed,57.18167,0,Natural Gas - Sweet,Gas,No,2010,2010-09-10,2010/09/10 04:00:00 PM Mountain,,,Operation,Employee / Contractor (Onsite),11/9/2012,Yes,No,Natural Gas - Sweet,0,No,No,,,,,,,,,,,0,OPR,,,,,,,,,Canada,No,No,Yes,No,0,,Level I,Standard Review - 168 days,No,,"Pipeline, Flange, Bolt;Pipeline, Valve, Plug, Seal/Packing;Pipeline, Valve, Plug, Flange, Bolt",,,,,,,,,,,,,,,,,,,,,,,,,,,No,Rebuilt,11/17/2010,No,,,No,No,11/17/2010,Repair,No,-118.19522,1,1,0,0,0,0,0,0,0,0,0,1,0,0,0,0,0,0,0,0,0,0,0,0,0,0,0,0,0,9,0,0,1,0
201,INC2010-101,Release of Substance,9/20/2010,Alida,Enbridge Pipelines Inc.,Closed,49.42185,0,Natural Gas - Sweet,Gas,No,2010,2010-09-19,2010/09/19 11:30:00 AM Mountain,,,Construction,Employee / Contractor (Onsite),7/11/2011,No,No,Natural Gas - Sweet,0,No,No,,,,,,,,,,,0,OPR,Alida Terminal,,,,,,,,Canada,No,No,Yes,No,0,,Level I,Standard Review - 168 days,No,,,,,,,,,,,,,,,,,,,,,,,,,,,,,No,,,No,,,No,No,,,No,-101.87015,1,0,0,0,1,0,0,0,0,0,0,1,0,0,0,0,0,0,0,0,0,0,0,0,0,0,0,0,0,9,0,0,1,0
202,INC2010-102,Operation Beyond Design Limits,9/21/2010,Edmonton,Enbridge Pipelines Inc.,Closed,53.54740278,0,Not Applicable,Not Applicable,No,2010,2010-09-20,2010/09/20 07:38:00 PM Mountain,,,Operation,Employee / Contractor (Onsite),2/13/2013,Yes,No,,,,No,,,,,,,,,Over Pressure,,0,OPR,Line 4,"1219.00000000, 864.00000000, 914.00000000",1248.909872,Crude Oil,,,,,Canada,Yes,No,No,No,0,,Level I,Standard Review - 168 days,No,"INC2009-149, INC2009-150, INC2009-151, INC2009-152, INC2010-167, INC2010-168, INC2010-169, INC2010-170, INC2010-171, INC2010-172, INC2010-173, INC2010-174, INC2010-175, INC2010-176, INC2010-177",,,,,,,,,,,,,,,,,,,,,,,,,,,,No,,,No,,,No,No,,,No,-113.3556944,0,1,0,0,0,0,0,0,0,0,0,1,0,0,0,0,0,0,0,0,0,0,0,0,0,0,0,0,0,9,0,0,1,0
203,INC2010-103,Release of Substance,9/22/2010,Saint George,Maritimes & Northeast Pipeline Management Ltd.,Closed,45.129046,14.2,Natural Gas - Sweet,Gas,No,2010,2010-09-22,2010/09/22 11:15:00 AM Atlantic,,,Operation,Employee / Contractor (Onsite),9/11/2012,Yes,No,Natural Gas - Sweet,14.2,No,No,,,,,,,,,,,0,OPR,Mainline,"762.00000000, 863.60000000",574.8807991,Natural Gas,,,,,Canada,Yes,No,No,No,0,,Level I,Standard Review - 168 days,No,,"Station/Facility, Metering, Delivering, Fitting",,,,,,,,,,,,,,,,,,,,,,,,,,,No,,,No,,,No,No,,,No,-66.831379,1,0,0,0,0,0,1,0,0,0,0,1,0,0,0,0,0,0,0,0,0,0,0,0,0,0,0,0,0,9,0,0,1,0
204,INC2010-104,Release of Substance,9/23/2010,Enchant,NOVA Gas Transmission Ltd.,Closed,50.04984,0,Natural Gas - Sweet,Gas,No,2010,2010-09-22,2010/09/23 12:00:00 AM Mountain,,,Operation,Employee / Contractor (Onsite),8/26/2016,Yes,No,Natural Gas - Sweet,0,No,No,,,,,,,,,,,0,OPR,,,,,,,,,Canada,No,No,Yes,No,0,Legal Subdivision 2-4-13-19W4,Level I,Standard Review - 168 days,No,REM-0107,,,,,,,,,,,,,,,,,,,,,,,,,,,,No,,,No,,,No,No,,,No,-112.53824,1,1,0,0,0,0,0,0,0,0,1,1,0,0,0,0,0,0,0,0,0,0,0,0,0,0,0,0,0,9,0,0,1,0
205,INC2010-105,Release of Substance,9/29/2010,Spirit River,NOVA Gas Transmission Ltd.,Closed,55.77705,0,Natural Gas - Sweet,Gas,No,2010,,2010/09/28 03:20:00 PM Mountain,,,Operation,Employee / Contractor (Onsite),11/9/2012,Yes,No,Natural Gas - Sweet,0,No,No,,,,,,,,,,,0,OPR,,,,,,,,,Canada,No,No,Yes,No,3,Kilometer Post,Level I,Standard Review - 168 days,No,REM-0108,"Pipeline, Pipe, Body",,,,,,,,,,,,,,,,,,,,,,External,Polyethylene Tape Wrap,Disbonded,Field Applied,,No,Replacement,10/7/2010,No,,,No,No,10/7/2010,Replacement,No,-119.36823,1,1,0,0,0,0,0,0,0,0,0,1,0,0,0,0,0,0,0,0,0,0,0,0,0,0,0,0,0,9,0,0,1,0
206,INC2010-106,Release of Substance,9/30/2010,Geraldton,TransCanada PipeLines Limited,Closed,49.73149,0,Natural Gas - Sweet,Gas,No,2010,,2010/09/30 07:00:00 AM Mountain,,Transmission,Operation,Employee / Contractor (Onsite),2/13/2013,No,No,Natural Gas - Sweet,0,No,No,,,,,,,,,,,0,OPR,LINE 100-3,"1066.80000000, 762.00000000, 863.60000000, 914.40000000",2681.81132,Natural Gas,,,,,Canada,No,No,Yes,No,3,Mainline Valve + Offset (km),Level I,Standard Review - 168 days,No,,"Pipeline, Valve, Pressure relief, Other (please explain)",,,,,,,,,,,,,,,,,,,,,,,,,,,No,,,No,,,No,No,,,No,-87.06539,1,0,0,0,0,1,0,0,0,0,0,1,0,0,0,0,0,0,0,0,0,0,0,0,0,0,0,0,0,9,0,0,1,0
207,INC2010-107,Release of Substance,10/1/2010,Piapot,Foothills Pipe Lines Ltd.,Closed,49.98,0,Natural Gas - Sweet,Gas,No,2010,,2010/09/30 01:00:00 PM Mountain,,Transmission,Operation,Employee / Contractor (Onsite),9/18/2012,No,No,Natural Gas - Sweet,0,No,No,,,,,,,,,,,0,OPR,Foothills - Piapot Saskatchewan Compressor Stn,,,,,,,,Canada,No,No,Yes,No,3,,Level I,Standard Review - 168 days,No,,"Station/Facility, Compression, Pipe",,NPS 1/2,,,80,,,,0,,,,,,,,,,,,,,,,,,No,,,No,,,No,No,,,No,-109.12,1,0,0,0,1,0,0,0,0,0,0,1,0,0,0,0,0,0,0,0,0,0,0,0,0,0,0,0,0,9,0,0,1,0
208,INC2010-110,Release of Substance,10/6/2010,North Bay,TransCanada PipeLines Limited,Closed,46.37985,0,Natural Gas - Sweet,Gas,No,2010,,2010/09/30 04:00:00 PM Mountain,,,Operation,Employee / Contractor (Onsite),11/9/2012,Yes,No,Natural Gas - Sweet,,No,No,,,,,,,,,,,0,OPR,LINE 100-1,"508.00000000, 762.00000000, 863.60000000",2595.724534,Natural Gas,,,,,Canada,Yes,No,No,No,0,,Level I,Standard Review - 168 days,No,,"Station/Facility, Compression, Valve",,,,,,,,,,,,,,,,,,,,,,,,,,,No,Grinding,10/5/2010,No,,,No,No,10/5/2010,Repair,No,-79.46885,1,0,0,0,0,1,0,0,0,0,0,1,0,0,0,0,0,0,0,0,0,0,0,0,0,0,0,0,0,9,0,0,1,0
209,INC2010-111,Release of Substance,10/7/2010,Fox Creek,NOVA Gas Transmission Ltd.,Closed,54.0923,0,Natural Gas - Sweet,Gas,No,2010,,2010/10/04 10:00:00 PM Mountain,,,Operation,Employee / Contractor (Onsite),9/28/2011,Yes,No,Natural Gas - Sweet,0,No,No,,,,,,,,,,,0,OPR,NGTL - Kaybob South #3 Meter Station,,,,,,,,Canada,Yes,No,No,No,0,,Level I,Standard Review - 168 days,No,,"Station/Facility, Metering, Delivering, Valve",,,,,,,,,0,,,,,,,,,,,,,,,,,,No,,,No,,,No,No,,,No,-116.62298,1,1,0,0,0,0,0,0,0,0,0,1,0,0,0,0,0,0,0,0,0,0,0,0,0,0,0,0,0,10,0,0,1,0
210,INC2010-112,Release of Substance,10/7/2010,Monchy,Foothills Pipe Lines (Saskatchewan) Ltd.,Closed,50.53819444,0,Fuel Gas,Gas,No,2010,2010-10-06,2010/10/06 04:00:00 PM Mountain,,,Operation,Employee / Contractor (Onsite),9/29/2011,Yes,No,Fuel Gas,0,No,No,,,,,,,,,,,0,OPR,Foothills - Monchy Compressor Stn,,,,,,,,Canada,Yes,No,No,No,0,,Level I,Standard Review - 168 days,No,,"Station/Facility, Compression, Fitting",,,,,,,,,0,,,,,,,,,,,,,,,,,,No,,,No,,,No,No,,,No,-107.3048333,1,0,0,0,1,0,0,0,0,0,0,1,0,0,0,0,0,0,0,0,0,0,0,0,0,0,0,0,0,10,0,0,1,0
211,INC2010-113,"Explosion, Fire",10/14/2010,Fort St. John,"Westcoast Energy Inc., carrying on business as Spectra Energy Transmission",Closed,56.63939722,0,Not Applicable,Not Applicable,No,2010,,2010/10/14 12:00:00 PM Mountain,,,Maintenance,Employee / Contractor (Onsite),9/15/2011,Yes,No,,,,No,Under Investigation or Unknown,Under Investigation or Unknown,,,,,,,,,0,OPR,,,,,,,,,Canada,Yes,No,No,No,0,,Level I,Standard Review - 168 days,No,,"Station/Facility, Pigging, Launching, Fitting",,NPS 20,Carbon Steel,,,,,,0,,,,,,,,,,,,,,,,,,No,,,No,,,No,No,,,No,-121.6420556,0,0,0,1,0,0,0,0,0,0,0,1,0,0,0,0,0,0,0,0,0,0,0,0,0,0,0,0,0,10,0,0,1,0
212,INC2010-114,Release of Substance,10/15/2010,Haldimand,Enbridge Pipelines Inc.,Closed,42.83421028,17.5,Crude Oil - Sweet,Liquid,No,2010,,2010/10/15 11:00:00 AM Eastern,,,Operation,Employee / Contractor (Onsite),3/17/2011,No,No,Crude Oil - Sweet,17.5,No,No,,,,,,,,,,,0,OPR,Nanticoke Refinery,,,,,,,,Canada,Yes,No,No,No,0,,Level I,Standard Review - 168 days,No,REM-0109,,,,,,,,,,,,,,,,,,,,,,,,,,,,No,,,No,,,No,No,,,No,-80.0417111,1,0,0,0,0,1,0,0,0,0,0,1,0,0,0,0,0,0,0,0,0,0,0,0,0,0,0,0,0,10,0,0,1,0
213,INC2010-116,Release of Substance,10/21/2010,North Bay,TransCanada PipeLines Limited,Closed,46.43231389,0,Natural Gas - Sweet,Gas,No,2010,,2010/10/21 12:15:00 AM Mountain,,Gathering,Operation,Employee / Contractor (Onsite),7/23/2012,No,No,Natural Gas - Sweet,0,No,No,,,,,,,,,,,0,OPR,TCPL -  Widdifield Sales Meter Station,,,,,,,,Canada,Yes,No,No,No,0,,Level I,Standard Review - 168 days,No,,"Station/Facility, Metering, Delivering, Piping",,,,,,,,,,,,,,,,,,,,,,,,,,,No,,,No,,,No,No,,,No,-79.4676583,1,0,0,0,0,1,0,0,0,0,0,1,0,0,0,0,0,0,0,0,0,0,0,0,0,0,0,0,0,10,0,0,1,0
214,INC2010-121,Release of Substance,11/1/2010,Grande Prairie,NOVA Gas Transmission Ltd.,Closed,54.83012222,0,Natural Gas - Sweet,Gas,No,2010,2010-10-30,2010/10/30 04:00:00 PM Mountain,,,Operation,Employee / Contractor (Onsite),3/9/2011,Yes,No,Natural Gas - Sweet,0,No,No,,,,,,,,,,,0,OPR,NGTL - Gold Creek Compressor Station,,,,,,,,Canada,Yes,No,No,No,0,,Level I,Standard Review - 168 days,No,,"Station/Facility, Compression, Pipe",,NPS 1/2,Stainless Steel,,,,,,0,,,,,,,,,,,,,,,,,,No,,,No,,,No,No,,,No,-118.6471944,1,1,0,0,0,0,0,0,0,0,0,1,0,0,0,0,0,0,0,0,0,0,0,0,0,0,0,0,0,10,0,0,1,0
215,INC2010-118,Fire,10/27/2010,Kenora,TransCanada PipeLines Limited,Closed,49.79171111,0,Not Applicable,Not Applicable,No,2010,2010-10-26,2010/10/26 10:30:00 PM Eastern,,,Operation,Employee / Contractor (Onsite),7/11/2011,Yes,No,,,,No,,Equipment & Electrical,,,,,,,,,0,OPR,LINE 100-1,"508.00000000, 762.00000000, 863.60000000",2595.724534,Natural Gas,,,,,Canada,Yes,No,No,No,0,,Level I,Standard Review - 168 days,No,,,,,,,,,,,,,,,,,,,,,,,,,,,,,No,,,No,,,No,No,,,No,-94.4943138,0,0,0,0,0,1,0,0,0,0,1,1,0,0,0,0,0,0,0,0,0,0,0,0,0,0,0,1,0,10,0,0,1,0
216,INC2010-119,Release of Substance,10/28/2010,Burstall,TransCanada PipeLines Limited,Closed,50.67645278,11000,Natural Gas - Sweet,Gas,No,2010,2010-10-28,2010/10/28 09:00:00 AM Central,,,Operation,Employee / Contractor (Onsite),6/6/2011,Yes,No,Natural Gas - Sweet,11000,No,No,,,,,,,,,,,0,OPR,LINE 100-1,"508.00000000, 762.00000000, 863.60000000",2595.724534,Natural Gas,,,,,Canada,Yes,No,No,No,0,,Level I,Standard Review - 168 days,No,,"Station/Facility, Metering, Delivering, Valve",,,,,,,,,,,,,,,,,,,,,,,,,,,No,,,No,,,No,No,,,No,-109.9787222,1,0,0,0,1,0,0,0,0,0,0,1,0,0,0,0,0,0,0,0,0,0,0,0,0,0,0,0,0,10,0,0,1,0
217,INC2010-122,Release of Substance,11/2/2010,Kendal,TransCanada PipeLines Limited,Closed,50.33116111,0,Natural Gas - Sweet,Gas,No,2010,2010-11-01,2010/11/01 04:00:00 PM Mountain,,,Operation,Landowner,3/17/2011,Yes,No,Natural Gas - Sweet,0,No,No,,,,,,,,,,,0,OPR,,,,,,,,,Canada,No,No,Yes,No,0,Mainline Valve + Offset (km),Level I,Standard Review - 168 days,No,,"Pipeline, Valve, Ball, Other (please explain)",,,,,,,,,,,,,,,,,,,,,,,,,,,No,,,No,,,No,No,,,No,-103.6093333,1,0,0,0,1,0,0,0,0,0,0,1,0,0,0,0,0,0,0,0,0,0,0,0,0,0,0,0,0,11,0,0,1,0
218,INC2010-123,Serious Injury (CER or TSB),11/5/2010,Fort Nelson,"Westcoast Energy Inc., carrying on business as Spectra Energy Transmission",Closed,58.65305556,0,Not Applicable,Not Applicable,Yes,2010,2010-10-18,2010/10/18 09:00:00 AM Mountain,,,Construction,,12/15/2010,No,No,,,,No,,,,,,1,,No,,,0,PPR,WEI - Fort Nelson North Processing Facility,,,,,,,,Canada,No,No,No,No,0,,Level I,Standard Review - 168 days,No,,,,,,,,,,,,,,,,,,,,,,,,,,,,,No,,,No,,,No,No,,,No,-122.6848278,0,0,0,1,0,0,0,0,0,0,0,1,0,0,0,0,0,0,0,0,0,0,0,0,0,0,0,0,0,10,0,0,1,0
219,INC2010-124,Operation Beyond Design Limits,11/5/2010,Gordondale,NOVA Gas Transmission Ltd.,Closed,55.82576,0,Not Applicable,Not Applicable,No,2010,2010-11-03,2010/11/03 12:00:00 AM Mountain,,,Operation,Employee / Contractor (Onsite),10/14/2015,No,No,,,,No,,,,,,,,,Inappropriate Product,,0,OPR,,,,,,,,,Canada,Yes,No,No,No,0,Legal Subdivision 79-12-W6,Level I,Standard Review - 168 days,No,,"Pipeline, Pipe, Body",,,,,,,,,,,,,,,,,,,,,,,,,,,No,,,No,,,No,No,,,No,-119.73576,0,1,0,0,0,0,0,0,0,0,0,1,0,0,0,0,0,0,0,0,0,0,0,0,0,0,0,0,0,11,0,0,1,0
220,INC2010-127,Fire,11/15/2010,Portage La Prairie,TransCanada Keystone Pipeline GP Ltd.,Closed,50.01944722,0,Not Applicable,Not Applicable,No,2010,2010-11-11,2010/11/11 04:00:00 PM Mountain,,,Operation,Employee / Contractor (Onsite),11/9/2012,Yes,No,,,,No,,Equipment & Electrical,,,,,,,,,0,OPR,TCP Keystone Wellwood Pump Station,,,,,,,,Canada,Yes,No,No,No,0,,Level I,Standard Review - 168 days,No,,"Station/Facility, Pumping, Auxiliary power unit",,,,,,,,,,,,,,,,,,,,,,,,,,,No,Removal,,No,,,No,No,,Repair,No,-99.3645055,0,0,1,0,0,0,0,0,0,0,0,1,0,0,0,0,0,0,0,0,0,0,0,0,0,0,0,0,0,11,0,0,1,0
221,INC2010-128,Release of Substance,11/17/2010,Grovedale,NOVA Gas Transmission Ltd.,Closed,54.67993889,1,Natural Gas - Sweet,Gas,No,2010,2010-11-09,2010/11/09 07:49:00 AM Mountain,,,Operation,Employee / Contractor (Onsite),11/9/2012,Yes,No,Natural Gas - Sweet,1,No,No,,,,,,,,,,,0,OPR,NGTL - Cutbank Lateral,,,,,,,,Canada,No,No,Yes,No,0,,Level I,Standard Review - 168 days,No,,"Pipeline, Valve, Ball, Other (please explain)",,,,,,,,,,,,,,,,,,,,,,,,,,,No,Removal,11/17/2010,No,,,No,No,11/17/2010,Repair,No,-118.9943333,1,1,0,0,0,0,0,0,0,0,0,1,0,0,0,0,0,0,0,0,0,0,0,0,0,0,0,0,0,11,0,0,1,0
222,INC2010-129,Release of Substance,11/19/2010,Lincoln,TransCanada PipeLines Limited,Closed,43.11360833,0,Natural Gas - Sweet,Gas,No,2010,2010-11-18,2010/11/18 07:45:00 AM Mountain,,,Operation,Employee / Contractor (Onsite),11/7/2011,Yes,No,Natural Gas - Sweet,0,No,No,,,,,,,,,,,0,OPR,Line 200-1,508,104.8390755,Natural Gas,,,,,Canada,Yes,No,No,No,0,,Level I,Standard Review - 168 days,No,,"Station/Facility, Compression, Fitting",,,,,,,,,,,,,,,,,,,,,,,,,,,No,,,No,,,No,No,,,No,-79.463075,1,0,0,0,0,1,0,0,0,0,0,1,0,0,0,0,0,0,0,0,0,0,0,0,0,0,0,0,0,11,0,0,1,0
223,INC2010-130,Release of Substance,11/19/2010,Jellicoe,TransCanada PipeLines Limited,Closed,49.68026111,0,Natural Gas - Sweet,Gas,No,2010,2010-11-19,2010/11/19 03:30:00 PM Mountain,,,Operation,Employee / Contractor (Onsite),11/7/2011,Yes,No,Natural Gas - Sweet,0,No,No,,,,,,,,,,,0,OPR,TCPL - Station 77 (Jellicoe Compressor Station),,,,,,,,Canada,Yes,No,No,No,0,,Level I,Standard Review - 168 days,No,,"Station/Facility, Compression, Compressor",,,,,,,,,,,,,,,,,,,,,,,,,,,No,,,No,,,No,No,,,No,-87.5951138,1,0,0,0,0,1,0,0,0,0,0,1,0,0,0,0,0,0,0,0,0,0,0,0,0,0,0,0,0,11,0,0,1,0
224,INC2010-131,Release of Substance,11/20/2010,Saint John,Maritimes & Northeast Pipeline Management Ltd.,Closed,45.27811111,2.8,Natural Gas - Sweet,Gas,No,2010,,2010/11/20 09:20:00 AM Atlantic,,,Operation,Employee / Contractor (Onsite),9/11/2012,Yes,No,Natural Gas - Sweet,2.8,No,No,,,,,,,,,,,0,OPR,,,,,,,,,Canada,Yes,No,No,No,0,,Level I,Standard Review - 168 days,No,,"Station/Facility, Metering, Delivering, Fitting",,,,,,,,,,,,,,,,,,,,,,,,,,,No,,,No,,,No,No,,,No,-66.0088056,1,0,0,0,0,0,1,0,0,0,0,1,0,0,0,0,0,0,0,0,0,0,0,0,0,0,0,0,0,11,0,0,1,0
225,INC2010-134,Adverse Environmental Effects,11/22/2010,Not specified,"Westcoast Energy Inc., carrying on business as Spectra Energy Transmission",Closed,55.39952,0,Not Applicable,Not Applicable,Yes,2010,,2010/11/19 07:00:00 AM Mountain,,,Operation,Employee / Contractor (Onsite),8/11/2014,Yes,No,,,,No,,,,,,,,,,,0,OPR,,,,,WEI - Goodrich Pipeline Extension Injection Well,,55.39952,-122.09349,Canada,Yes,No,No,No,0,Legal Subdivision 88-H/93-O-08,Level I,Standard Review - 168 days,No,REM-0113,"Pipeline, Auxiliary device(s) (please explain)",,,,,,,,,,,,,,,,,,,,,,,,,,,No,,,No,,,No,No,,,No,-122.09349,0,0,0,1,0,0,0,0,0,0,0,1,0,0,0,0,0,0,0,0,0,0,0,0,0,0,0,0,0,11,0,0,1,0
226,INC2010-135,Release of Substance,11/22/2010,Tumbler Ridge,"Westcoast Energy Inc., carrying on business as Spectra Energy Transmission",Closed,54.86820278,0,Natural Gas - Sour,Gas,Yes,2010,,2010/11/22 11:00:00 AM Mountain,,,Operation,Employee / Contractor (Onsite),8/11/2014,Yes,No,Natural Gas - Sour,0,No,No,,,,,,,,,,,0,OPR,Grizzly Pipeline,"273.10000000, 508.00000000, 610.00000000",160.6451852,"Natural Gas Sour, Natural Gas Sweet",,,,,Canada,No,No,Yes,No,0,Mile Post 13.6,Level I,Standard Review - 168 days,No,,"Pipeline, Valve, Pressure relief, Stem",,,,,,,,,,,,,,,,,,,,,,,,,,,No,,,No,,,No,No,,,No,-120.6479722,1,0,0,1,0,0,0,0,0,0,0,1,0,0,0,0,0,0,0,0,0,0,0,0,0,0,0,0,0,11,0,0,1,0
227,INC2010-137,Release of Substance,11/22/2010,Kendal,TransCanada PipeLines Limited,Closed,50.33177,0,Natural Gas - Sweet,Gas,No,2010,,2010/11/20 10:14:00 AM Mountain,,,Operation,Employee / Contractor (Onsite),10/10/2012,Yes,No,Natural Gas - Sweet,0,No,No,,,,,,,,,,,0,OPR,,,,,,,,,Canada,No,No,Yes,No,0,Mainline Valve + Offset (km) MLV 19,Level I,Standard Review - 168 days,No,,"Pipeline, Valve, Pressure relief, Diaphragm",,,,,,,,,,,,,,,,,,,,,,,,,,,No,,11/20/2010,No,,,No,No,11/20/2010,,No,-103.60955,1,0,0,0,1,0,0,0,0,0,0,1,0,0,0,0,0,0,0,0,0,0,0,0,0,0,0,0,0,11,0,0,1,0
228,INC2010-139,Operation Beyond Design Limits,11/24/2010,Edmonton,Enbridge Pipelines Inc.,Closed,53.54769,0,Not Applicable,Not Applicable,No,2010,2010-11-24,2010/11/24 07:56:00 PM Mountain,Short-term interruption,,Operation,Employee / Contractor (Onsite),3/30/2015,Yes,No,,,,No,,,,,,,,,Over Pressure,,0,OPR,,,,,,Valve,,,Canada,Yes,No,No,No,0,,Level I,Standard Review - 168 days,No,,,,,,,,,,,,,,,,,,,,,,,,,,,,,No,,,No,,,No,No,,,No,-113.35921,0,1,0,0,0,0,0,0,0,0,0,1,0,0,0,0,0,0,0,0,0,0,0,0,0,0,0,0,0,11,0,0,1,0
229,INC2010-141,Release of Substance,11/27/2010,Piapot,Foothills Pipe Lines (Saskatchewan) Ltd.,Closed,49.98,0,Natural Gas - Sweet,Gas,No,2010,2010-11-26,2010/11/26 05:44:00 PM Mountain,,,Operation,Employee / Contractor (Onsite),1/2/2013,Yes,No,Natural Gas - Sweet,0,No,No,,,,,,,,,,,0,OPR,,,,,,,,,Canada,Yes,No,No,No,0,,Level I,Standard Review - 168 days,No,,"Station/Facility, Compression, Valve",,,,,,,,,,,,,,,,,,,,,,,,,,,No,,11/26/2010,No,,,No,No,11/26/2010,,No,-109.12,1,0,0,0,1,0,0,0,0,0,0,1,0,0,0,0,0,0,0,0,0,0,0,0,0,0,0,0,0,11,0,0,1,0
230,INC2010-143,Release of Substance,11/30/2010,Shaunavon,Foothills Pipe Lines Ltd.,Closed,49.55266,0,Natural Gas - Sweet,Gas,No,2010,2010-11-29,2010/11/29 09:15:00 AM Mountain,,,Operation,Employee / Contractor (Onsite),6/18/2013,Yes,No,Natural Gas - Sweet,0,No,No,,,,,,,,,,,0,OPR,,,,,,,,,Canada,Yes,No,No,No,0,,Level I,Standard Review - 168 days,No,,"Station/Facility, Compression, Valve",,,,,,,,,,,,,,,,,,,,,,,,,,,No,,,No,,,No,No,,,No,-108.3695,1,0,0,0,1,0,0,0,0,0,0,1,0,0,0,0,0,0,0,0,0,0,0,0,0,0,0,0,0,11,0,0,1,0
231,INC2010-145,Release of Substance,12/1/2010,Hanna,NOVA Gas Transmission Ltd.,Closed,51.93893056,0,Natural Gas - Sweet,Gas,No,2010,2010-11-30,2010/11/30 06:00:00 PM Mountain,,,Operation,Employee / Contractor (Onsite),9/5/2014,Yes,No,Natural Gas - Sweet,0,No,No,,,,,,,,,,,0,OPR,,,,,,,,,Canada,Yes,No,No,No,0,,Level I,Standard Review - 168 days,No,,"Station/Facility, Compression, Valve, Pressure relief, Other (please explain)",,,,,,,,,,,,,,,,,,,,,,,,,,,No,,,No,,,No,No,,,No,-112.0749444,1,1,0,0,0,0,0,0,0,0,0,1,0,0,0,0,0,0,0,0,0,0,0,0,0,0,0,0,0,11,0,0,1,0
232,INC2010-147,Release of Substance,12/1/2010,Lincoln,Maritimes & Northeast Pipeline Management Ltd.,Closed,45.886624,0.5,Natural Gas - Sweet,Gas,No,2010,2010-12-01,2010/12/01 12:00:00 AM Mountain,,,Operation,Employee / Contractor (Onsite),11/6/2012,Yes,No,Natural Gas - Sweet,0.5,No,No,,,,,,,,,,,0,OPR,Fredericton Meter Station,,,,,,,,Canada,Yes,No,No,No,4,,Level I,Standard Review - 168 days,No,,"Station/Facility, Metering, Delivering, Valve",,,,,,,,,0,,,,,,2000,,,,,,,,,,,,No,,,No,,,No,No,,,No,-66.551134,1,0,0,0,0,0,1,0,0,0,0,1,0,0,0,0,0,0,0,0,0,0,0,0,0,0,0,0,0,12,0,0,0,1
233,INC2010-148,Release of Substance,12/3/2010,Cabri,TransCanada PipeLines Limited,Closed,50.605125,0,Natural Gas - Sweet,Gas,No,2010,2010-12-03,2010/12/03 12:00:00 AM Mountain,,,Operation,Employee / Contractor (Onsite),7/27/2012,Yes,No,Natural Gas - Sweet,0,No,No,,,,,,,,,,,0,OPR,,,,,,,,,Canada,Yes,No,No,No,0,,Level I,Standard Review - 168 days,No,,"Station/Facility, Compression, Valve",,,,,,,,,,,,,,,,,,,,,,,,,,,No,,,No,,,No,No,,,No,-108.7085556,1,0,0,0,1,0,0,0,0,0,0,1,0,0,0,0,0,0,0,0,0,0,0,0,0,0,0,0,0,12,0,0,0,1
234,INC2010-149,Operation Beyond Design Limits,12/3/2010,Hardisty,Enbridge Pipelines Inc.,Closed,52.63944722,0,Not Applicable,Not Applicable,No,2010,2010-11-25,2010/11/25 12:00:00 AM Mountain,,,Operation,Employee / Contractor (Onsite),6/18/2013,Yes,No,,,,No,,,,,,,,,Over Pressure,,0,OPR,Enbridge - Alberta Clipper,,,,,,,,Canada,No,No,Yes,No,0,,Level I,Standard Review - 168 days,No,,"Pipeline, Pipe, Body",,,,,,,,,,,,,,,,,,,,,,,,,,,No,,,No,,,No,No,,,No,-111.2781389,0,1,0,0,0,0,0,0,0,0,0,1,0,0,0,0,0,0,0,0,0,0,0,0,0,0,0,0,0,11,0,0,1,0
235,INC2010-150,Release of Substance,12/6/2010,Sundridge,TransCanada PipeLines Limited,Closed,45.71830278,0,Natural Gas - Sweet,Gas,No,2010,2010-12-06,2010/12/06 04:00:00 AM Eastern,,,Operation,Employee / Contractor (Onsite),10/10/2012,Yes,No,Natural Gas - Sweet,0,No,No,,,,,,,,,,,0,OPR,,,,,,,,,Canada,Yes,No,No,No,0,,Level I,Standard Review - 168 days,No,,"Station/Facility, Compression, Auxiliary device(s) (please explain)",,,,,,,,,,,,,,,,,,,,,,,,,,,No,Rebuilt,12/6/2010,No,,,No,No,12/6/2010,Repair,No,-79.4368138,1,0,0,0,0,1,0,0,0,0,0,1,0,0,0,0,0,0,0,0,0,0,0,0,0,0,0,0,0,12,0,0,0,1
236,INC2010-151,Operation Beyond Design Limits,12/8/2010,Fort Nelson,"Westcoast Energy Inc., carrying on business as Spectra Energy Transmission",Closed,59.20186,0,Not Applicable,Not Applicable,No,2010,2010-12-05,2010/12/05 12:00:00 AM Mountain,,,Operation,Employee / Contractor (Onsite),6/18/2013,Yes,No,,,,No,,,,,,,,,Over Pressure,,0,OPR,,,,,,,,,Canada,No,No,Yes,No,3,Mile Post,Level I,Standard Review - 168 days,No,,"Pipeline, Pipe, Body",,,,,,,,,,,,,,,,,,,,,,,,,,,No,,,No,,,No,No,,,No,-121.596498,0,0,0,1,0,0,0,0,0,0,0,1,0,0,0,0,0,0,0,0,0,0,0,0,0,0,0,0,0,12,0,0,0,1
237,INC2010-153,Release of Substance,12/10/2010,Regina,TransCanada PipeLines Limited,Closed,50.39316667,2.8,Natural Gas - Sweet,Gas,No,2010,2010-12-08,2010/12/08 05:00:00 PM Mountain,,,Operation,Employee / Contractor (Onsite),10/4/2011,Yes,No,Natural Gas - Sweet,2.8,No,No,,,,,,,,,,,0,OPR,TCPL - Station 17 (Regina Compressor Station),,,,,,,,Canada,Yes,No,No,No,3,,Level I,Standard Review - 168 days,No,,"Station/Facility, Compression, Compressor",,,,,,,,,0,,,,,1996,,,,,,,,,,,,,No,,,No,,,No,No,,,No,-104.4093611,1,0,0,0,1,0,0,0,0,0,0,1,0,0,0,0,0,0,0,0,0,0,0,0,0,0,0,0,0,12,0,0,0,1
238,INC2010-155,Release of Substance,12/13/2010,Jellicoe,TransCanada PipeLines Limited,Closed,49.70361,0,Natural Gas - Sweet,Gas,No,2010,2010-12-13,2010/12/13 10:30:00 AM Mountain,,,Operation,Employee / Contractor (Onsite),7/30/2012,Yes,No,Natural Gas - Sweet,0,No,No,,,,,,,,,,,0,OPR,TCPL - MLV 78,,,,,,,,Canada,Yes,No,No,No,3,Mainline Valve + Offset (km),Level I,Standard Review - 168 days,No,,,,,,,,,,,,,,,,,,,,,,,,,,,,,No,,,No,,,No,No,,,No,-87.41084,1,0,0,0,0,1,0,0,0,0,0,1,0,0,0,0,0,0,0,0,0,0,0,0,0,0,0,0,0,12,0,0,0,1
239,INC2010-156,"Release of Substance, Adverse Environmental Effects",12/13/2010,Taylor,"Westcoast Energy Inc., carrying on business as Spectra Energy Transmission",Closed,56.14630278,0,Contaminated Water,Miscellaneous,Yes,2010,2010-12-12,2010/12/12 02:30:00 PM Mountain,,,Operation,,8/24/2017,Yes,No,Contaminated Water,0,No,No,,,,,,,,,,,0,PPR,,,,,,,,,Canada,Yes,No,No,No,5,,Level I,Standard Review - 168 days,No,REM2010-156,,,,,,,,,,,,,,,,,,,,,,,,,,,,No,,,No,,,No,No,,,No,-120.6691694,1,0,0,1,0,0,0,0,0,0,0,1,0,0,0,0,0,0,0,0,0,0,0,0,0,0,0,0,0,12,0,0,0,1
240,INC2010-157,Release of Substance,12/15/2010,Dartmouth,Maritimes & Northeast Pipeline Management Ltd.,Closed,44.663897,1,Natural Gas - Sweet,Gas,No,2010,2010-12-15,2010/12/15 04:00:00 AM Atlantic,,,Operation,Employee / Contractor (Onsite),9/18/2014,Yes,No,Natural Gas - Sweet,1,No,No,,,,,,,,,,,0,OPR,Tuffs Cove MS,,,,,,,,Canada,Yes,No,No,No,0,,Level I,Standard Review - 168 days,No,,"Station/Facility, Metering, Delivering, Valve",,,,,,,,,,,,,,,,,,,,,,,,,,,No,,,No,,,No,No,,,No,-63.568182,1,0,0,0,0,0,0,1,0,0,0,1,0,0,0,0,0,0,0,0,0,0,0,0,0,0,0,0,0,12,0,0,0,1
241,INC2010-159,Release of Substance,12/17/2010,Fox Creek,NOVA Gas Transmission Ltd.,Closed,54.50731,0,Natural Gas - Sweet,Gas,No,2010,2010-12-16,2010/12/16 04:30:00 PM Mountain,,,Operation,Employee / Contractor (Onsite),6/6/2011,Yes,No,Natural Gas - Sweet,,No,No,,,,,,,,,,,0,OPR,Raspberry Lake MS,,,,,,,,Canada,Yes,No,No,No,0,Legal Subdivision 64-17 W5,Level I,Standard Review - 168 days,No,,"Station/Facility, Metering, Delivering, Valve",,,,,,,,,,,,,,,,,,,,,,,,,,,No,,,No,,,No,No,,,No,-116.44281,1,1,0,0,0,0,0,0,0,0,0,1,0,0,0,0,0,0,0,0,0,0,0,0,0,0,0,0,0,12,0,0,0,1
242,INC2010-158,Fire,12/17/2010,Hardisty,TransCanada Keystone Pipeline GP Ltd.,Closed,52.65486,0,Not Applicable,Not Applicable,No,2010,,2010/12/16 01:00:00 PM Mountain,,,Operation,Employee / Contractor (Onsite),8/26/2016,No,No,,,,No,,Equipment & Electrical,,,,,,,,,0,OPR,TCP Keystone - Hardisty Terminal,,,,,,,,Canada,Yes,No,No,No,0,,Level I,Standard Review - 168 days,No,,,,,,,,,,,,,,,,,,,,,,,,,,,,,No,,,No,,,No,No,,,No,-111.26462,0,1,0,0,0,0,0,0,0,0,0,1,0,0,0,0,0,0,0,0,0,0,0,0,0,0,0,0,0,12,0,0,0,1
243,INC2010-164,Release of Substance,12/22/2010,Jarvie,NOVA Gas Transmission Ltd.,Closed,54.65256,0,Natural Gas - Sweet,Gas,No,2010,2010-12-21,2010/12/21 04:00:00 PM Mountain,,,Operation,Employee / Contractor (Onsite),9/5/2014,Yes,No,Natural Gas - Sweet,0,No,No,,,,,,,,,,,0,OPR,,,,,,,,,Canada,Yes,No,No,No,0,,Level I,Standard Review - 168 days,No,,"Pipeline, Valve, Pressure relief, Other (please explain)",,,,,,,,,,,,,,,,,,,,,,,,,,,No,,,No,,,No,No,,,No,-114.52778,1,1,0,0,0,0,0,0,0,0,0,1,0,0,0,0,0,0,0,0,0,0,0,0,0,0,0,0,0,12,0,0,0,1
244,INC2010-165,Serious Injury (CER or TSB),12/30/2010,Taylor,"Westcoast Energy Inc., carrying on business as Spectra Energy Transmission",Closed,56.14652,0,Not Applicable,Not Applicable,Yes,2010,2010-12-29,2010/12/29 05:00:00 PM Mountain,,,Maintenance,,1/22/2018,No,No,,,,No,,,,,,1,,No,,,0,PPR,WEI - McMahon Gas Plant (Taylor Gas Plant),,,,,,,,Canada,No,No,No,No,0,,Level I,Standard Review - 168 days,No,,,,,,,,,,,,,,,,,,,,,,,,,,,,,No,,,No,,,No,No,,,No,-120.66907,0,0,0,1,0,0,0,0,0,0,0,1,0,0,0,0,0,0,0,0,0,0,0,0,0,0,0,0,0,12,0,0,0,1
245,INC2010-167,Operation Beyond Design Limits,11/11/2010,Edmonton,Enbridge Pipelines Inc.,Closed,53.547403,0,Not Applicable,Not Applicable,No,2010,2009-09-09,2010/11/11 12:00:00 AM Mountain,,,Operation,Employee / Contractor (Onsite),4/13/2015,Yes,No,,,,No,,,,,,,,,Over Pressure,,0,OPR,Line 4,"1219.00000000, 864.00000000, 914.00000000",1248.909872,Crude Oil,,,,,Canada,No,No,Yes,No,0,,Level I,Standard Review - 168 days,No,INC2010-102,,,,,,,,,,,,,,,,,,,,,,,,,,,,No,,,No,,,No,No,,,No,-113.355714,0,1,0,0,0,0,0,0,0,0,0,1,0,0,0,0,0,0,0,0,0,0,0,0,0,0,0,0,0,9,0,0,1,0
246,INC2010-168,Operation Beyond Design Limits,11/11/2010,Edmonton,Enbridge Pipelines Inc.,Closed,53.547403,0,Not Applicable,Not Applicable,No,2010,2010-01-20,2010/11/11 12:00:00 AM Mountain,,,Operation,Employee / Contractor (Onsite),4/13/2015,Yes,No,,,,No,,,,,,,,,Over Pressure,,0,OPR,Line 4,"1219.00000000, 864.00000000, 914.00000000",1248.909872,Crude Oil,,,,,Canada,No,No,Yes,No,0,,Level I,Standard Review - 168 days,No,INC2010-102,,,,,,,,,,,,,,,,,,,,,,,,,,,,No,,,No,,,No,No,,,No,-113.355714,0,1,0,0,0,0,0,0,0,0,0,1,0,0,0,0,0,0,0,0,0,0,0,0,0,0,0,0,0,1,0,0,0,1
247,INC2010-169,Operation Beyond Design Limits,11/11/2010,Edmonton,Enbridge Pipelines Inc.,Closed,53.547403,0,Not Applicable,Not Applicable,No,2010,2010-03-06,2010/11/11 12:00:00 AM Mountain,,,Operation,Employee / Contractor (Onsite),4/13/2015,Yes,No,,,,No,,,,,,,,,Over Pressure,,0,OPR,Line 4,"1219.00000000, 864.00000000, 914.00000000",1248.909872,Crude Oil,,,,,Canada,No,No,Yes,No,0,,Level I,Standard Review - 168 days,No,INC2010-102,,,,,,,,,,,,,,,,,,,,,,,,,,,,No,,,No,,,No,No,,,No,-113.355714,0,1,0,0,0,0,0,0,0,0,0,1,0,0,0,0,0,0,0,0,0,0,0,0,0,0,0,0,0,3,1,0,0,0
248,INC2010-170,Operation Beyond Design Limits,11/11/2010,Edmonton,Enbridge Pipelines Inc.,Closed,53.547403,0,Not Applicable,Not Applicable,No,2010,2010-03-09,2010/11/11 12:00:00 AM Mountain,,,Operation,Employee / Contractor (Onsite),4/13/2015,Yes,No,,,,No,,,,,,,,,Over Pressure,,0,OPR,Line 4,"1219.00000000, 864.00000000, 914.00000000",1248.909872,Crude Oil,,,,,Canada,No,No,Yes,No,0,,Level I,Standard Review - 168 days,No,INC2010-102,,,,,,,,,,,,,,,,,,,,,,,,,,,,No,,,No,,,No,No,,,No,-113.355714,0,1,0,0,0,0,0,0,0,0,0,1,0,0,0,0,0,0,0,0,0,0,0,0,0,0,0,0,0,3,1,0,0,0
249,INC2010-171,Operation Beyond Design Limits,11/11/2010,Edmonton,Enbridge Pipelines Inc.,Closed,53.547403,0,Not Applicable,Not Applicable,No,2010,2010-03-11,2010/11/11 12:00:00 AM Mountain,,,Operation,Employee / Contractor (Onsite),4/13/2015,Yes,No,,,,No,,,,,,,,,Over Pressure,,0,OPR,Line 4,"1219.00000000, 864.00000000, 914.00000000",1248.909872,Crude Oil,,,,,Canada,No,No,Yes,No,0,,Level I,Standard Review - 168 days,No,INC2010-102,,,,,,,,,,,,,,,,,,,,,,,,,,,,No,,,No,,,No,No,,,No,-113.355714,0,1,0,0,0,0,0,0,0,0,0,1,0,0,0,0,0,0,0,0,0,0,0,0,0,0,0,0,0,3,1,0,0,0
250,INC2010-172,Operation Beyond Design Limits,11/11/2010,Edmonton,Enbridge Pipelines Inc.,Closed,53.547403,0,Not Applicable,Not Applicable,No,2010,2010-05-06,2010/11/11 12:00:00 AM Mountain,,,Operation,Employee / Contractor (Onsite),4/13/2015,Yes,No,,,,No,,,,,,,,,Over Pressure,,0,OPR,Line 4,"1219.00000000, 864.00000000, 914.00000000",1248.909872,Crude Oil,,,,,Canada,No,No,Yes,No,0,,Level I,Standard Review - 168 days,No,INC2010-102,,,,,,,,,,,,,,,,,,,,,,,,,,,,No,,,No,,,No,No,,,No,-113.355714,0,1,0,0,0,0,0,0,0,0,0,1,0,0,0,0,0,0,0,0,0,0,0,0,0,0,0,0,0,5,1,0,0,0
251,INC2010-173,Operation Beyond Design Limits,11/11/2010,Edmonton,Enbridge Pipelines Inc.,Closed,53.547403,0,Not Applicable,Not Applicable,No,2010,2010-06-03,2010/11/11 12:00:00 AM Mountain,,,Operation,Employee / Contractor (Onsite),4/13/2015,Yes,No,,,,No,,,,,,,,,Over Pressure,,0,OPR,Line 4,"1219.00000000, 864.00000000, 914.00000000",1248.909872,Crude Oil,,,,,Canada,No,No,Yes,No,0,,Level I,Standard Review - 168 days,No,INC2010-102,,,,,,,,,,,,,,,,,,,,,,,,,,,,No,,,No,,,No,No,,,No,-113.355714,0,1,0,0,0,0,0,0,0,0,0,1,0,0,0,0,0,0,0,0,0,0,0,0,0,0,0,0,0,6,0,1,0,0
252,INC2010-174,Operation Beyond Design Limits,11/11/2010,Edmonton,Enbridge Pipelines Inc.,Closed,53.547403,0,Not Applicable,Not Applicable,No,2010,2010-06-21,2010/11/11 12:00:00 AM Mountain,,,Operation,Employee / Contractor (Onsite),4/13/2015,Yes,No,,,,No,,,,,,,,,Over Pressure,,0,OPR,Line 4,"1219.00000000, 864.00000000, 914.00000000",1248.909872,Crude Oil,,,,,Canada,No,No,Yes,No,0,,Level I,Standard Review - 168 days,No,INC2010-102,,,,,,,,,,,,,,,,,,,,,,,,,,,,No,,,No,,,No,No,,,No,-113.355714,0,1,0,0,0,0,0,0,0,0,0,1,0,0,0,0,0,0,0,0,0,0,0,0,0,0,0,0,0,6,0,1,0,0
253,INC2010-175,Operation Beyond Design Limits,11/11/2010,Edmonton,Enbridge Pipelines Inc.,Closed,53.547403,0,Not Applicable,Not Applicable,No,2010,2010-06-29,2010/11/11 12:00:00 AM Mountain,,,Operation,Employee / Contractor (Onsite),4/13/2015,Yes,No,,,,No,,,,,,,,,Over Pressure,,0,OPR,Line 4,"1219.00000000, 864.00000000, 914.00000000",1248.909872,Crude Oil,,,,,Canada,No,No,Yes,No,0,,Level I,Standard Review - 168 days,No,INC2010-102,,,,,,,,,,,,,,,,,,,,,,,,,,,,No,,,No,,,No,No,,,No,-113.355714,0,1,0,0,0,0,0,0,0,0,0,1,0,0,0,0,0,0,0,0,0,0,0,0,0,0,0,0,0,6,0,1,0,0
254,INC2010-176,Operation Beyond Design Limits,11/11/2010,Edmonton,Enbridge Pipelines Inc.,Closed,53.547403,0,Not Applicable,Not Applicable,No,2010,2010-09-07,2010/11/11 12:00:00 AM Mountain,,,Operation,Employee / Contractor (Onsite),4/13/2015,Yes,No,,,,No,,,,,,,,,Over Pressure,,0,OPR,Line 4,"1219.00000000, 864.00000000, 914.00000000",1248.909872,Crude Oil,,,,,Canada,No,No,Yes,No,0,,Level I,Standard Review - 168 days,No,INC2010-102,,,,,,,,,,,,,,,,,,,,,,,,,,,,No,,,No,,,No,No,,,No,-113.355714,0,1,0,0,0,0,0,0,0,0,0,1,0,0,0,0,0,0,0,0,0,0,0,0,0,0,0,0,0,9,0,0,1,0
255,INC2010-177,Operation Beyond Design Limits,11/11/2010,Edmonton,Enbridge Pipelines Inc.,Closed,53.547403,0,Not Applicable,Not Applicable,No,2010,2010-09-20,2010/11/11 12:00:00 AM Mountain,,,Operation,Employee / Contractor (Onsite),4/13/2015,Yes,No,,,,No,,,,,,,,,Over Pressure,,0,OPR,Line 4,"1219.00000000, 864.00000000, 914.00000000",1248.909872,Crude Oil,,,,,Canada,No,No,Yes,No,0,,Level I,Standard Review - 168 days,No,INC2010-102,,,,,,,,,,,,,,,,,,,,,,,,,,,,No,,,No,,,No,No,,,No,-113.355714,0,1,0,0,0,0,0,0,0,0,0,1,0,0,0,0,0,0,0,0,0,0,0,0,0,0,0,0,0,9,0,0,1,0
256,INC2011-004,Release of Substance,1/13/2011,Marten River,TransCanada PipeLines Limited,Closed,46.84822454,192,Natural Gas - Sweet,Gas,No,2011,2011-01-12,2011/01/12 02:00:00 PM Mountain,,,Operation,Employee / Contractor (Onsite),6/30/2011,Yes,No,Natural Gas - Sweet,192,No,No,,,,,,,,,,,0,OPR,,,,,,,,,Canada,Yes,No,No,No,0,Kilometer Post 112,Level I,Standard Review - 168 days,No,,"Station/Facility, Compression, Pipe",,,,,,,,,,,,,,,,,,,,,,,,,,,No,,,No,,,No,No,,,No,-79.8090245,1,0,0,0,0,1,0,0,0,0,0,1,0,0,0,0,0,0,0,0,0,0,0,0,0,0,0,0,0,1,0,0,0,1
257,INC2011-003,Fire,1/9/2011,Grande Prairie,Alliance Pipeline Ltd.,Closed,54.5224,0,Not Applicable,Not Applicable,No,2011,2011-01-08,2011/01/08 09:00:00 PM Mountain,,,Operation,Employee / Contractor (Onsite),3/20/2014,Yes,No,,,,No,,Equipment & Electrical,,,,,,,,,0,OPR,Alliance - Moose River Meter Station,,,,,,,,Canada,Yes,No,No,No,0,Kilometer Post 198.9,Level I,Standard Review - 168 days,No,,,,,,,,,,,,,,,,,,,,,,,,,,,,,No,,,No,,,No,No,,,No,-118.10037,0,1,0,0,0,0,0,0,0,0,0,1,0,0,0,0,0,0,0,0,0,0,0,0,0,0,0,0,0,1,0,0,0,1
258,INC2011-007,Release of Substance,1/20/2011,Taylor,"Westcoast Energy Inc., carrying on business as Spectra Energy Transmission",Closed,56.14641,4.2,Propane,Gas,No,2011,,2011/01/20 12:00:00 AM Mountain,,,Operation,,9/25/2013,Yes,No,Propane,4.2,No,Yes,,,,,,,,,,,0,PPR,WEI - McMahon Gas Plant (Taylor Gas Plant),,,,,,,,Canada,No,No,No,No,0,,Level I,Standard Review - 168 days,No,,,,,,,,,,,,,,,,,,,,,,,,,,,,,No,,,No,,,No,No,,,No,-120.66907,1,0,0,1,0,0,0,0,0,0,1,1,0,0,0,0,0,0,0,0,0,0,0,0,1,0,0,0,0,1,0,0,0,1
259,INC2011-008,Release of Substance,1/21/2011,Bowmanville,TransCanada PipeLines Limited,Closed,43.96,1000,Natural Gas - Sweet,Gas,No,2011,,2011/01/18 08:30:00 AM Eastern,,,Operation,Employee / Contractor (Onsite),6/30/2011,Yes,No,Natural Gas - Sweet,1000,No,No,,,,,,,,,,,0,OPR,TCPL - Station 134 (Bowmanville Compressor Stn),,,,,,,,Canada,Yes,No,No,No,0,,Level I,Standard Review - 168 days,No,,,,,,,,,,,,,,,,,,,,,,,,,,,,,No,,,No,,,No,No,,,No,-78.81941,1,0,0,0,0,1,0,0,0,0,0,1,0,0,0,0,0,0,0,0,0,0,0,0,0,0,0,0,0,1,0,0,0,1
260,INC2011-011,Release of Substance,1/31/2011,Slave Lake,NOVA Gas Transmission Ltd.,Closed,55.57555,0,Natural Gas - Sweet,Gas,No,2011,2011-01-31,2011/01/31 09:00:00 AM Mountain,,,Operation,Employee / Contractor (Onsite),3/30/2011,Yes,No,Natural Gas - Sweet,0,No,No,,,,,,,,,,,0,OPR,NGTL - Martin Hills Meter Station,,,,,,,,Canada,Yes,No,No,No,3,,Level I,Standard Review - 168 days,No,,"Station/Facility, Metering, Delivering, Valve",,,,,,,,,,,,,,,,,,,,,,,,,,,No,Removal,,No,,,No,No,,Repair,No,-113.87749,1,1,0,0,0,0,0,0,0,0,0,1,0,0,0,0,0,0,0,0,0,0,0,0,0,0,0,0,0,1,0,0,0,1
261,INC2011-012,Operation Beyond Design Limits,1/31/2011,Toronto,Trans-Northern Pipelines Inc.,Closed,43.69257,0,Not Applicable,Not Applicable,No,2011,2011-01-29,2011/01/29 04:02:00 AM Eastern,,,Operation,Employee / Contractor (Onsite),2/4/2013,Yes,No,,,,No,,,,,,,,,Over Pressure,,0,OPR,Toronto Airport Lateral,273.1,4.01694557,"Refined Products-Aviation, Refined Products-Distillate, Refined Products-Gasoline",,,,,Canada,Yes,No,No,No,6,,Level I,Standard Review - 168 days,No,"INC2015-002, INC2016-008","Pipeline, Valve, Ball, Other (please explain)",,,,,,,,,,,,,,,,,,,,,,,,,,,No,,,No,,,No,No,,,No,-79.61074,0,0,0,0,0,1,0,0,0,0,0,1,0,0,0,0,0,0,0,0,0,0,0,0,0,0,0,0,0,1,0,0,0,1
262,INC2011-013,Release of Substance,2/2/2011,Taylor,"Westcoast Energy Inc., carrying on business as Spectra Energy Transmission",Closed,56.14642,37,Propane,Gas,No,2011,2011-02-01,2011/02/01 07:00:00 PM Mountain,,,Maintenance,,8/16/2012,Yes,No,Propane,37,No,No,,,,,,,,,,,0,PPR,WEI - McMahon Gas Plant (Taylor Gas Plant),,,,,,,,Canada,No,No,No,No,5,,Level I,Standard Review - 168 days,No,,"Station/Facility, Pumping, Pump",,,,,,,,,,,,,,,,,,,,,,,,,,,No,Removal,9/1/2011,No,,,No,No,9/1/2011,Repair,No,-120.66907,1,0,0,1,0,0,0,0,0,0,0,1,0,0,0,0,0,0,0,0,0,0,0,0,0,0,0,0,0,2,0,0,0,1
263,INC2011-014,Fire,2/2/2011,Neutral Hills,TransCanada Keystone Pipeline GP Ltd.,Closed,52.29321,0,Not Applicable,Not Applicable,No,2011,2011-01-28,2011/01/28 12:00:00 AM Mountain,,,Operation,Employee / Contractor (Onsite),4/18/2012,Yes,No,,,,No,,Equipment & Electrical,,,,,,,,,0,OPR,TCP Keystone Lake Send Pump Station 6,,,,,,,,Canada,Yes,No,No,No,3,Kilometer Post,Level I,Standard Review - 168 days,No,,,,,,,,,,,,,,,,,,,,,,,,,,,,,No,,,No,,,No,No,,,No,-111.09081,0,1,0,0,0,0,0,0,0,0,0,1,0,0,0,0,0,0,0,0,0,0,0,0,0,0,0,0,0,1,0,0,0,1
264,INC2011-016,Release of Substance,2/3/2011,Monchy,Foothills Pipe Lines (Saskatchewan) Ltd.,Closed,49.017155,2,Natural Gas - Sweet,Gas,No,2011,2011-02-01,2011/02/01 08:00:00 PM Mountain,,,Operation,Employee / Contractor (Onsite),7/27/2012,Yes,No,Natural Gas - Sweet,2,No,No,,,,,,,,,,,0,OPR,Foothills - Monchy Compressor Stn,,,,,,,,Canada,Yes,No,No,No,3,,Level I,Standard Review - 168 days,No,,,,,,,,,,,,,,,,,,,,,,,,,,,,,No,,,No,,,No,No,,,No,-107.831853,1,0,0,0,1,0,0,0,0,0,0,1,0,0,0,0,0,0,0,0,0,0,0,0,0,0,0,0,0,2,0,0,0,1
265,INC2011-017,Release of Substance,2/4/2011,Lincoln,Maritimes & Northeast Pipeline Management Ltd.,Closed,45.88657778,0,Natural Gas - Sweet,Gas,No,2011,,2011/01/28 09:00:00 AM Atlantic,,,Operation,Employee / Contractor (Onsite),2/20/2014,Yes,No,Natural Gas - Sweet,0,No,No,,,,,,,,,,,0,OPR,Mainline,"762.00000000, 863.60000000",574.8807991,Natural Gas,,,,,Canada,No,No,Yes,No,5,Kilometer Post,Level I,Standard Review - 168 days,No,,"Station/Facility, Metering, Delivering, Fitting",,,,,,,,,,,,,,,,,,,,,,,,,,,No,,,No,,,No,No,,,No,-66.5511694,1,0,0,0,0,0,1,0,0,0,0,1,0,0,0,0,0,0,0,0,0,0,0,0,0,0,0,0,0,1,0,0,0,1
266,INC2011-018,Release of Substance,2/7/2011,Moncton,Maritimes & Northeast Pipeline Management Ltd.,Closed,46.11307222,0,Natural Gas - Sweet,Gas,No,2011,2011-02-01,2011/02/01 05:30:00 PM Atlantic,,,Operation,Employee / Contractor (Onsite),2/20/2014,Yes,No,Natural Gas - Sweet,0,No,No,,,,,,,,,,,0,OPR,Muncton PRS,,,,,,,,Canada,Yes,No,No,No,0,,Level I,Standard Review - 168 days,No,,,,,,,,,,,,,,,,,,,,,,,,,,,,,No,,,No,,,No,No,,,No,-64.7157694,1,0,0,0,0,0,1,0,0,0,0,1,0,0,0,0,0,0,0,0,0,0,0,0,0,0,0,0,0,2,0,0,0,1
267,INC2011-019,Fire,2/8/2011,Neutral Hills,TransCanada Keystone Pipeline GP Ltd.,Closed,52.29334,0,Not Applicable,Not Applicable,No,2011,2011-02-04,2011/02/04 12:00:00 AM Mountain,,,Operation,Employee / Contractor (Onsite),4/18/2012,Yes,No,,,,No,,Equipment & Electrical,,,,,,,,,0,OPR,TCP Keystone Lake Send Pump Station 6,,,,,,,,Canada,Yes,No,No,No,0,Mile Post 48.1 KP,Level I,Standard Review - 168 days,No,,,,,,,,,,,,,,,,,,,,,,,,,,,,,No,,,No,,,No,No,,,No,-111.09092,0,1,0,0,0,0,0,0,0,0,0,1,0,0,0,0,0,0,0,0,0,0,0,0,0,0,0,0,0,2,0,0,0,1
268,INC2011-026,Release of Substance,2/14/2011,North Bay,TransCanada PipeLines Limited,Closed,46.37977,0,Natural Gas - Sweet,Gas,No,2011,2011-02-11,2011/02/11 06:00:00 AM Eastern,,,Operation,Employee / Contractor (Onsite),10/10/2012,Yes,No,Natural Gas - Sweet,0,No,No,,,,,,,,,,,0,OPR,,,,,,,,,Canada,Yes,No,No,No,0,,Level I,Standard Review - 168 days,No,,"Station/Facility, Metering, Receiving, Fitting",,,,,,,,,,,,,,,,,,,,,,,,,,,No,Removal,2/11/2011,No,,,No,No,2/11/2011,Repair,No,-79.46897,1,0,0,0,0,1,0,0,0,0,0,1,0,0,0,0,0,0,0,0,0,0,0,0,0,0,0,0,0,2,0,0,0,1
269,INC2011-027,Release of Substance,2/18/2011,Lincoln,Maritimes & Northeast Pipeline Management Ltd.,Closed,45.887,0,Natural Gas - Sweet,Gas,No,2011,2011-02-18,2011/02/18 01:55:00 PM Atlantic,,,Operation,Employee / Contractor (Onsite),2/20/2014,Yes,No,Natural Gas - Sweet,0,No,No,,,,,,,,,,,0,OPR,Mainline,"762.00000000, 863.60000000",574.8807991,Natural Gas,,,,,Canada,Yes,No,No,No,0,,Level I,Standard Review - 168 days,No,,"Station/Facility, Metering, Delivering, Valve",,,,,,,,,,,,,,,,,,,,,,,,,,,No,,,No,,,No,No,,,No,-66.551169,1,0,0,0,0,0,1,0,0,0,0,1,0,0,0,0,0,0,0,0,0,0,0,0,0,0,0,0,0,2,0,0,0,1
270,INC2011-029,"Fire, Release of Substance",2/20/2011,Beardmore,TransCanada PipeLines Limited,Closed,49.58894444,2790000,Natural Gas - Sweet,Gas,Yes,2011,2011-02-19,2011/02/19 11:30:00 PM Eastern,,,Operation,Employee / Contractor (Onsite),5/2/2017,Yes,Yes,Natural Gas - Sweet,2790000,Yes,No,,Under Investigation or Unknown,,,,,,,,,0,OPR,LINE 100-2,"508.00000000, 609.60000000, 762.00000000, 863.60000000, 914.40000000",3393.42642,Natural Gas,,Meter,,,Canada,No,No,Yes,Yes,0,Mainline Valve + Offset (km) MLV 76-2 + 9.76,Level III,Category C,Yes,,,,,,,,,,,,,,,,,,,,,,,,,,,,,No,,,No,,,No,No,,,No,-87.9718889,1,0,0,0,0,1,0,0,0,0,0,1,0,0,0,0,0,0,0,0,0,0,0,0,0,0,0,0,0,2,0,0,0,1
271,INC2011-030,Release of Substance,2/20/2011,Rainbow Lake,NOVA Gas Transmission Ltd.,Closed,58.44721,0,Natural Gas - Sweet,Gas,No,2011,2011-02-20,2011/02/20 01:00:00 PM Mountain,,,Operation,Employee / Contractor (Onsite),8/22/2012,Yes,No,Natural Gas - Sweet,0,No,No,,,,,,,,,,,0,OPR,,,,,,,,,Canada,Yes,No,No,No,0,,Level I,Standard Review - 168 days,No,,,,,,,,,,,,,,,,,,,,,,,,,,,,,No,Replacement,,No,,,No,No,,Replacement,No,-119.22429,1,1,0,0,0,0,0,0,0,0,0,1,0,0,0,0,0,0,0,0,0,0,0,0,0,0,0,0,0,2,0,0,0,1
272,INC2011-032,Release of Substance,2/23/2011,Burnside,Maritimes & Northeast Pipeline Management Ltd.,Closed,45.3,3,Natural Gas - Sweet,Gas,No,2011,2011-02-23,2011/02/23 02:00:00 PM Atlantic,,,Operation,Employee / Contractor (Onsite),2/20/2014,Yes,No,Natural Gas - Sweet,3,No,No,,,,,,,,,,,0,OPR,MNE - Halifax Lateral pressure reducing station,,,,,,,,Canada,Yes,No,No,No,0,,Level I,Standard Review - 168 days,No,,"Station/Facility, Metering, Delivering, Valve, Pressure relief, Seat",,,,,,,,,,,,,,,,,,,,,,,,,,,No,,,No,,,No,No,,,No,-62.983333,1,0,0,0,0,0,0,1,0,0,0,1,0,0,0,0,0,0,0,0,0,0,0,0,0,0,0,0,0,2,0,0,0,1
273,INC2011-035,Fire,3/2/2011,Fort McMurray,NOVA Gas Transmission Ltd.,Closed,57.25289,0,Not Applicable,Not Applicable,No,2011,2011-02-26,2011/02/26 02:20:00 PM Mountain,,,Operation,Employee / Contractor (Onsite),3/30/2012,No,No,,,,No,,Housekeeping,,,,,,,,,0,OPR,KEARL EXTENSION,"508.00000000, 610.00000000",22.6599965,Natural Gas Sweet,,,,,Canada,Yes,No,No,No,0,Kilometer Post 5.61,Level I,Standard Review - 168 days,No,,,,,,,,,,,,,,,,,,,,,,,,,,,,,No,,,No,,,No,No,,,No,-111.05669,0,1,0,0,0,0,0,0,0,0,0,1,0,0,0,0,0,0,0,0,0,0,0,0,0,0,0,0,0,2,0,0,0,1
274,INC2011-036,Release of Substance,3/2/2011,Hanna,NOVA Gas Transmission Ltd.,Closed,52.36527,0,Natural Gas - Sweet,Gas,No,2011,,2011/02/27 11:28:00 AM Mountain,,,Operation,3rd Party / Other Company,11/9/2012,Yes,No,Natural Gas - Sweet,0,No,No,,,,,,,,,,,0,OPR,,,,,,,,,Canada,No,No,Yes,No,0,Legal Subdivision SE 22 39 22 W4M,Level I,Standard Review - 168 days,No,,"Pipeline, Valve, Ball, Flange, Gasket/O-ring",,,,,,,,,,,,,,,,,,,,,,,,,,,No,Replacement,5/9/2011,No,,,No,No,5/9/2011,Replacement,No,-113.08174,1,1,0,0,0,0,0,0,0,0,0,1,0,0,0,0,0,0,0,0,0,0,0,0,0,0,0,0,0,2,0,0,0,1
275,INC2011-038,Release of Substance,3/7/2011,Kamloops,Trans Mountain Pipeline ULC,Closed,50.66255,11,Waste Oil,Liquid,No,2011,2011-03-05,2011/03/05 03:00:00 PM Pacific,,,Operation,Employee / Contractor (Onsite),6/9/2014,No,No,Waste Oil,11,No,No,,,,,,,,,,,0,OPR,"TMPL - Kamloops, BC Terminal",,,,,,,,Canada,Yes,No,No,No,0,,Level I,Standard Review - 168 days,No,REM-0120a,,,,,,,,,,,,,,,,,,,,,,,,,,,,No,,,No,,,No,No,,,No,-120.41416,1,0,0,1,0,0,0,0,0,0,0,1,0,0,0,0,0,0,0,0,0,0,0,0,0,0,0,0,0,3,1,0,0,0
276,INC2011-042,Release of Substance,3/13/2011,Rosebud,NOVA Gas Transmission Ltd.,Closed,51.18869,0,Natural Gas - Sweet,Gas,No,2011,2011-03-13,2011/03/13 03:00:00 AM Mountain,,,Operation,3rd Party / Other Company,10/10/2012,Yes,No,Natural Gas - Sweet,0,No,No,,,,,,,,,,,0,OPR,,,,,,,,,Canada,No,No,Yes,No,0,Legal Subdivision 08-01-026-22 W4M,Level I,Standard Review - 168 days,No,,,,,,,,,,,,,,,,,,,,,,,,,,,,,No,Removal,3/13/2012,No,,,No,No,3/13/2012,Repair,No,-112.93903,1,1,0,0,0,0,0,0,0,0,0,1,0,0,0,0,0,0,0,0,0,0,0,0,0,0,0,0,0,3,1,0,0,0
277,INC2011-044,Release of Substance,3/17/2011,Ignace,TransCanada PipeLines Limited,Closed,49.48823,0,Natural Gas - Sweet,Gas,No,2011,2011-03-16,2011/03/16 03:00:00 PM Mountain,,,Maintenance,Employee / Contractor (Onsite),4/16/2012,Yes,No,Natural Gas - Sweet,0,No,No,,,,,,,,,,,0,OPR,LINE 100-1,"508.00000000, 762.00000000, 863.60000000",2595.724534,Natural Gas,,,,,Canada,No,No,Yes,No,3,Mainline Valve + Offset (km) 57 + 28.799,Level I,Standard Review - 168 days,No,,"Pipeline, Pipe, Body",CSA,NPS 30,Carbon Steel,290 - X42,,9.5 mm = 0.375 in,,,6895,,,,,1957,,,,,,,6 o'clock,External,Coal Tar Enamel Narrow,,,,No,,,No,,,No,No,,,No,-91.98782,1,0,0,0,0,1,0,0,0,0,0,1,0,0,0,0,0,0,0,0,0,0,0,0,0,0,0,0,0,3,1,0,0,0
278,INC2011-045,Release of Substance,3/18/2011,Ignace,TransCanada PipeLines Limited,Closed,49.48823,0,Natural Gas - Sweet,Gas,No,2011,,2011/03/18 04:45:00 PM Mountain,,,Operation,Employee / Contractor (Onsite),4/16/2012,Yes,No,Natural Gas - Sweet,0,No,No,,,,,,,,,,,0,OPR,LINE 100-1,"508.00000000, 762.00000000, 863.60000000",2595.724534,Natural Gas,,,,,Canada,No,No,Yes,No,3,Mainline Valve + Offset (km),Level I,Standard Review - 168 days,No,,"Pipeline, Pipe, Body",CSA,NPS 30,Carbon Steel,359 - X52,,9.5 mm = 0.375 in,,,6895,,,,,,,,,,,,6 o'clock,External,Coal Tar Enamel Narrow,,,,No,,,No,,,No,No,,,No,-91.98782,1,0,0,0,0,1,0,0,0,0,0,1,0,0,0,0,0,0,0,0,0,0,0,0,0,0,0,0,0,3,1,0,0,0
279,INC2011-046,Release of Substance,3/21/2011,Fort Nelson,"Westcoast Energy Inc., carrying on business as Spectra Energy Transmission",Closed,58.85595,0,Natural Gas - Sweet,Gas,No,2011,2011-03-21,2011/03/21 10:00:00 AM Pacific,,,Operation,3rd Party / Other Company,9/7/2012,Yes,No,Natural Gas - Sweet,0,No,No,,,,,,,,,,,0,OPR,,,,,,,,,Canada,No,No,Yes,No,0,Kilometer Post Reseipt Point 861,Level I,Standard Review - 168 days,No,,"Pipeline, Fitting, Tee, Body",,NPS 3/4,,,,,,,0,,,,,,,,,,,,,,,,,,No,Replacement,,No,,,No,No,,Replacement,No,-121.78287,1,0,0,1,0,0,0,0,0,0,0,1,0,0,0,0,0,0,0,0,0,0,0,0,0,0,0,0,0,3,1,0,0,0
280,INC2011-048,Release of Substance,3/24/2011,Regina,Alliance Pipeline Ltd.,Closed,49.9746,170,Natural Gas - Sweet,Gas,No,2011,2011-03-24,2011/03/24 09:58:00 AM Central,,,Operation,Landowner,11/9/2012,Yes,No,Natural Gas - Sweet,170,No,No,,,,,,,,,,,0,OPR,MAINLINE,"1067.00000000, 914.00000000",1551.609274,Natural Gas,,,,,Canada,No,No,Yes,No,0,Kilometer Post 1337.42,Level I,Standard Review - 168 days,No,,"Pipeline, Fitting, Tee, Body",,,,,,,,,,,,,,,,,,,,,,,,,,,No,Replacement,3/24/2011,No,,,No,No,3/24/2011,Replacement,No,-103.6528,1,0,0,0,1,0,0,0,0,0,0,1,0,0,0,0,0,0,0,0,0,0,0,0,0,0,0,0,0,3,1,0,0,0
281,INC2011-053,Release of Substance,3/31/2011,Nipigon,TransCanada PipeLines Limited,Closed,49.29513,1000,Natural Gas - Sweet,Gas,No,2011,,2011/03/31 09:00:00 AM Eastern,,,Operation,Employee / Contractor (Onsite),3/19/2012,Yes,No,Natural Gas - Sweet,1000,No,No,,,,,,,,,,,0,OPR,,,,,,,,,Canada,Yes,No,No,No,0,,Level I,Standard Review - 168 days,No,,,,,,,,,,,,,,,,,,,,,,,,,,,,,No,,,No,,,No,No,,,No,-88.10109,1,0,0,0,0,1,0,0,0,0,0,1,0,0,0,0,0,0,0,0,0,0,0,0,0,0,0,0,0,3,1,0,0,0
282,INC2011-054,Fatality,4/1/2011,Grande Prairie,NOVA Gas Transmission Ltd.,Closed,54.868241,0,Not Applicable,Not Applicable,Yes,2011,,2011/03/31 05:00:00 PM Mountain,,,Construction,Employee / Contractor (Onsite),5/31/2012,No,No,,,,No,,,Vehicle Accident,,,,,,,,0,OPR,CUTBANK RIVER LATERAL LOOP,610,10.01269026,Natural Gas Sweet,,,,,Canada,No,Yes,No,Yes,0,,Level I,Standard Review - 168 days,No,,,,,,,,,,,,,,,,,,,,,,,,,,,,,No,,,No,,,No,No,,,No,-118.809763,0,1,0,0,0,0,0,0,0,0,0,1,0,0,0,0,0,0,0,0,0,0,0,0,0,0,0,0,0,3,1,0,0,0
283,INC2011-055,Release of Substance,4/1/2011,Tunis,TransCanada PipeLines Limited,Closed,48.87166,0,Natural Gas - Sweet,Gas,No,2011,2011-04-01,2011/04/01 12:55:00 PM Eastern,,,Operation,Employee / Contractor (Onsite),3/14/2012,Yes,No,Natural Gas - Sweet,0,No,No,,,,,,,,,,,0,OPR,,,,,,,,,Canada,Yes,No,No,No,0,,Level I,Standard Review - 168 days,No,,,,,,,,,,,,,,,,,,,,,,,,,,,,,No,,,No,,,No,No,,,No,-80.893589,1,0,0,0,0,1,0,0,0,0,0,1,0,0,0,0,0,0,0,0,0,0,0,0,0,0,0,0,0,4,1,0,0,0
284,INC2011-056,Release of Substance,4/3/2011,Burnside,Maritimes & Northeast Pipeline Management Ltd.,Closed,45.3,0,Natural Gas - Sweet,Gas,No,2011,,2011/04/03 06:20:00 AM Atlantic,,,Operation,Employee / Contractor (Onsite),3/20/2014,Yes,No,Natural Gas - Sweet,0,No,No,,,,,,,,,,,0,OPR,MNE - Halifax Lateral pressure reducing station,,,,,,,,Canada,Yes,No,No,No,0,Kilometer Post 118,Level I,Standard Review - 168 days,No,,"Station/Facility, Metering, Delivering, Valve, Pressure relief, Seat",,,,,,,,,,,,,,,,,,,,,,,,,,,No,,,No,,,No,No,,,No,-62.98333,1,0,0,0,0,0,0,1,0,0,0,1,0,0,0,0,0,0,0,0,0,0,0,0,0,0,0,0,0,4,1,0,0,0
285,INC2011-058,"Release of Substance, Operation Beyond Design Limits",4/5/2011,Burnside,Maritimes & Northeast Pipeline Management Ltd.,Closed,45.3,0,Natural Gas - Sweet,Gas,No,2011,,2011/04/05 08:00:00 AM Atlantic,,,Operation,Employee / Contractor (Onsite),3/18/2014,Yes,No,Natural Gas - Sweet,,No,No,,,,,,,,,Over Pressure,,0,OPR,MNE - Halifax Lateral pressure reducing station,,,,,,,,Canada,Yes,No,No,No,0,,Level I,Standard Review - 168 days,No,,"Station/Facility, Metering, Delivering, Valve, Pressure relief, Seat",,,,,,,,,,,,,,,,,,,,,,,,,,,No,,,No,,,No,No,,,No,-62.98333,1,0,0,0,0,0,0,1,0,0,0,1,0,0,0,0,0,0,0,0,0,0,0,0,0,0,0,0,0,4,1,0,0,0
286,INC2011-059,Release of Substance,4/6/2011,Hardisty,Enbridge Pipelines Inc.,Closed,52.635343,0,Natural Gas Liquids,Gas,No,2011,,2011/04/06 07:00:00 AM Mountain,,,Operation,Employee / Contractor (Onsite),10/10/2012,Yes,No,Natural Gas Liquids,0,No,No,,,,,,,,,,,0,OPR,Line 1,"508.00000000, 864.00000000",1255.999121,Crude Oil,,,,,Canada,Yes,No,No,No,0,,Level I,Standard Review - 168 days,No,,"Station/Facility, Compression, Fitting, Nipple, Thread",,,,,,,,,,,,,,,,,,,,,,,,,,,No,Replacement,4/6/2011,No,,,No,No,4/6/2011,Replacement,No,-111.267485,1,1,0,0,0,0,0,0,0,0,0,1,0,0,0,0,0,0,0,0,0,0,0,0,0,0,0,0,0,4,1,0,0,0
287,INC2011-061,Release of Substance,4/14/2011,Cochrane,TransCanada PipeLines Limited,Closed,49.10559503,0,Natural Gas - Sweet,Gas,No,2011,2011-04-13,2011/04/13 02:15:00 PM Mountain,,,Maintenance,Employee / Contractor (Onsite),11/9/2012,Yes,No,Natural Gas - Sweet,0,No,No,,,,,,,,,,,0,OPR,,,,,,,,,Canada,No,No,Yes,No,0,Mainline Valve + Offset (km) 100-2 + 0,Level I,Standard Review - 168 days,No,,"Pipeline, Fitting, Other (please explain)",,,,,,,,,,,,,,,,,,,,,,,,,,,No,Replacement,4/13/2011,No,,,No,No,4/13/2011,Replacement,No,-81.273875,1,0,0,0,0,1,0,0,0,0,0,1,0,0,0,0,0,0,0,0,0,0,0,0,0,0,0,0,0,4,1,0,0,0
288,INC2011-063,Release of Substance,4/17/2011,Wabigoon,TransCanada PipeLines Limited,Closed,49.72702,0,Natural Gas - Sweet,Gas,No,2011,2011-04-14,2011/04/14 10:00:00 AM Mountain,,,Operation,Employee / Contractor (Onsite),2/5/2013,Yes,No,Natural Gas - Sweet,0,No,No,,,,,,,,,,,0,OPR,,,,,,,,,Canada,No,No,Yes,No,0,Mainline Valve + Offset (km) 56+0,Level I,Standard Review - 168 days,No,,,,,,,,,,,,,,,,,,,,,,,,,,,,,No,,,No,,,No,No,,,No,-92.58215,1,0,0,0,0,1,0,0,0,0,0,1,0,0,0,0,0,0,0,0,0,0,0,0,0,0,0,0,0,4,1,0,0,0
289,INC2011-064,Release of Substance,4/21/2011,Zama Lake,NOVA Gas Transmission Ltd.,Closed,59.06394,0,Natural Gas - Sweet,Gas,No,2011,2011-04-21,2011/04/21 07:25:00 AM Mountain,,,Operation,Employee / Contractor (Onsite),3/20/2014,Yes,No,Natural Gas - Sweet,0,No,No,,,,,,,,,,,0,OPR,,,,,,,,,Canada,No,No,Yes,No,0,Legal Subdivision NW 7-116-5-W6,Level I,Standard Review - 168 days,No,,"Pipeline, Valve, Pressure relief, Other (please explain)",,,,,,,,,,,,,,,,,,,,,,,,,,,No,,,No,,,No,No,,,No,-118.84693,1,1,0,0,0,0,0,0,0,0,0,1,0,0,0,0,0,0,0,0,0,0,0,0,0,0,0,0,0,4,1,0,0,0
290,INC2011-065,Release of Substance,4/22/2011,Chip Lake,Trans Mountain Pipeline ULC,Closed,53.60352778,1.6,Crude Oil - Sweet,Liquid,Yes,2011,2011-04-22,2011/04/22 04:40:00 PM Mountain,,,Operation,Landowner,5/4/2017,Yes,No,Crude Oil - Sweet,1.6,No,No,,,,,,,,,,,0,OPR,,,,,,,,,Canada,No,No,Yes,Yes,0,,Level III,Category C,Yes,REM-0124,,,,,,,,,,,,,,,,,,,,,,,,,,,,No,,,No,,,No,No,,,No,-115.4963889,1,1,0,0,0,0,0,0,0,0,0,1,0,0,0,0,0,0,0,0,0,0,0,0,0,0,0,0,0,4,1,0,0,0
291,INC2011-066,Release of Substance,4/26/2011,Chetwynd,"Westcoast Energy Inc., carrying on business as Spectra Energy Transmission",Closed,55.28501,1300,Natural Gas - Sour,Gas,Yes,2011,2011-04-26,2011/04/26 03:45:00 AM Mountain,,,Operation,Employee / Contractor (Onsite),2/10/2012,Yes,No,Natural Gas - Sour,1300,No,No,,,,,,,,,,,0,OPR,Kwoen Re-injection Pipeline,168.3,13.4284204,Natural Gas Sour,,,,,Canada,Yes,No,No,No,0,,Level I,Standard Review - 168 days,No,,,,,,,,,,,,,,,,,,,,,,,,,,,,,No,,,No,,,No,No,,,No,-121.65768,1,0,0,1,0,0,0,0,0,0,0,1,0,0,0,0,0,0,0,0,0,0,0,0,0,0,0,0,0,4,1,0,0,0
292,INC2011-067,Release of Substance,4/25/2011,Burstall,TransCanada PipeLines Limited,Closed,50.67651,0,Natural Gas - Sweet,Gas,No,2011,2011-04-21,2011/04/21 03:00:00 PM Mountain,,,Operation,Employee / Contractor (Onsite),3/28/2014,Yes,No,Natural Gas - Sweet,0,No,No,,,,,,,,,,,0,OPR,TCPL - Station 2 (Burstall Compressor Station),,,,,,,,Canada,Yes,No,No,No,0,,Level I,Standard Review - 168 days,No,,"Station/Facility, Compression, Fitting",,,,,,,,,,,,,,,,,,,,,,,,,,,No,,,No,,,No,No,,,No,-109.97872,1,0,0,0,1,0,0,0,0,0,0,1,0,0,0,0,0,0,0,0,0,0,0,0,0,0,0,0,0,4,1,0,0,0
293,INC2011-068,Fire,4/28/2011,Czar,TransCanada Keystone Pipeline GP Ltd.,Closed,52.29327,0,Not Applicable,Not Applicable,No,2011,2011-04-28,2011/04/28 12:00:00 PM Mountain,,,Maintenance,Employee / Contractor (Onsite),4/18/2012,Yes,No,,,,No,,Equipment & Electrical,,,,,,,,,0,OPR,TCP Keystone Lake Send Pump Station 6,,,,,,,,Canada,Yes,No,No,No,0,,Level I,Standard Review - 168 days,No,,,,,,,,,,,,,,,,,,,,,,,,,,,,,No,,,No,,,No,No,,,No,-111.0907,0,1,0,0,0,0,0,0,0,0,0,1,0,0,0,0,0,0,0,0,0,0,0,0,0,0,0,0,0,4,1,0,0,0
294,INC2011-070,Fire,5/3/2011,Hamilton,TransCanada PipeLines Limited,Closed,43.25556,0,Not Applicable,Not Applicable,No,2011,,2011/05/03 03:30:00 PM Mountain,,,Operation,Employee / Contractor (Onsite),9/2/2014,Yes,No,,,,No,,Under Investigation or Unknown,,,,,,,,,0,OPR,TCPL -  Hamilton Gate Sales Meter Station,,,,,,,,Canada,Yes,No,No,No,0,,Level I,Standard Review - 168 days,No,,"Station/Facility, Metering, Delivering, Piping",,,,,,,,,,,,,,,,,,,,,,,,,,,No,,,No,,,No,No,,,No,-79.87348,0,0,0,0,0,1,0,0,0,0,1,1,0,0,0,0,0,0,0,0,0,0,0,0,0,0,0,0,0,5,1,0,0,0
295,INC2011-071,Release of Substance,5/3/2011,Beardmore,TransCanada PipeLines Limited,Closed,49.61136,50,Natural Gas - Sweet,Gas,No,2011,,2011/05/03 02:10:00 PM Mountain,,,Operation,Employee / Contractor (Onsite),3/28/2014,Yes,No,Natural Gas - Sweet,50,No,No,,,,,,,,,,,0,OPR,TCPL - Station 77 (Jellicoe Compressor Station),,,,,,,,Canada,Yes,No,No,No,0,,Level I,Standard Review - 168 days,No,,"Station/Facility, Compression, Fitting",,,,,,,,,,,,,,,,,,,,,,,,,,,No,,,No,,,No,No,,,No,-87.96157,1,0,0,0,0,1,0,0,0,0,0,1,0,0,0,0,0,0,0,0,0,0,0,0,0,0,0,0,0,5,1,0,0,0
296,INC2011-073,Release of Substance,5/7/2011,Edson,NOVA Gas Transmission Ltd.,Closed,53.60098,10,Natural Gas - Sweet,Gas,No,2011,2011-05-06,2011/05/06 03:00:00 PM Mountain,,,Operation,Employee / Contractor (Onsite),3/1/2017,Yes,No,Natural Gas - Sweet,10,No,No,,,,,,,,,,,0,OPR,,,,,,,,,Canada,Yes,No,No,No,0,Legal Subdivision SE-29-53-17W5,Level I,Standard Review - 168 days,No,,"Pipeline, Valve, Ball, Body",,NPS 1/2,,,,,,,0,,,,,,,,,,,,,,,,,,No,Removal,,No,,,No,No,,Repair,No,-116.46762,1,1,0,0,0,0,0,0,0,0,1,1,0,0,0,0,0,0,0,0,0,0,0,1,0,0,0,0,0,5,1,0,0,0
297,INC2011-082,Serious Injury (CER or TSB),5/18/2011,Fort Nelson,"Westcoast Energy Inc., carrying on business as Spectra Energy Transmission",Closed,58.6533,0,Not Applicable,Not Applicable,Yes,2011,2011-05-18,2011/05/18 12:25:00 PM Eastern,,,Operation,,2/26/2014,No,No,,,,No,,,,,,,,No,,,0,PPR,,,,,,,,,Canada,No,No,No,No,0,,Level I,Standard Review - 168 days,No,,,,,,,,,,,,,,,,,,,,,,,,,,,,,No,,,No,,,No,No,,,No,-122.68493,0,0,0,1,0,0,0,0,0,0,0,1,0,0,0,0,0,0,0,0,0,0,0,0,0,0,0,0,0,5,1,0,0,0
298,INC2011-074,Release of Substance,5/9/2011,Wrigley,Enbridge Pipelines (NW) Inc.,Closed,62.70880556,259,Crude Oil - Sweet,Liquid,Yes,2011,2011-05-09,2011/05/09 11:35:00 AM Mountain,,Transmission,Operation,Employee / Contractor (Onsite),11/4/2014,Yes,No,Crude Oil - Sweet,259,No,Yes,,,,,,,,,,,0,OPR,Line 21,"305.00000000, 323.90000000",989.5584688,Crude Oil,,,,,Canada,No,No,Yes,Yes,3,Kilometer Post 380.4,Level II,Category B,Yes,REM-0126,"Pipeline, Pipe, Body",CSA,NPS 12,Carbon Steel,359 - X52,,6.3 mm = 0.250 in,,,1439,,,,,,1983,,,,Straight,Electric Resistance Welded,,External,Extruded Polyethylene,,,,No,Replacement,2/1/2012,No,,,No,No,2/1/2012,Replacement,No,-123.079889,1,0,0,0,0,0,0,0,0,1,0,1,0,0,0,0,0,0,0,0,0,0,0,0,0,0,0,0,0,5,1,0,0,0
299,INC2011-075,Release of Substance,5/12/2011,Terrebonne,Enbridge Pipelines Inc.,Closed,45.72466,4,Crude Oil - Sweet,Liquid,No,2011,2011-05-12,2011/05/12 04:15:00 PM Eastern,,,Maintenance,Employee / Contractor (Onsite),3/2/2012,No,No,Crude Oil - Sweet,4,No,No,,,,,,,,,,,0,OPR,Line 9,"508.00000000, 762.00000000",859.7003376,Crude Oil,,,,,Canada,Yes,No,No,No,6,Kilometer Post,Level I,Standard Review - 168 days,No,,,,,,,,,,,,,,,,,,,,,,,,,,,,,No,,,No,,,No,No,,,No,-73.69588,1,0,0,0,0,0,0,0,1,0,0,1,0,0,0,0,0,0,0,0,0,0,0,0,0,0,0,0,0,5,1,0,0,0
300,INC2011-085,Release of Substance,5/27/2011,Pincher Creek,NOVA Gas Transmission Ltd.,Closed,49.30721,2,Natural Gas - Sweet,Gas,No,2011,,2011/05/11 12:00:00 AM Mountain,,,Operation,Employee / Contractor (Onsite),8/15/2017,Yes,No,Natural Gas - Sweet,2,No,No,,,,,,,,,,,0,OPR,NGTL - Waterton Interchange Meter Station,,,,,,,,Canada,Yes,No,No,No,0,,Level I,Standard Review - 168 days,No,,,,,,,,,,,,,,,,,,,,,,,,,,,,,No,,,No,,,No,No,,,No,-114.015,1,1,0,0,0,0,0,0,0,0,0,1,0,0,0,0,0,0,0,0,0,0,0,0,0,0,0,0,0,5,1,0,0,0
301,INC2011-087,Release of Substance,6/5/2011,Niverville,TransCanada PipeLines Limited,Closed,49.58317,0,Natural Gas - Sweet,Gas,No,2011,,2011/06/04 05:00:00 PM Mountain,,,Operation,Landowner,7/30/2012,Yes,No,Natural Gas - Sweet,0,No,No,,,,,,,,,,,0,OPR,Line 400-2,914.4,81.33942881,Natural Gas,,,,,Canada,No,No,Yes,No,0,Mainline Valve + Offset (km) 401+16.4 km,Level I,Standard Review - 168 days,No,,"Pipeline, Pipe, Body",,NPS 36,,448 - X65,,,,,0,,,,,,,,,,,,,,,,,,No,Replacement,6/13/2011,No,,,No,No,6/13/2011,Replacement,No,-97.0036,1,0,1,0,0,0,0,0,0,0,0,1,0,0,0,0,0,0,0,0,0,0,0,0,0,0,0,0,0,6,0,1,0,0
302,INC2011-089,Release of Substance,6/6/2011,Saint John,Emera Brunswick Pipeline Company Ltd.,Closed,45.30744,0,Natural Gas - Sweet,Gas,No,2011,,2011/06/06 06:40:00 AM Atlantic,,,Operation,Employee / Contractor (Onsite),3/19/2014,Yes,No,Natural Gas - Sweet,,No,No,,,,,,,,,,,0,OPR,Emera - Red Head Metre Station,,,,,,,,Canada,Yes,No,No,No,0,,Level I,Standard Review - 168 days,No,,"Station/Facility, Pumping, Pump",,,,,,,,,,,,,,,,,,,,,,,,,,,No,,,No,,,No,No,,,No,-66.04273,1,0,0,0,0,0,1,0,0,0,0,1,0,0,0,0,0,0,0,0,0,0,0,0,0,0,0,0,0,6,0,1,0,0
303,INC2011-090,Fatality,6/7/2011,Dawson Creek,"Westcoast Energy Inc., carrying on business as Spectra Energy Transmission",Closed,55.81189,0,Not Applicable,Not Applicable,Yes,2011,,2011/06/07 08:05:00 AM Mountain,,,Construction,Employee / Contractor (Onsite),9/13/2011,No,No,,,,No,,,Vehicle Accident,1,,,,,,,0,OPR,WEI - Sunset Creek Compressor Station,,,,,,,,Canada,Yes,No,No,No,0,,Level I,Standard Review - 168 days,No,,,,,,,,,,,,,,,,,,,,,,,,,,,,,No,,,No,,,No,No,,,No,-120.86837,0,0,0,1,0,0,0,0,0,0,0,1,0,0,0,0,0,0,0,0,0,0,0,0,0,0,0,0,0,6,0,1,0,0
304,INC2011-092,Release of Substance,6/9/2011,Taylor,"Westcoast Energy Inc., carrying on business as Spectra Energy Transmission",Closed,56.14635,3.6,Natural Gas - Sour,Gas,Yes,2011,,2011/06/08 09:49:00 PM Mountain,,,Operation,,4/16/2012,Yes,No,Natural Gas - Sour,3.6,No,No,,,,,,,,,,,0,PPR,WEI - McMahon Gas Plant (Taylor Gas Plant),,,,,,,,Canada,No,No,No,No,0,,Level I,Standard Review - 168 days,No,,,,,,,,,,,,,,,,,,,,,,,,,,,,,No,,,No,,,No,No,,,No,-120.66936,1,0,0,1,0,0,0,0,0,0,0,1,0,0,0,0,0,0,0,0,0,0,0,0,0,0,0,0,0,6,0,1,0,0
305,INC2011-094,Release of Substance,6/17/2011,Fort St. John,"Westcoast Energy Inc., carrying on business as Spectra Energy Transmission",Closed,56.254,0.0001,Natural Gas - Sweet,Gas,No,2011,2011-06-16,2011/06/16 08:55:00 PM Mountain,,,Operation,3rd Party / Other Company,12/29/2011,Yes,No,Natural Gas - Sweet,0.0001,No,No,,,,,,,,,,,0,OPR,,,,,,,,,Canada,No,No,Yes,No,0,Mile Post 19.3,Level I,Standard Review - 168 days,No,,,,,,,,,,,,,,,,,,,,,,,,,,,,,No,,,No,,,No,No,,,No,-120.716,1,0,0,1,0,0,0,0,0,0,0,1,0,0,0,0,0,0,0,0,0,0,0,0,0,0,0,0,0,6,0,1,0,0
306,INC2011-095,Operation Beyond Design Limits,6/21/2011,Hardisty,TransCanada Keystone Pipeline GP Ltd.,Closed,52.64129,0,Not Applicable,Not Applicable,No,2011,2011-06-21,2011/06/21 06:27:00 AM Mountain,,,Maintenance,Employee / Contractor (Onsite),3/1/2017,Yes,No,,,,No,,,,,,,,,Over Pressure,,0,OPR,,,,,,,,,Canada,Yes,No,No,No,0,,Level I,Standard Review - 168 days,No,,,,,,,,,,,,,,,,,,,,,,,,,,,,,No,,,No,,,No,No,,,No,-111.2708,0,1,0,0,0,0,0,0,0,0,0,1,0,0,0,0,0,0,0,0,0,0,0,0,0,0,0,0,0,6,0,1,0,0
307,INC2011-100,Release of Substance,6/27/2011,Lincoln,Maritimes & Northeast Pipeline Management Ltd.,Closed,45.806186,0,Natural Gas - Sweet,Gas,No,2011,,2011/06/22 12:00:00 AM Mountain,,,Operation,Employee / Contractor (Onsite),3/17/2014,Yes,No,Natural Gas - Sweet,0,No,No,,,,,,,,,,,0,OPR,Mainline,"762.00000000, 863.60000000",574.8807991,Natural Gas,,,,,Canada,No,No,Yes,No,0,Mainline Valve + Offset (km),Level I,Standard Review - 168 days,No,,"Pipeline, Fitting, Other (please explain)",,,,,,,,,,,,,,,,,,,,,,,,,,,No,,,No,,,No,No,,,No,-66.593942,1,0,0,0,0,0,1,0,0,0,0,1,0,0,0,0,0,0,0,0,0,0,0,0,0,0,0,0,0,6,0,1,0,0
308,INC2011-099,Release of Substance,6/27/2011,Saint John,Maritimes & Northeast Pipeline Management Ltd.,Closed,45.27811111,0,Natural Gas - Sweet,Gas,No,2011,2011-06-15,2011/06/15 12:00:00 AM Atlantic,,,Operation,Employee / Contractor (Onsite),3/17/2014,Yes,No,Natural Gas - Sweet,0,No,No,,,,,,,,,,,0,OPR,MNE - Grandview Meter Station,,,,,,,,Canada,Yes,No,No,No,0,,Level I,Standard Review - 168 days,No,,"Station/Facility, Metering, Delivering, Fitting",,,,,,,,,,,,,,,,,,,,,,,,,,,No,,,No,,,No,No,,,No,-66.0088056,1,0,0,0,0,0,1,0,0,0,0,1,0,0,0,0,0,0,0,0,0,0,0,0,0,0,0,0,0,6,0,1,0,0
309,INC2011-101,Release of Substance,6/27/2011,Fredericton,Maritimes & Northeast Pipeline Management Ltd.,Closed,45.881317,0,Natural Gas - Sweet,Gas,No,2011,,2011/06/22 12:00:00 AM Mountain,,,Operation,Employee / Contractor (Onsite),3/17/2014,Yes,No,Natural Gas - Sweet,0,No,No,,,,,,,,,,,0,OPR,MNE - Fredericton Meter Station,,,,,,,,Canada,Yes,No,No,No,0,,Level I,Standard Review - 168 days,No,,"Station/Facility, Metering, Delivering, Fitting",,,,,,,,,,,,,,,,,,,,,,,,,,,No,,,No,,,No,No,,,No,-66.551169,1,0,0,0,0,0,1,0,0,0,0,1,0,0,0,0,0,0,0,0,0,0,0,0,0,0,0,0,0,6,0,1,0,0
310,INC2011-102,Release of Substance,6/27/2011,Gaspereau,Maritimes & Northeast Pipeline Management Ltd.,Closed,47.590212,0,Natural Gas - Sweet,Gas,No,2011,,2011/06/23 12:00:00 AM Mountain,,,Operation,Employee / Contractor (Onsite),3/17/2014,Yes,No,Natural Gas - Sweet,0,No,No,,,,,,,,,,,0,OPR,Mainline,"762.00000000, 863.60000000",574.8807991,Natural Gas,,,,,Canada,No,No,Yes,No,0,Mainline Valve + Offset (km),Level I,Standard Review - 168 days,No,,"Pipeline, Fitting, Other (please explain)",,,,,,,,,,,,,,,,,,,,,,,,,,,No,,,No,,,No,No,,,No,-64.959858,1,0,0,0,0,0,1,0,0,0,0,1,0,0,0,0,0,0,0,0,0,0,0,0,0,0,0,0,0,6,0,1,0,0
311,INC2011-104,Release of Substance,6/30/2011,Red Deer,NOVA Gas Transmission Ltd.,Closed,52.24822,0,Natural Gas - Sweet,Gas,No,2011,2011-06-30,2011/06/30 10:00:00 AM Mountain,,,Operation,3rd Party / Other Company,3/31/2014,Yes,No,Natural Gas - Sweet,0,No,No,,,,,,,,,,,0,OPR,,,,,,,,,Canada,No,No,Yes,No,0,Legal Subdivision SW11-38-26W4,Level I,Standard Review - 168 days,No,,"Pipeline, Pipe, Body",,,,,,,,,,,,,,,,,,,,,,,,,,,No,,,No,,,No,No,,,No,-113.61774,1,1,0,0,0,0,0,0,0,0,1,1,0,0,0,0,0,0,0,0,0,0,0,0,0,0,0,0,0,6,0,1,0,0
312,INC2011-105,Fire,7/7/2011,Edson,NOVA Gas Transmission Ltd.,Closed,53.96088,0,Not Applicable,Not Applicable,No,2011,2011-07-07,2011/07/07 02:30:00 PM Mountain,,,Operation,Employee / Contractor (Onsite),3/31/2014,Yes,No,,,,No,,Other Event (Nature or 3rd Party),,,,,,,,,0,OPR,NGTL - Knight Compressor Station,,,,,,,,Canada,Yes,No,No,No,0,,Level I,Standard Review - 168 days,No,,"Station/Facility, Compression, Valve",,,,,,,,,,,,,,,,,,,,,,,,,,,No,,,No,,,No,No,,,No,-116.46033,0,1,0,0,0,0,0,0,0,0,0,1,0,0,0,0,0,0,0,0,0,0,0,0,0,0,0,0,0,7,0,1,0,0
313,INC2011-106,Release of Substance,7/8/2011,Burstall,TransCanada PipeLines Limited,Closed,50.67653,0,Natural Gas - Sweet,Gas,No,2011,2011-05-19,2011/05/19 09:20:00 AM Central,,,Operation,Employee / Contractor (Onsite),9/5/2014,Yes,No,Natural Gas - Sweet,0,No,No,,,,,,,,,,,0,OPR,TCPL - Station 2 (Burstall Compressor Station),,,,,,,,Canada,Yes,No,No,No,0,,Level I,Standard Review - 168 days,No,,"Station/Facility, Compression, Fitting",,,,,,,,,,,,,,,,,,,,,,,,,,,No,,,No,,,No,No,,,No,-109.97885,1,0,0,0,1,0,0,0,0,0,0,1,0,0,0,0,0,0,0,0,0,0,0,0,0,0,0,0,0,5,1,0,0,0
314,INC2011-109,Release of Substance,7/22/2011,Caledonia,Maritimes & Northeast Pipeline Management Ltd.,Closed,45.37514774,113,Natural Gas - Sweet,Gas,No,2011,2011-07-19,2011/07/19 01:00:00 PM Atlantic,,,Operation,Employee / Contractor (Onsite),3/14/2012,Yes,No,Natural Gas - Sweet,113,No,No,,,,,,,,,,,0,OPR,Mainline,"762.00000000, 863.60000000",574.8807991,Natural Gas,,,,,Canada,No,No,Yes,No,0,Mainline Valve + Offset (km) 0,Level I,Standard Review - 168 days,No,,,,,,,,,,,,,,,,,,,,,,,,,,,,,No,,,No,,,No,No,,,No,-62.452671,1,0,0,0,0,0,0,1,0,0,0,1,0,0,0,0,0,0,0,0,0,0,0,0,0,0,0,0,0,7,0,1,0,0
315,INC2011-114,Release of Substance,8/4/2011,Halifax,Maritimes & Northeast Pipeline Management Ltd.,Closed,44.648901,934,Natural Gas - Sweet,Gas,No,2011,2011-08-04,2011/08/04 09:30:00 AM Atlantic,,,Operation,Employee / Contractor (Onsite),3/20/2012,Yes,No,Natural Gas - Sweet,934,No,No,,,,,,,,,,,0,OPR,Halifax Lateral,323.9,126.1401343,Natural Gas,,,,,Canada,No,No,Yes,No,0,Kilometer Post 77,Level I,Standard Review - 168 days,No,,"Pipeline, Fitting, Tee, Body",,NPS 1/2,,,,,,,0,,,,,,,,,,,,,,,,,,No,,,No,,,No,No,,,No,-63.575335,1,0,0,0,0,0,0,1,0,0,0,1,0,0,0,0,0,0,0,0,0,0,0,0,0,0,0,0,0,8,0,1,0,0
316,INC2011-115,Release of Substance,8/4/2011,Fredericton,Maritimes & Northeast Pipeline Management Ltd.,Closed,45.45872,0,Natural Gas - Sweet,Gas,No,2011,2011-08-02,2011/08/02 10:00:00 AM Atlantic,,,Construction,Employee / Contractor (Onsite),3/17/2014,Yes,No,Natural Gas - Sweet,0,No,No,,,,,,,,,,,0,OPR,MNE - MLV 518,,,,,,,,Canada,No,No,Yes,No,0,,Level I,Standard Review - 168 days,No,,"Pipeline, Fitting, Other (please explain)",,,,,,,,,,,,,,,,,,,,,,,,,,,No,,,No,,,No,No,,,No,-67.02456,1,0,0,0,0,0,1,0,0,0,0,1,0,0,0,0,0,0,0,0,0,0,0,0,0,0,0,0,0,8,0,1,0,0
317,INC2011-119,Fire,8/6/2011,Consort,TransCanada Keystone Pipeline GP Ltd.,Closed,51.92351,0,Not Applicable,Not Applicable,No,2011,2011-08-04,2011/08/04 12:00:00 PM Mountain,,,Construction,Employee / Contractor (Onsite),1/23/2017,No,No,,,,No,,Welding or Cutting,,,,,,,,,0,OPR,,,,,,,,,Canada,Yes,No,No,No,0,,Level I,Standard Review - 168 days,No,,,,,,,,,,,,,,,,,,,,,,,,,,,,,No,,,No,,,No,No,,,No,-110.63297,0,1,0,0,0,0,0,0,0,0,0,1,0,0,0,0,0,0,0,0,0,0,0,0,0,0,0,0,0,8,0,1,0,0
318,INC2011-116,Fire,8/4/2011,Herbert,TransCanada Keystone Pipeline GP Ltd.,Closed,50.53923,0,Not Applicable,Not Applicable,No,2011,2011-08-04,2011/08/04 11:00:00 AM Mountain,,,Construction,Employee / Contractor (Onsite),8/26/2016,No,No,,,,No,,Welding or Cutting,,,,,,,,,0,OPR,TCP Keystone - Herbert Pump Station #13,,,,,,,,Canada,Yes,No,No,No,0,,Level I,Standard Review - 168 days,No,,,,,,,,,,,,,,,,,,,,,,,,,,,,,No,,,No,,,No,No,,,No,-107.30765,0,0,0,0,1,0,0,0,0,0,0,1,0,0,0,0,0,0,0,0,0,0,0,0,0,0,0,0,0,8,0,1,0,0
319,INC2011-120,Fire,8/6/2011,Oyen,TransCanada Keystone Pipeline GP Ltd.,Closed,51.42256,0,Not Applicable,Not Applicable,No,2011,2011-08-05,2011/08/05 11:45:00 AM Mountain,,,Construction,Employee / Contractor (Onsite),1/23/2017,No,No,,,,No,,Welding or Cutting,,,,,,,,,0,OPR,,,,,,,,,Canada,Yes,No,No,No,0,,Level I,Standard Review - 168 days,No,,,,,,,,,,,,,,,,,,,,,,,,,,,,,No,,,No,,,No,No,,,No,-110.54117,0,1,0,0,0,0,0,0,0,0,0,1,0,0,0,0,0,0,0,0,0,0,0,0,0,0,0,0,0,8,0,1,0,0
320,INC2011-125,Fire,8/9/2011,Rapid City,TransCanada Keystone Pipeline GP Ltd.,Closed,50.0749,0,Not Applicable,Not Applicable,No,2011,2011-08-09,2011/08/09 11:00:00 AM Mountain,,,Operation,Employee / Contractor (Onsite),3/31/2014,Yes,No,,,,No,,Housekeeping,,,,,,,,,0,OPR,TCP Keystone - Rapid City Pump Station 23,,,,,,,,Canada,Yes,No,No,No,0,,Level I,Standard Review - 168 days,No,,,,,,,,,,,,,,,,,,,,,,,,,,,,,No,,,No,,,No,No,,,No,-100.00047,0,0,1,0,0,0,0,0,0,0,0,1,0,0,0,0,0,0,0,0,0,0,0,0,0,0,0,0,0,8,0,1,0,0
321,INC2011-127,Release of Substance,8/16/2011,Meanook,NOVA Gas Transmission Ltd.,Closed,54.46884,0,Natural Gas - Sweet,Gas,No,2011,2011-08-15,2011/08/15 09:37:00 AM Mountain,,,Operation,3rd Party / Other Company,3/15/2012,Yes,No,Natural Gas - Sweet,0,No,No,,,,,,,,,,,0,OPR,,,,,,,,,Canada,Yes,No,No,No,0,,Level I,Standard Review - 168 days,No,,,,,,,,,,,,,,,,,,,,,,,,,,,,,No,,,No,,,No,No,,,No,-113.21624,1,1,0,0,0,0,0,0,0,0,0,1,0,0,0,0,0,0,0,0,0,0,0,0,0,0,0,0,0,8,0,1,0,0
322,INC2011-129,Operation Beyond Design Limits,8/17/2011,Toronto,Trans-Northern Pipelines Inc.,Closed,43.768426,0,Not Applicable,Not Applicable,No,2011,2011-08-16,2011/08/16 12:00:00 PM Eastern,,,Operation,Employee / Contractor (Onsite),5/16/2012,Yes,No,,,,No,,,,,,,,,Over Pressure,,0,OPR,Mainline,273.1,635.0188165,Refined Products-Aviation,,,,,Canada,Yes,No,No,No,0,,Level I,Standard Review - 168 days,No,"INC2015-002, INC2016-008",,,,,,,,,,,,,,,,,,,,,,,,,,,,No,,,No,,,No,No,,,No,-79.485336,0,0,0,0,0,1,0,0,0,0,0,1,0,0,0,0,0,0,0,0,0,0,0,0,0,0,0,0,0,8,0,1,0,0
323,INC2011-131,Fire,8/21/2011,White City,TransCanada PipeLines Limited,Closed,50.39317,0,Not Applicable,Not Applicable,No,2011,2011-08-21,2011/08/21 04:35:00 AM Mountain,,,Maintenance,Employee / Contractor (Onsite),1/23/2017,No,No,,,,No,,Equipment & Electrical,,,,,,,,,0,OPR,TCPL - Station 17 (Regina Compressor Station),,,,,,,,Canada,Yes,No,No,No,0,,Level I,Standard Review - 168 days,No,,,,,,,,,,,,,,,,,,,,,,,,,,,,,No,,,No,,,No,No,,,No,-104.40937,0,0,0,0,1,0,0,0,0,0,0,1,0,0,0,0,0,0,0,0,0,0,0,0,0,0,0,0,0,8,0,1,0,0
324,INC2011-132,Fire,8/22/2011,Grande Prairie,NOVA Gas Transmission Ltd.,Closed,55.12635,0,Not Applicable,Not Applicable,No,2011,2011-08-22,2011/08/22 09:00:00 AM Mountain,,,Operation,Employee / Contractor (Onsite),1/23/2017,Yes,No,,,,No,,Equipment & Electrical,,,,,,,,,0,OPR,NGTL - Clarkson Valley Compressor Station,,,,,,,,Canada,Yes,No,No,No,0,Legal Subdivision 14-6-71-25 W5,Level I,Standard Review - 168 days,No,,,,,,,,,,,,,,,,,,,,,,,,,,,,,No,,,No,,,No,No,,,No,-117.83833,0,1,0,0,0,0,0,0,0,0,0,1,0,0,0,0,0,0,0,0,0,0,0,0,0,0,0,0,0,8,0,1,0,0
325,INC2011-133,Fire,8/23/2011,Manning,NOVA Gas Transmission Ltd.,Closed,57.19241,0,Not Applicable,Not Applicable,No,2011,2011-08-22,2011/08/22 11:55:00 PM Mountain,,,Operation,Employee / Contractor (Onsite),1/23/2017,Yes,No,,,,No,,Equipment & Electrical,,,,,,,,,0,OPR,,,,,,,,,Canada,Yes,No,No,No,0,,Level I,Standard Review - 168 days,No,,,,,,,,,,,,,,,,,,,,,,,,,,,,,No,,,No,,,No,No,,,No,-118.19542,0,1,0,0,0,0,0,0,0,0,0,1,0,0,0,0,0,0,0,0,0,0,0,0,0,0,0,0,0,8,0,1,0,0
326,INC2011-134,Fire,8/29/2011,White City,Enbridge Pipelines Inc.,Closed,50.44344,0,Not Applicable,Not Applicable,No,2011,2011-08-25,2011/08/25 01:45:00 PM Mountain,,,Construction,Employee / Contractor (Onsite),4/18/2012,Yes,No,,,,No,,Equipment & Electrical,,,,,,,,,0,OPR,,,,,,,,,Canada,No,Yes,No,Yes,0,,Level I,Standard Review - 168 days,No,,Vehicle / mobile equipment,,,,,,,,,,,,,,,,,,,,,,,,,,,No,,,No,,,No,No,,,No,-104.35691,0,0,0,0,1,0,0,0,0,0,0,1,0,0,0,0,0,0,0,0,0,0,0,0,0,0,0,0,0,8,0,1,0,0
327,INC2011-135,Release of Substance,8/31/2011,Grande Prairie,NOVA Gas Transmission Ltd.,Closed,54.83012,0,Natural Gas - Sweet,Gas,No,2011,,2011/08/31 07:25:00 AM Mountain,,,Operation,Employee / Contractor (Onsite),1/2/2013,Yes,No,Natural Gas - Sweet,0,No,No,,,,,,,,,,,0,OPR,,,,,,,,,Canada,No,No,Yes,Yes,0,,Level I,Standard Review - 168 days,No,,"Pipeline, Pipe, Body",,NPS 18,Carbon Steel,414 - X60,,5.6 mm = 0.219 in,,,724.8,,,,,1970,,,,,Spiral,Double Submerged Arc Welding,6 o'clock,External,Polyethylene Tape Wrap,,,,No,Replacement,9/25/2011,No,,,No,No,9/25/2011,Replacement,No,-118.64715,1,1,0,0,0,0,0,0,0,0,0,1,0,0,0,0,0,0,0,0,0,0,0,0,0,0,0,0,0,8,0,1,0,0
328,INC2011-136,Serious Injury (CER or TSB),9/1/2011,Huntsville,TransCanada PipeLines Limited,Closed,45.51138,0,Not Applicable,Not Applicable,Yes,2011,2011-08-24,2011/08/24 04:00:00 PM Eastern,,,Construction,Employee / Contractor (Onsite),4/19/2012,No,No,,,,No,,,,,Fracture,1,,No,,,0,OPR,LINE 100-1,"508.00000000, 762.00000000, 863.60000000",2595.724534,Natural Gas,,,,,Canada,No,No,Yes,Yes,0,Mainline Valve + Offset (km) 18 km,Level I,Standard Review - 168 days,No,,,,,,,,,,,,,,,,,,,,,,,,,,,,,No,,,No,,,No,No,,,No,-79.31036,0,0,0,0,0,1,0,0,0,0,0,1,0,0,0,0,0,0,0,0,0,0,0,0,0,0,0,0,0,8,0,1,0,0
329,INC2011-138,Release of Substance,9/2/2011,Wabasca,NOVA Gas Transmission Ltd.,Closed,55.84448,0,Natural Gas - Sweet,Gas,No,2011,,2011/09/01 01:45:00 PM Mountain,,,Operation,3rd Party / Other Company,3/20/2014,Yes,No,Natural Gas - Sweet,0,No,No,,,,,,,,,,,0,OPR,NGTL - Weaver Lake South Meter Station,,,,,,,,Canada,Yes,No,No,No,0,,Level I,Standard Review - 168 days,No,,"Station/Facility, Metering, Delivering, Valve",,,,,,,,,,,,,,,,,,,,,,,,,,,No,,,No,,,No,No,,,No,-113.89141,1,1,0,0,0,0,0,0,0,0,0,1,0,0,0,0,0,0,0,0,0,0,0,0,0,0,0,0,0,9,0,0,1,0
330,INC2011-141,Release of Substance,9/8/2011,Musquash,Maritimes & Northeast Pipeline Management Ltd.,Closed,45.195347,0,Natural Gas - Sweet,Gas,No,2011,2011-09-08,2011/09/08 01:00:00 PM Eastern,,,Operation,Employee / Contractor (Onsite),3/12/2014,Yes,No,Natural Gas - Sweet,0,No,No,,,,,,,,,,,0,OPR,,,,,,,,,Canada,No,No,Yes,No,0,,Level I,Standard Review - 168 days,No,,"Pipeline, Fitting, Other (please explain)",,,,,,,,,,,,,,,,,,,,,,,,,,,No,,,No,,,No,No,,,No,-66.401993,1,0,0,0,0,0,1,0,0,0,0,1,0,0,0,0,0,0,0,0,0,0,0,0,0,0,0,0,0,9,0,0,1,0
331,INC2011-142,Release of Substance,9/9/2011,Albrights Corner,Maritimes & Northeast Pipeline Management Ltd.,Closed,46.022695,0,Natural Gas - Sweet,Gas,No,2011,,2011/09/09 03:30:00 PM Atlantic,,,Operation,Employee / Contractor (Onsite),3/20/2014,Yes,No,Natural Gas - Sweet,0,No,No,,,,,,,,,,,0,OPR,MNE - MLV 420,,,,,,,,Canada,No,No,Yes,No,0,Mainline Valve + Offset (km),Level I,Standard Review - 168 days,No,,"Pipeline, Fitting, Other (please explain)",,,,,,,,,,,,,,,,,,,,,,,,,,,No,,,No,,,No,No,,,No,-66.189817,1,0,0,0,0,0,1,0,0,0,0,1,0,0,0,0,0,0,0,0,0,0,0,0,0,0,0,0,0,9,0,0,1,0
332,INC2011-143,Release of Substance,9/9/2011,Noonan,Maritimes & Northeast Pipeline Management Ltd.,Closed,45.963713,0,Natural Gas - Sweet,Gas,No,2011,,2011/09/09 03:30:00 PM Atlantic,,,Operation,Employee / Contractor (Onsite),3/21/2014,Yes,No,Natural Gas - Sweet,0,No,No,,,,,,,,,,,0,OPR,MNE - MLV 446,,,,,,,,Canada,No,No,Yes,No,0,Mainline Valve + Offset (km),Level I,Standard Review - 168 days,No,,"Pipeline, Fitting, Other (please explain)",,,,,,,,,,,,,,,,,,,,,,,,,,,No,,,No,,,No,No,,,No,-66.52814,1,0,0,0,0,0,1,0,0,0,0,1,0,0,0,0,0,0,0,0,0,0,0,0,0,0,0,0,0,9,0,0,1,0
333,INC2011-146,Fire,9/10/2011,Grande Prairie,NOVA Gas Transmission Ltd.,Closed,55.50563,0,Not Applicable,Not Applicable,No,2011,2011-09-10,2011/09/10 09:00:00 AM Mountain,,,Construction,Employee / Contractor (Onsite),3/31/2014,No,No,,,,No,,Welding or Cutting,,,,,,,,,0,OPR,,,,,,,,,Canada,Yes,No,No,No,3,,Level I,Standard Review - 168 days,No,,,,,,,,,,,,,,,,,,,,,,,,,,,,,No,,,No,,,No,No,,,No,-119.56184,0,1,0,0,0,0,0,0,0,0,0,1,0,0,0,0,0,0,0,0,0,0,0,0,0,0,0,0,0,9,0,0,1,0
334,INC2011-152,Release of Substance,9/20/2011,Grenfell,TransCanada PipeLines Limited,Closed,50.28587,0,Natural Gas - Sweet,Gas,No,2011,2011-09-20,2011/09/20 09:00:00 AM Mountain,,,Operation,Employee / Contractor (Onsite),3/20/2014,Yes,No,Natural Gas - Sweet,0,No,No,,,,,,,,,,,0,OPR,TCPL - Station 21 (Grenfell Compressor Station),,,,,,,,Canada,Yes,No,No,No,3,Mainline Valve + Offset (km),Level I,Standard Review - 168 days,No,,"Station/Facility, Compression, Valve",,,,,,,,,,,,,,,,,,,,,,,,,,,No,,,No,,,No,No,,,No,-102.95155,1,0,0,0,1,0,0,0,0,0,0,1,0,0,0,0,0,0,0,0,0,0,0,0,0,0,0,0,0,9,0,0,1,0
335,INC2011-153,Release of Substance,9/26/2011,Saint George,Maritimes & Northeast Pipeline Management Ltd.,Closed,45.129009,0,Natural Gas - Sweet,Gas,No,2011,2011-09-26,2011/09/26 12:00:00 PM Atlantic,,,Operation,Employee / Contractor (Onsite),3/17/2014,Yes,No,Natural Gas - Sweet,0,No,No,,,,,,,,,,,0,OPR,,,,,,,,,Canada,Yes,No,No,No,0,,Level I,Standard Review - 168 days,No,,"Station/Facility, Metering, Delivering, Valve",,,,,,,,,,,,,,,,,,,,,,,,,,,No,,,No,,,No,No,,,No,-66.83136,1,0,0,0,0,0,1,0,0,0,0,1,0,0,0,0,0,0,0,0,0,0,0,0,0,0,0,0,0,9,0,0,1,0
336,INC2011-154,Release of Substance,9/28/2011,Grande Prairie,NOVA Gas Transmission Ltd.,Closed,54.83025,0,Natural Gas - Sweet,Gas,No,2011,2011-09-27,2011/09/27 11:25:00 AM Mountain,,,Operation,Employee / Contractor (Onsite),3/20/2014,Yes,No,Natural Gas - Sweet,0,No,No,,,,,,,,,,,0,OPR,,,,,,,,,Canada,Yes,No,No,No,0,Legal Subdivision 10-26-067-5W6,Level I,Standard Review - 168 days,No,,"Station/Facility, Compression, Fitting",,,,,,,,,,,,,,,,,,,,,,,,,,,No,,,No,,,No,No,,,No,-118.64722,1,1,0,0,0,0,0,0,0,0,0,1,0,0,0,0,0,0,0,0,0,0,0,0,0,0,0,0,0,9,0,0,1,0
337,INC2011-155,Release of Substance,10/1/2011,Maple,TransCanada PipeLines Limited,Closed,43.87391,0,Natural Gas - Sweet,Gas,No,2011,2011-10-01,2011/10/01 06:40:00 AM Mountain,,,Operation,Employee / Contractor (Onsite),3/20/2014,Yes,No,Natural Gas - Sweet,0,No,No,,,,,,,,,,,0,OPR,,,,,,,,,Canada,No,No,Yes,No,0,,Level I,Standard Review - 168 days,No,,,,,,,,,,,,,,,,,,,,,,,,,,,,,No,,,No,,,No,No,,,No,-79.58006,1,0,0,0,0,1,0,0,0,0,0,1,0,0,0,0,0,0,0,0,0,0,0,0,0,0,0,0,0,10,0,0,1,0
338,INC2011-158,Release of Substance,10/13/2011,Tulita,Enbridge Pipelines (NW) Inc.,Closed,64.65833,0.0005,Propane,Gas,No,2011,2011-10-12,2011/10/12 12:00:00 AM Mountain,,,Operation,Employee / Contractor (Onsite),5/15/2012,No,No,Propane,0.0005,No,No,,,,,,,,,,,0,OPR,,,,,,,,,Canada,Yes,No,No,No,0,Kilometer Post 123,Level I,Standard Review - 168 days,No,,"Pipeline, Fitting, Other (please explain)",,,,,,,,,,,,,,,,,,,,,,,,,,,No,,,No,,,No,No,,,No,-124.83612,1,0,0,0,0,0,0,0,0,1,0,1,0,0,0,0,0,0,0,0,0,0,0,0,0,0,0,0,0,10,0,0,1,0
339,INC2011-157,Fatality,10/12/2011,Sarnia,Niagara Gas Transmission Limited,Closed,42.97508,0,Not Applicable,Not Applicable,Yes,2011,2011-10-11,2011/10/11 12:00:00 AM Mountain,,,Maintenance,Employee / Contractor (Onsite),1/23/2017,No,No,,,,No,,,Operation of Equipment,1,,,,,,,0,OPR,,,,,,,,,Canada,No,No,Yes,No,0,,Level I,Standard Review - 168 days,No,,,,,,,,,,,,,,,,,,,,,,,,,,,,,No,,,No,,,No,No,,,No,-82.40654,0,0,0,0,0,1,0,0,0,0,0,1,0,0,0,0,0,0,0,0,0,0,0,0,0,0,0,0,0,10,0,0,1,0
340,INC2011-160,Operation Beyond Design Limits,10/14/2011,Windsor,Ethane Shippers Joint Venture,Closed,42.280509,0,Not Applicable,Not Applicable,No,2011,,2011/10/02 09:40:00 PM Eastern,,,Operation,Employee / Contractor (Onsite),1/9/2013,Yes,No,,,,No,,,,,,,,,Over Pressure,,0,OPR,BP Windsor Storage Terminal,,,,,,,,Canada,Yes,No,No,No,0,,Level I,Standard Review - 168 days,No,,,,,,,,,,,,,,,,,,,,,,,,,,,,,No,,,No,,,No,No,,,No,-83.077658,0,0,0,0,0,1,0,0,0,0,1,1,0,0,0,0,0,0,0,0,0,0,0,0,0,0,0,0,0,10,0,0,1,0
341,INC2011-162,Release of Substance,10/19/2011,Wrigley,Enbridge Pipelines (NW) Inc.,Closed,63.87793,0,Mixed HVP Hydrocarbons,Gas,No,2011,2011-10-19,2011/10/19 02:09:00 PM Mountain,,,Operation,Employee / Contractor (Onsite),3/6/2012,No,No,Mixed HVP Hydrocarbons,0,No,No,,,,,,,,,,,0,OPR,,,,,,,,,Canada,Yes,No,No,No,0,Kilometer Post 228,Level I,Standard Review - 168 days,No,,,,,,,,,,,,,,,,,,,,,,,,,,,,,No,,,No,,,No,No,,,No,-123.98697,1,0,0,0,0,0,0,0,0,1,0,1,0,0,0,0,0,0,0,0,0,0,0,0,0,0,0,0,0,10,0,0,1,0
342,INC2011-163,Release of Substance,10/19/2011,Wrigley,Enbridge Pipelines (NW) Inc.,Closed,63.261177,0.001,Propane,Gas,No,2011,2011-10-19,2011/10/19 04:51:00 PM Mountain,,,Maintenance,Employee / Contractor (Onsite),3/6/2012,Yes,No,Propane,0.001,No,No,,,,,,,,,,,0,OPR,,,,,,,,,Canada,Yes,No,No,No,0,Kilometer Post 305,Level I,Standard Review - 168 days,No,,"Pipeline, Valve, Pressure relief, Other (please explain)",,,,,,,,,,,,,,,,,,,,,,,,,,,No,,,No,,,No,No,,,No,-123.402616,1,0,0,0,0,0,0,0,0,1,0,1,0,0,0,0,0,0,0,0,0,0,0,0,0,0,0,0,0,10,0,0,1,0
343,INC2011-165,Fire,10/24/2011,Regina,Enbridge Pipelines Inc.,Closed,50.25906,0,Not Applicable,Not Applicable,No,2011,2011-10-24,2011/10/24 07:10:00 PM Mountain,,,Maintenance,Employee / Contractor (Onsite),3/31/2014,No,No,,,,No,,Welding or Cutting,,,,,,,,,0,OPR,Line 1,"508.00000000, 864.00000000",1255.999121,Crude Oil,,,,,Canada,No,No,Yes,No,0,,Level I,Standard Review - 168 days,No,,,,,,,,,,,,,,,,,,,,,,,,,,,,,No,,,No,,,No,No,,,No,-103.70813,0,0,0,0,1,0,0,0,0,0,0,1,0,0,0,0,0,0,0,0,0,0,0,0,0,0,0,0,0,10,0,0,1,0
344,INC2011-166,Release of Substance,10/26/2011,Rosemary,NOVA Gas Transmission Ltd.,Closed,50.90519,0,Natural Gas - Sweet,Gas,No,2011,,2011/10/25 08:00:00 AM Mountain,,,Operation,Employee / Contractor (Onsite),12/29/2011,Yes,No,Natural Gas - Sweet,0,No,No,,,,,,,,,,,0,OPR,NGTL - Gem South Meter Station,,,,,,,,Canada,Yes,No,No,No,0,,Level I,Standard Review - 168 days,No,,"Station/Facility, Metering, Delivering, Auxiliary device(s) (please explain)",,,,,,,,,,,,,,,,,,,,,,,,,,,No,,,No,,,No,No,,,No,-112.10804,1,1,0,0,0,0,0,0,0,0,0,1,0,0,0,0,0,0,0,0,0,0,0,0,0,0,0,0,0,10,0,0,1,0
345,INC2011-167,Fire,10/31/2011,Hearst,TransCanada PipeLines Limited,Closed,49.67061,0,Not Applicable,Not Applicable,No,2011,2011-10-31,2011/10/31 03:30:00 AM Mountain,,,Maintenance,Employee / Contractor (Onsite),11/28/2017,No,No,,,,No,,Equipment & Electrical,,,,,,,,,0,OPR,LINE 100-2,"508.00000000, 609.60000000, 762.00000000, 863.60000000, 914.40000000",3393.42642,Natural Gas,,,,,Canada,No,No,Yes,No,0,,Level I,Standard Review - 168 days,No,,,,,,,,,,,,,,,,,,,,,,,,,,,,,No,,,No,,,No,No,,,No,-83.65592,0,0,0,0,0,1,0,0,0,0,0,1,0,0,0,0,0,0,0,0,0,0,0,0,0,0,0,0,0,10,0,0,1,0
346,INC2011-168,Fire,11/4/2011,Yahk,Foothills Pipe Lines Ltd.,Closed,49.07839,0,Not Applicable,Not Applicable,No,2011,2011-11-03,2011/11/03 02:00:00 PM Mountain,,,Operation,Employee / Contractor (Onsite),2/25/2014,Yes,No,,,,No,,Equipment & Electrical,,,,,,,,,0,OPR,Foothills - East Kootenay Exchange Meter Station,,,,,,,,Canada,Yes,No,No,No,3,,Level I,Standard Review - 168 days,No,,"Station/Facility, Metering, Delivering, Auxiliary power unit",,,,,,,,,,,,,,,,,,,,,,,,,,,No,,,No,,,No,No,,,No,-116.10601,0,0,0,1,0,0,0,0,0,0,0,1,0,0,0,0,0,0,0,0,0,0,0,0,0,0,0,0,0,11,0,0,1,0
347,INC2011-171,Release of Substance,11/20/2011,Whitecourt,NOVA Gas Transmission Ltd.,Closed,54.14314,50,Natural Gas - Sweet,Gas,No,2011,2011-11-19,2011/11/19 06:30:00 PM Mountain,,,Operation,3rd Party / Other Company,3/20/2014,Yes,No,Natural Gas - Sweet,50,No,No,,,,,,,,,,,0,OPR,NGTL - Greencourt West Meter Station,,,,,,,,Canada,Yes,No,No,No,0,,Level I,Standard Review - 168 days,No,,"Station/Facility, Metering, Delivering, Auxiliary device(s) (please explain)",,,,,,,,,,,,,,,,,,,,,,,,,,,No,,,No,,,No,No,,,No,-115.36091,1,1,0,0,0,0,0,0,0,0,0,1,0,0,0,0,0,0,0,0,0,0,0,0,0,0,0,0,0,11,0,0,1,0
348,INC2011-172,Release of Substance,11/20/2011,Donnelly,NOVA Gas Transmission Ltd.,Closed,55.72877,0,Natural Gas - Sweet,Gas,No,2011,2011-11-19,2011/11/19 10:00:00 PM Mountain,,,Operation,3rd Party / Other Company,3/20/2014,Yes,No,Natural Gas - Sweet,0,No,No,,,,,,,,,,,0,OPR,NGTL - Fahler Meter Station,,,,,,,,Canada,Yes,No,No,No,0,,Level I,Standard Review - 168 days,No,,"Station/Facility, Metering, Delivering, Auxiliary device(s) (please explain)",,,,,,,,,,,,,,,,,,,,,,,,,,,No,,,No,,,No,No,,,No,-117.08296,1,1,0,0,0,0,0,0,0,0,0,1,0,0,0,0,0,0,0,0,0,0,0,0,0,0,0,0,0,11,0,0,1,0
349,INC2011-173,Release of Substance,11/21/2011,Calstock,TransCanada PipeLines Limited,Closed,49.74457,4,Natural Gas - Sweet,Gas,No,2011,2011-11-21,2011/11/21 10:50:00 AM Mountain,,,Operation,Employee / Contractor (Onsite),3/20/2014,Yes,No,Natural Gas - Sweet,4,No,No,,,,,,,,,,,0,OPR,LINE 100-1,"508.00000000, 762.00000000, 863.60000000",2595.724534,Natural Gas,,,,,Canada,Yes,No,No,No,0,,Level I,Standard Review - 168 days,No,,"Station/Facility, Compression, Fitting",,,,,,,,,,,,,,,,,,,,,,,,,,,No,,,No,,,No,No,,,No,-84.06787,1,0,0,0,0,1,0,0,0,0,0,1,0,0,0,0,0,0,0,0,0,0,0,0,0,0,0,0,0,11,0,0,1,0
350,INC2011-177,Fire,12/2/2011,Fort Frances,Centra Transmission Holdings Inc.,Closed,48.613425,0,Not Applicable,Not Applicable,No,2011,2011-12-01,2011/12/01 12:00:00 AM Central,,,Construction,Employee / Contractor (Onsite),3/31/2014,Yes,No,,,,No,,Welding or Cutting,,,,,,,,,0,OPR,Rainy River/Fort Frances,323.9,94.90328073,Natural Gas,,,,,Canada,Yes,No,No,No,0,,Level I,Standard Review - 168 days,No,,,,,,,,,,,,,,,,,,,,,,,,,,,,,No,,,No,,,No,No,,,No,-93.417778,0,0,0,0,0,1,0,0,0,0,0,1,0,0,0,0,0,0,0,0,0,0,0,0,0,0,0,0,0,12,0,0,0,1
351,INC2011-174,Fire,11/21/2011,Maple,TransCanada PipeLines Limited,Closed,43.87374,0,Not Applicable,Not Applicable,No,2011,2011-11-12,2011/11/12 11:33:00 AM Mountain,No pipeline interruption,Transmission,Operation,Other Control System,6/30/2016,Yes,No,,,,No,,Equipment & Electrical,,,,,,,,,0,OPR,LINE 100-1,"508.00000000, 762.00000000, 863.60000000",2595.724534,Natural Gas,STN 130 - MAPLE,,43.87374203,-79.57983402,Canada,Yes,No,No,No,0,,Level I,Standard Review - 168 days,No,,"Station/Facility, Compression, Compressor",,,,,,,,,,,,,,,,,,,,,,,,,,,No,,,No,,,No,No,,,No,-79.57983,0,0,0,0,0,1,0,0,0,0,0,1,0,0,0,0,0,0,0,0,0,0,0,0,0,0,0,0,0,11,0,0,1,0
352,INC2011-175,Operation Beyond Design Limits,11/24/2011,Portage La Prairie,TransCanada Keystone Pipeline GP Ltd.,Closed,49.91197,0,Not Applicable,Not Applicable,No,2011,2011-11-24,2011/11/24 12:42:00 PM Mountain,,,Construction,Employee / Contractor (Onsite),5/4/2017,No,No,,,,No,,,,,,,,,Over Pressure,,0,OPR,,,,,,,,,Canada,Yes,No,No,No,0,Kilometer Post 1099.9,Level I,Standard Review - 168 days,No,,,,,,,,,,,,,,,,,,,,,,,,,,,,,No,,,No,,,No,No,,,No,-98.51779,0,0,1,0,0,0,0,0,0,0,0,1,0,0,0,0,0,0,0,0,0,0,0,0,0,0,0,0,0,11,0,0,1,0
353,INC2011-178,Release of Substance,12/5/2011,Huntsville,TransCanada PipeLines Limited,Closed,45.375736,0,Natural Gas - Sweet,Gas,No,2011,,2011/12/01 10:00:00 AM Mountain,,,Maintenance,Employee / Contractor (Onsite),3/20/2014,Yes,No,Natural Gas - Sweet,0,No,No,,,,,,,,,,,0,OPR,TCPL -  MLV 120,,,,,,,,Canada,No,No,Yes,No,0,Mainline Valve + Offset (km) 120,Level I,Standard Review - 168 days,No,,"Pipeline, Fitting, Other (please explain)",,,,,,,,,,,,,,,,,,,,,,,,,,,No,,,No,,,No,No,,,No,-79.239306,1,0,0,0,0,1,0,0,0,0,0,1,0,0,0,0,0,0,0,0,0,0,0,0,0,0,0,0,0,12,0,0,0,1
354,INC2011-179,Release of Substance,12/6/2011,Amisk,NOVA Gas Transmission Ltd.,Closed,52.54673,0,Natural Gas - Sweet,Gas,No,2011,2011-12-06,2011/12/06 04:00:00 PM Mountain,,,Operation,Landowner,5/4/2017,Yes,No,Natural Gas - Sweet,0,No,No,,,,,,,,,,,0,OPR,,,,,,,,,Canada,No,No,Yes,No,0,Legal Subdivision NW-24-41-08 W4,Level I,Standard Review - 168 days,No,REM-0147,,,,,,,,,,,,,,,,,,,,,,,,,,,,No,,,No,,,No,No,,,No,-111.03052,1,1,0,0,0,0,0,0,0,0,0,1,0,0,0,0,0,0,0,0,0,0,0,0,0,0,0,0,0,12,0,0,0,1
355,INC2011-180,Release of Substance,12/7/2011,Glenboro,Enbridge Pipelines Inc.,Closed,49.54445,7,Crude Oil - Sweet,Liquid,No,2011,,2011/12/07 08:30:00 AM Mountain,,,Operation,Employee / Contractor (Onsite),3/20/2014,Yes,No,Crude Oil - Sweet,7,No,No,,,,,,,,,,,0,OPR,,,,,,Meter,,,Canada,Yes,No,No,No,0,,Level I,Standard Review - 168 days,No,REM-0148,"Station/Facility, Pumping, Valve",,,,,,,,,,,,,,,,,,,,,,,,,,,No,,,No,,,No,No,,,No,-99.3207,1,0,1,0,0,0,0,0,0,0,0,1,0,0,0,0,0,0,0,0,0,0,0,0,0,0,0,0,0,12,0,0,0,1
356,INC2011-183,Release of Substance,12/14/2011,Steelman,Enbridge Pipelines (Westspur) Inc.,Closed,49.28813,2,Crude Oil - Sweet,Liquid,No,2011,,2011/12/13 04:00:00 PM Central,,,Operation,Employee / Contractor (Onsite),2/6/2012,Yes,No,Crude Oil - Sweet,2,No,No,,,,,,,,,,,0,OPR,EPI (Westspur) - Steelman Terminal,,,,,,,,Canada,Yes,No,No,No,0,Legal Subdivision LSD: 16-8-4-5-W2,Level I,Standard Review - 168 days,No,,,,,,,,,,,,,,,,,,,,,,,,,,,,,No,,,No,,,No,No,,,No,-102.63736,1,0,0,0,1,0,0,0,0,0,0,1,0,0,0,0,0,0,0,0,0,0,0,0,0,0,0,0,0,12,0,0,0,1
357,INC2011-185,Release of Substance,12/20/2011,Ignace,TransCanada PipeLines Limited,Closed,49.26712,0,Natural Gas - Sweet,Gas,No,2011,,2011/12/20 08:30:00 AM Mountain,,,Operation,Employee / Contractor (Onsite),5/15/2012,Yes,No,Natural Gas - Sweet,0,No,No,,,,,,,,,,,0,OPR,LINE 100-1,"508.00000000, 762.00000000, 863.60000000",2595.724534,Natural Gas,,,,,Canada,Yes,No,No,No,0,,Level I,Standard Review - 168 days,No,,"Station/Facility, Compression, Fitting",,,,,,,,,,,,,,,,,,,,,,,,,,,No,Replacement,12/20/2011,No,,,No,No,12/20/2011,Replacement,No,-91.23269,1,0,0,0,0,1,0,0,0,0,0,1,0,0,0,0,0,0,0,0,0,0,0,0,0,0,0,0,0,12,0,0,0,1
358,INC2011-186,Release of Substance,12/21/2011,Saint John,Maritimes & Northeast Pipeline Management Ltd.,Closed,45.251566,236,Natural Gas - Sweet,Gas,No,2011,2011-12-27,2011/12/27 07:50:00 AM Atlantic,,,Operation,Public,3/20/2014,Yes,No,Natural Gas - Sweet,236,No,No,,,,,,,,,,,0,OPR,,,,,,,,,Canada,Yes,No,No,No,0,Mainline Valve + Offset (km),Level I,Standard Review - 168 days,No,,"Station/Facility, Metering, Delivering, Valve",,,,,,,,,,,,,,,,,,,,,,,,,,,No,,,No,,,No,No,,,No,-66.097871,1,0,0,0,0,0,1,0,0,0,0,1,0,0,0,0,0,0,0,0,0,0,0,0,0,0,0,0,0,12,0,0,0,1
359,INC2012-002,Release of Substance,1/4/2012,Kapuskasing,TransCanada PipeLines Limited,Closed,49.3881,0,Natural Gas - Sweet,Gas,No,2012,,2012/01/03 12:10:00 PM Mountain,,,Operation,Employee / Contractor (Onsite),3/5/2014,Yes,No,Natural Gas - Sweet,0,No,No,,,,,,,,,,,0,OPR,TCPL - Station 95 (Kapuskasing Compressor Station),,,,,,,,Canada,Yes,No,No,No,0,,Level I,Standard Review - 168 days,No,,"Station/Facility, Compression, Valve",,,,,,,,,,,,,,,,,,,,,,,,,,,No,,,No,,,No,No,,,No,-82.43604,1,0,0,0,0,1,0,0,0,0,0,1,0,0,0,0,0,0,0,0,0,0,0,0,0,0,0,0,0,1,0,0,0,1
360,INC2012-003,Release of Substance,1/6/2012,Burlington,TransCanada PipeLines Limited,Closed,43.37273,6,Natural Gas - Sweet,Gas,No,2012,2012-01-04,2012/01/04 12:30:00 PM Mountain,,,Operation,Employee / Contractor (Onsite),3/5/2014,Yes,No,Natural Gas - Sweet,6,No,No,,,,,,,,,,,0,OPR,TCPL - MLV 207,,,,,,,,Canada,No,No,Yes,No,0,,Level I,Standard Review - 168 days,No,,"Pipeline, Auxiliary device(s) (please explain)",,,,,,,,,,,,,,,,,,,,,,,,,,,No,,,No,,,No,No,,,No,-79.83172,1,0,0,0,0,1,0,0,0,0,0,1,0,0,0,0,0,0,0,0,0,0,0,0,0,0,0,0,0,1,0,0,0,1
361,INC2012-004,Operation Beyond Design Limits,1/7/2012,Sherwood Park,Enbridge Pipelines Inc.,Closed,53.5467,0,Not Applicable,Not Applicable,No,2012,2012-01-07,2012/01/07 05:29:00 AM Mountain,,,Operation,Employee / Contractor (Onsite),10/22/2012,Yes,No,,,,No,,,,,,,,,Over Pressure,,0,OPR,Line 2,"1219.00000000, 609.40000000, 610.00000000",1282.304863,Crude Oil,,,,,Canada,No,No,Yes,No,0,,Level I,Standard Review - 168 days,No,"INC2012-176, INC2012-177, INC2012-178, INC2012-179, INC2012-180, INC2012-181, INC2012-182, INC2012-183, INC2012-184, INC2012-185, INC2012-186, INC2012-187, INC2012-188, INC2012-189, INC2012-190, INC2012-191, INC2012-192, INC2012-193, INC2012-194, INC2012-195, INC2012-196, INC2012-197, INC2012-198, INC2012-199, INC2012-200, INC2012-201, INC2012-202","Pipeline, Pipe, Body;Pipeline, Flange, Gasket/O-ring",CSA,NPS 24,Carbon Steel,,,,,,275,,,,0,,,,,,,,,,,,,,No,,,No,,,No,No,,,No,-113.35465,0,1,0,0,0,0,0,0,0,0,0,1,0,0,0,0,0,0,0,0,0,0,0,0,0,0,0,0,0,1,0,0,0,1
362,INC2012-005,Serious Injury (CER or TSB),1/9/2012,Fort Nelson,NOVA Gas Transmission Ltd.,Closed,59.04522,0,Not Applicable,Not Applicable,Yes,2012,2012-01-06,2012/01/06 02:15:00 PM Pacific,,Transmission,Construction,Employee / Contractor (Onsite),6/25/2012,Yes,No,,,,No,,,,,Fracture,,,No,,,0,OPR,,,,,,,,,Canada,Yes,No,No,Yes,0,,Level II,Category B,No,,Vehicle / mobile equipment,,,,,,,,,,,,,,,,,,,,,,,,,,,No,,,No,,,No,No,,,No,-121.26857,0,0,0,1,0,0,0,0,0,0,0,1,0,0,0,0,0,0,0,0,0,0,0,0,0,0,0,0,0,1,0,0,0,1
363,INC2012-006,Release of Substance,1/10/2012,Cobourg,TransCanada PipeLines Limited,Closed,44.04676,0,Natural Gas - Sweet,Gas,No,2012,2012-01-10,2012/01/10 02:55:00 AM Mountain,,,Operation,Employee / Contractor (Onsite),7/3/2013,Yes,No,Natural Gas - Sweet,0,No,No,,,,,,,,,,,0,OPR,,,,,,,,,Canada,Yes,No,No,No,0,,Level I,Standard Review - 168 days,No,,"Station/Facility, Compression, Valve",,,,,,,,,,,,,,,,,,,,,,,,,,,No,Replacement,,No,,,No,No,,Replacement,No,-78.00709,1,0,0,0,0,1,0,0,0,0,0,1,0,0,0,0,0,0,0,0,0,0,0,0,0,0,0,0,0,1,0,0,0,1
364,INC2012-007,Release of Substance,1/15/2012,Chetwynd,"Westcoast Energy Inc., carrying on business as Spectra Energy Transmission",Closed,55.70181,0,Natural Gas - Sour,Gas,Yes,2012,2012-01-15,2012/01/15 07:30:00 AM Pacific,,,Operation,Employee / Contractor (Onsite),9/7/2012,Yes,No,Natural Gas - Sour,0,No,No,,,,,,,,,,,0,OPR,Grizzly Pipeline,"273.10000000, 508.00000000, 610.00000000",160.6451852,"Natural Gas Sour, Natural Gas Sweet",,,,,Canada,No,No,Yes,No,3,Mainline Valve + Offset (km),Level I,Standard Review - 168 days,No,,"Pipeline, Valve, Ball, Stem",,NPS 1/2,,,,,,,0,,,,,,,,,,,,,,,,,,No,Replacement,,No,,,No,No,,Replacement,No,-121.63465,1,0,0,1,0,0,0,0,0,0,0,1,0,0,0,0,0,0,0,0,0,0,0,0,0,0,0,0,0,1,0,0,0,1
365,INC2012-009,Operation Beyond Design Limits,1/17/2012,Clearwater,Trans Mountain Pipeline ULC,Closed,51.5659,0,Not Applicable,Not Applicable,No,2012,2012-01-17,2012/01/17 01:58:00 PM Mountain,,,Operation,Employee / Contractor (Onsite),1/28/2014,Yes,No,,,,No,,,,,,,,,Over Pressure,,0,OPR,,,,,,,,,Canada,Yes,No,No,No,0,,Level I,Standard Review - 168 days,No,,"Pipeline, Pipe, Body",,,,,,,,,,,,,,,,,,,,,,,,,,,No,,,No,,,No,No,,,No,-120.16191,0,0,0,1,0,0,0,0,0,0,0,1,0,0,0,0,0,0,0,0,0,0,0,0,0,0,0,0,0,1,0,0,0,1
366,INC2012-010,Release of Substance,1/18/2012,Manning,NOVA Gas Transmission Ltd.,Closed,57.19155,0,Natural Gas - Sweet,Gas,No,2012,2012-01-16,2012/01/16 04:55:00 PM Mountain,,,Operation,Employee / Contractor (Onsite),1/2/2013,Yes,No,Natural Gas - Sweet,0,No,No,,,,,,,,,,,0,OPR,NGTL - Meikle River Compressor Station,,,,,,,,Canada,Yes,No,No,No,0,,Level I,Standard Review - 168 days,No,,"Station/Facility, Compression, Valve",,,,,,,,,,,,,,,,,,,,,,,,,,,No,Rebuilt,1/18/2012,No,,,No,No,1/18/2012,Repair,No,-118.19433,1,1,0,0,0,0,0,0,0,0,0,1,0,0,0,0,0,0,0,0,0,0,0,0,0,0,0,0,0,1,0,0,0,1
367,INC2012-011,Fire,1/20/2012,Prespatou,NOVA Gas Transmission Ltd.,Closed,57.36771,0,Not Applicable,Not Applicable,No,2012,2012-01-17,2012/01/17 11:15:00 AM Mountain,,,Construction,Employee / Contractor (Onsite),11/21/2013,No,No,,,,No,,Welding or Cutting,,,,,,,,,0,OPR,NGTL - Tanghe Creek Lateral,,,,,,,,Canada,No,No,Yes,No,0,,Level I,Standard Review - 168 days,No,,,,,,,,,,,,,,,,,,,,,,,,,,,,,No,,,No,,,No,No,,,No,-119.75255,0,1,0,0,0,0,0,0,0,0,0,1,0,0,0,0,0,0,0,0,0,0,0,0,0,0,0,0,0,1,0,0,0,1
368,INC2012-013,Fire,1/19/2012,Assumption,NOVA Gas Transmission Ltd.,Closed,57.37269,0,Not Applicable,Not Applicable,No,2012,2012-01-17,2012/01/17 09:00:00 PM Mountain,,,Construction,Employee / Contractor (Onsite),3/5/2014,Yes,No,,,,No,,Equipment & Electrical,,,,,,,,,0,OPR,NGTL - Tanghe Creek Lateral,,,,,,,,Canada,Yes,No,No,No,0,,Level I,Standard Review - 168 days,No,,,,,,,,,,,,,,,,,,,,,,,,,,,,,No,,,No,,,No,No,,,No,-119.13156,0,1,0,0,0,0,0,0,0,0,0,1,0,0,0,0,0,0,0,0,0,0,0,0,0,0,0,0,0,1,0,0,0,1
369,INC2012-014,Fire,1/19/2012,Kerrobert,Enbridge Pipelines Inc.,Closed,51.86534,0,Not Applicable,Not Applicable,No,2012,2012-01-18,2012/01/18 08:25:00 AM Mountain,,,Construction,Employee / Contractor (Onsite),3/21/2014,No,No,,,,No,,Equipment & Electrical,,,,,,,,,0,OPR,EPI - Kerrobert Pump Station,,,,,,,,Canada,Yes,No,No,No,0,,Level I,Standard Review - 168 days,No,,,,,,,,,,,,,,,,,,,,,,,,,,,,,No,,,No,,,No,No,,,No,-109.02627,0,0,0,0,1,0,0,0,0,0,0,1,0,0,0,0,0,0,0,0,0,0,0,0,0,0,0,0,0,1,0,0,0,1
370,INC2012-015,Fire,1/21/2012,Manning,NOVA Gas Transmission Ltd.,Closed,57.38062,0,Not Applicable,Not Applicable,No,2012,2012-01-19,2012/01/19 02:00:00 PM Mountain,,,Construction,Employee / Contractor (Onsite),10/21/2013,No,No,,,,No,,Other Event (Nature or 3rd Party),,,,,,,,,0,OPR,NGTL - Tanghe Creek Lateral,,,,,,,,Canada,No,No,Yes,No,0,,Level I,Standard Review - 168 days,No,,,,,,,,,,,,,,,,,,,,,,,,,,,,,No,,,No,,,No,No,,,No,-119.18572,0,1,0,0,0,0,0,0,0,0,0,1,0,0,0,0,0,0,0,0,0,0,0,0,0,0,0,0,0,1,0,0,0,1
371,INC2012-016,Release of Substance,1/24/2012,Abbotsford,Trans Mountain Pipeline ULC,Closed,49.07801,90,Crude Oil - Sweet,Liquid,No,2012,,2012/01/24 08:00:00 AM Pacific,,,Operation,Employee / Contractor (Onsite),11/15/2012,Yes,No,Crude Oil - Sweet,90,No,No,,,,,,,,,,,0,OPR,TMPL - Sumas Tank Farm,,,,,,,,Canada,Yes,No,No,No,0,,Level II,Category B,Yes,,"Pipeline, Flange, Gasket/O-ring",,,,,,,,,,,,,,,,,,,,,,,,,,,No,,,No,,,No,No,,,No,-122.20215,1,0,0,1,0,0,0,0,0,0,1,1,0,0,0,0,0,0,0,0,0,0,0,0,0,0,0,0,0,1,0,0,0,1
372,INC2012-017,"Fire, Release of Substance",1/25/2012,Fort Nelson,NOVA Gas Transmission Ltd.,Closed,59.20208,0.001,Propane,Gas,No,2012,2012-01-20,2012/01/20 11:00:00 AM Mountain,,,Construction,Employee / Contractor (Onsite),10/22/2013,No,No,Propane,0.001,No,No,,Housekeeping,,,,,,,,,0,OPR,,,,,,,,,Canada,No,No,Yes,No,0,,Level I,Standard Review - 168 days,No,,,,,,,,,,,,,,,,,,,,,,,,,,,,,No,,,No,,,No,No,,,No,-121.62187,1,0,0,1,0,0,0,0,0,0,0,1,0,0,0,0,0,0,0,0,0,0,0,0,0,0,0,0,0,1,0,0,0,1
373,INC2012-018,Fire,1/25/2012,Cheecham,NOVA Gas Transmission Ltd.,Closed,56.19745,0,Not Applicable,Not Applicable,No,2012,,2012/01/24 09:30:00 PM Mountain,,,Construction,Employee / Contractor (Onsite),10/22/2013,Yes,No,,,,No,,Equipment & Electrical,,,,,,,,,0,OPR,CHEECHAM WEST CROSSOVER,508,14.04277652,Natural Gas Sweet,,,,,Canada,No,No,No,Yes,0,,Level I,Standard Review - 168 days,No,,Vehicle / mobile equipment,,,,,,,,,,,,,,,,,,,,,,,,,,,No,,,No,,,No,No,,,No,-110.86556,0,1,0,0,0,0,0,0,0,0,0,1,0,0,0,0,0,0,0,0,0,0,0,0,0,0,0,0,0,1,0,0,0,1
374,INC2012-019,Release of Substance,1/26/2012,Saint John,Maritimes & Northeast Pipeline Management Ltd.,Closed,45.274038,0,Natural Gas - Sweet,Gas,No,2012,,2012/01/26 12:50:00 PM Atlantic,,,Operation,Employee / Contractor (Onsite),1/2/2013,Yes,No,Natural Gas - Sweet,0,No,No,,,,,,,,,,,0,OPR,M&NP - Bayside Power Customer Station,,,,,,,,Canada,Yes,No,No,No,0,,Level I,Standard Review - 168 days,No,,"Station/Facility, Compression, Valve;Pipeline, Valve, Plug, Seal/Packing",,,,,,,,,0,,,,,,,,,,,,,,,,,,No,Replacement,3/19/2012,No,,,No,No,3/19/2012,Replacement,No,-66.0275,1,0,0,0,0,0,1,0,0,0,0,1,0,0,0,0,0,0,0,0,0,0,0,0,0,0,0,0,0,1,0,0,0,1
375,INC2012-020,Serious Injury (CER or TSB),1/27/2012,Cheecham,NOVA Gas Transmission Ltd.,Closed,56.25495,0,Not Applicable,Not Applicable,Yes,2012,2012-01-25,2012/01/25 02:20:00 PM Mountain,,Transmission,Construction,Employee / Contractor (Onsite),10/23/2013,No,No,,,,No,,,,,Lost Consciousness,1,,Yes,,,0,OPR,CHEECHAM WEST CROSSOVER,508,14.04277652,Natural Gas Sweet,,,,,Canada,No,No,Yes,No,0,Legal Subdivision 4 84 6 W4,Level I,Standard Review - 168 days,No,,,,,,,,,,,,,,,,,,,,,,,,,,,,,No,,,No,,,No,No,,,No,-110.89551,0,1,0,0,0,0,0,0,0,0,0,1,0,0,0,0,0,0,0,0,0,0,0,0,0,0,0,0,0,1,0,0,0,1
376,INC2012-021,Release of Substance,2/3/2012,Shaunavon,Foothills Pipe Lines (Saskatchewan) Ltd.,Closed,49.78627,0,Natural Gas - Sweet,Gas,No,2012,,2012/02/02 11:00:00 AM Mountain,,,Maintenance,Employee / Contractor (Onsite),1/24/2014,Yes,No,Natural Gas - Sweet,0,No,No,,,,,,,,,,,0,OPR,Foothills - Valve Site 135,,,,,,,,Canada,No,No,Yes,No,0,Kilometer Post 135,Level I,Standard Review - 168 days,No,,"Station/Facility, Pigging, Launching, Fitting",,,,,,,,,,,,,,,,,,,,,,,,,,,No,,,No,,,No,No,,,No,-108.72239,1,0,0,0,1,0,0,0,0,0,0,1,0,0,0,0,0,0,0,0,0,0,0,0,0,0,0,0,0,2,0,0,0,1
377,INC2012-022,"Fire, Release of Substance",2/3/2012,Cheecham,NOVA Gas Transmission Ltd.,Closed,56.18776,0,Mixed HVP Hydrocarbons,Gas,No,2012,2012-01-28,2012/01/28 04:00:00 PM Mountain,,,Construction,Employee / Contractor (Onsite),10/28/2013,No,No,Mixed HVP Hydrocarbons,0,No,No,,Equipment & Electrical,,,,,,,,,0,OPR,CHEECHAM WEST CROSSOVER,508,14.04277652,Natural Gas Sweet,,,,,Canada,No,No,Yes,No,0,,Level I,Standard Review - 168 days,No,,,,,,,,,,,,,,,,,,,,,,,,,,,,,No,,,No,,,No,No,,,No,-110.86149,1,1,0,0,0,0,0,0,0,0,0,1,0,0,0,0,0,0,0,0,0,0,0,0,0,0,0,0,0,1,0,0,0,1
378,INC2012-023,Fire,2/6/2012,Thorndale,Enbridge Pipelines Inc.,Closed,43.14439,0,Not Applicable,Not Applicable,No,2012,,2012/02/06 09:05:00 PM Eastern,,,Operation,Employee / Contractor (Onsite),3/6/2014,Yes,No,,,,No,,Equipment & Electrical,,,,,,,,,0,OPR,EPI (Bryanston) pump station,,,,,,,,Canada,Yes,No,No,No,0,,Level I,Standard Review - 168 days,No,,"Station/Facility, Pumping, Auxiliary power unit",,,,,,,,,,,,,,,,,,,,,,,,,,,No,,,No,,,No,No,,,No,-81.21239,0,0,0,0,0,1,0,0,0,0,0,1,0,0,0,0,0,0,0,0,0,0,0,0,0,0,0,0,0,2,0,0,0,1
379,INC2012-024,Fire,2/7/2012,Burstall,Foothills Pipe Lines Ltd.,Closed,50.66225,0,Not Applicable,Not Applicable,No,2012,,2012/02/06 12:10:00 PM Mountain,,,Maintenance,Employee / Contractor (Onsite),10/31/2012,No,No,,,,No,,Other Event (Nature or 3rd Party),,,,,,,,,0,OPR,,,,,,,,,Canada,Yes,No,No,No,0,,Level I,Standard Review - 168 days,No,,,,,,,,,,,,,,,,,,,,,,,,,,,,,No,,,No,,,No,No,,,No,-110.01655,0,0,0,0,1,0,0,0,0,0,0,1,0,0,0,0,0,0,0,0,0,0,0,0,0,0,0,0,0,2,0,0,0,1
380,INC2012-026,Serious Injury (CER or TSB),2/9/2012,Chetwynd,"Westcoast Energy Inc., carrying on business as Spectra Energy Transmission",Closed,55.697588,0,Not Applicable,Not Applicable,Yes,2012,,2012/02/09 08:20:00 AM Mountain,,Transmission,Maintenance,Employee / Contractor (Onsite),2/11/2014,No,No,,,,No,,,,,Lost Consciousness,,,No,,,0,OPR,Grizzly Pipeline,"273.10000000, 508.00000000, 610.00000000",160.6451852,"Natural Gas Sour, Natural Gas Sweet",,,,,Canada,No,No,Yes,No,0,,Level I,Standard Review - 168 days,No,,,,,,,,,,,,,,,,,,,,,,,,,,,,,No,,,No,,,No,No,,,No,-121.629633,0,0,0,1,0,0,0,0,0,0,0,1,0,0,0,0,0,0,0,0,0,0,0,0,0,0,0,0,0,2,0,0,0,1
381,INC2012-027,Release of Substance,2/13/2012,Vermilion Bay,TransCanada PipeLines Limited,Closed,49.82818,0,Natural Gas - Sweet,Gas,No,2012,2012-02-12,2012/02/12 12:00:00 PM Mountain,,,Operation,Employee / Contractor (Onsite),1/15/2014,Yes,No,Natural Gas - Sweet,0,No,No,,,,,,,,,,,0,OPR,LINE 100-1,"508.00000000, 762.00000000, 863.60000000",2595.724534,Natural Gas,,,,,Canada,Yes,No,No,No,0,Mainline Valve + Offset (km) 52-1,Level I,Standard Review - 168 days,No,,"Station/Facility, Compression, Valve",,,,,,,,,,,,,,,,,,,,,,,,,,,No,,,No,,,No,No,,,No,-93.63726,1,0,0,0,0,1,0,0,0,0,0,1,0,0,0,0,0,0,0,0,0,0,0,0,0,0,0,0,0,2,0,0,0,1
382,INC2012-028,Release of Substance,2/13/2012,Vermilion Bay,TransCanada PipeLines Limited,Closed,49.82797,0,Natural Gas - Sweet,Gas,No,2012,2012-02-12,2012/02/12 12:00:00 PM Mountain,,,Operation,Employee / Contractor (Onsite),1/16/2014,Yes,No,Natural Gas - Sweet,0,No,No,,,,,,,,,,,0,OPR,LINE 100-1,"508.00000000, 762.00000000, 863.60000000",2595.724534,Natural Gas,,,,,Canada,Yes,No,No,No,0,Mainline Valve + Offset (km) 52-1,Level I,Standard Review - 168 days,No,,,,,,,,,,,,,,,,,,,,,,,,,,,,,No,,,No,,,No,No,,,No,-93.63666,1,0,0,0,0,1,0,0,0,0,0,1,0,0,0,0,0,0,0,0,0,0,0,0,0,0,0,0,0,2,0,0,0,1
383,INC2012-029,Release of Substance,2/15/2012,Fredericton,Maritimes & Northeast Pipeline Management Ltd.,Closed,45.895524,0,Natural Gas - Sweet,Gas,No,2012,2012-02-15,2012/02/15 01:40:00 PM Atlantic,,,Operation,Employee / Contractor (Onsite),11/1/2013,Yes,No,Natural Gas - Sweet,0,No,No,,,,,,,,,,,0,OPR,Mainline,"762.00000000, 863.60000000",574.8807991,Natural Gas,,,,,Canada,Yes,No,No,No,0,Mainline Valve + Offset (km),Level I,Standard Review - 168 days,No,,,,,,,,,,,,,,,,,,,,,,,,,,,,,No,,,No,,,No,No,,,No,-66.542645,1,0,0,0,0,0,1,0,0,0,0,1,0,0,0,0,0,0,0,0,0,0,0,0,0,0,0,0,0,2,0,0,0,1
384,INC2012-032,Release of Substance,2/21/2012,Haileybury,TransCanada PipeLines Limited,Closed,47.44682,0,Natural Gas - Sweet,Gas,No,2012,,2012/02/09 02:00:00 PM Mountain,,,Operation,Employee / Contractor (Onsite),5/14/2013,Yes,No,Natural Gas - Sweet,0,No,No,,,,,,,,,,,0,OPR,TCPL - Station 110 (Haileybury Compressor Station),,,,,,,,Canada,Yes,No,No,No,0,,Level I,Standard Review - 168 days,No,,"Station/Facility, Compression, Fitting",,,,,,,,,,,,,,,,,,,,,,,,,,,No,Replacement,2/9/2012,No,,,No,No,2/9/2012,Replacement,No,-79.76273,1,0,0,0,0,1,0,0,0,0,0,1,0,0,0,0,0,0,0,0,0,0,0,0,0,0,0,0,0,2,0,0,0,1
385,INC2012-031,Fire,2/16/2012,Nipigon,TransCanada PipeLines Limited,Closed,49.29549,0,Not Applicable,Not Applicable,No,2012,2012-02-15,2012/02/15 04:41:00 PM Mountain,,,Maintenance,Employee / Contractor (Onsite),5/17/2012,No,No,,,,No,,Housekeeping,,,,,,,,,0,OPR,,,,,,,,,Canada,Yes,No,No,No,0,,Level I,Standard Review - 168 days,No,,,,,,,,,,,,,,,,,,,,,,,,,,,,,No,,,No,,,No,No,,,No,-88.10056,0,0,0,0,0,1,0,0,0,0,0,1,0,0,0,0,0,0,0,0,0,0,0,0,0,0,0,0,0,2,0,0,0,1
386,INC2012-038,Release of Substance,2/29/2012,Athabasca,NOVA Gas Transmission Ltd.,Closed,54.64742,65,Natural Gas - Sweet,Gas,No,2012,2012-02-28,2012/02/28 11:00:00 AM Mountain,,,Operation,Employee / Contractor (Onsite),1/2/2013,Yes,No,Natural Gas - Sweet,65,No,No,,,,,,,,,,,0,OPR,,,,,,,,,Canada,No,No,Yes,No,3,Legal Subdivision,Level I,Standard Review - 168 days,No,,"Station/Facility, Metering, Delivering, Valve",,,,,,,,,,,,,,,,,,,,,,,,,,,No,Replacement,3/19/2012,No,,,No,No,3/19/2012,Replacement,No,-112.80015,1,1,0,0,0,0,0,0,0,0,0,1,0,0,0,0,0,0,0,0,0,0,0,0,0,0,0,0,0,2,0,0,0,1
387,INC2012-040,Release of Substance,3/1/2012,Brandon,TransCanada PipeLines Limited,Closed,50.07461,1400,Fuel Gas,Gas,No,2012,2012-02-27,2012/02/27 07:00:00 AM Mountain,,,Operation,Employee / Contractor (Onsite),10/10/2012,Yes,No,Fuel Gas,1400,No,No,,,,,,,,,,,0,OPR,TCPL - Station 30 (Rapid City Compressor Station),,,,,,,,Canada,Yes,No,No,No,3,Kilometer Post,Level I,Standard Review - 168 days,No,,"Station/Facility, Compression, Valve",,NPS 4,,,,,,,0,,,,,,,,,,,,,,,,,,No,Replacement,,No,,,No,No,,Replacement,No,-100.00038,1,0,1,0,0,0,0,0,0,0,0,1,0,0,0,0,0,0,0,0,0,0,0,0,0,0,0,0,0,2,0,0,0,1
388,INC2012-041,Release of Substance,3/2/2012,Spirit River,NOVA Gas Transmission Ltd.,Closed,55.7578,0,Natural Gas - Sweet,Gas,No,2012,2012-03-01,2012/03/01 03:00:00 PM Mountain,,,Operation,Employee / Contractor (Onsite),1/2/2013,Yes,No,Natural Gas - Sweet,0,No,No,,,,,,,,,,,0,OPR,NGTL - Belloy West Meter Station,,,,,,,,Canada,Yes,No,No,No,3,Legal Subdivision,Level I,Standard Review - 168 days,No,,"Station/Facility, Metering, Delivering, Piping",,,,,,,,,,,,,,,,,,,,,,,,,,,No,Replacement,3/2/2012,No,,,No,No,3/2/2012,Replacement,No,-118.30145,1,1,0,0,0,0,0,0,0,0,0,1,0,0,0,0,0,0,0,0,0,0,0,0,0,0,0,0,0,3,1,0,0,0
389,INC2012-044,Operation Beyond Design Limits,3/13/2012,Edmonton,Enbridge Pipelines Inc.,Closed,53.54727,0,Not Applicable,Not Applicable,No,2012,2012-03-13,2012/03/13 08:09:00 AM Mountain,,,Operation,Employee / Contractor (Onsite),10/22/2012,Yes,No,,,,No,,,,,,,,,Over Pressure,,0,OPR,Line 2,"1219.00000000, 609.40000000, 610.00000000",1282.304863,Crude Oil,,,,,Canada,Yes,No,No,No,0,,Level I,Standard Review - 168 days,No,,"Pipeline, Pipe, Body;Pipeline, Flange, Gasket/O-ring",CSA,NPS 24,Carbon Steel,,,,,,275,,,,0,,,,,,,,,,,,,,No,,,No,,,No,No,,,No,-113.35571,0,1,0,0,0,0,0,0,0,0,0,1,0,0,0,0,0,0,0,0,0,0,0,0,0,0,0,0,0,3,1,0,0,0
390,INC2012-045,Release of Substance,3/13/2012,Saint John,Maritimes & Northeast Pipeline Management Ltd.,Closed,45.274038,0,Natural Gas - Sweet,Gas,No,2012,2012-03-13,2012/03/13 03:25:00 PM Eastern,,,Operation,Employee / Contractor (Onsite),6/8/2012,Yes,No,Natural Gas - Sweet,0,No,No,,,,,,,,,,,0,OPR,MNE - Bayside Power Meter Station,,,,,,,,Canada,Yes,No,No,No,0,,Level I,Standard Review - 168 days,No,,,,,,,,,,,0,,,,,,,,,,,,,,,,,,No,,,No,,,No,No,,,No,-66.0275,1,0,0,0,0,0,1,0,0,0,0,1,0,0,0,0,0,0,0,0,0,0,0,0,0,0,0,0,0,3,1,0,0,0
391,INC2012-048,Release of Substance,3/29/2012,Whitburn,NOVA Gas Transmission Ltd.,Closed,55.81522,0,Natural Gas - Sweet,Gas,No,2012,2012-03-29,2012/03/29 11:30:00 AM Mountain,,,Construction,Employee / Contractor (Onsite),1/24/2014,Yes,No,Natural Gas - Sweet,0,No,No,,,,,,,,,,,0,OPR,NGTL - Saddle Hills Compressor Station,,,,,,,,Canada,Yes,No,No,No,0,Legal Subdivision SW5-79-9W6,Level I,Standard Review - 168 days,No,,,,,,,,,,,,,,,,,,,,,,,,,,,,,No,,,No,,,No,No,,,No,-119.36594,1,1,0,0,0,0,0,0,0,0,0,1,0,0,0,0,0,0,0,0,0,0,0,0,0,0,0,0,0,3,1,0,0,0
392,INC2012-049,Release of Substance,3/30/2012,Iroquois,TransCanada PipeLines Limited,Closed,44.88671,0,Natural Gas - Sweet,Gas,No,2012,2012-03-29,2012/03/29 03:00:00 PM Mountain,,,Operation,Employee / Contractor (Onsite),8/20/2012,Yes,No,Natural Gas - Sweet,0,No,No,,,,,,,,,,,0,OPR,,,,,,,,,Canada,Yes,No,No,No,0,,Level I,Standard Review - 168 days,No,,,,,,,,,,,,,,,,,,,,,,,,,,,,,No,,,No,,,No,No,,,No,-75.29431,1,0,0,0,0,1,0,0,0,0,0,1,0,0,0,0,0,0,0,0,0,0,0,0,0,0,0,0,0,3,1,0,0,0
393,INC2012-051,Release of Substance,4/13/2012,Saint John,Maritimes & Northeast Pipeline Management Ltd.,Closed,45.27614,0,Natural Gas - Sweet,Gas,No,2012,2012-04-13,2012/04/13 11:00:00 AM Atlantic,,,Operation,Employee / Contractor (Onsite),11/1/2013,Yes,No,Natural Gas - Sweet,,No,No,,,,,,,,,,,0,OPR,,,,,,,,,Canada,Yes,No,No,No,0,,Level I,Standard Review - 168 days,No,,,,,,,,,,,,,,,,,,,,,,,,,,,,,No,,,No,,,No,No,,,No,-66.02945,1,0,0,0,0,0,1,0,0,0,0,1,0,0,0,0,0,0,0,0,0,0,0,0,0,0,0,0,0,4,1,0,0,0
394,INC2012-053,Fire,4/23/2012,Edmonton,Enbridge Pipelines Inc.,Closed,53.54746,0,Not Applicable,Not Applicable,No,2012,2012-04-20,2012/04/20 08:00:00 AM Mountain,,,Maintenance,Employee / Contractor (Onsite),6/27/2012,No,No,,,,No,,Welding or Cutting,,,,,,,,,0,OPR,EPI - Edmonton Terminal,,,,,,,,Canada,No,No,No,Yes,5,,Level I,Standard Review - 168 days,No,,,,,,,,,,,,,,,,,,,,,,,,,,,,,No,,,No,,,No,No,,,No,-113.35569,0,1,0,0,0,0,0,0,0,0,0,1,0,0,0,0,0,0,0,0,0,0,0,0,0,0,0,0,0,4,1,0,0,0
395,INC2012-054,Operation Beyond Design Limits,4/23/2012,Toronto,Trans-Northern Pipelines Inc.,Closed,43.693367,0,Not Applicable,Not Applicable,No,2012,2012-04-19,2012/04/19 12:00:00 AM Mountain,,,Operation,Employee / Contractor (Onsite),3/26/2013,Yes,No,,,,No,,,,,,,,,Over Pressure,,0,OPR,,,,,,,,,Canada,No,No,Yes,No,5,,Level I,Standard Review - 168 days,No,"INC2015-002, INC2016-008","Pipeline, Valve, Pressure relief, Other (please explain)",,,,,,,,,0,,,,,,,,,,,,,,,,,,No,Replacement,4/19/2012,No,,,No,No,4/19/2012,Replacement,No,-79.609444,0,0,0,0,0,1,0,0,0,0,0,1,0,0,0,0,0,0,0,0,0,0,0,0,0,0,0,0,0,4,1,0,0,0
396,INC2012-056,Release of Substance,5/3/2012,Saint John,Maritimes & Northeast Pipeline Management Ltd.,Closed,45.23904,0,Natural Gas - Sweet,Gas,No,2012,2012-05-03,2012/05/03 02:10:00 PM Atlantic,,,Operation,Employee / Contractor (Onsite),11/5/2013,Yes,No,Natural Gas - Sweet,0,No,No,,,,,,,,,,,0,OPR,MNE - St. John Lateral Pressure Regulating Station,,,,,,,,Canada,Yes,No,No,No,0,,Level I,Standard Review - 168 days,No,,,,,,,,,,,,,,,,,,,,,,,,,,,,,No,,,No,,,No,No,,,No,-66.1031,1,0,0,0,0,0,1,0,0,0,0,1,0,0,0,0,0,0,0,0,0,0,0,0,0,0,0,0,0,5,1,0,0,0
397,INC2012-057,Fire,5/5/2012,Chetwynd,"Westcoast Energy Inc., carrying on business as Spectra Energy Transmission",Closed,55.64991,0,Not Applicable,Not Applicable,No,2012,2012-05-02,2012/05/02 11:10:00 AM Mountain,,,Operation,Employee / Contractor (Onsite),2/18/2014,Yes,No,,,,No,,Equipment & Electrical,,,,,,,,,0,OPR,WEI - Compressor Station 2,,,,,,,,Canada,Yes,No,No,No,3,,Level I,Standard Review - 168 days,No,,"Station/Facility, Compression, Fitting",,,,,,,,,,,,,,,,,,,,,,,,,,,No,,,No,,,No,No,,,No,-122.20723,0,0,0,1,0,0,0,0,0,0,0,1,0,0,0,0,0,0,0,0,0,0,0,0,0,0,0,0,0,5,1,0,0,0
398,INC2012-059,Release of Substance,5/8/2012,Grande Prairie,NOVA Gas Transmission Ltd.,Closed,54.830521,0,Natural Gas - Sweet,Gas,No,2012,2012-05-08,2012/05/08 12:20:00 PM Mountain,,,Maintenance,Employee / Contractor (Onsite),1/23/2014,Yes,No,Natural Gas - Sweet,0,No,Yes,,,,,,,,,,,0,OPR,,,,,,,,,Canada,No,No,Yes,No,0,,Level I,Standard Review - 168 days,No,,"Pipeline, Pipe, Body",,,,,,,,,,,,,,,,,,,,,,,,,,,No,Replacement,,No,,,No,No,,Replacement,No,-118.647866,1,1,0,0,0,0,0,0,0,0,0,1,0,0,0,0,0,0,0,0,0,0,0,0,0,0,0,0,0,5,1,0,0,0
399,INC2012-060,Release of Substance,5/9/2012,Saint John,Maritimes & Northeast Pipeline Management Ltd.,Closed,45.258307,0,Natural Gas - Sweet,Gas,No,2012,,2012/05/09 11:00:00 AM Atlantic,,,Operation,Employee / Contractor (Onsite),11/7/2013,Yes,No,Natural Gas - Sweet,0,No,No,,,,,,,,,,,0,OPR,MNe - Irving Tissue Meter Station,,,,,,,,Canada,Yes,No,No,No,0,,Level I,Standard Review - 168 days,No,,,,,,,,,,,,,,,,,,,,,,,,,,,,,No,,,No,,,No,No,,,No,-66.093651,1,0,0,0,0,0,1,0,0,0,0,1,0,0,0,0,0,0,0,0,0,0,0,0,0,0,0,0,0,5,1,0,0,0
400,INC2012-061,Release of Substance,5/9/2012,Valleyview,NOVA Gas Transmission Ltd.,Closed,55.16008,0,Natural Gas - Sweet,Gas,No,2012,,2012/05/02 12:00:00 AM Mountain,,,Operation,Employee / Contractor (Onsite),7/3/2013,Yes,No,Natural Gas - Sweet,0,No,No,,,,,,,,,,,0,OPR,,,,,,,,,Canada,No,No,Yes,No,0,,Level I,Standard Review - 168 days,No,,"Pipeline, Fitting, Tee, Body",,,,,,,,,,,,,,,,,,,,,,,,,,,No,Replacement,,No,,,No,No,,Replacement,No,-117.8411,1,1,0,0,0,0,0,0,0,0,0,1,0,0,0,0,0,0,0,0,0,0,0,0,0,0,0,0,0,5,1,0,0,0
401,INC2012-073,Release of Substance,6/13/2012,Nipigon,TransCanada PipeLines Limited,Closed,49.29567,0,Natural Gas - Sweet,Gas,No,2012,2012-06-13,2012/06/13 01:00:00 PM Mountain,,,Operation,Employee / Contractor (Onsite),2/5/2013,Yes,No,Natural Gas - Sweet,0,No,No,,,,,,,,,,,0,OPR,,,,,,,,,Canada,Yes,No,No,No,0,,Level I,Standard Review - 168 days,No,,"Station/Facility, Compression, Fitting, Other (please explain)",,NPS 3/8,,,,,,,0,,,,,,,,,,,,,,,,,,No,,,No,,,No,No,,,No,-88.10151,1,0,0,0,0,1,0,0,0,0,0,1,0,0,0,0,0,0,0,0,0,0,0,0,0,0,0,0,0,6,0,1,0,0
402,INC2012-062,Fire,5/14/2012,Glenavon,Enbridge Pipelines Inc.,Closed,50.18704,0,Not Applicable,Not Applicable,No,2012,2012-05-13,2012/05/13 08:33:00 AM Central,,,Operation,Employee / Contractor (Onsite),1/28/2014,No,No,,,,No,,Welding or Cutting,,,,,,,,,0,OPR,,,,,,,,,Canada,Yes,No,No,No,0,Mile Post 504,Level I,Standard Review - 168 days,No,,,,,,,,,,,,,,,,,,,,,,,,,,,,,No,,,No,,,No,No,,,No,-103.17201,0,0,0,0,1,0,0,0,0,0,0,1,0,0,0,0,0,0,0,0,0,0,0,0,0,0,0,0,0,5,1,0,0,0
403,INC2012-063,Release of Substance,5/14/2012,Matheson,TransCanada PipeLines Limited,Closed,48.41782,200,Natural Gas - Sweet,Gas,No,2012,2012-05-13,2012/05/13 11:30:00 AM Eastern,,,Operation,Employee / Contractor (Onsite),7/26/2012,Yes,No,Natural Gas - Sweet,200,No,No,,,,,,,,,,,0,OPR,LINE 100-1,"508.00000000, 762.00000000, 863.60000000",2595.724534,Natural Gas,,,,,Canada,Yes,No,No,No,3,,Level I,Standard Review - 168 days,No,,"Station/Facility, Compression, Valve, Pressure relief, Diaphragm;Station/Facility, Compression, Valve, Pressure relief, Flange, Gasket/O-ring;Station/Facility, Compression, Valve, Pressure relief, Seal/Packing",,,,,,,,,0,,,,,,,,,,,,,,,,,,No,Replacement,6/8/2012,No,,,No,No,6/8/2012,Replacement,No,-80.33662,1,0,0,0,0,1,0,0,0,0,0,1,0,0,0,0,0,0,0,0,0,0,0,0,0,0,0,0,0,5,1,0,0,0
404,INC2012-064,Release of Substance,5/15/2012,Medicine Hat,NOVA Gas Transmission Ltd.,Closed,50.08985,0,Natural Gas - Sweet,Gas,No,2012,2012-05-14,2012/05/14 02:00:00 PM Mountain,,,Operation,Employee / Contractor (Onsite),7/9/2012,Yes,No,Natural Gas - Sweet,0,No,No,,,,,,,,,,,0,OPR,,,,,,,,,Canada,Yes,No,No,No,0,Legal Subdivision 14-13-6 W4M,Level I,Standard Review - 168 days,No,,"Station/Facility, Metering, Delivering, Valve",,,,,,,,,,,,,,,,,,,,,,,,,,,No,Replacement,5/15/2012,No,,,No,No,5/15/2012,Replacement,No,-110.72397,1,1,0,0,0,0,0,0,0,0,0,1,0,0,0,0,0,0,0,0,0,0,0,0,0,0,0,0,0,5,1,0,0,0
405,INC2012-065,Release of Substance,5/16/2012,Mattice,TransCanada PipeLines Limited,Closed,49.58892,0,Natural Gas - Sweet,Gas,No,2012,2012-05-16,2012/05/16 09:15:00 AM Eastern,,Transmission,Operation,Employee / Contractor (Onsite),7/26/2012,No,No,Natural Gas - Sweet,0,No,No,,,,,,,,,,,0,OPR,,,,,,,,,Canada,Yes,No,No,No,0,,Level I,Standard Review - 168 days,No,,"Station/Facility, Compression, Fitting",,NPS 3/8,Stainless Steel,,,,,,0,,,,,,,,,,,,,,,,,,No,Replacement,5/16/2012,No,,,No,No,5/16/2012,Replacement,No,-83.16656,1,0,0,0,0,1,0,0,0,0,0,1,0,0,0,0,0,0,0,0,0,0,0,0,0,0,0,0,0,5,1,0,0,0
406,INC2012-067,Fire,5/28/2012,Fox Creek,NOVA Gas Transmission Ltd.,Closed,54.34678,0,Not Applicable,Not Applicable,No,2012,2012-05-27,2012/05/27 06:30:00 PM Mountain,,,Operation,Employee / Contractor (Onsite),1/16/2014,Yes,No,,,,No,,Other Event (Nature or 3rd Party),,,,,,,,,0,OPR,NGTL - Kaybob South #3 Meter Station,,,,,,,,Canada,Yes,No,No,No,0,Legal Subdivision 5-12-062-20 W5,Level I,Standard Review - 168 days,No,,,,,,,,,,,,,,,,,,,,,,,,,,,,,No,,,No,,,No,No,,,No,-116.87308,0,1,0,0,0,0,0,0,0,0,1,1,0,0,0,0,0,0,0,0,0,0,0,0,0,0,1,0,0,5,1,0,0,0
407,INC2012-068,Release of Substance,5/30/2012,Manning,NOVA Gas Transmission Ltd.,Closed,57.36666,0,Natural Gas - Sweet,Gas,No,2012,2012-05-29,2012/05/29 04:30:00 PM Mountain,,,Operation,Employee / Contractor (Onsite),1/24/2014,Yes,No,Natural Gas - Sweet,,No,No,,,,,,,,,,,0,OPR,,,,,,,,,Canada,No,No,Yes,No,0,Legal Subdivision 3-32-96-11 W6,Level I,Standard Review - 168 days,No,,"Pipeline, Valve, Ball, Body",,,,,,,,,,,,,,,,,,,,,,,,,,,No,Replacement,,No,,,No,No,,Replacement,No,-119.75241,1,1,0,0,0,0,0,0,0,0,0,1,0,0,0,0,0,0,0,0,0,0,0,0,0,0,0,0,0,5,1,0,0,0
408,INC2012-069,Operation Beyond Design Limits,5/31/2012,Edson,NOVA Gas Transmission Ltd.,Closed,53.96051,0,Not Applicable,Not Applicable,No,2012,2012-05-31,2012/05/31 07:00:00 AM Mountain,,,Operation,Employee / Contractor (Onsite),1/24/2014,No,No,,,,No,,,,,,,,,Inappropriate Product,,0,OPR,,,,,,,,,Canada,Yes,No,No,No,0,Legal Subdivision 15-28-57-17 W5,Level I,Standard Review - 168 days,No,,,,,,,,,,,,,,,,,,,,,,,,,,,,,No,,,No,,,No,No,,,No,-116.46002,0,1,0,0,0,0,0,0,0,0,0,1,0,0,0,0,0,0,0,0,0,0,0,0,0,0,0,0,0,5,1,0,0,0
409,INC2012-070,Serious Injury (CER or TSB),6/6/2012,Dawson Creek,"Westcoast Energy Inc., carrying on business as Spectra Energy Transmission",Closed,55.81403,0,Not Applicable,Not Applicable,Yes,2012,2012-06-05,2012/06/05 12:00:00 AM Pacific,,Transmission,Construction,Employee / Contractor (Onsite),2/10/2014,No,No,,,,No,,,,,Fracture,,,No,,,0,OPR,,,,,,,,,Canada,Yes,No,No,No,0,,Level I,Standard Review - 168 days,No,,,,,,,,,,,,,,,,,,,,,,,,,,,,,No,,,No,,,No,No,,,No,-120.86935,0,0,0,1,0,0,0,0,0,0,0,1,0,0,0,0,0,0,0,0,0,0,0,0,0,0,0,0,0,6,0,1,0,0
410,INC2012-071,Fire,6/8/2012,Oshawa,TransCanada PipeLines Limited,Closed,43.95785704,0,Not Applicable,Not Applicable,No,2012,2012-06-08,2012/06/08 08:15:00 AM Eastern,,,Operation,Employee / Contractor (Onsite),1/22/2015,Yes,No,,,,No,,Equipment & Electrical,,,,,,,,,0,OPR,LINE 100-1,"508.00000000, 762.00000000, 863.60000000",2595.724534,Natural Gas,BOWMANVILLE,,43.95785704,-78.60959252,Canada,Yes,No,No,No,0,,Level I,Standard Review - 168 days,No,,,,,,,,,,,,,,,,,,,,,,,,,,,,,No,,,No,,,No,No,,,No,-78.60959252,0,0,0,0,0,1,0,0,0,0,0,1,0,0,0,0,0,0,0,0,0,0,0,0,0,0,0,0,0,6,0,1,0,0
411,INC2012-072,Fire,6/8/2012,Hardisty,TransCanada Keystone Pipeline GP Ltd.,Closed,52.65396,0,Not Applicable,Not Applicable,No,2012,2012-06-08,2012/06/08 04:00:00 PM Mountain,,,Construction,Employee / Contractor (Onsite),2/10/2014,No,No,,,,No,,Welding or Cutting,,,,,,,,,0,OPR,,,,,,,,,Canada,Yes,No,No,No,0,,Level I,Standard Review - 168 days,No,,,,,,,,,,,,,,,,,,,,,,,,,,,,,No,,,No,,,No,No,,,No,-111.26847,0,1,0,0,0,0,0,0,0,0,0,1,0,0,0,0,0,0,0,0,0,0,0,0,0,0,0,0,0,6,0,1,0,0
412,INC2012-074,Release of Substance,6/15/2012,Port Elgin,Maritimes & Northeast Pipeline Management Ltd.,Closed,45.98763,0,Natural Gas - Sweet,Gas,No,2012,,2012/06/06 12:00:00 AM Mountain,,,Operation,Employee / Contractor (Onsite),1/3/2013,Yes,No,Natural Gas - Sweet,0,No,No,,,,,,,,,,,0,OPR,Mainline,"762.00000000, 863.60000000",574.8807991,Natural Gas,,,,,Canada,Yes,No,No,No,0,,Level I,Standard Review - 168 days,No,,"Station/Facility, Metering, Delivering, Fitting, Plug, Thread",,NPS 1/2,,,,,,,0,,,,,,,,,,,,,,,,,,No,,,No,,,No,No,,,No,-64.14375,1,0,0,0,0,0,1,0,0,0,0,1,0,0,0,0,0,0,0,0,0,0,0,0,0,0,0,0,0,6,0,1,0,0
413,INC2012-075,Release of Substance,6/15/2012,Fredericton,Maritimes & Northeast Pipeline Management Ltd.,Closed,45.98763,0,Natural Gas - Sweet,Gas,No,2012,2012-06-15,2012/06/15 03:15:00 AM Mountain,,,Operation,Employee / Contractor (Onsite),1/3/2013,Yes,No,Natural Gas - Sweet,0,No,No,,,,,,,,,,,0,OPR,Mainline,"762.00000000, 863.60000000",574.8807991,Natural Gas,,,,,Canada,Yes,No,No,No,0,,Level I,Standard Review - 168 days,No,,"Station/Facility, Metering, Delivering, Fitting, Plug, Body",,,,,,,,,,,,,,,,,,,,,,,,,,,No,,,No,,,No,No,,,No,-64.14375,1,0,0,0,0,0,1,0,0,0,0,1,0,0,0,0,0,0,0,0,0,0,0,0,0,0,0,0,0,6,0,1,0,0
414,INC2012-078,"Serious Injury (CER or TSB), Fire, Release of Substance",6/23/2012,Hudson's Hope,"Westcoast Energy Inc., carrying on business as Spectra Energy Transmission",Closed,56.4714,0,Natural Gas - Sweet,Gas,Yes,2012,2012-06-23,2012/06/23 12:00:00 AM Pacific,,Transmission,Maintenance,Employee / Contractor (Onsite),2/11/2014,Yes,No,Natural Gas - Sweet,0,No,No,,Under Investigation or Unknown,,,Burns,,,No,,,0,OPR,WEI - Compressor Station N4,,,,,,,,Canada,Yes,No,No,No,0,,Level III,Category C,No,,"Station/Facility, Compression, Valve, Ball, Seal/Packing;Station/Facility, Compression, Valve, Ball, Stem",,,,,,,,,,,,,,,,,,,,,,,,,,,No,,,No,,,No,No,,,No,-122.11376,1,0,0,1,0,0,0,0,0,0,0,1,0,0,0,0,0,0,0,0,0,0,0,0,0,0,0,0,0,6,0,1,0,0
415,INC2012-079,Release of Substance,6/27/2012,New Harbour,ExxonMobil Canada Properties,Closed,45.17195,0,Condensate,Liquid,No,2012,,2012/06/27 11:10:00 AM Atlantic,,,Operation,,8/27/2012,Yes,No,Condensate,0,No,No,,,,,,,,,,,0,PPR,,,,,,,,,Canada,Yes,No,No,No,0,,Level I,Standard Review - 168 days,No,,"Processing Plant, Inlet",,,,,,,,,,,,,,,,,,,,,,,,,,,No,,,No,,,No,No,,,No,-61.61551,1,0,0,0,0,0,0,1,0,0,0,1,0,0,0,0,0,0,0,0,0,0,0,0,0,0,0,0,0,6,0,1,0,0
416,INC2012-086,Release of Substance,7/11/2012,Grande Prairie,NOVA Gas Transmission Ltd.,Closed,54.83015,5,Natural Gas - Sweet,Gas,No,2012,,2012/07/10 11:50:00 AM Mountain,,,Maintenance,Employee / Contractor (Onsite),2/10/2014,Yes,No,Natural Gas - Sweet,5,No,No,,,,,,,,,,,0,OPR,NGTL - Gold Creek Compressor Station,,,,,,,,Canada,Yes,No,No,No,0,,Level I,Standard Review - 168 days,No,,"Station/Facility, Compression, Pipe",,,,,,,,,,,,,,,,,,,,,,,,,,,No,,,No,,,No,No,,,No,-118.64728,1,1,0,0,0,0,0,0,0,0,0,1,0,0,0,0,0,0,0,0,0,0,0,0,0,0,0,0,0,7,0,1,0,0
417,INC2012-080,Explosion,6/28/2012,Fort McMurray,NOVA Gas Transmission Ltd.,Closed,56.46368,0,Not Applicable,Not Applicable,No,2012,2012-06-27,2012/06/27 05:00:00 PM Mountain,,,Operation,Employee / Contractor (Onsite),2/20/2014,Yes,No,,,,No,Battery Explosion,,,,,,,,,,0,OPR,NGTL - Buffalo Creek Compressor Station,,,,,,,,Canada,Yes,No,No,No,0,,Level I,Standard Review - 168 days,No,,"Station/Facility, Compression, Auxiliary power unit",,,,,,,,,,,,,,,,,,,,,,,,,,,No,,,No,,,No,No,,,No,-112.84413,0,1,0,0,0,0,0,0,0,0,0,1,0,0,0,0,0,0,0,0,0,0,0,0,0,0,0,0,0,6,0,1,0,0
418,INC2012-081,"Fire, Release of Substance",6/29/2012,Wonowon,"Westcoast Energy Inc., carrying on business as Spectra Energy Transmission",Closed,57.06925,955000,Natural Gas - Sweet,Gas,Yes,2012,2012-06-28,2012/06/28 10:57:00 PM Mountain,,,Operation,Employee / Contractor (Onsite),3/5/2014,Yes,Yes,Natural Gas - Sweet,955000,Yes,No,,Under Investigation or Unknown,,,,,,,,,0,OPR,"16"" Nig Creek Pipeline",406.4,44.85426204,Natural Gas Sour,,,,,Canada,No,No,Yes,Yes,0,,Level III,Category C,Yes,,"Pipeline, Pipe, Body",,,,,,,,,,,,,,,,,,,,,,,,,,,No,,,No,,,No,No,,,No,-121.63939,1,0,0,1,0,0,0,0,0,0,0,1,0,0,0,0,0,0,0,0,0,0,0,0,0,0,0,0,0,6,0,1,0,0
419,INC2012-082,Release of Substance,6/29/2012,Charlie Lake,"Westcoast Energy Inc., carrying on business as Spectra Energy Transmission",Closed,56.27789,0,Natural Gas - Sour,Gas,Yes,2012,,2012/06/29 01:45:00 AM Pacific,,,Operation,Employee / Contractor (Onsite),2/20/2014,Yes,No,Natural Gas - Sour,0,No,No,,,,,,,,,,,0,OPR,,,,,,,,,Canada,No,No,Yes,No,0,Mile Post 20.5,Level I,Standard Review - 168 days,No,,"Pipeline, Valve, Check, Seal/Packing",,,,,,,,,,,,,,,,,,,,,,,,,,,No,,,No,,,No,No,,,No,-120.97802,1,0,0,1,0,0,0,0,0,0,0,1,0,0,0,0,0,0,0,0,0,0,0,0,0,0,0,0,0,6,0,1,0,0
420,INC2012-083,Explosion,7/4/2012,Paddle Prairie,TransCanada PipeLines Limited,Closed,57.87538,0,Not Applicable,Not Applicable,No,2012,2012-07-03,2012/07/03 08:40:00 PM Mountain,,,Operation,Employee / Contractor (Onsite),2/20/2014,Yes,No,,,,No,,,,,,,,,,,0,OPR,Dryden creek Compressor Station,,,,,,,,Canada,Yes,No,No,No,3,Legal Subdivision SE 28-102-03 W6M,Level I,Standard Review - 168 days,No,,"Station/Facility, Compression, Auxiliary power unit",,,,,,,,,,,,,,,,,,,,,,,,,,,No,,,No,,,No,No,,,No,-118.41276,0,1,0,0,0,0,0,0,0,0,0,1,0,0,0,0,0,0,0,0,0,0,0,0,0,0,0,0,0,7,0,1,0,0
421,INC2012-084,Explosion,7/4/2012,Fox Creek,NOVA Gas Transmission Ltd.,Closed,54.34676,0,Not Applicable,Not Applicable,No,2012,2012-07-04,2012/07/04 12:30:00 PM Mountain,,,Operation,Employee / Contractor (Onsite),2/20/2014,Yes,No,,,,No,Battery Explosion,,,,,,,,,,0,OPR,NGTL - Kaybob South #3 Meter Station,,,,,,,,Canada,Yes,No,No,No,0,Kilometer Post,Level I,Standard Review - 168 days,No,,"Station/Facility, Metering, Delivering, Auxiliary power unit",,,,,,,,,,,,,,,,,,,,,,,,,,,No,,,No,,,No,No,,,No,-116.87305,0,1,0,0,0,0,0,0,0,0,0,1,0,0,0,0,0,0,0,0,0,0,0,0,0,0,0,0,0,7,0,1,0,0
422,INC2012-088,Fire,2/2/2012,Rocky Mountain House,NOVA Gas Transmission Ltd.,Closed,52.50498,0,Not Applicable,Not Applicable,No,2012,2012-02-01,2012/02/01 01:30:00 PM Mountain,,,Maintenance,Employee / Contractor (Onsite),10/10/2012,No,No,,,,No,,Other Event (Nature or 3rd Party),,,,,,,,,0,OPR,,,,,,,,,Canada,No,No,Yes,No,0,Legal Subdivision NW 02-041-11 W5M,Level I,Standard Review - 168 days,No,,,,,,,,,,,,,,,,,,,,,,,,,,,,,No,,,No,,,No,No,,,No,-115.48418,0,1,0,0,0,0,0,0,0,0,0,1,0,0,0,0,0,0,0,0,0,0,0,0,0,0,0,0,0,2,0,0,0,1
423,INC2012-089,"Release of Substance, Adverse Environmental Effects",7/14/2012,Taylor,"Westcoast Energy Inc., carrying on business as Spectra Energy Transmission",Closed,56.14632,0,Sulphur Dioxide,Miscellaneous,Yes,2012,2012-06-29,2012/06/29 08:00:00 AM Mountain,,,Maintenance,,1/24/2014,Yes,No,Sulphur Dioxide,0,No,No,,,,,,,,,,,0,PPR,WEI - McMahon Gas Plant (Taylor Gas Plant),,,,,,,,Canada,No,No,No,No,0,,Level I,Standard Review - 168 days,No,,,,,,,,,,,,,,,,,,,,,,,,,,,,,No,,,No,,,No,No,,,No,-120.66908,1,0,0,1,0,0,0,0,0,0,0,1,0,0,0,0,0,0,0,0,0,0,0,0,0,0,0,0,0,6,0,1,0,0
424,INC2012-090,Explosion,7/16/2012,Manning,NOVA Gas Transmission Ltd.,Closed,57.36127,0,Not Applicable,Not Applicable,No,2012,2012-07-14,2012/07/14 02:20:00 PM Mountain,,,Operation,Employee / Contractor (Onsite),2/25/2014,Yes,No,,,,No,,,,,,,,,,,0,OPR,NGTL - Tanghe Creek Meter Station,,,,,,,,Canada,Yes,No,No,No,0,Legal Subdivision 11-29-96-11W6M,Level I,Standard Review - 168 days,No,,"Station/Facility, Metering, Delivering, Auxiliary power unit",,,,,,,,,,,,,,,,,,,,,,,,,,,No,,,No,,,No,No,,,No,-119.75155,0,1,0,0,0,0,0,0,0,0,0,1,0,0,0,0,0,0,0,0,0,0,0,0,0,0,0,0,0,7,0,1,0,0
425,INC2012-091,Release of Substance,7/18/2012,Grenfell,TransCanada PipeLines Limited,Closed,50.28593,0,Natural Gas - Sweet,Gas,No,2012,2012-07-18,2012/07/18 05:25:00 AM Mountain,,,Operation,Employee / Contractor (Onsite),2/25/2014,Yes,No,Natural Gas - Sweet,0,No,No,,,,,,,,,,,0,OPR,,,,,,,,,Canada,Yes,No,No,No,0,,Level I,Standard Review - 168 days,No,,"Station/Facility, Compression, Auxiliary power unit",,,,,,,,,,,,,,,,,,,,,,,,,,,No,,,No,,,No,No,,,No,-102.95152,1,0,0,0,1,0,0,0,0,0,0,1,0,0,0,0,0,0,0,0,0,0,0,0,0,0,0,0,0,7,0,1,0,0
426,INC2012-092,Release of Substance,7/16/2012,Edmundston,Twin Rivers Paper Company Inc.,Closed,47.35983,10,Pulp slurry,Miscellaneous,No,2012,,2012/07/16 02:15:00 PM Eastern,,,Operation,,1/23/2017,No,No,Pulp slurry,10,Yes,No,,,,,,,,,,,0,OPR,,,,,,,,,Canada,Yes,No,No,No,0,,Level I,Standard Review - 168 days,No,,,,,,,,,,,,,,,,,,,,,,,,,,,,,No,,,No,,,No,No,,,No,-68.32515,1,0,0,0,0,0,1,0,0,0,0,1,0,0,0,0,0,0,0,0,0,0,0,0,0,0,0,0,0,7,0,1,0,0
427,INC2012-093,Explosion,7/26/2012,Lodgepole,NOVA Gas Transmission Ltd.,Closed,53.03778,0,Not Applicable,Not Applicable,No,2012,,2012/07/26 10:00:00 AM Mountain,,,Operation,Employee / Contractor (Onsite),2/25/2014,Yes,No,,,,No,Battery Explosion,,,,,,,,,,0,OPR,NGTL - Boggy Hall Meter Sation,,,,,,,,Canada,Yes,No,No,No,0,Legal Subdivision 8-8-47-9 W5M,Level I,Standard Review - 168 days,No,,"Station/Facility, Metering, Delivering, Auxiliary power unit",,,,,,,,,,,,,,,,,,,,,,,,,,,No,,,No,,,No,No,,,No,-115.27248,0,1,0,0,0,0,0,0,0,0,0,1,0,0,0,0,0,0,0,0,0,0,0,0,0,0,0,0,0,7,0,1,0,0
428,INC2012-095,Explosion,7/27/2012,Regina,TransCanada PipeLines Limited,Closed,50.40093,0,Not Applicable,Not Applicable,No,2012,,2012/07/26 04:10:00 PM Mountain,,,Operation,Employee / Contractor (Onsite),2/25/2014,Yes,No,,,,No,Battery Explosion,,,,,,,,,,0,OPR,TCPL -  Grand Coulee Receipt Meter Station,,,,,,,,Canada,Yes,No,No,No,0,,Level I,Standard Review - 168 days,No,,"Station/Facility, Metering, Delivering, Auxiliary power unit",,,,,,,,,,,,,,,,,,,,,,,,,,,No,,,No,,,No,No,,,No,-104.77915,0,0,0,0,1,0,0,0,0,0,0,1,0,0,0,0,0,0,0,0,0,0,0,0,0,0,0,0,0,7,0,1,0,0
429,INC2012-097,Fire,7/31/2012,Ignace,TransCanada PipeLines Limited,Closed,49.48156,0,Not Applicable,Not Applicable,No,2012,2012-07-31,2012/07/31 10:30:00 AM Eastern,,,Operation,Employee / Contractor (Onsite),5/14/2013,Yes,No,,,,No,,Equipment & Electrical,,,,,,,,,0,OPR,TCPL - Station 58 (Ignace Compressor Station),,,,,,,,Canada,Yes,No,No,No,0,,Level I,Standard Review - 168 days,No,,"Station/Facility, Compression, Valve",,,,,,,,,,,,,,,,,,,,,,,,,,,No,Rebuilt,7/31/2012,No,,,No,No,7/31/2012,Repair,No,-91.95934,0,0,0,0,0,1,0,0,0,0,0,1,0,0,0,0,0,0,0,0,0,0,0,0,0,0,0,0,0,7,0,1,0,0
430,INC2012-098,Release of Substance,8/1/2012,Douglastown,TransCanada PipeLines Limited,Closed,43.00477,100,Natural Gas - Sweet,Gas,No,2012,2012-07-31,2012/07/31 02:00:00 PM Eastern,,,Operation,Employee / Contractor (Onsite),7/2/2013,Yes,No,Natural Gas - Sweet,100,No,No,,,,,,,,,,,0,OPR,TCPL - Station 1703 (Douglastown Compressor Stn),,,,,,,,Canada,Yes,No,No,No,0,,Level I,Standard Review - 168 days,No,,"Station/Facility, Compression, Valve",,,,,,,,,,,,,,,,,,,,,,,,,,,No,Replacement,,No,,,No,No,,Replacement,No,-79.05065,1,0,0,0,0,1,0,0,0,0,0,1,0,0,0,0,0,0,0,0,0,0,0,0,0,0,0,0,0,7,0,1,0,0
431,INC2012-099,Release of Substance,8/3/2012,Saint John,Emera Brunswick Pipeline Company Ltd.,Closed,45.27916,0,Natural Gas - Sweet,Gas,No,2012,,2012/08/03 10:00:00 AM Mountain,,,Operation,Employee / Contractor (Onsite),11/13/2013,Yes,No,Natural Gas - Sweet,0,No,No,,,,,,,,,,,0,OPR,Emera - MLV 20,,,,,,,,Canada,No,No,Yes,No,0,Mainline Valve + Offset (km),Level I,Standard Review - 168 days,No,,,,,,,,,,,,,,,,,,,,,,,,,,,,,No,,,No,,,No,No,,,No,-66.09058,1,0,0,0,0,0,1,0,0,0,0,1,0,0,0,0,0,0,0,0,0,0,0,0,0,0,0,0,0,8,0,1,0,0
432,INC2012-100,Release of Substance,8/7/2012,Lincoln,Maritimes & Northeast Pipeline Management Ltd.,Closed,45.88692,0,Natural Gas - Sweet,Gas,No,2012,2012-08-07,2012/08/07 09:00:00 AM Atlantic,,,Maintenance,Employee / Contractor (Onsite),2/1/2013,Yes,No,Natural Gas - Sweet,0,No,No,,,,,,,,,,,0,OPR,MNE - Fredericton Meter Station,,,,,,,,Canada,Yes,No,No,No,0,,Level I,Standard Review - 168 days,No,,"Station/Facility, Metering, Delivering, Fitting",,,,,,,,,,,,,,,,,,,,,,,,,,,No,,,No,,,No,No,,,No,-66.5514,1,0,0,0,0,0,1,0,0,0,0,1,0,0,0,0,0,0,0,0,0,0,0,0,0,0,0,0,0,8,0,1,0,0
433,INC2012-101,Fire,8/9/2012,Kerrobert,Enbridge Pipelines Inc.,Closed,51.86562,0,Not Applicable,Not Applicable,No,2012,2012-08-09,2012/08/09 08:30:00 AM Mountain,,,Operation,Employee / Contractor (Onsite),1/28/2014,No,No,,,,No,,Equipment & Electrical,,,,,,,,,0,OPR,EPI - Kerrobert Terminal,,,,,,,,Canada,Yes,No,No,No,0,Mile Post,Level I,Standard Review - 168 days,No,,"Station/Facility, Pumping, Auxiliary device(s) (please explain)",,,,,,,,,,,,,,,,,,,,,,,,,,,No,,,No,,,No,No,,,No,-109.02627,0,0,0,0,1,0,0,0,0,0,0,1,0,0,0,0,0,0,0,0,0,0,0,0,0,0,0,0,0,8,0,1,0,0
434,INC2012-106,Fire,8/16/2012,Rainbow Lake,NOVA Gas Transmission Ltd.,Closed,58.48217,0,Not Applicable,Not Applicable,No,2012,2012-08-15,2012/08/15 11:30:00 AM Mountain,,,Construction,Employee / Contractor (Onsite),3/5/2014,No,No,,,,No,,Welding or Cutting,,,,,,,,,0,OPR,,,,,,,,,Canada,Yes,No,No,No,3,Legal Subdivision NW-3-109-12-W6,Level I,Standard Review - 168 days,No,,"Station/Facility, Compression, Pipe",,,,,,,,,,,,,,,,,,,,,,,,,,,No,,,No,,,No,No,,,No,-119.92404,0,1,0,0,0,0,0,0,0,0,0,1,0,0,0,0,0,0,0,0,0,0,0,0,0,0,0,0,0,8,0,1,0,0
435,INC2012-107,Release of Substance,8/20/2012,Saint John,Maritimes & Northeast Pipeline Management Ltd.,Closed,45.23904,0,Natural Gas - Sweet,Gas,No,2012,2012-08-20,2012/08/20 02:00:00 PM Atlantic,,,Operation,Employee / Contractor (Onsite),11/18/2013,Yes,No,Natural Gas - Sweet,0,No,No,,,,,,,,,,,0,OPR,,,,,,,,,Canada,Yes,No,No,No,6,Legal Subdivision,Level I,Standard Review - 168 days,No,,,,,,,,,,,,,,,,,,,,,,,,,,,,,No,,,No,,,No,No,,,No,-66.1032,1,0,0,0,0,0,1,0,0,0,0,1,0,0,0,0,0,0,0,0,0,0,0,0,0,0,0,0,0,8,0,1,0,0
436,INC2012-109,Release of Substance,8/21/2012,Jellicoe,TransCanada PipeLines Limited,Closed,49.69204,0,Natural Gas - Sweet,Gas,No,2012,2012-08-21,2012/08/21 07:48:00 AM Mountain,,,Operation,Employee / Contractor (Onsite),2/4/2013,Yes,No,Natural Gas - Sweet,0,No,No,,,,,,,,,,,0,OPR,,,,,,,,,Canada,No,No,Yes,No,3,Mainline Valve + Offset (km) 78.1 +5.7,Level I,Standard Review - 168 days,No,,"Pipeline, Pipe, Body",,,,,,,,,,,,,,,,,,,,,,,,,,,No,,,No,,,No,No,,,No,-87.24486,1,0,0,0,0,1,0,0,0,0,0,1,0,0,0,0,0,0,0,0,0,0,0,0,0,0,0,0,0,8,0,1,0,0
437,INC2012-110,Fire,8/21/2012,Regina,Enbridge Pipelines Inc.,Closed,51.58466,0,Not Applicable,Not Applicable,No,2012,2012-08-21,2012/08/21 06:00:00 PM Central,,,Operation,Employee / Contractor (Onsite),1/28/2014,No,No,,,,No,,Other Event (Nature or 3rd Party),,,,,,,,,0,OPR,,,,,,,,,Canada,No,No,Yes,No,6,Kilometer Post 436.5,Level I,Standard Review - 168 days,No,,,,,,,,,,,,,,,,,,,,,,,,,,,,,No,,,No,,,No,No,,,No,-107.91601,0,0,0,0,1,0,0,0,0,0,1,1,0,0,0,0,0,0,0,0,0,0,0,0,0,0,0,0,0,8,0,1,0,0
438,INC2012-111,Release of Substance,8/22/2012,Airdrie,TransCanada PipeLines Limited,Closed,51.40776,34.9,Natural Gas - Sweet,Gas,No,2012,2012-08-22,2012/08/22 02:31:00 PM Mountain,,,Operation,Employee / Contractor (Onsite),1/28/2014,Yes,No,Natural Gas - Sweet,34.9,No,No,,,,,,,,,,,0,OPR,,,,,,,,,Canada,Yes,No,No,No,6,Legal Subdivision 19-28-26-W4,Level I,Standard Review - 168 days,No,,"Station/Facility, Compression, Auxiliary power unit",,,,,,,,,,,,,,,,,,,,,,,,,,,No,,,No,,,No,No,,,No,-113.65548,1,1,0,0,0,0,0,0,0,0,0,1,0,0,0,0,0,0,0,0,0,0,0,0,0,0,0,0,0,8,0,1,0,0
439,INC2012-112,Fire,8/23/2012,Cabri,TransCanada PipeLines Limited,Closed,50.5882,0,Not Applicable,Not Applicable,No,2012,2012-08-22,2012/08/22 01:45:00 PM Mountain,,,Operation,Employee / Contractor (Onsite),1/24/2014,No,No,,,,No,,Other Event (Nature or 3rd Party),,,,,,,,,0,OPR,,,,,,,,,Canada,No,No,Yes,No,4,Mainline Valve + Offset (km) MLV 6 +6.39,Level I,Standard Review - 168 days,No,,"Pipeline, Auxiliary device(s) (please explain)",,,,,,,,,,,,,,,,,,,,,,,,,,,No,,,No,,,No,No,,,No,-108.45721,0,0,0,0,1,0,0,0,0,0,1,1,0,0,0,0,0,0,0,0,0,0,0,0,0,0,0,0,0,8,0,1,0,0
440,INC2012-113,Release of Substance,8/24/2012,Fort Nelson,"Westcoast Energy Inc., carrying on business as Spectra Energy Transmission",Closed,58.65325,0,Mixed HVP Hydrocarbons,Gas,No,2012,2012-08-22,2012/08/22 03:00:00 PM Mountain,,,Operation,,6/9/2014,Yes,No,Mixed HVP Hydrocarbons,0,No,No,,,,,,,,,,,0,PPR,,,,,,,,,Canada,No,No,No,No,5,"Mile Post MP 285, Alaska Hwy",Level I,Standard Review - 168 days,No,,,,,,,,,,,,,,,,,,,,,,,,,,,,,No,,,No,,,No,No,,,No,-122.68505,1,0,0,1,0,0,0,0,0,0,0,1,0,0,0,0,0,0,0,0,0,0,0,0,0,0,0,0,0,8,0,1,0,0
441,INC2012-114,Release of Substance,8/25/2012,Ignace,TransCanada PipeLines Limited,Closed,49.48139,0,Natural Gas - Sweet,Gas,No,2012,2012-08-24,2012/08/24 07:00:00 AM Mountain,,,Maintenance,Employee / Contractor (Onsite),1/24/2014,Yes,No,Natural Gas - Sweet,0,No,No,,,,,,,,,,,0,OPR,,,,,,,,,Canada,Yes,No,No,No,3,,Level I,Standard Review - 168 days,No,,"Station/Facility, Compression, Valve",,,,,,,,,,,,,,,,,,,,,,,,,,,No,Rebuilt,,No,,,No,No,,Repair,No,-91.95966,1,0,0,0,0,1,0,0,0,0,0,1,0,0,0,0,0,0,0,0,0,0,0,0,0,0,0,0,0,8,0,1,0,0
442,INC2012-115,Release of Substance,8/27/2012,Elmworth,Burlington Resources Canada (Hunter) Ltd.,Closed,55.09204,0,Natural Gas - Sweet,Gas,No,2012,,2012/08/26 07:00:00 PM Mountain,,,Operation,Landowner,2/25/2014,Yes,No,Natural Gas - Sweet,0,No,No,,,,,,,,,,,0,OPR,,,,,,,,,Canada,No,No,Yes,No,0,Legal Subdivision 4-25-70-13 W6M,Level I,Standard Review - 168 days,No,REM-0176,"Pipeline, Pipe, Body",,,,,,,,,,,,,,,,,,,,,,,,,,,No,,,No,,,No,No,,,No,-119.85311,1,1,0,0,0,0,0,0,0,0,0,1,0,0,0,0,0,0,0,0,0,0,0,0,0,0,0,0,0,8,0,1,0,0
443,INC2012-116,Release of Substance,8/29/2012,Moncton,Maritimes & Northeast Pipeline Management Ltd.,Closed,46.087816,0,Natural Gas - Sweet,Gas,No,2012,,2012/08/28 02:00:00 PM Atlantic,,,Operation,Employee / Contractor (Onsite),2/25/2014,Yes,No,Natural Gas - Sweet,0,No,No,,,,,,,,,,,0,OPR,Mainline,"762.00000000, 863.60000000",574.8807991,Natural Gas,,,,,Canada,No,No,Yes,No,0,,Level I,Standard Review - 168 days,No,,"Station/Facility, Metering, Delivering, Fitting",,,,,,,,,,,,,,,,,,,,,,,,,,,No,,,No,,,No,No,,,No,-64.778231,1,0,0,0,0,0,1,0,0,0,0,1,0,0,0,0,0,0,0,0,0,0,0,0,0,0,0,0,0,8,0,1,0,0
444,INC2012-118,Fire,9/7/2012,Glenboro,Enbridge Pipelines Inc.,Closed,49.544121,0,Not Applicable,Not Applicable,No,2012,,2012/09/06 11:45:00 AM Central,,,Construction,Employee / Contractor (Onsite),4/19/2013,No,No,,,,No,,Welding or Cutting,,,,,,,,,0,OPR,,,,,,,,,Canada,Yes,No,No,No,0,Mile Post 684.4056,Level I,Standard Review - 168 days,No,,"Pipeline, Auxiliary device(s) (please explain)",,,,,,,,,,,,,,,,,,,,,,,,,,,No,,,No,,,No,No,,,No,-99.314964,0,0,1,0,0,0,0,0,0,0,0,1,0,0,0,0,0,0,0,0,0,0,0,0,0,0,0,0,0,9,0,0,1,0
445,INC2012-119,Fire,9/7/2012,Regina,Enbridge Pipelines Inc.,Closed,50.454722,0,Not Applicable,Not Applicable,No,2012,,2012/09/07 03:20:00 PM Mountain,,,Operation,Employee / Contractor (Onsite),10/22/2012,No,No,,,,No,,Other Event (Nature or 3rd Party),,,,,,,,,0,OPR,,,,,,,,,Canada,No,No,Yes,Yes,0,Mile Post 435.4,Level II,Category B,No,,,,,,,,,,,,,,,,,,,,,,,,,,,,,No,,,No,,,No,No,,,No,-104.606667,0,0,0,0,1,0,0,0,0,0,1,1,0,0,0,0,0,0,0,0,0,0,0,0,0,0,0,0,0,9,0,0,1,0
446,INC2012-120,Release of Substance,9/10/2012,Chetwynd,"Westcoast Energy Inc., carrying on business as Spectra Energy Transmission",Closed,55.56913,0,Hydrogen Sulphide,Miscellaneous,Yes,2012,,2012/09/09 05:40:00 PM Pacific,,,Operation,,5/3/2013,Yes,No,Hydrogen Sulphide,0,No,No,,,,,,,,,,,0,PPR,WEI - Pine River Gas Plant,,,,,,,,Canada,No,No,No,No,0,,Level I,Standard Review - 168 days,No,,"Processing Plant, Sulphur plant",,,,,,,,,,,,,,,,,,,,,,,,,,,No,,,No,,,No,No,,,No,-121.94465,1,0,0,1,0,0,0,0,0,0,0,1,0,0,0,0,0,0,0,0,0,0,0,0,0,0,0,0,0,9,0,0,1,0
447,INC2012-121,Release of Substance,9/10/2012,Musquash,Maritimes & Northeast Pipeline Management Ltd.,Closed,45.19227,0,Natural Gas - Sweet,Gas,No,2012,2012-09-10,2012/09/10 02:00:00 PM Atlantic,,,Operation,Employee / Contractor (Onsite),2/6/2013,Yes,No,Natural Gas - Sweet,0,No,No,,,,,,,,,,,0,OPR,,,,,,,,,Canada,Yes,No,No,No,5,Mainline Valve + Offset (km) 053,Level I,Standard Review - 168 days,No,,"Station/Facility, Pigging, Receiving, Closure;Station/Facility, Pigging, Receiving, Valve, Globe, Other (please explain)",,,,,,,,,0,,,,0,,2008,,,,,,,,,,,,No,,,No,,,No,No,,,No,-66.40471,1,0,0,0,0,0,1,0,0,0,0,1,0,0,0,0,0,0,0,0,0,0,0,0,0,0,0,0,0,9,0,0,1,0
448,INC2012-122,Fire,9/12/2012,Caronport,TransCanada Keystone Pipeline GP Ltd.,Closed,50.48071,0,Not Applicable,Not Applicable,No,2012,,2012/09/11 12:15:00 PM Mountain,,,Operation,Employee / Contractor (Onsite),2/11/2013,Yes,No,,,,No,,Equipment & Electrical,,,,,,,,,0,OPR,TCPL - Station 13 (Caron Compressor Station),,,,,,,,Canada,Yes,No,No,No,0,,Level I,Standard Review - 168 days,No,,"Station/Facility, Pumping, Auxiliary power unit",,,,,,,,,,,,,,,,,,,,,,,,,,,No,,,No,,,No,No,,,No,-105.86698,0,0,0,0,1,0,0,0,0,0,0,1,0,0,0,0,0,0,0,0,0,0,0,0,0,0,0,0,0,9,0,0,1,0
449,INC2012-123,Release of Substance,9/17/2012,Saint John,Maritimes & Northeast Pipeline Management Ltd.,Closed,45.239404,0,Natural Gas - Sweet,Gas,No,2012,2012-09-17,2012/09/17 05:00:00 PM Atlantic,,,Operation,Employee / Contractor (Onsite),11/30/2012,No,No,Natural Gas - Sweet,0,No,No,,,,,,,,,,,0,OPR,Saint John PRS,,,,,,,,Canada,Yes,No,No,No,0,,Level I,Standard Review - 168 days,No,,,,,,,,,,,,,,,,,,,,,,,,,,,,,No,,,No,,,No,No,,,No,-66.102907,1,0,0,0,0,0,1,0,0,0,0,1,0,0,0,0,0,0,0,0,0,0,0,0,0,0,0,0,0,9,0,0,1,0
450,INC2012-124,Release of Substance,9/18/2012,Shaunavon,Foothills Pipe Lines (Saskatchewan) Ltd.,Closed,49.98,0,Natural Gas - Sweet,Gas,No,2012,2012-09-17,2012/09/17 11:00:00 AM Mountain,,,Operation,Employee / Contractor (Onsite),2/5/2013,Yes,No,Natural Gas - Sweet,0,No,No,,,,,,,,,,,0,OPR,,,,,,,,,Canada,Yes,No,No,No,0,,Level I,Standard Review - 168 days,No,,"Station/Facility, Compression, Auxiliary power unit",,,,,,,,,,,,,,,,,,,,,,,,,,,No,,,No,,,No,No,,,No,-109.12,1,0,0,0,1,0,0,0,0,0,0,1,0,0,0,0,0,0,0,0,0,0,0,0,0,0,0,0,0,9,0,0,1,0
451,INC2012-125,Release of Substance,9/18/2012,Sarnia,Enbridge Pipelines Inc.,Closed,42.95262,0.001,Natural Gas - Sweet,Gas,No,2012,2012-09-18,2012/09/18 11:25:00 AM Eastern,,,Operation,Employee / Contractor (Onsite),1/2/2014,Yes,No,Natural Gas - Sweet,0.001,No,No,,,,,,,,,,,0,OPR,Enbridge Sarnia Terminal,,,,,,,,Canada,Yes,No,No,No,0,,Level I,Standard Review - 168 days,No,,"Station/Facility, Metering, Delivering, Fitting, Other (please explain)",,,,,,,,,,,,,,,,,,,,,,,,,,,No,,,No,,,No,No,,,No,-82.37435,1,0,0,0,0,1,0,0,0,0,0,1,0,0,0,0,0,0,0,0,0,0,0,0,0,0,0,0,0,9,0,0,1,0
452,INC2012-127,Release of Substance,9/21/2012,Flume Ridge,Maritimes & Northeast Pipeline Management Ltd.,Closed,45.461,0,Natural Gas - Sweet,Gas,No,2012,2012-09-21,2012/09/21 02:02:00 PM Atlantic,,,Operation,Employee / Contractor (Onsite),1/8/2013,Yes,No,Natural Gas - Sweet,0,No,No,,,,,,,,,,,0,OPR,Mainline,"762.00000000, 863.60000000",574.8807991,Natural Gas,,,,,Canada,Yes,No,No,No,6,Mainline Valve + Offset (km) MLV 518,Level I,Standard Review - 168 days,No,,"Pipeline, Flange, Gasket/O-ring",,,,,,,,,,,,,,,,,,,,,,,,,,,No,,,No,,,No,No,,,No,-66.99757,1,0,0,0,0,0,1,0,0,0,0,1,0,0,0,0,0,0,0,0,0,0,0,0,0,0,0,0,0,9,0,0,1,0
453,INC2012-130,Operation Beyond Design Limits,9/26/2012,Hardisty,TransCanada Keystone Pipeline GP Ltd.,Closed,52.29348,0,Not Applicable,Not Applicable,No,2012,2012-09-26,2012/09/26 02:00:00 PM Mountain,,,Construction,Employee / Contractor (Onsite),7/3/2013,No,No,,,,No,,,,,,,,,Over Pressure,,0,OPR,,,,,,,,,Canada,Yes,No,No,No,0,,Level I,Standard Review - 168 days,No,,"Pipeline, Pipe, Body",,,,,,,,,,,,,,,,,,,,,,,,,,,No,,,No,,,No,No,,,No,-111.09216,0,1,0,0,0,0,0,0,0,0,0,1,0,0,0,0,0,0,0,0,0,0,0,0,0,0,0,0,0,9,0,0,1,0
454,INC2012-128,"Explosion, Fire",9/21/2012,Drayton Valley,NOVA Gas Transmission Ltd.,Closed,52.93315,0,Not Applicable,Not Applicable,No,2012,2012-09-21,2012/09/21 10:45:00 AM Mountain,,,Operation,Employee / Contractor (Onsite),2/25/2014,Yes,No,,,,No,Battery Explosion,Battery Explosion,,,,,,,,,0,OPR,,,,,,,,,Canada,Yes,No,No,No,0,Legal Subdivision 2-1-46-7W5M,Level I,Standard Review - 168 days,No,,"Station/Facility, Metering, Delivering, Auxiliary power unit",,,,,,,,,,,,,,,,,,,,,,,,,,,No,,,No,,,No,No,,,No,-114.88072,0,1,0,0,0,0,0,0,0,0,0,1,0,0,0,0,0,0,0,0,0,0,0,0,0,0,0,0,0,9,0,0,1,0
455,INC2012-131,Release of Substance,9/27/2012,Rapid City,TransCanada PipeLines Limited,Closed,50.0747,10,Natural Gas - Sweet,Gas,No,2012,2012-09-26,2012/09/26 01:00:00 PM Central,,,Operation,Employee / Contractor (Onsite),12/21/2012,Yes,No,Natural Gas - Sweet,10,No,No,,,,,,,,,,,0,OPR,LINE 100-3,"1066.80000000, 762.00000000, 863.60000000, 914.40000000",2681.81132,Natural Gas,,,,,Canada,Yes,No,No,No,0,,Level I,Standard Review - 168 days,No,,"Pipeline, Fitting, Tee, Body",,,,,,,,,,,,,,,,,,,,,,,,,,,No,,,No,,,No,No,,,No,-100.00049,1,0,1,0,0,0,0,0,0,0,0,1,0,0,0,0,0,0,0,0,0,0,0,0,0,0,0,0,0,9,0,0,1,0
456,INC2012-132,Fire,9/27/2012,Kerrobert,Enbridge Pipelines Inc.,Closed,51.86536,0,Not Applicable,Not Applicable,No,2012,2012-09-27,2012/09/27 11:00:00 AM Mountain,,,Operation,Employee / Contractor (Onsite),7/17/2013,No,No,,,,No,,Under Investigation or Unknown,,,,,,,,,0,OPR,EPI - Kerrobert Pump Station,,,,,,,,Canada,Yes,No,No,No,0,,Level I,Standard Review - 168 days,No,,,,,,,,,,,,,,,,,,,,,,,,,,,,,No,,,No,,,No,No,,,No,-109.02607,0,0,0,0,1,0,0,0,0,0,0,1,0,0,0,0,0,0,0,0,0,0,0,0,0,0,0,0,0,9,0,0,1,0
457,INC2012-133,Release of Substance,9/28/2012,Lincoln,Maritimes & Northeast Pipeline Management Ltd.,Closed,45.806186,5.7,Natural Gas - Sweet,Gas,No,2012,2012-09-28,2012/09/28 12:20:00 AM Atlantic,,,Operation,Employee / Contractor (Onsite),4/9/2013,Yes,No,Natural Gas - Sweet,5.7,No,No,,,,,,,,,,,0,OPR,Mainline,"762.00000000, 863.60000000",574.8807991,Natural Gas,,,,,Canada,Yes,No,No,No,4,,Level I,Standard Review - 168 days,No,,"Station/Facility, Metering, Delivering, Valve, Pressure relief, Stem",,,,,,,,,,,,,,,,,,,,,,,,,,,No,,,No,,,No,No,,,No,-66.593942,1,0,0,0,0,0,1,0,0,0,0,1,0,0,0,0,0,0,0,0,0,0,0,0,0,0,0,0,0,9,0,0,1,0
458,INC2012-134,Operation Beyond Design Limits,9/28/2012,Hinton,NOVA Gas Transmission Ltd.,Closed,53.65218,0,Not Applicable,Not Applicable,No,2012,2012-09-09,2012/09/09 05:16:00 PM Mountain,,,Operation,Employee / Contractor (Onsite),7/18/2013,Yes,No,,,,No,,,,,,,,,Over Pressure,,0,OPR,,,,,,,,,Canada,No,No,Yes,No,0,Legal Subdivision 10-11-054-15 W5M,Level I,Standard Review - 168 days,No,,,,,,,,,,,,,,,,,,,,,,,,,,,,,No,,,No,,,No,No,,,No,-116.09968,0,1,0,0,0,0,0,0,0,0,0,1,0,0,0,0,0,0,0,0,0,0,0,0,0,0,0,0,0,9,0,0,1,0
459,INC2012-135,Fire,9/30/2012,Vaughan,TransCanada PipeLines Limited,Closed,43.87374,0,Not Applicable,Not Applicable,No,2012,2012-09-28,2012/09/28 10:30:00 AM Mountain,,,Construction,Employee / Contractor (Onsite),3/5/2014,No,No,,,,No,,Under Investigation or Unknown,,,,,,,,,0,OPR,TCPL - Station 130 (Maple Compressor Station),,,,,,,,Canada,No,No,Yes,No,0,,Level I,Standard Review - 168 days,No,,,,,,,,,,,,,,,,,,,,,,,,,,,,,No,,,No,,,No,No,,,No,-79.57984,0,0,0,0,0,1,0,0,0,0,0,1,0,0,0,0,0,0,0,0,0,0,0,0,0,0,0,0,0,9,0,0,1,0
460,INC2012-137,Release of Substance,10/2/2012,Rapid City,TransCanada PipeLines Limited,Closed,50.07455,0,Natural Gas - Sweet,Gas,No,2012,,2012/10/02 10:00:00 AM Mountain,,,Maintenance,Employee / Contractor (Onsite),2/11/2013,Yes,No,Natural Gas - Sweet,0,No,No,,,,,,,,,,,0,OPR,TCPL - Station 30 (Rapid City Compressor Station),,,,,,,,Canada,Yes,No,No,No,0,,Level I,Standard Review - 168 days,No,,"Station/Facility, Compression, Fitting",,NPS 3/8,Stainless Steel,,,,,,0,,,,,,,,,,,,,,,,,,No,,,No,,,No,No,,,No,-100.00074,1,0,1,0,0,0,0,0,0,0,0,1,0,0,0,0,0,0,0,0,0,0,0,0,0,0,0,0,0,10,0,0,1,0
461,INC2012-138,Release of Substance,10/2/2012,Carberry,TransCanada PipeLines Limited,Closed,50.024295,0,Natural Gas - Sweet,Gas,No,2012,,2012/10/02 02:00:00 PM Mountain,,,Operation,Employee / Contractor (Onsite),1/24/2014,Yes,No,Natural Gas - Sweet,0,No,No,,,,,,,,,,,0,OPR,TCPL - Neepawa Meter Station,,,,,,,,Canada,Yes,No,No,No,0,,Level I,Standard Review - 168 days,No,,"Station/Facility, Metering, Delivering, Fitting",,,,,,,,,,,,,,,,,,,,,,,,,,,No,Replacement,,No,,,No,No,,Replacement,No,-99.454233,1,0,1,0,0,0,0,0,0,0,0,1,0,0,0,0,0,0,0,0,0,0,0,0,0,0,0,0,0,10,0,0,1,0
462,INC2012-139,Operation Beyond Design Limits,10/3/2012,Hines Creek,NOVA Gas Transmission Ltd.,Closed,56.55718,0,Not Applicable,Not Applicable,No,2012,,2012/10/02 08:23:00 AM Mountain,,,Operation,Employee / Contractor (Onsite),1/24/2014,No,No,,,,No,,,,,,,,,Inappropriate Product,,0,OPR,,,,,,,,,Canada,Yes,No,No,No,0,Legal Subdivision 7-22-87-7-W6M,Level I,Standard Review - 168 days,No,,"Station/Facility, Pumping, Pump",,,,,,,,,,,,,,,,,,,,,,,,,,,No,,,No,,,No,No,,,No,-119.02232,0,1,0,0,0,0,0,0,0,0,0,1,0,0,0,0,0,0,0,0,0,0,0,0,0,0,0,0,0,10,0,0,1,0
463,INC2012-140,Release of Substance,10/4/2012,Rosemary,NOVA Gas Transmission Ltd.,Closed,50.74405,0,Natural Gas - Sweet,Gas,No,2012,,2012/10/04 10:25:00 AM Mountain,,,Operation,Landowner,1/24/2014,Yes,No,Natural Gas - Sweet,0,No,No,,,,,,,,,,,0,OPR,,,,,,,,,Canada,No,No,Yes,No,0,,Level II,Category B,No,,"Pipeline, Pipe, Body",,,,,,,,,,,,,,,,,,,,,,,,,,,No,,,No,,,No,No,,,No,-112.06708,1,1,0,0,0,0,0,0,0,0,0,1,0,0,0,0,0,0,0,0,0,0,0,0,0,0,0,0,0,10,0,0,1,0
464,INC2012-141,Release of Substance,10/4/2012,Regina,Enbridge Pipelines Inc.,Closed,50.48045,0,Natural Gas - Sweet,Gas,No,2012,,2012/10/04 01:02:00 PM Central,,,Maintenance,Employee / Contractor (Onsite),2/10/2014,Yes,No,Natural Gas - Sweet,,No,No,,,,,,,,,,,0,OPR,EPI - Regina Terminal,,,,,,,,Canada,Yes,No,No,No,0,,Level I,Standard Review - 168 days,No,,"Station/Facility, Metering, Delivering, Densitometer",,,,,,,,,,,,,,,,,,,,,,,,,,,No,,,No,,,No,No,,,No,-104.57805,1,0,0,0,1,0,0,0,0,0,0,1,0,0,0,0,0,0,0,0,0,0,0,0,0,0,0,0,0,10,0,0,1,0
465,INC2012-142,Fire,10/5/2012,Caroline,NOVA Gas Transmission Ltd.,Closed,52.06411,0,Not Applicable,Not Applicable,No,2012,,2012/10/04 09:00:00 AM Mountain,,,Operation,Employee / Contractor (Onsite),2/10/2014,No,No,,,,No,,Under Investigation or Unknown,,,,,,,,,0,OPR,,,,,,,,,Canada,No,No,Yes,No,0,,Level I,Standard Review - 168 days,No,,"Station/Facility, Compression, Compressor",,,,,,,,,,,,,,,,,,,,,,,,,,,No,,,No,,,No,No,,,No,-114.91249,0,1,0,0,0,0,0,0,0,0,0,1,0,0,0,0,0,0,0,0,0,0,0,0,0,0,0,0,0,10,0,0,1,0
466,INC2012-144,Release of Substance,10/9/2012,Kenora,TransCanada PipeLines Limited,Closed,49.72752728,0,Natural Gas - Sweet,Gas,No,2012,2012-10-09,2012/10/09 05:15:00 PM Mountain,,,Maintenance,Employee / Contractor (Onsite),1/24/2014,Yes,No,Natural Gas - Sweet,0,No,No,,,,,,,,,,,0,OPR,LINE 100-1,"508.00000000, 762.00000000, 863.60000000",2595.724534,Natural Gas,,,,,Canada,No,No,Yes,No,0,Mainline Valve + Offset (km) TCPL-MLV 46-1+1.280,Level I,Standard Review - 168 days,No,,"Pipeline, Pipe, Body",,,,,,,,,,,,,,,,,,,,,,,,,,,No,Replacement,,No,,,No,No,,Replacement,No,-95.125515,1,0,0,0,0,1,0,0,0,0,0,1,0,0,0,0,0,0,0,0,0,0,0,0,0,0,0,0,0,10,0,0,1,0
467,INC2012-146,Operation Beyond Design Limits,10/22/2012,Swan Hill,NOVA Gas Transmission Ltd.,Closed,54.539693,0,Not Applicable,Not Applicable,No,2012,,2012/10/21 08:16:00 AM Mountain,,,Operation,Employee / Contractor (Onsite),2/11/2013,Yes,No,,,,No,,,,,,,,,Inappropriate Product,,0,OPR,NGTL - Virginia Hills Meter Station,,,,,,,,Canada,Yes,No,No,No,0,,Level I,Standard Review - 168 days,No,,"Station/Facility, Metering, Delivering, Valve",,,,,,,,,,,,,,,,,,,,,,,,,,,No,,,No,,,No,No,,,No,-115.919971,0,1,0,0,0,0,0,0,0,0,0,1,0,0,0,0,0,0,0,0,0,0,0,0,0,0,0,0,0,10,0,0,1,0
468,INC2012-148,Operation Beyond Design Limits,10/27/2012,Rosetown,Enbridge Pipelines Inc.,Closed,51.482482,0,Not Applicable,Not Applicable,No,2012,2012-10-27,2012/10/27 09:40:00 AM Mountain,,,Operation,Employee / Contractor (Onsite),6/19/2013,Yes,No,,,,No,,,,,,,,,Over Pressure,,0,OPR,EPI - Milden Takeoff,,,,,,,,Canada,Yes,No,No,No,0,Mile Post 288.8,Level I,Standard Review - 168 days,No,,,,,,,,,,,,,,,,,,,,,,,,,,,,,No,,,No,,,No,No,,,No,-107.525115,0,0,0,0,1,0,0,0,0,0,0,1,0,0,0,0,0,0,0,0,0,0,0,0,0,0,0,0,0,10,0,0,1,0
469,INC2012-149,Release of Substance,10/29/2012,Sarnia,Enbridge Pipelines Inc.,Closed,42.95261,7.44,Crude Oil - Sour,Liquid,No,2012,2012-10-29,2012/10/29 08:35:00 AM Eastern,,,Operation,Employee / Contractor (Onsite),4/19/2013,Yes,No,Crude Oil - Sour,7.44,No,No,,,,,,,,,,,0,OPR,Enbridge Sarnia Terminal,,,,,,,,Canada,Yes,No,No,No,0,,Level I,Standard Review - 168 days,No,REM2012-149,"Storage, Tank, Aboveground",,,,,,,,,,,,,,,,,,,,,,,,,,,No,Rebuilt,10/31/2012,No,,,No,No,10/31/2012,Repair,No,-82.37433,1,0,0,0,0,1,0,0,0,0,0,1,0,0,0,0,0,0,0,0,0,0,0,0,0,0,0,0,0,10,0,0,1,0
470,INC2012-150,Release of Substance,10/29/2012,Kapuskasing,TransCanada PipeLines Limited,Closed,49.38796,0,Natural Gas - Sweet,Gas,No,2012,,2012/10/25 08:35:00 AM Eastern,,,Operation,Employee / Contractor (Onsite),2/10/2014,Yes,No,Natural Gas - Sweet,0,No,No,,,,,,,,,,,0,OPR,LINE 100-1,"508.00000000, 762.00000000, 863.60000000",2595.724534,Natural Gas,,,,,Canada,No,No,Yes,No,0,,Level I,Standard Review - 168 days,No,,"Station/Facility, Compression, Valve",,,,,,,,,,,,,,,,,,,,,,,,,,,No,,,No,,,No,No,,,No,-82.43616,1,0,0,0,0,1,0,0,0,0,0,1,0,0,0,0,0,0,0,0,0,0,0,0,0,0,0,0,0,10,0,0,1,0
471,INC2012-151,Release of Substance,10/29/2012,Slave Lake,NOVA Gas Transmission Ltd.,Closed,55.04178,0,Natural Gas - Sweet,Gas,No,2012,2012-10-29,2012/10/29 09:10:00 AM Mountain,,,Maintenance,Employee / Contractor (Onsite),5/1/2014,Yes,No,Natural Gas - Sweet,0,No,No,,,,,,,,,,,0,OPR,NGTL - Mitsue South Lateral,,,,,,,,Canada,No,No,Yes,No,0,,Level I,Standard Review - 168 days,No,,,,,,,,,,,,,,,,,,,,,,,,,,,,,No,,,No,,,No,No,,,No,-114.46266,1,1,0,0,0,0,0,0,0,0,0,1,0,0,0,0,0,0,0,0,0,0,0,0,0,0,0,0,0,10,0,0,1,0
472,INC2012-152,Release of Substance,11/1/2012,Moyie,TransCanada PipeLines Limited B.C. System,Closed,49.238462,0,Natural Gas - Sweet,Gas,No,2012,2012-10-31,2012/10/31 02:10:00 PM Mountain,,,Operation,Employee / Contractor (Onsite),4/23/2013,Yes,No,Natural Gas - Sweet,0,No,No,,,,,,,,,,,0,OPR,"TCPL, BC - Station 2B (Moyie Compressor Station)",,,,,,,,Canada,Yes,No,No,No,0,Kilometer Post,Level I,Standard Review - 168 days,No,,"Station/Facility, Compression, Pipe",,,Stainless Steel,,,,,,0,,,,,,1971,,,,,,,,,,,,No,,,No,,,No,No,,,No,-115.855313,1,0,0,1,0,0,0,0,0,0,0,1,0,0,0,0,0,0,0,0,0,0,0,0,0,0,0,0,0,10,0,0,1,0
473,INC2012-153,Release of Substance,11/1/2012,Not specified,NOVA Gas Transmission Ltd.,Closed,54.26029388,0,Natural Gas - Sweet,Gas,No,2012,,2012/11/01 12:15:00 PM Mountain,,,Operation,Employee / Contractor (Onsite),4/19/2013,Yes,No,Natural Gas - Sweet,0,No,No,,,,,,,,,,,0,OPR,,,,,,,,,Canada,Yes,No,No,No,0,,Level I,Standard Review - 168 days,No,,,,,,,,,,,0,,,,,,,,,,,,,,,,,,No,,,No,,,No,No,,,No,-115.2028366,1,1,0,0,0,0,0,0,0,0,0,1,0,0,0,0,0,0,0,0,0,0,0,0,0,0,0,0,0,11,0,0,1,0
474,INC2012-154,Release of Substance,11/8/2012,Lincoln,Maritimes & Northeast Pipeline Management Ltd.,Closed,45.806186,0,Natural Gas - Sweet,Gas,No,2012,,2012/11/08 08:30:00 AM Atlantic,,,Operation,Employee / Contractor (Onsite),1/4/2013,Yes,No,Natural Gas - Sweet,0,No,No,,,,,,,,,,,0,OPR,Mainline,"762.00000000, 863.60000000",574.8807991,Natural Gas,,,,,Canada,Yes,No,No,No,0,Mainline Valve + Offset (km),Level I,Standard Review - 168 days,No,,"Pipeline, Valve, Gate, Other (please explain)",,,,,,,,,,,,,,,,,,,,,,,,,,,No,Rebuilt,11/8/2012,No,,,No,No,11/8/2012,Repair,No,-66.593942,1,0,0,0,0,0,1,0,0,0,0,1,0,0,0,0,0,0,0,0,0,0,0,0,0,0,0,0,0,11,0,0,1,0
475,INC2012-155,Fire,11/12/2012,Manning,NOVA Gas Transmission Ltd.,Closed,57.36002,0,Not Applicable,Not Applicable,No,2012,2012-11-12,2012/11/12 12:01:00 AM Mountain,,,Construction,Employee / Contractor (Onsite),3/5/2014,No,No,,,,No,,Equipment & Electrical,,,,,,,,,0,OPR,NGTL - Hidden Lake Compressor Station,,,,,,,,Canada,Yes,No,No,No,0,,Level I,Standard Review - 168 days,No,,,,,,,,,,,,,,,,,,,,,,,,,,,,,No,,,No,,,No,No,,,No,-119.74979,0,1,0,0,0,0,0,0,0,0,0,1,0,0,0,0,0,0,0,0,0,0,0,0,0,0,0,0,0,11,0,0,1,0
476,INC2012-156,Release of Substance,11/14/2012,Salisbury,Maritimes & Northeast Pipeline Management Ltd.,Closed,46.050194,0,Natural Gas - Sweet,Gas,No,2012,2012-11-14,2012/11/14 04:30:00 PM Atlantic,,,Maintenance,Employee / Contractor (Onsite),1/9/2013,Yes,No,Natural Gas - Sweet,0,No,No,,,,,,,,,,,0,OPR,MNE - Corridor Meter Station,,,,,,,,Canada,Yes,No,No,No,0,Kilometer Post 3.6,Level I,Standard Review - 168 days,No,,"Station/Facility, Metering, Delivering, Auxiliary device(s) (please explain)",,,,,,,,,0,,,,,,,,,,,,,,,,,,No,,,No,,,No,No,,,No,-65.259182,1,0,0,0,0,0,1,0,0,0,0,1,0,0,0,0,0,0,0,0,0,0,0,0,0,0,0,0,0,11,0,0,1,0
477,INC2012-157,Release of Substance,11/15/2012,Fox Creek,NOVA Gas Transmission Ltd.,Closed,54.043732,0,Natural Gas - Sweet,Gas,No,2012,2012-11-15,2012/11/15 07:30:00 AM Mountain,,,Operation,Employee / Contractor (Onsite),3/5/2014,Yes,No,Natural Gas - Sweet,0,No,No,,,,,,,,,,,0,OPR,NGTL - Berland River Compressor Station,,,,,,,,Canada,Yes,No,No,No,0,,Level I,Standard Review - 168 days,No,,"Station/Facility, Compression, Fitting, Nipple",,,,,,,,,,,,,,,,,,,,,,,,,,,No,,,No,,,No,No,,,No,-117.421244,1,1,0,0,0,0,0,0,0,0,0,1,0,0,0,0,0,0,0,0,0,0,0,0,0,0,0,0,0,11,0,0,1,0
478,INC2012-158,Release of Substance,11/18/2012,Shaunavon,Foothills Pipe Lines (Saskatchewan) Ltd.,Closed,49.98008,0,Natural Gas - Sweet,Gas,No,2012,2012-11-17,2012/11/17 12:35:00 PM Mountain,,,Operation,Employee / Contractor (Onsite),2/10/2014,Yes,No,Natural Gas - Sweet,0,No,No,,,,,,,,,,,0,OPR,Foothills - Piapot Saskatchewan Compressor Stn 392,,,,,,,,Canada,Yes,No,No,No,0,,Level I,Standard Review - 168 days,No,,"Station/Facility, Compression, Valve",,,,,,,,,,,,,,,,,,,,,,,,,,,No,,,No,,,No,No,,,No,-109.12,1,0,0,0,1,0,0,0,0,0,0,1,0,0,0,0,0,0,0,0,0,0,0,0,0,0,0,0,0,11,0,0,1,0
479,INC2012-159,Release of Substance,11/18/2012,Chetwynd,"Westcoast Energy Inc., carrying on business as Spectra Energy Transmission",Closed,55.15019444,0,Natural Gas - Sour,Gas,Yes,2012,2012-11-17,2012/11/17 11:11:00 PM Mountain,,,Operation,Employee / Contractor (Onsite),5/29/2014,Yes,No,Natural Gas - Sour,0,No,No,,,,,,,,,,,0,OPR,Bullmoose Pipeline,219.1,7.99857685,Natural Gas Sour,,,,,Canada,No,No,Yes,No,0,,Level I,Standard Review - 168 days,No,,"Pipeline, Pipe, Body",,,,,,,,,,,,,,,,,,,,,,,,,,,No,,,No,,,No,No,,,No,-121.4512055,1,0,0,1,0,0,0,0,0,0,0,1,0,0,0,0,0,0,0,0,0,0,0,0,0,0,0,0,0,11,0,0,1,0
480,INC2012-161,Fire,11/22/2012,Kitchener,TransCanada PipeLines Limited,Closed,43.406032,0,Not Applicable,Not Applicable,No,2012,2012-11-21,2012/11/21 07:30:00 AM Mountain,,,Construction,Employee / Contractor (Onsite),2/10/2014,No,No,,,,No,,Under Investigation or Unknown,,,,,,,,,0,OPR,,,,,,,,,Canada,No,No,Yes,No,0,Legal Subdivision,Level I,Standard Review - 168 days,No,,,,,,,,,,,,,,,,,,,,,,,,,,,,,No,,,No,,,No,No,,,No,-80.43846,0,0,0,0,0,1,0,0,0,0,0,1,0,0,0,0,0,0,0,0,0,0,0,0,0,0,0,0,0,11,0,0,1,0
481,INC2012-162,Release of Substance,11/22/2012,Beauharnois,TransCanada PipeLines Limited,Closed,45.27297,0,Natural Gas - Sweet,Gas,No,2012,2012-11-21,2012/11/21 10:10:00 AM Mountain,,,Construction,Employee / Contractor (Onsite),3/5/2014,Yes,No,Natural Gas - Sweet,,No,No,,,,,,,,,,,0,OPR,,,,,,,,,Canada,Yes,No,No,No,6,Mainline Valve + Offset (km) MLV 706,Level I,Standard Review - 168 days,No,,"Station/Facility, Compression, Fitting",,,,,,,,,,,,,,,,,,,,,,,,,,,No,,,No,,,No,No,,,No,-73.893093,1,0,0,0,0,0,0,0,1,0,0,1,0,0,0,0,0,0,0,0,0,0,0,0,0,0,0,0,0,11,0,0,1,0
482,INC2012-164,Release of Substance,11/24/2012,Regina,Enbridge Pipelines Inc.,Closed,50.48053,0,Natural Gas Liquids,Gas,No,2012,2012-11-24,2012/11/24 04:35:00 PM Central,,,Operation,Employee / Contractor (Onsite),1/28/2014,Yes,No,Natural Gas Liquids,0,No,No,,,,,,,,,,,0,OPR,Regina Terminal,,,,,,,,Canada,Yes,No,No,No,0,,Level I,Standard Review - 168 days,No,,"Station/Facility, Metering, Delivering, Densitometer",,,,,,,,,,,,,,,,,,,,,,,,,,,No,,,No,,,No,No,,,No,-104.57829,1,0,0,0,1,0,0,0,0,0,0,1,0,0,0,0,0,0,0,0,0,0,0,0,0,0,0,0,0,11,0,0,1,0
483,INC2012-166,Release of Substance,11/27/2012,Goldboro,Maritimes & Northeast Pipeline Management Ltd.,Closed,45.17667,0,Natural Gas - Sweet,Gas,No,2012,2012-11-26,2012/11/26 10:00:00 AM Atlantic,,,Operation,Employee / Contractor (Onsite),4/17/2013,Yes,No,Natural Gas - Sweet,,No,No,,,,,,,,,,,0,OPR,Goldboro Meter Station,,,,,,,,Canada,Yes,No,No,No,5,,Level I,Standard Review - 168 days,No,,"Station/Facility, Metering, Delivering, Fitting",,,,,,,,,,,,,,,,,,,,,,,,,,,No,Rebuilt,11/27/2012,No,,,No,No,11/27/2012,Repair,No,-61.6226,1,0,0,0,0,0,0,1,0,0,0,1,0,0,0,0,0,0,0,0,0,0,0,0,0,0,0,0,0,11,0,0,1,0
484,INC2012-168,Release of Substance,12/7/2012,Saint John,Maritimes & Northeast Pipeline Management Ltd.,Closed,45.239523,0,Natural Gas - Sweet,Gas,No,2012,,2012/12/07 10:30:00 AM Atlantic,,,Operation,Employee / Contractor (Onsite),4/19/2013,Yes,No,Natural Gas - Sweet,0,No,No,,,,,,,,,,,0,OPR,MNE - St. John Lateral Pressure Regulating Station,,,,,,,,Canada,Yes,No,No,No,0,,Level I,Standard Review - 168 days,No,,"Station/Facility, Metering, Delivering, Valve, Pressure relief, Other (please explain)",,NPS 1/2,,,,,,,0,,,,,,,,,,,,,,,,,,No,,,No,,,No,No,,,No,-66.102866,1,0,0,0,0,0,1,0,0,0,0,1,0,0,0,0,0,0,0,0,0,0,0,0,0,0,0,0,0,12,0,0,0,1
485,INC2012-173,Release of Substance,12/26/2012,Cabri,TransCanada PipeLines Limited,Closed,50.60505,0,Natural Gas - Sweet,Gas,No,2012,2012-12-23,2012/12/23 12:00:00 AM Mountain,,,Operation,Employee / Contractor (Onsite),7/2/2013,Yes,No,Natural Gas - Sweet,0,No,No,,,,,,,,,,,0,OPR,TCPL - Station 5 (Cabri Compressor Station),,,,,,,,Canada,Yes,No,No,No,0,,Level I,Standard Review - 168 days,No,,"Station/Facility, Compression, Valve",,,,,,,,,,,,,,,,,,,,,,,,,,,No,,,No,,,No,No,,,No,-108.70856,1,0,0,0,1,0,0,0,0,0,0,1,0,0,0,0,0,0,0,0,0,0,0,0,0,0,0,0,0,12,0,0,0,1
486,INC2012-171,Serious Injury (CER or TSB),12/15/2012,Edmonton,Enbridge Pipelines Inc.,Closed,53.54719,0,Not Applicable,Not Applicable,Yes,2012,2012-12-14,2012/12/14 02:30:00 PM Mountain,,Transmission,Construction,Employee / Contractor (Onsite),2/5/2013,No,No,,,,No,,,,,Fracture,1,,No,,,0,OPR,EPI - Edmonton Terminal,,,,,,,,Canada,Yes,No,No,No,0,,Level I,Standard Review - 168 days,No,,,,,,,,,,,,,,,,,,,,,,,,,,,,,No,,,No,,,No,No,,,No,-113.35571,0,1,0,0,0,0,0,0,0,0,0,1,0,0,0,0,0,0,0,0,0,0,0,0,0,0,0,0,0,12,0,0,0,1
487,INC2012-174,Fire,12/29/2012,Sherwood Park,Enbridge Pipelines Inc.,Closed,53.54747,0,Not Applicable,Not Applicable,No,2012,2012-12-29,2012/12/29 07:34:00 PM Mountain,,,Operation,Employee / Contractor (Onsite),6/9/2014,Yes,No,,,,No,,Equipment & Electrical,,,,,,,,,0,OPR,Line 4,"1219.00000000, 864.00000000, 914.00000000",1248.909872,Crude Oil,,,,,Canada,Yes,No,No,No,0,,Level I,Standard Review - 168 days,No,"INC2015-022, INC2015-097, INC2016-003, INC2016-122, INC2017-006",,,,,,,,,,,,,,,,,,,,,,,,,,,,No,,,No,,,No,No,,,No,-113.35571,0,1,0,0,0,0,0,0,0,0,0,1,0,0,0,0,0,0,0,0,0,0,0,0,0,0,0,0,0,12,0,0,0,1
488,INC2012-175,Fire,1/8/2013,Mississauga,TransCanada PipeLines Limited,Closed,43.551392,0,Not Applicable,Not Applicable,No,2013,2012-12-19,2012/12/19 08:05:00 PM Mountain,,,Construction,Employee / Contractor (Onsite),12/4/2013,No,No,,,,Yes,,Equipment & Electrical,,,,,,,,,0,OPR,PARKWAY LOOP,1067,13.34365467,Natural Gas Sweet,,,,,Canada,Yes,No,No,No,0,,Level I,Standard Review - 168 days,No,,"Pipeline, Auxiliary device(s) (please explain)",,,,,,,,,,,,,,,,,,,,,,,,,,,No,Replacement,12/19/2012,No,,,No,No,12/19/2012,Replacement,No,-79.593431,0,0,0,0,0,1,0,0,0,0,0,1,0,0,0,0,0,0,0,0,0,0,0,0,0,0,0,0,0,12,0,0,0,1
489,INC2012-176,Operation Beyond Design Limits,2/27/2012,Sherwood Park,Enbridge Pipelines Inc.,Closed,53.5467,0,Not Applicable,Not Applicable,No,2012,2011-01-06,2012/02/27 12:00:00 AM Mountain,,,Operation,,4/13/2015,No,No,,,,No,,,,,,,,,Over Pressure,,0,OPR,Line 2,"1219.00000000, 609.40000000, 610.00000000",1282.304863,Crude Oil,,,,,Canada,No,No,Yes,No,0,,Level I,Standard Review - 168 days,No,INC2012-004,,,,,,,,,,,,,,,,,,,,,,,,,,,,No,,,No,,,No,No,,,No,-113.35465,0,1,0,0,0,0,0,0,0,0,0,1,0,0,0,0,0,0,0,0,0,0,0,0,0,0,0,0,0,1,0,0,0,1
490,INC2012-177,Operation Beyond Design Limits,2/27/2012,Sherwood Park,Enbridge Pipelines Inc.,Closed,53.5467,0,Not Applicable,Not Applicable,No,2012,2011-01-06,2012/02/27 12:00:00 AM Mountain,,,Operation,,4/13/2015,No,No,,,,No,,,,,,,,,Over Pressure,,0,OPR,Line 2,"1219.00000000, 609.40000000, 610.00000000",1282.304863,Crude Oil,,,,,Canada,No,No,Yes,No,0,,Level I,Standard Review - 168 days,No,INC2012-004,,,,,,,,,,,,,,,,,,,,,,,,,,,,No,,,No,,,No,No,,,No,-113.35465,0,1,0,0,0,0,0,0,0,0,0,1,0,0,0,0,0,0,0,0,0,0,0,0,0,0,0,0,0,1,0,0,0,1
491,INC2012-178,Operation Beyond Design Limits,2/27/2012,Sherwood Park,Enbridge Pipelines Inc.,Closed,53.5467,0,Not Applicable,Not Applicable,No,2012,2011-01-20,2012/02/27 12:00:00 AM Mountain,,,Operation,,4/13/2015,No,No,,,,No,,,,,,,,,Over Pressure,,0,OPR,Line 2,"1219.00000000, 609.40000000, 610.00000000",1282.304863,Crude Oil,,,,,Canada,No,No,Yes,No,0,,Level I,Standard Review - 168 days,No,INC2012-004,,,,,,,,,,,,,,,,,,,,,,,,,,,,No,,,No,,,No,No,,,No,-113.35465,0,1,0,0,0,0,0,0,0,0,0,1,0,0,0,0,0,0,0,0,0,0,0,0,0,0,0,0,0,1,0,0,0,1
492,INC2012-179,Operation Beyond Design Limits,2/27/2012,Sherwood Park,Enbridge Pipelines Inc.,Closed,53.5467,0,Not Applicable,Not Applicable,No,2012,2011-01-20,2012/02/27 12:00:00 AM Mountain,,,Operation,,4/13/2015,No,No,,,,No,,,,,,,,,Over Pressure,,0,OPR,Line 2,"1219.00000000, 609.40000000, 610.00000000",1282.304863,Crude Oil,,,,,Canada,No,No,Yes,No,0,,Level I,Standard Review - 168 days,No,INC2012-004,,,,,,,,,,,,,,,,,,,,,,,,,,,,No,,,No,,,No,No,,,No,-113.35465,0,1,0,0,0,0,0,0,0,0,0,1,0,0,0,0,0,0,0,0,0,0,0,0,0,0,0,0,0,1,0,0,0,1
493,INC2012-180,Operation Beyond Design Limits,2/27/2012,Sherwood Park,Enbridge Pipelines Inc.,Closed,53.5467,0,Not Applicable,Not Applicable,No,2012,2011-01-27,2012/02/27 12:00:00 AM Mountain,,,Operation,,4/13/2015,No,No,,,,No,,,,,,,,,Over Pressure,,0,OPR,Line 2,"1219.00000000, 609.40000000, 610.00000000",1282.304863,Crude Oil,,,,,Canada,No,No,Yes,No,0,,Level I,Standard Review - 168 days,No,INC2012-004,,,,,,,,,,,,,,,,,,,,,,,,,,,,No,,,No,,,No,No,,,No,-113.35465,0,1,0,0,0,0,0,0,0,0,0,1,0,0,0,0,0,0,0,0,0,0,0,0,0,0,0,0,0,1,0,0,0,1
494,INC2012-181,Operation Beyond Design Limits,2/27/2012,Sherwood Park,Enbridge Pipelines Inc.,Closed,53.5467,0,Not Applicable,Not Applicable,No,2012,2011-02-20,2012/02/27 12:00:00 AM Mountain,,,Operation,,4/13/2015,No,No,,,,No,,,,,,,,,Over Pressure,,0,OPR,Line 2,"1219.00000000, 609.40000000, 610.00000000",1282.304863,Crude Oil,,,,,Canada,No,No,Yes,No,0,,Level I,Standard Review - 168 days,No,INC2012-004,,,,,,,,,,,,,,,,,,,,,,,,,,,,No,,,No,,,No,No,,,No,-113.35465,0,1,0,0,0,0,0,0,0,0,0,1,0,0,0,0,0,0,0,0,0,0,0,0,0,0,0,0,0,2,0,0,0,1
495,INC2012-182,Operation Beyond Design Limits,2/27/2012,Sherwood Park,Enbridge Pipelines Inc.,Closed,53.5467,0,Not Applicable,Not Applicable,No,2012,2011-02-22,2012/02/27 12:00:00 AM Mountain,,,Operation,,4/13/2015,No,No,,,,No,,,,,,,,,Over Pressure,,0,OPR,Line 2,"1219.00000000, 609.40000000, 610.00000000",1282.304863,Crude Oil,,,,,Canada,No,No,Yes,No,0,,Level I,Standard Review - 168 days,No,INC2012-004,,,,,,,,,,,,,,,,,,,,,,,,,,,,No,,,No,,,No,No,,,No,-113.35465,0,1,0,0,0,0,0,0,0,0,0,1,0,0,0,0,0,0,0,0,0,0,0,0,0,0,0,0,0,2,0,0,0,1
496,INC2012-183,Operation Beyond Design Limits,2/27/2012,Sherwood Park,Enbridge Pipelines Inc.,Closed,53.5467,0,Not Applicable,Not Applicable,No,2012,2011-03-05,2012/02/27 12:00:00 AM Mountain,,,Operation,,4/13/2015,No,No,,,,No,,,,,,,,,Over Pressure,,0,OPR,Line 2,"1219.00000000, 609.40000000, 610.00000000",1282.304863,Crude Oil,,,,,Canada,No,No,Yes,No,0,,Level I,Standard Review - 168 days,No,INC2012-004,,,,,,,,,,,,,,,,,,,,,,,,,,,,No,,,No,,,No,No,,,No,-113.35465,0,1,0,0,0,0,0,0,0,0,0,1,0,0,0,0,0,0,0,0,0,0,0,0,0,0,0,0,0,3,1,0,0,0
497,INC2012-184,Operation Beyond Design Limits,2/27/2012,Sherwood Park,Enbridge Pipelines Inc.,Closed,53.5467,0,Not Applicable,Not Applicable,No,2012,2011-03-29,2012/02/27 12:00:00 AM Mountain,,,Operation,,4/13/2015,No,No,,,,No,,,,,,,,,Over Pressure,,0,OPR,Line 2,"1219.00000000, 609.40000000, 610.00000000",1282.304863,Crude Oil,,,,,Canada,No,No,Yes,No,0,,Level I,Standard Review - 168 days,No,INC2012-004,,,,,,,,,,,,,,,,,,,,,,,,,,,,No,,,No,,,No,No,,,No,-113.35465,0,1,0,0,0,0,0,0,0,0,0,1,0,0,0,0,0,0,0,0,0,0,0,0,0,0,0,0,0,3,1,0,0,0
498,INC2012-185,Operation Beyond Design Limits,2/27/2012,Sherwood Park,Enbridge Pipelines Inc.,Closed,53.5467,0,Not Applicable,Not Applicable,No,2012,2011-05-05,2012/02/27 12:00:00 AM Mountain,,,Operation,,4/13/2015,No,No,,,,No,,,,,,,,,Over Pressure,,0,OPR,Line 2,"1219.00000000, 609.40000000, 610.00000000",1282.304863,Crude Oil,,,,,Canada,No,No,Yes,No,0,,Level I,Standard Review - 168 days,No,INC2012-004,,,,,,,,,,,,,,,,,,,,,,,,,,,,No,,,No,,,No,No,,,No,-113.35465,0,1,0,0,0,0,0,0,0,0,0,1,0,0,0,0,0,0,0,0,0,0,0,0,0,0,0,0,0,5,1,0,0,0
499,INC2012-186,Operation Beyond Design Limits,2/27/2012,Sherwood Park,Enbridge Pipelines Inc.,Closed,53.5467,0,Not Applicable,Not Applicable,No,2012,2011-06-20,2012/02/27 12:00:00 AM Mountain,,,Operation,,4/13/2015,No,No,,,,No,,,,,,,,,Over Pressure,,0,OPR,Line 2,"1219.00000000, 609.40000000, 610.00000000",1282.304863,Crude Oil,,,,,Canada,No,No,Yes,No,0,,Level I,Standard Review - 168 days,No,INC2012-004,,,,,,,,,,,,,,,,,,,,,,,,,,,,No,,,No,,,No,No,,,No,-113.35465,0,1,0,0,0,0,0,0,0,0,0,1,0,0,0,0,0,0,0,0,0,0,0,0,0,0,0,0,0,6,0,1,0,0
500,INC2012-187,Operation Beyond Design Limits,2/27/2012,Sherwood Park,Enbridge Pipelines Inc.,Closed,53.5467,0,Not Applicable,Not Applicable,No,2012,2011-07-10,2012/02/27 12:00:00 AM Mountain,,,Operation,,4/13/2015,No,No,,,,No,,,,,,,,,Over Pressure,,0,OPR,Line 2,"1219.00000000, 609.40000000, 610.00000000",1282.304863,Crude Oil,,,,,Canada,No,No,Yes,No,0,,Level I,Standard Review - 168 days,No,INC2012-004,,,,,,,,,,,,,,,,,,,,,,,,,,,,No,,,No,,,No,No,,,No,-113.35465,0,1,0,0,0,0,0,0,0,0,0,1,0,0,0,0,0,0,0,0,0,0,0,0,0,0,0,0,0,7,0,1,0,0
501,INC2012-188,Operation Beyond Design Limits,2/27/2012,Sherwood Park,Enbridge Pipelines Inc.,Closed,53.5467,0,Not Applicable,Not Applicable,No,2012,2011-07-11,2012/02/27 12:00:00 AM Mountain,,,Operation,,4/13/2015,No,No,,,,No,,,,,,,,,Over Pressure,,0,OPR,Line 2,"1219.00000000, 609.40000000, 610.00000000",1282.304863,Crude Oil,,,,,Canada,No,No,Yes,No,0,,Level I,Standard Review - 168 days,No,INC2012-004,,,,,,,,,,,,,,,,,,,,,,,,,,,,No,,,No,,,No,No,,,No,-113.35465,0,1,0,0,0,0,0,0,0,0,0,1,0,0,0,0,0,0,0,0,0,0,0,0,0,0,0,0,0,7,0,1,0,0
502,INC2012-189,Operation Beyond Design Limits,2/27/2012,Sherwood Park,Enbridge Pipelines Inc.,Closed,53.5467,0,Not Applicable,Not Applicable,No,2012,2011-07-17,2012/02/27 12:00:00 AM Mountain,,,Operation,,4/13/2015,No,No,,,,No,,,,,,,,,Over Pressure,,0,OPR,Line 2,"1219.00000000, 609.40000000, 610.00000000",1282.304863,Crude Oil,,,,,Canada,No,No,Yes,No,0,,Level I,Standard Review - 168 days,No,INC2012-004,,,,,,,,,,,,,,,,,,,,,,,,,,,,No,,,No,,,No,No,,,No,-113.35465,0,1,0,0,0,0,0,0,0,0,0,1,0,0,0,0,0,0,0,0,0,0,0,0,0,0,0,0,0,7,0,1,0,0
503,INC2012-190,Operation Beyond Design Limits,2/27/2012,Sherwood Park,Enbridge Pipelines Inc.,Closed,53.5467,0,Not Applicable,Not Applicable,No,2012,2011-07-19,2012/02/27 12:00:00 AM Mountain,,,Operation,,4/13/2015,No,No,,,,No,,,,,,,,,Over Pressure,,0,OPR,Line 2,"1219.00000000, 609.40000000, 610.00000000",1282.304863,Crude Oil,,,,,Canada,No,No,Yes,No,0,,Level I,Standard Review - 168 days,No,INC2012-004,,,,,,,,,,,,,,,,,,,,,,,,,,,,No,,,No,,,No,No,,,No,-113.35465,0,1,0,0,0,0,0,0,0,0,0,1,0,0,0,0,0,0,0,0,0,0,0,0,0,0,0,0,0,7,0,1,0,0
504,INC2012-191,Operation Beyond Design Limits,2/27/2012,Sherwood Park,Enbridge Pipelines Inc.,Closed,53.5467,0,Not Applicable,Not Applicable,No,2012,2011-08-24,2012/02/27 12:00:00 AM Mountain,,,Operation,,4/13/2015,No,No,,,,No,,,,,,,,,Over Pressure,,0,OPR,Line 2,"1219.00000000, 609.40000000, 610.00000000",1282.304863,Crude Oil,,,,,Canada,No,No,Yes,No,0,,Level I,Standard Review - 168 days,No,INC2012-004,,,,,,,,,,,,,,,,,,,,,,,,,,,,No,,,No,,,No,No,,,No,-113.35465,0,1,0,0,0,0,0,0,0,0,0,1,0,0,0,0,0,0,0,0,0,0,0,0,0,0,0,0,0,8,0,1,0,0
505,INC2012-192,Operation Beyond Design Limits,2/27/2012,Sherwood Park,Enbridge Pipelines Inc.,Closed,53.5467,0,Not Applicable,Not Applicable,No,2012,2011-09-10,2012/02/27 12:00:00 AM Mountain,,,Operation,,4/13/2015,No,No,,,,No,,,,,,,,,Over Pressure,,0,OPR,Line 2,"1219.00000000, 609.40000000, 610.00000000",1282.304863,Crude Oil,,,,,Canada,No,No,Yes,No,0,,Level I,Standard Review - 168 days,No,INC2012-004,,,,,,,,,,,,,,,,,,,,,,,,,,,,No,,,No,,,No,No,,,No,-113.35465,0,1,0,0,0,0,0,0,0,0,0,1,0,0,0,0,0,0,0,0,0,0,0,0,0,0,0,0,0,9,0,0,1,0
506,INC2012-193,Operation Beyond Design Limits,2/27/2012,Sherwood Park,Enbridge Pipelines Inc.,Closed,53.5467,0,Not Applicable,Not Applicable,No,2012,2011-09-15,2012/02/27 12:00:00 AM Mountain,,,Operation,,4/13/2015,No,No,,,,No,,,,,,,,,Over Pressure,,0,OPR,Line 2,"1219.00000000, 609.40000000, 610.00000000",1282.304863,Crude Oil,,,,,Canada,No,No,Yes,No,0,,Level I,Standard Review - 168 days,No,INC2012-004,,,,,,,,,,,,,,,,,,,,,,,,,,,,No,,,No,,,No,No,,,No,-113.35465,0,1,0,0,0,0,0,0,0,0,0,1,0,0,0,0,0,0,0,0,0,0,0,0,0,0,0,0,0,9,0,0,1,0
507,INC2012-194,Operation Beyond Design Limits,2/27/2012,Sherwood Park,Enbridge Pipelines Inc.,Closed,53.5467,0,Not Applicable,Not Applicable,No,2012,2011-09-22,2012/02/27 12:00:00 AM Mountain,,,Operation,,4/14/2015,No,No,,,,No,,,,,,,,,Over Pressure,,0,OPR,Line 2,"1219.00000000, 609.40000000, 610.00000000",1282.304863,Crude Oil,,,,,Canada,No,No,Yes,No,0,,Level I,Standard Review - 168 days,No,INC2012-004,,,,,,,,,,,,,,,,,,,,,,,,,,,,No,,,No,,,No,No,,,No,-113.35465,0,1,0,0,0,0,0,0,0,0,0,1,0,0,0,0,0,0,0,0,0,0,0,0,0,0,0,0,0,9,0,0,1,0
508,INC2012-195,Operation Beyond Design Limits,2/27/2012,Sherwood Park,Enbridge Pipelines Inc.,Closed,53.5467,0,Not Applicable,Not Applicable,No,2012,2011-10-07,2012/02/27 12:00:00 AM Mountain,,,Operation,,4/13/2015,No,No,,,,No,,,,,,,,,Over Pressure,,0,OPR,Line 2,"1219.00000000, 609.40000000, 610.00000000",1282.304863,Crude Oil,,,,,Canada,No,No,Yes,No,0,,Level I,Standard Review - 168 days,No,INC2012-004,,,,,,,,,,,,,,,,,,,,,,,,,,,,No,,,No,,,No,No,,,No,-113.35465,0,1,0,0,0,0,0,0,0,0,0,1,0,0,0,0,0,0,0,0,0,0,0,0,0,0,0,0,0,10,0,0,1,0
509,INC2012-196,Operation Beyond Design Limits,2/27/2012,Sherwood Park,Enbridge Pipelines Inc.,Closed,53.5467,0,Not Applicable,Not Applicable,No,2012,2011-10-08,2012/02/27 12:00:00 AM Mountain,,,Operation,,4/13/2015,No,No,,,,No,,,,,,,,,Over Pressure,,0,OPR,Line 2,"1219.00000000, 609.40000000, 610.00000000",1282.304863,Crude Oil,,,,,Canada,No,No,Yes,No,0,,Level I,Standard Review - 168 days,No,INC2012-004,,,,,,,,,,,,,,,,,,,,,,,,,,,,No,,,No,,,No,No,,,No,-113.35465,0,1,0,0,0,0,0,0,0,0,0,1,0,0,0,0,0,0,0,0,0,0,0,0,0,0,0,0,0,10,0,0,1,0
510,INC2012-197,Operation Beyond Design Limits,2/27/2012,Sherwood Park,Enbridge Pipelines Inc.,Closed,53.5467,0,Not Applicable,Not Applicable,No,2012,2011-11-18,2012/02/27 12:00:00 AM Mountain,,,Operation,,4/13/2015,No,No,,,,No,,,,,,,,,Over Pressure,,0,OPR,Line 2,"1219.00000000, 609.40000000, 610.00000000",1282.304863,Crude Oil,,,,,Canada,No,No,Yes,No,0,,Level I,Standard Review - 168 days,No,INC2012-004,,,,,,,,,,,,,,,,,,,,,,,,,,,,No,,,No,,,No,No,,,No,-113.35465,0,1,0,0,0,0,0,0,0,0,0,1,0,0,0,0,0,0,0,0,0,0,0,0,0,0,0,0,0,11,0,0,1,0
511,INC2012-198,Operation Beyond Design Limits,2/27/2012,Sherwood Park,Enbridge Pipelines Inc.,Closed,53.5467,0,Not Applicable,Not Applicable,No,2012,2011-11-21,2012/02/27 12:00:00 AM Mountain,,,Operation,,4/13/2015,No,No,,,,No,,,,,,,,,Over Pressure,,0,OPR,Line 2,"1219.00000000, 609.40000000, 610.00000000",1282.304863,Crude Oil,,,,,Canada,No,No,Yes,No,0,,Level I,Standard Review - 168 days,No,INC2012-004,,,,,,,,,,,,,,,,,,,,,,,,,,,,No,,,No,,,No,No,,,No,-113.35465,0,1,0,0,0,0,0,0,0,0,0,1,0,0,0,0,0,0,0,0,0,0,0,0,0,0,0,0,0,11,0,0,1,0
512,INC2012-199,Operation Beyond Design Limits,2/27/2012,Sherwood Park,Enbridge Pipelines Inc.,Closed,53.5467,0,Not Applicable,Not Applicable,No,2012,2011-11-22,2012/02/27 12:00:00 AM Mountain,,,Operation,,4/13/2015,No,No,,,,No,,,,,,,,,Over Pressure,,0,OPR,Line 2,"1219.00000000, 609.40000000, 610.00000000",1282.304863,Crude Oil,,,,,Canada,No,No,Yes,No,0,,Level I,Standard Review - 168 days,No,INC2012-004,,,,,,,,,,,,,,,,,,,,,,,,,,,,No,,,No,,,No,No,,,No,-113.35465,0,1,0,0,0,0,0,0,0,0,0,1,0,0,0,0,0,0,0,0,0,0,0,0,0,0,0,0,0,11,0,0,1,0
513,INC2012-200,Operation Beyond Design Limits,2/27/2012,Sherwood Park,Enbridge Pipelines Inc.,Closed,53.5467,0,Not Applicable,Not Applicable,No,2012,2011-12-11,2012/02/27 12:00:00 AM Mountain,,,Operation,,4/13/2015,No,No,,,,No,,,,,,,,,Over Pressure,,0,OPR,Line 2,"1219.00000000, 609.40000000, 610.00000000",1282.304863,Crude Oil,,,,,Canada,No,No,Yes,No,0,,Level I,Standard Review - 168 days,No,INC2012-004,,,,,,,,,,,,,,,,,,,,,,,,,,,,No,,,No,,,No,No,,,No,-113.35465,0,1,0,0,0,0,0,0,0,0,0,1,0,0,0,0,0,0,0,0,0,0,0,0,0,0,0,0,0,12,0,0,0,1
514,INC2012-201,Operation Beyond Design Limits,2/27/2012,Sherwood Park,Enbridge Pipelines Inc.,Closed,53.5467,0,Not Applicable,Not Applicable,No,2012,2011-12-21,2012/02/27 12:00:00 AM Mountain,,,Operation,,4/13/2015,No,No,,,,No,,,,,,,,,Over Pressure,,0,OPR,Line 2,"1219.00000000, 609.40000000, 610.00000000",1282.304863,Crude Oil,,,,,Canada,No,No,Yes,No,0,,Level I,Standard Review - 168 days,No,INC2012-004,,,,,,,,,,,,,,,,,,,,,,,,,,,,No,,,No,,,No,No,,,No,-113.35465,0,1,0,0,0,0,0,0,0,0,0,1,0,0,0,0,0,0,0,0,0,0,0,0,0,0,0,0,0,12,0,0,0,1
515,INC2012-202,Operation Beyond Design Limits,2/27/2012,Sherwood Park,Enbridge Pipelines Inc.,Closed,53.5467,0,Not Applicable,Not Applicable,No,2012,2011-12-28,2012/02/27 12:00:00 AM Mountain,,,Operation,,4/13/2015,No,No,,,,No,,,,,,,,,Over Pressure,,0,OPR,Line 2,"1219.00000000, 609.40000000, 610.00000000",1282.304863,Crude Oil,,,,,Canada,No,No,Yes,No,0,,Level I,Standard Review - 168 days,No,INC2012-004,,,,,,,,,,,,,,,,,,,,,,,,,,,,No,,,No,,,No,No,,,No,-113.35465,0,1,0,0,0,0,0,0,0,0,0,1,0,0,0,0,0,0,0,0,0,0,0,0,0,0,0,0,0,12,0,0,0,1
516,INC2013-003,Fire,1/8/2013,Maple,TransCanada PipeLines Limited,Closed,43.87366,0,Not Applicable,Not Applicable,No,2013,2013-01-07,2013/01/07 11:00:00 AM Mountain,,,Operation,Employee / Contractor (Onsite),4/18/2013,Yes,No,,,,No,,Equipment & Electrical,,,,,,,,,0,OPR,TCPL - Station 130 (Maple Compressor Station),,,,,,,,Canada,Yes,No,No,No,0,,Level I,Standard Review - 168 days,No,,,,,,,,,,,,,,,,,,,,,,,,,,,,,No,,,No,,,No,No,,,No,-79.57983,0,0,0,0,0,1,0,0,0,0,0,1,0,0,0,0,0,0,0,0,0,0,0,0,0,0,0,0,0,1,0,0,0,1
517,INC2013-004,Release of Substance,1/8/2013,Goldboro,Maritimes & Northeast Pipeline Management Ltd.,Closed,45.17741,679,Natural Gas - Sweet,Gas,No,2013,2013-01-08,2013/01/08 04:55:00 PM Atlantic,,,Operation,Employee / Contractor (Onsite),12/4/2013,Yes,No,Natural Gas - Sweet,679,No,No,,,,,,,,,,,0,OPR,Goldboro Meter Station,,,,,,,,Canada,Yes,No,No,No,0,,Level I,Standard Review - 168 days,No,,"Station/Facility, Metering, Delivering, Valve",,,,,,,,,,,,,,,,,,,,,,,,,,,No,Replacement,1/8/2013,No,,,No,No,1/8/2013,Replacement,No,-61.6223,1,0,0,0,0,0,0,1,0,0,0,1,0,0,0,0,0,0,0,0,0,0,0,0,0,0,0,0,0,1,0,0,0,1
518,INC2013-005,Release of Substance,1/15/2013,Dryden,TransCanada PipeLines Limited,Closed,49.789417,0,Natural Gas - Sweet,Gas,No,2013,2013-01-14,2013/01/14 02:35:00 PM Mountain,,,Operation,Employee / Contractor (Onsite),5/14/2013,Yes,No,Natural Gas - Sweet,0,No,No,,,,,,,,,,,0,OPR,TCPL - Station 55 (Dryden Compressor Station),,,,,,,,Canada,Yes,No,No,No,0,,Level I,Standard Review - 168 days,No,,"Station/Facility, Compression, Fitting",,NPS 3/4,,,,,,,0,,,,,,,,,,,,,,,,,,No,Replacement,1/25/2013,No,,,No,No,1/25/2013,Replacement,No,-92.765515,1,0,0,0,0,1,0,0,0,0,0,1,0,0,0,0,0,0,0,0,0,0,0,0,0,0,0,0,0,1,0,0,0,1
519,INC2013-007,Release of Substance,1/21/2013,Taylor,"Westcoast Energy Inc., carrying on business as Spectra Energy Transmission",Closed,56.1442,9.1,Condensate,Liquid,No,2013,2013-01-21,2013/01/21 06:00:00 AM Mountain,,,Operation,Employee / Contractor (Onsite),8/29/2013,Yes,No,Condensate,9.1,No,Yes,,,,,,,,,,,0,OPR,Spectra Energy Transmission,,,,,,,,Canada,Yes,No,No,No,5,"Mile Post Mile 36, Alaska Hwy",Level I,Standard Review - 168 days,No,,"Station/Facility, Pumping, Fitting",,,,,,,,,,,,,,,,,,,,,,,,,,,No,,,No,,,No,No,,,No,-120.67138,1,0,0,1,0,0,0,0,0,0,0,1,0,0,0,0,0,0,0,0,0,0,0,0,0,0,0,0,0,1,0,0,0,1
520,INC2013-010,Release of Substance,1/25/2013,Manning,NOVA Gas Transmission Ltd.,Closed,57.11437,0,Natural Gas - Sweet,Gas,No,2013,2013-01-25,2013/01/25 08:30:00 AM Mountain,,,Operation,Employee / Contractor (Onsite),12/20/2013,Yes,No,Natural Gas - Sweet,0,No,No,,,,,,,,,,,0,OPR,,,,,,,,,Canada,No,No,Yes,No,5,Legal Subdivision NW 34-93-22 W5M,Level I,Standard Review - 168 days,No,,"Pipeline, Flange, Gasket/O-ring",,,,,,,,,,,,,,,,,,,,,,,Multi-layer,,,,No,Rebuilt,1/26/2013,No,,,No,No,1/26/2013,Repair,No,-117.45693,1,1,0,0,0,0,0,0,0,0,0,1,0,0,0,0,0,0,0,0,0,0,0,0,0,0,0,0,0,1,0,0,0,1
521,INC2013-011,Release of Substance,1/26/2013,Brockville,TransCanada PipeLines Limited,Closed,44.68344,1,Natural Gas - Sweet,Gas,No,2013,2013-01-25,2013/01/25 07:00:00 PM Mountain,,,Operation,Employee / Contractor (Onsite),8/28/2017,Yes,No,Natural Gas - Sweet,1,No,No,,,,,,,,,,,0,OPR,,,,,,,,,Canada,Yes,No,No,No,6,5 kms east of Brockville,Level I,Standard Review - 168 days,No,,,,,,,,,,,,,,,,,,,,,,,,,,,,,No,,,No,,,No,No,,,No,-75.62107,1,0,0,0,0,1,0,0,0,0,1,1,0,0,0,0,0,0,0,0,0,0,1,0,0,0,0,0,0,1,0,0,0,1
522,INC2013-012,Release of Substance,1/26/2013,Whitecourt,NOVA Gas Transmission Ltd.,Closed,53.96046,0,Natural Gas - Sweet,Gas,No,2013,2013-01-26,2013/01/26 01:45:00 AM Mountain,,,Operation,Employee / Contractor (Onsite),12/4/2013,Yes,No,Natural Gas - Sweet,0,No,No,,,,,,,,,,,0,OPR,,,,,,,,,Canada,Yes,No,No,No,5,28-57-17-W5,Level I,Standard Review - 168 days,No,,"Station/Facility, Compression, Fitting",,NPS 1/2,,,,,,,0,,,,,,,,,,,,,,,,,,No,Replacement,1/26/2013,No,,,No,No,1/26/2013,Replacement,No,-116.46003,1,1,0,0,0,0,0,0,0,0,0,1,0,0,0,0,0,0,0,0,0,0,0,0,0,0,0,0,0,1,0,0,0,1
523,INC2013-015,Serious Injury (CER or TSB),1/30/2013,Fort Nelson,"Westcoast Energy Inc., carrying on business as Spectra Energy Transmission",Closed,59.20188,0,Not Applicable,Not Applicable,Yes,2013,2013-01-29,2013/01/29 05:50:00 PM Mountain,,Processing,Construction,Employee / Contractor (Onsite),11/21/2016,No,No,,,,No,,,,,,,,No,,,0,PPR,WEI - Fort Nelson North Processing Facility,,,,,,,,Canada,No,No,No,No,0,,Level II,Category B,No,,,,,,,,,,,,,,,,,,,,,,,,,,,,,No,,,No,,,No,No,,,No,-121.600162,0,0,0,1,0,0,0,0,0,0,0,1,0,0,0,0,0,0,0,0,0,0,0,0,0,0,0,0,0,1,0,0,0,1
524,INC2013-016,Release of Substance,2/1/2013,Caledonia,Maritimes & Northeast Pipeline Management Ltd.,Closed,44.375026,1000,Natural Gas - Sweet,Gas,No,2013,,2013/02/01 12:30:00 PM Atlantic,,,Operation,Employee / Contractor (Onsite),7/4/2013,Yes,No,Natural Gas - Sweet,1000,No,No,,,,,,,,,,,0,OPR,Mainline,"762.00000000, 863.60000000",574.8807991,Natural Gas,,,,,Canada,Yes,No,No,No,0,Kilometer Post 64,Level I,Standard Review - 168 days,No,,"Pipeline, Valve, Pressure relief, Seal/Packing",,,,,,,,,,,,,,,,,,,,,,,,,,,No,Rebuilt,2/1/2013,No,,,No,No,2/1/2013,Repair,No,-65.031085,1,0,0,0,0,0,0,1,0,0,0,1,0,0,0,0,0,0,0,0,0,0,0,0,0,0,0,0,0,2,0,0,0,1
525,INC2013-018,Release of Substance,2/2/2013,Glenavon,Enbridge Pipelines Inc.,Closed,50.18688,7.7,Crude Oil - Sweet,Liquid,No,2013,2013-02-02,2013/02/02 10:30:00 AM Mountain,,,Operation,Employee / Contractor (Onsite),4/17/2013,Yes,No,Crude Oil - Sweet,7.7,No,Yes,,,,,,,,,,,0,OPR,,,,,,,,,Canada,Yes,No,No,No,0,,Level I,Standard Review - 168 days,No,,,,,,,,,,,,,,,,,,,,,,,,,,,,,No,,,No,,,No,No,,,No,-103.17213,1,0,0,0,1,0,0,0,0,0,1,1,0,0,0,0,0,0,0,0,0,0,1,0,0,0,0,0,0,2,0,0,0,1
526,INC2013-024,Release of Substance,2/10/2013,Fort McMurray,NOVA Gas Transmission Ltd.,Closed,57.02618,0,Natural Gas - Sweet,Gas,No,2013,2013-02-10,2013/02/10 09:00:00 AM Mountain,,,Operation,Employee / Contractor (Onsite),7/5/2013,Yes,No,Natural Gas - Sweet,0,No,No,,,,,,,,,,,0,OPR,,,,,,,,,Canada,No,No,Yes,No,0,Mainline Valve + Offset (km),Level I,Standard Review - 168 days,No,,"Pipeline, Fitting, Tee, Body",,NPS 1,,,,,,,0,,,,,,,,,,,,,,,,,,No,Rebuilt,,No,,,No,No,,Repair,No,-111.69054,1,1,0,0,0,0,0,0,0,0,0,1,0,0,0,0,0,0,0,0,0,0,0,0,0,0,0,0,0,2,0,0,0,1
527,INC2013-030,Release of Substance,2/19/2013,Redcliff,NOVA Gas Transmission Ltd.,Closed,50.060735,0,Natural Gas - Sweet,Gas,No,2013,2013-02-19,2013/02/19 10:18:00 AM Mountain,,,Operation,Employee / Contractor (Onsite),7/5/2013,Yes,No,Natural Gas - Sweet,0,No,No,,,,,,,,,,,0,OPR,NGTL - Stormham Sales Meter Station,,,,,,,,Canada,Yes,No,No,No,0,,Level I,Standard Review - 168 days,No,,"Station/Facility, Metering, Delivering, Piping",,,,,,,,,,,,,,,,,,,,,,,,,,,No,Replacement,2/19/2013,No,,,No,No,2/19/2013,Replacement,No,-110.729591,1,1,0,0,0,0,0,0,0,0,0,1,0,0,0,0,0,0,0,0,0,0,0,0,0,0,0,0,0,2,0,0,0,1
528,INC2013-025,Fire,2/12/2013,Vegreville,NOVA Gas Transmission Ltd.,Closed,54.095087,0,Not Applicable,Not Applicable,No,2013,2013-02-12,2013/02/12 09:30:00 AM Mountain,,,Maintenance,Employee / Contractor (Onsite),2/10/2015,Yes,No,,,,No,,Housekeeping,,,,,,,,,0,OPR,,,,,,,,,Canada,Yes,No,No,No,5,,Level I,Standard Review - 168 days,No,,"Processing Plant, Cooling;Storage, Tank, Aboveground",,,,,,,,,,,,,,,,,,,,,,,,,,,No,,,No,,,No,No,,,No,-112.305849,0,1,0,0,0,0,0,0,0,0,0,1,0,0,0,0,0,0,0,0,0,0,0,0,0,0,0,0,0,2,0,0,0,1
529,INC2013-028,Release of Substance,2/14/2013,Slave Lake,NOVA Gas Transmission Ltd.,Closed,55.22444444,0,Natural Gas - Sweet,Gas,No,2013,2013-02-14,2013/02/14 04:00:00 PM Mountain,,,Operation,Employee / Contractor (Onsite),12/23/2013,Yes,No,Natural Gas - Sweet,0,No,Yes,,,,,,,,,,,0,OPR,,,,,,,,,Canada,No,No,Yes,No,0,,Level I,Standard Review - 168 days,No,,,,,,,,,,,,,,,,,,,,,,,,,,,,,No,,,No,,,No,No,,,No,-114.8005555,1,1,0,0,0,0,0,0,0,0,0,1,0,0,0,0,0,0,0,0,0,0,0,0,0,0,0,0,0,2,0,0,0,1
530,INC2013-031,Release of Substance,2/21/2013,Falcon Lake,TransCanada PipeLines Limited,Closed,49.681165,0,Natural Gas - Sweet,Gas,No,2013,2013-02-18,2013/02/18 02:30:00 PM Mountain,,,Operation,Employee / Contractor (Onsite),9/5/2014,Yes,No,Natural Gas - Sweet,0,No,No,,,,,,,,,,,0,OPR,,,,,,,,,Canada,Yes,No,No,No,0,,Level I,Standard Review - 168 days,No,,"Station/Facility, Compression, Valve;Station/Facility, Compression, Auxiliary power unit",,,,,,,,,,,,,,,,,,,,,,,,,,,No,,,No,,,No,No,,,No,-95.374581,1,0,1,0,0,0,0,0,0,0,0,1,0,0,0,0,0,0,0,0,0,0,0,0,0,0,0,0,0,2,0,0,0,1
531,INC2013-041,Release of Substance,3/8/2013,Falcon Lake,TransCanada PipeLines Limited,Closed,49.681165,0.0001,Natural Gas - Sweet,Gas,No,2013,2013-03-07,2013/03/07 04:30:00 PM Mountain,,,Operation,Employee / Contractor (Onsite),8/28/2017,No,No,Natural Gas - Sweet,0.0001,No,No,,,,,,,,,,,0,OPR,TCPL - Station 45 (Falcon Lake Compressor Station),,,,,,,,Canada,Yes,No,No,No,0,,Level I,Standard Review - 168 days,No,,,,,,,,,,,,,,,,,,,,,,,,,,,,,No,,,No,,,No,No,,,No,-95.374581,1,0,1,0,0,0,0,0,0,0,0,1,0,0,0,0,0,0,0,0,0,0,0,0,0,0,0,0,0,3,1,0,0,0
532,INC2013-038,Release of Substance,3/4/2013,Geraldton,TransCanada PipeLines Limited,Closed,49.801251,0,Natural Gas - Sweet,Gas,No,2013,2013-03-04,2013/03/04 04:30:00 PM Eastern,,,Operation,Employee / Contractor (Onsite),9/5/2014,Yes,No,Natural Gas - Sweet,0,No,No,,,,,,,,,,,0,OPR,TCPL - Station 80 (Geraldton Compressor Station),,,,,,,,Canada,Yes,No,No,No,0,,Level I,Standard Review - 168 days,No,,"Station/Facility, Compression, Fitting",,,,,,,,,,,,,,,,,,,,,,,,,,,No,,,No,,,No,No,,,No,-86.760603,1,0,0,0,0,1,0,0,0,0,0,1,0,0,0,0,0,0,0,0,0,0,0,0,0,0,0,0,0,3,1,0,0,0
533,INC2013-039,Release of Substance,3/8/2013,Chetwynd,"Westcoast Energy Inc., carrying on business as Spectra Energy Transmission",Closed,55.569092,1,Sulphur Dioxide,Miscellaneous,No,2013,2013-03-08,2013/03/08 08:15:00 AM Mountain,,,Operation,,5/7/2015,Yes,No,Sulphur Dioxide,1,No,No,,,,,,,,,,,0,PPR,WEI - Pine River Gas Plant,,,,,,,,Canada,No,No,No,No,0,,Level I,Standard Review - 168 days,No,,"Processing Plant, Sulphur plant;Pipeline, Fitting, Elbow, Body",,NPS 30,Carbon Steel,241 - B,,,,,,,187,,,,,,,,,,,,,,,,No,,,No,,,No,No,,,No,-121.944662,1,0,0,1,0,0,0,0,0,0,0,1,0,0,0,0,0,0,0,0,0,0,0,0,0,0,0,0,0,3,1,0,0,0
534,INC2013-043,Release of Substance,3/15/2013,Fort Nelson,"Westcoast Energy Inc., carrying on business as Spectra Energy Transmission",Closed,59.20186,2,Condensate,Liquid,No,2013,2013-03-13,2013/03/13 08:00:00 AM Pacific,,,Operation,Employee / Contractor (Onsite),8/8/2013,No,No,Condensate,2,No,No,,,,,,,,,,,0,OPR,WEI - Cabin Lake Booster Station,,,,,,,,Canada,Yes,No,No,No,0,,Level I,Standard Review - 168 days,No,,,,,,,,,,,,,,,,,,,,,,,,,,,,,No,,,No,,,No,No,,,No,-121.596498,1,0,0,1,0,0,0,0,0,0,1,1,0,0,0,0,0,0,0,0,0,0,0,0,1,0,0,0,0,3,1,0,0,0
535,INC2013-044,Fire,3/16/2013,Hamburg,NOVA Gas Transmission Ltd.,Closed,57.367714,0,Not Applicable,Not Applicable,No,2013,2013-03-16,2013/03/16 11:45:00 AM Mountain,,,Construction,Employee / Contractor (Onsite),7/4/2013,No,No,,,,No,,Equipment & Electrical,,,,,,,,,0,OPR,NGTL - Hidden Lake North Compressor Station,,,,,,,,Canada,Yes,No,No,No,0,3-32-96-11-W6M,Level I,Standard Review - 168 days,No,,,,,,,,,,,,,,,,,,,,,,,,,,,,,No,,,No,,,No,No,,,No,-119.752776,0,1,0,0,0,0,0,0,0,0,0,1,0,0,0,0,0,0,0,0,0,0,0,0,0,0,0,0,0,3,1,0,0,0
536,INC2013-047,Operation Beyond Design Limits,3/18/2013,Hardisty,TransCanada Keystone Pipeline GP Ltd.,Closed,52.65396,0,Not Applicable,Not Applicable,No,2013,2013-03-17,2013/03/17 02:20:00 PM Mountain,,Transmission,Operation,Employee / Contractor (Onsite),11/9/2017,Yes,No,,,,No,,,,,,,,,Over Pressure,,0,OPR,,,,,,,,,Canada,No,No,Yes,No,5,Kilometer Post 0.0,Level I,Standard Review - 168 days,No,,"Pipeline, Pipe, Body",,,,,,,,,,,,,,,,,,,,,,,,,,,No,,,No,,,No,No,,,No,-111.26844,0,1,0,0,0,0,0,0,0,0,1,1,0,0,0,0,0,0,0,0,0,0,0,0,0,0,0,0,0,3,1,0,0,0
537,INC2013-058,Fire,4/5/2013,Hardisty,TransCanada Keystone Pipeline GP Ltd.,Closed,52.653959,0,Not Applicable,Not Applicable,No,2013,2013-04-05,2013/04/05 06:15:00 AM Mountain,,,Construction,3rd Party / Other Company,7/4/2013,No,No,,,,No,,Under Investigation or Unknown,,,,,,,,,0,OPR,,,,,,,,,Canada,Yes,No,No,No,0,,Level I,Standard Review - 168 days,No,,,,,,,,,,,,,,,,,,,,,,,,,,,,,No,,,No,,,No,No,,,No,-111.268469,0,1,0,0,0,0,0,0,0,0,0,1,0,0,0,0,0,0,0,0,0,0,0,0,0,0,0,0,0,4,1,0,0,0
538,INC2013-052,"Serious Injury (CER or TSB), Fire, Release of Substance",3/26/2013,Fort Nelson,"Westcoast Energy Inc., carrying on business as Spectra Energy Transmission",Closed,58.653246,0.01,Natural Gas - Sweet,Gas,Yes,2013,2013-03-26,2013/03/26 12:30:00 PM Pacific,No pipeline interruption,Transmission,Construction,Employee / Contractor (Onsite),11/7/2017,Yes,No,Natural Gas - Sweet,0.01,No,No,,Welding or Cutting,,,Burns,4,,No,,,0,OPR,,,,,,,,,Canada,No,No,Yes,No,0,,Level II,Category B,No,,,,,,,,,,,,,,,,,,,,,,,,,,,,,No,,,No,,,No,No,,,No,-122.684823,1,0,0,1,0,0,0,0,0,0,0,1,0,0,0,0,0,0,0,0,0,0,0,0,0,0,0,0,0,3,1,0,0,0
539,INC2013-053,Release of Substance,4/1/2013,Edson,Alliance Pipeline Ltd.,Closed,53.66111,0,Natural Gas - Sweet,Gas,No,2013,2013-03-30,2013/03/30 09:00:00 AM Mountain,,Gathering,Construction,Employee / Contractor (Onsite),10/15/2014,No,No,Natural Gas - Sweet,0,No,No,,,,,,,,,,,0,OPR,,,,,,,,,Canada,No,No,Yes,No,0,Legal Subdivision SW 16-54-18 W5M,Level I,Standard Review - 168 days,No,,"Pipeline, Pipe, Body",,,,,,,,,,,,,,,,,,,,,,,,,,,No,,,No,,,No,No,,,No,-116.59955,1,1,0,0,0,0,0,0,0,0,0,1,0,0,0,0,0,0,0,0,0,0,0,0,0,0,0,0,0,3,1,0,0,0
540,INC2013-056,"Fire, Release of Substance",4/4/2013,Windsor,Plains Midstream Canada ULC,Closed,42.281736,30,Mixed HVP Hydrocarbons,Gas,No,2013,2013-04-04,2013/04/04 06:30:00 AM Mountain,,Distribution,Operation,Employee / Contractor (Onsite),3/28/2017,No,No,Mixed HVP Hydrocarbons,30,Yes,No,,Equipment & Electrical,,,,,,,,,0,OPR,Plains - Windsor Terminal,,,,,,,,Canada,Yes,No,No,No,5,Well Site,Level II,Category B,No,,,,,,,,,,,,,,,,,,,,,,,,,,,,,No,,,No,,,No,No,,,No,-83.07803,1,0,0,0,0,1,0,0,0,0,1,1,0,0,0,0,0,0,0,0,0,0,0,0,0,1,0,0,0,4,1,0,0,0
541,INC2013-059,Operation Beyond Design Limits,4/9/2013,Hanna,NOVA Gas Transmission Ltd.,Closed,51.9565,0,Not Applicable,Not Applicable,No,2013,2013-04-08,2013/04/08 10:20:00 AM Mountain,,,Operation,Employee / Contractor (Onsite),2/28/2017,No,No,,,,No,,,,,,,,,Inappropriate Product,,0,OPR,NGTL - Byemoor Meter Station,,,,,,,,Canada,Yes,No,No,No,0,,Level I,Standard Review - 168 days,No,,,,,,,,,,,,,,,,,,,,,,,,,,,,,No,,,No,,,No,No,,,No,-112.370504,0,1,0,0,0,0,0,0,0,0,0,1,0,0,0,0,0,0,0,0,0,0,0,0,0,0,0,0,0,4,1,0,0,0
542,INC2013-062,Operation Beyond Design Limits,4/13/2013,Windsor,Kinder Morgan Cochin ULC,Closed,42.281736,0,Not Applicable,Not Applicable,No,2013,2013-04-09,2013/04/13 12:00:00 AM Mountain,,,Operation,Employee / Contractor (Onsite),8/22/2014,Yes,No,,,,Yes,,,,,,,,,Over Pressure,,0,OPR,,,,,,,,,Canada,Yes,No,No,No,0,,Level I,Standard Review - 168 days,No,,,,,,,,,,,,,,,,,,,,,,,,,,,,,No,,,No,,,No,No,,,No,-83.07803,0,0,0,0,0,1,0,0,0,0,0,1,0,0,0,0,0,0,0,0,0,0,0,0,0,0,0,0,0,4,1,0,0,0
543,INC2013-063,Release of Substance,4/16/2013,Fredericton,Emera Brunswick Pipeline Company Ltd.,Closed,45.218884,0.028,Natural Gas - Sweet,Gas,No,2013,,2013/04/15 11:05:00 AM Atlantic,,Distribution,Operation,Employee / Contractor (Onsite),9/23/2014,No,No,Natural Gas - Sweet,0.028,No,No,,,,,,,,,,,0,OPR,Emera - Red Head Metre Station,,,,,,,,Canada,Yes,No,No,No,0,,Level I,Standard Review - 168 days,No,,"Station/Facility, Metering, Delivering, Fitting",,,,,,,,,,,,,,,,,,,,,,,,,,,No,,,No,,,No,No,,,No,-65.984989,1,0,0,0,0,0,1,0,0,0,0,1,0,0,0,0,0,0,0,0,0,0,0,0,0,0,0,0,0,4,1,0,0,0
544,INC2013-064,Release of Substance,4/18/2013,Kerrobert,Enbridge Pipelines Inc.,Closed,51.865344,4,Crude Oil - Sweet,Liquid,No,2013,2013-04-18,2013/04/18 02:45:00 AM Mountain,,,Operation,Employee / Contractor (Onsite),9/29/2016,Yes,No,Crude Oil - Sweet,4,No,No,,,,,,,,,,,0,OPR,EPI - Kerrobert Pump Station,,,,,,,,Canada,Yes,No,No,No,0,,Level I,Standard Review - 168 days,No,,"Station/Facility, Pumping, Valve",,,,,,,,,,,,,,,,,,,,,,,,,,,No,,,No,,,No,No,,,No,-109.026045,1,0,0,0,1,0,0,0,0,0,0,1,0,0,0,0,0,0,0,0,0,0,0,0,0,0,0,0,0,4,1,0,0,0
545,INC2013-066,Release of Substance,4/26/2013,Dartmouth,Maritimes & Northeast Pipeline Management Ltd.,Closed,44.68563,736,Natural Gas - Sweet,Gas,No,2013,2013-04-25,2013/04/25 10:40:00 PM Atlantic,,Gathering,Operation,Employee / Contractor (Onsite),1/29/2014,No,No,Natural Gas - Sweet,736,No,Yes,,,,,,,,,,,0,OPR,Halifax Lateral,323.9,126.1401343,Natural Gas,,,,,Canada,Yes,No,No,No,0,,Level I,Standard Review - 168 days,No,,,,,,,,,,,,,,,,,,,,,,,,,,,,,No,,,No,,,No,No,,,No,-63.59679,1,0,0,0,0,0,0,1,0,0,0,1,0,0,0,0,0,0,0,0,0,0,0,0,0,0,0,0,0,4,1,0,0,0
546,INC2013-067,Operation Beyond Design Limits,4/26/2013,Edmonton,Enbridge Pipelines Inc.,Closed,53.5475,0,Not Applicable,Not Applicable,No,2013,2013-04-25,2013/04/25 09:18:00 PM Mountain,,,Operation,Employee / Contractor (Onsite),8/22/2014,No,No,,,,No,,,,,,,,,Over Pressure,,0,OPR,Edmonton Terminal,,,,,,,,Canada,Yes,No,No,No,0,,Level I,Standard Review - 168 days,No,,,,,,,,,,,,,,,,,,,,,,,,,,,,,No,,,No,,,No,No,,,No,-113.35566,0,1,0,0,0,0,0,0,0,0,0,1,0,0,0,0,0,0,0,0,0,0,0,0,0,0,0,0,0,4,1,0,0,0
547,INC2013-069,Operation Beyond Design Limits,4/30/2013,Not specified,NOVA Gas Transmission Ltd.,Closed,54.5353,0,Not Applicable,Not Applicable,No,2013,,2013/04/30 04:20:00 AM Mountain,,,Operation,Employee / Contractor (Onsite),8/26/2014,No,No,,,,No,,,,,,,,,Inappropriate Product,,0,OPR,,,,,,,,,Canada,Yes,No,No,No,0,,Level I,Standard Review - 168 days,No,,,,,,,,,,,,,,,,,,,,,,,,,,,,,No,,,No,,,No,No,,,No,-117.10964,0,1,0,0,0,0,0,0,0,0,0,1,0,0,0,0,0,0,0,0,0,0,0,0,0,0,0,0,0,4,1,0,0,0
548,INC2013-070,Fire,5/1/2013,Edmonton,Enbridge Pipelines Inc.,Closed,53.547403,0,Not Applicable,Not Applicable,No,2013,,2013/04/30 09:43:00 AM Mountain,,,Operation,Employee / Contractor (Onsite),9/4/2013,No,No,,,,Yes,,Equipment & Electrical,,,,,,,,,0,OPR,Edmonton Terminal,,,,,,,,Canada,Yes,No,No,No,0,,Level I,Standard Review - 168 days,No,,,,,,,,,,,,,,,,,,,,,,,,,,,,,No,,,No,,,No,No,,,No,-113.355714,0,1,0,0,0,0,0,0,0,0,0,1,0,0,0,0,0,0,0,0,0,0,0,0,0,0,0,0,0,4,1,0,0,0
549,INC2013-071,Fire,5/3/2013,Edmonton,Enbridge Pipelines Inc.,Closed,53.547403,0,Not Applicable,Not Applicable,No,2013,,2013/04/25 01:00:00 PM Mountain,,,Construction,Employee / Contractor (Onsite),9/4/2013,No,No,,,,No,,Housekeeping,,,,,,,,,0,OPR,Edmonton Terminal,,,,,,,,Canada,Yes,No,No,No,0,,Level I,Standard Review - 168 days,No,,,,,,,,,,,,,,,,,,,,,,,,,,,,,No,,,No,,,No,No,,,No,-113.355714,0,1,0,0,0,0,0,0,0,0,0,1,0,0,0,0,0,0,0,0,0,0,0,0,0,0,0,0,0,4,1,0,0,0
550,INC2013-072,Fire,5/4/2013,Vegreville,NOVA Gas Transmission Ltd.,Closed,54.095087,0,Not Applicable,Not Applicable,No,2013,,2013/05/03 09:25:00 AM Mountain,,,Operation,Employee / Contractor (Onsite),9/27/2013,No,No,,,,No,,Equipment & Electrical,,,,,,,,,0,OPR,NGTL - Smoky Lake Compressor Station,,,,,,,,Canada,Yes,No,No,No,0,,Level I,Standard Review - 168 days,No,,,,,,,,,,,,,,,,,,,,,,,,,,,,,No,,,No,,,No,No,,,No,-112.305849,0,1,0,0,0,0,0,0,0,0,0,1,0,0,0,0,0,0,0,0,0,0,0,0,0,0,0,0,0,5,1,0,0,0
551,INC2013-073,Release of Substance,5/7/2013,Saint John,Maritimes & Northeast Pipeline Management Ltd.,Closed,45.254932,0,Natural Gas - Sweet,Gas,No,2013,,2013/05/06 11:00:00 AM Atlantic,,,Operation,Employee / Contractor (Onsite),1/29/2014,No,No,Natural Gas - Sweet,0,No,Yes,,,,,,,,,,,0,OPR,Irving Meter Station,,,,,,,,Canada,Yes,No,No,No,0,,Level I,Standard Review - 168 days,No,,,,,,,,,,,,,,,,,,,,,,,,,,,,,No,,,No,,,No,No,,,No,-65.988823,1,0,0,0,0,0,1,0,0,0,0,1,0,0,0,0,0,0,0,0,0,0,0,0,0,0,0,0,0,5,1,0,0,0
552,INC2013-074,Operation Beyond Design Limits,5/10/2013,Kerrobert,Enbridge Pipelines Inc.,Closed,51.868264,0,Not Applicable,Not Applicable,No,2013,2013-05-10,2013/05/10 02:00:00 PM Mountain,,,Operation,Employee / Contractor (Onsite),10/15/2014,Yes,No,,,,No,,,,,,,,,Over Pressure,,0,OPR,Kerrobert Terminal,,,,,,,,Canada,Yes,No,No,No,0,,Level I,Standard Review - 168 days,No,,"Pipeline, Pipe, Body",,,,,,,,,,,,,,,,,,,,,,,,,,,No,,,No,,,No,No,,,No,-109.036068,0,0,0,0,1,0,0,0,0,0,0,1,0,0,0,0,0,0,0,0,0,0,0,0,0,0,0,0,0,5,1,0,0,0
553,INC2013-075,Release of Substance,5/12/2013,Fairview,NOVA Gas Transmission Ltd.,Closed,56.035238,0,Natural Gas - Sweet,Gas,No,2013,2013-05-11,2013/05/11 01:00:00 PM Mountain,,,Operation,Employee / Contractor (Onsite),2/7/2014,Yes,No,Natural Gas - Sweet,0,No,Yes,,,,,,,,,,,0,OPR,NGTL - Cardinal Lake Compressor Station,,,,,,,,Canada,Yes,No,No,No,0,,Level I,Standard Review - 168 days,No,,,,,,,,,,,,,,,,,,,,,,,,,,,,,No,,,No,,,No,No,,,No,-117.966456,1,1,0,0,0,0,0,0,0,0,0,1,0,0,0,0,0,0,0,0,0,0,0,0,0,0,0,0,0,5,1,0,0,0
554,INC2013-077,Release of Substance,5/15/2013,Saint John,Maritimes & Northeast Pipeline Management Ltd.,Closed,45.254932,0,Natural Gas - Sweet,Gas,No,2013,2013-05-15,2013/05/15 10:30:00 AM Atlantic,,,Operation,Employee / Contractor (Onsite),4/2/2014,Yes,No,Natural Gas - Sweet,0,No,No,,,,,,,,,,,0,OPR,Irving Meter Station,,,,,,,,Canada,Yes,No,No,No,6,,Level I,Standard Review - 168 days,No,,"Station/Facility, Metering, Delivering, Valve",,,,,,,,,,,,,,,,,,,,,,,,,,,No,,,No,,,No,No,,,No,-65.988823,1,0,0,0,0,0,1,0,0,0,0,1,0,0,0,0,0,0,0,0,0,0,0,0,0,0,0,0,0,5,1,0,0,0
555,INC2013-078,Release of Substance,5/15/2013,Sackville,Maritimes & Northeast Pipeline Management Ltd.,Closed,45.897931,0,Natural Gas - Sweet,Gas,No,2013,2013-05-15,2013/05/15 09:00:00 AM Atlantic,,,Operation,Employee / Contractor (Onsite),4/2/2014,Yes,No,Natural Gas - Sweet,0,No,No,,,,,,,,,,,0,OPR,MLV # 268,,,,,,,,Canada,No,No,Yes,No,6,,Level I,Standard Review - 168 days,No,,"Pipeline, Fitting, Other (please explain)",,,,,,,,,,,,,,,,,,,,,,,,,,,No,,,No,,,No,No,,,No,-64.368366,1,0,0,0,0,0,1,0,0,0,0,1,0,0,0,0,0,0,0,0,0,0,0,0,0,0,0,0,0,5,1,0,0,0
556,INC2013-079,Release of Substance,5/15/2013,Moncton,Maritimes & Northeast Pipeline Management Ltd.,Closed,46.087971,0,Natural Gas - Sweet,Gas,No,2013,2013-05-15,2013/05/15 10:00:00 AM Atlantic,,,Operation,Employee / Contractor (Onsite),4/2/2014,Yes,No,Natural Gas - Sweet,0,No,No,,,,,,,,,,,0,OPR,Moncton PRS,,,,,,,,Canada,Yes,No,No,No,6,,Level I,Standard Review - 168 days,No,,"Pipeline, Valve, Pressure relief, Other (please explain)",,,,,,,,,,,,,,,,,,,,,,,,,,,No,,,No,,,No,No,,,No,-64.77714,1,0,0,0,0,0,1,0,0,0,0,1,0,0,0,0,0,0,0,0,0,0,0,0,0,0,0,0,0,5,1,0,0,0
557,INC2013-080,Release of Substance,5/15/2013,Moncton,Maritimes & Northeast Pipeline Management Ltd.,Closed,46.087971,0,Natural Gas - Sweet,Gas,No,2013,2013-05-15,2013/05/15 10:00:00 AM Atlantic,,,Operation,Employee / Contractor (Onsite),4/2/2014,Yes,No,Natural Gas - Sweet,0,No,No,,,,,,,,,,,0,OPR,MLV #317,,,,,,,,Canada,Yes,No,No,No,6,,Level I,Standard Review - 168 days,No,,"Pipeline, Fitting, Other (please explain)",,,,,,,,,,,,,,,,,,,,,,,,,,,No,,,No,,,No,No,,,No,-64.77714,1,0,0,0,0,0,1,0,0,0,0,1,0,0,0,0,0,0,0,0,0,0,0,0,0,0,0,0,0,5,1,0,0,0
558,INC2013-083,Operation Beyond Design Limits,5/23/2013,Wrigley,Enbridge Pipelines (NW) Inc.,Closed,63.08805,0,Not Applicable,Not Applicable,No,2013,2013-05-23,2013/05/23 04:35:00 PM Eastern,,,Maintenance,Employee / Contractor (Onsite),9/19/2013,Yes,No,,,,Yes,,,,,,,,,Over Pressure,,0,OPR,,,,,,,,,Canada,Yes,No,No,No,0,Kilometer Post 336,Level I,Standard Review - 168 days,No,,"Station/Facility, Pumping, Pump",,,,,,,,,1440,,,,,,,,,,,,,,,,,,No,,,No,,,No,No,,,No,-123.2205611,0,0,0,0,0,0,0,0,0,1,0,1,0,0,0,0,0,0,0,0,0,0,0,0,0,0,0,0,0,5,1,0,0,0
559,INC2013-086,Operation Beyond Design Limits,6/6/2013,Edmonton,Enbridge Pipelines Inc.,Closed,53.547403,0,Not Applicable,Not Applicable,No,2013,2013-06-05,2013/06/05 11:08:00 PM Mountain,,,Operation,Employee / Contractor (Onsite),5/11/2017,Yes,No,,,,No,,,,,,,,,Over Pressure,,0,OPR,Edmonton Terminal,,,,,,,,Canada,Yes,No,No,No,0,,Level I,Standard Review - 168 days,No,,"Pipeline, Pipe, Body",,,,,,,,,,,,,,,,,,,,,,,,,,,No,,,No,,,No,No,,,No,-113.355714,0,1,0,0,0,0,0,0,0,0,0,1,0,0,0,0,0,0,0,0,0,0,0,0,0,0,0,0,0,6,0,1,0,0
560,INC2013-088,Release of Substance,6/10/2013,Saint John,Maritimes & Northeast Pipeline Management Ltd.,Closed,45.279238,0.3,Natural Gas - Sweet,Gas,No,2013,,2013/06/10 11:00:00 AM Atlantic,,,Operation,Employee / Contractor (Onsite),10/20/2014,Yes,No,Natural Gas - Sweet,0.3,No,No,,,,,,,,,,,0,OPR,Irving Meter Station,,,,,,,,Canada,Yes,No,No,No,0,,Level I,Standard Review - 168 days,No,,"Station/Facility, Metering, Delivering, Fitting",,,,,,,,,,,,,,,,,,,,,,,,,,,No,,,No,,,No,No,,,No,-66.006686,1,0,0,0,0,0,1,0,0,0,0,1,0,0,0,0,0,0,0,0,0,0,0,0,0,0,0,0,0,6,0,1,0,0
561,INC2013-089,Release of Substance,6/10/2013,Rollingdam,Emera Brunswick Pipeline Company Ltd.,Closed,45.271448,0,Natural Gas - Sweet,Gas,No,2013,,2013/06/10 12:15:00 PM Atlantic,,,Operation,Employee / Contractor (Onsite),9/2/2014,Yes,No,Natural Gas - Sweet,,No,No,,,,,,,,,,,0,OPR,,,,,,,,,Canada,No,No,Yes,No,0,,Level I,Standard Review - 168 days,No,,"Pipeline, Fitting, Plug, Body",,,,,,,,,,,,,,,,,,,,,,,,,,,No,,,No,,,No,No,,,No,-67.03329,1,0,0,0,0,0,1,0,0,0,0,1,0,0,0,0,0,0,0,0,0,0,0,0,0,0,0,0,0,6,0,1,0,0
562,INC2013-091,Release of Substance,6/11/2013,Hilda,NOVA Gas Transmission Ltd.,Closed,50.457417,0,Natural Gas - Sweet,Gas,No,2013,,2013/06/11 10:00:00 AM Mountain,,,Operation,Employee / Contractor (Onsite),2/7/2014,Yes,No,Natural Gas - Sweet,0,No,Yes,,,,,,,,,,,0,OPR,NGTL - Medicine Hat Meter Station,,,,,,,,Canada,Yes,No,No,No,0,,Level I,Standard Review - 168 days,No,,,,,,,,,,,,,,,,,,,,,,,,,,,,,No,,,No,,,No,No,,,No,-110.196855,1,1,0,0,0,0,0,0,0,0,0,1,0,0,0,0,0,0,0,0,0,0,0,0,0,0,0,0,0,6,0,1,0,0
563,INC2013-094,Release of Substance,6/14/2013,Saint George,Emera Brunswick Pipeline Company Ltd.,Closed,45.1291,0.3,Natural Gas - Sweet,Gas,No,2013,,2013/06/14 12:00:00 AM Mountain,No pipeline interruption,,Operation,Employee / Contractor (Onsite),3/19/2015,Yes,No,Natural Gas - Sweet,0.3,No,No,,,,,,,,,,,0,OPR,BRUNSWICK PIPELINE,762,142.8732829,Natural Gas,,,,,Canada,Yes,No,No,No,0,,Level I,Standard Review - 168 days,No,,"Pipeline, Fitting, Plug, Body",,,,,,,,,,,,,,,,,,,,,,,,,,,No,,,No,,,No,No,,,No,-66.819134,1,0,0,0,0,0,1,0,0,0,0,1,0,0,0,0,0,0,0,0,0,0,0,0,0,0,0,0,0,6,0,1,0,0
564,INC2013-095,Release of Substance,6/14/2013,Saint George,Maritimes & Northeast Pipeline Management Ltd.,Closed,45.156922,0.85,Natural Gas - Sweet,Gas,No,2013,,2013/06/14 12:00:00 AM Mountain,,,Operation,Employee / Contractor (Onsite),2/7/2014,No,No,Natural Gas - Sweet,0.85,No,Yes,,,,,,,,,,,0,OPR,MNE St. George Meter Station,,,,,,,,Canada,Yes,No,No,No,0,,Level I,Standard Review - 168 days,No,,,,,,,,,,,,,,,,,,,,,,,,,,,,,No,,,No,,,No,No,,,No,-66.769837,1,0,0,0,0,0,1,0,0,0,0,1,0,0,0,0,0,0,0,0,0,0,0,0,0,0,0,0,0,6,0,1,0,0
565,INC2013-096,Release of Substance,6/19/2013,Caron,TransCanada PipeLines Limited,Closed,50.480661,5000,Natural Gas - Sweet,Gas,No,2013,,2013/06/19 12:15:00 PM Mountain,,,Operation,Employee / Contractor (Onsite),9/27/2013,No,No,Natural Gas - Sweet,5000,No,No,,,,,,,,,,,0,OPR,TCPL - Station 13 (Caron Compressor Station),,,,,,,,Canada,Yes,No,No,No,0,,Level I,Standard Review - 168 days,No,,,,,,,,,,,,,,,,,,,,,,,,,,,,,No,,,No,,,No,No,,,No,-105.867038,1,0,0,0,1,0,0,0,0,0,1,1,0,0,0,0,0,0,0,0,0,0,0,0,0,0,0,0,0,6,0,1,0,0
566,INC2013-097,Release of Substance,6/19/2013,Fort Nelson,"Westcoast Energy Inc., carrying on business as Spectra Energy Transmission",Closed,59.20186,0.0001,Natural Gas - Sour,Gas,Yes,2013,,2013/06/19 11:00:00 AM Pacific,,,Maintenance,Employee / Contractor (Onsite),1/25/2018,Yes,No,Natural Gas - Sour,0.0001,No,No,,,,,,,,,,,0,OPR,,,,,,,,,Canada,No,No,Yes,No,0,,Level I,Standard Review - 168 days,No,,"Pipeline, Flange, Gasket/O-ring",,,,,,,,,,,,,,,,,,,,,,,,,,,No,,,No,,,No,No,,,No,-121.596498,1,0,0,1,0,0,0,0,0,0,0,1,0,0,0,0,0,0,0,0,0,0,0,0,0,0,0,0,0,6,0,1,0,0
567,INC2013-099,Release of Substance,6/26/2013,Hope,Trans Mountain Pipeline ULC,Closed,49.615781,17.8,Crude Oil - Sweet,Liquid,Yes,2013,,2013/06/26 01:09:00 PM Mountain,,,Maintenance,Employee / Contractor (Onsite),1/22/2015,Yes,No,Crude Oil - Sweet,17.8,Yes,Yes,,,,,,,,,,,0,OPR,Mainline,610,1596.893888,"Crude Oil, Crude Oil Sour Light, Crude Oil Sweet Heavy, Crude Oil Sweet Light",,,,,Canada,No,No,Yes,Yes,0,Kilometer Post KP 966.89,Level III,Category C,Yes,"INC2013-092, REM2013-99","Pipeline, Pipe, Seam weld",,NPS 24,,,,,,,,,1940,,,,,,,,,,,,Coal Tar Enamel Narrow,,,1952,No,,,No,,,No,No,,,No,-121.034754,1,0,0,1,0,0,0,0,0,0,0,1,0,0,0,0,0,0,0,0,0,0,0,0,0,0,0,0,0,6,0,1,0,0
568,INC2013-101,Operation Beyond Design Limits,7/1/2013,Montreal,Trans-Northern Pipelines Inc.,Closed,45.625321,0,Not Applicable,Not Applicable,No,2013,2013-06-30,2013/06/30 08:30:00 AM Eastern,,,Operation,Employee / Contractor (Onsite),11/15/2013,No,No,,,,Yes,,,,,,,,,Over Pressure,,0,OPR,Mainline,273.1,635.0188165,Refined Products-Aviation,,,,,Canada,Yes,No,No,No,0,.3 mile from Montreal st,Level I,Standard Review - 168 days,No,"INC2013-202, INC2013-203, INC2015-002, INC2016-008",,,,,,,,,,,,,,,,,,,,,,,,,,,,No,,,No,,,No,No,,,No,-73.537743,0,0,0,0,0,0,0,0,1,0,0,1,0,0,0,0,0,0,0,0,0,0,0,0,0,0,0,0,0,6,0,1,0,0
569,INC2013-103,Release of Substance,7/2/2013,Waasis,Maritimes & Northeast Pipeline Management Ltd.,Closed,45.828977,0.0001,Natural Gas - Sweet,Gas,No,2013,2013-07-02,2013/07/02 10:20:00 AM Atlantic,,,Operation,Employee / Contractor (Onsite),8/21/2015,Yes,No,Natural Gas - Sweet,0.0001,No,No,,,,,,,,,,,0,OPR,,,,,,,,,Canada,Yes,No,No,No,0,,Level I,Standard Review - 168 days,No,INC2013-111,"Station/Facility, Metering, Receiving, Valve, Ball, Thread",,,,,,,,,,,,,,,,,,,,,,,,,,,No,,,Yes,,,No,Yes,,,No,-66.578676,1,0,0,0,0,0,1,0,0,0,0,1,0,0,0,0,0,0,0,0,0,0,0,0,0,0,0,0,0,7,0,1,0,0
570,INC2013-104,Release of Substance,7/3/2013,Hardisty,TransCanada Keystone Pipeline GP Ltd.,Closed,52.653959,1.59,Crude Oil - Sweet,Liquid,No,2013,2013-07-02,2013/07/02 04:30:00 PM Mountain,,,Construction,Employee / Contractor (Onsite),12/3/2018,No,No,Crude Oil - Sweet,1.59,No,No,,,,,,,,,,,0,OPR,Hardisty terminal,,,,,,,,Canada,Yes,No,No,No,0,Hardisty terminal,Level I,Standard Review - 168 days,No,,,,,,,,,,,,,,,,,,,,,,,,,,,,,No,,,No,,,No,No,,,No,-111.268469,1,1,0,0,0,0,0,0,0,0,0,1,0,0,0,0,0,0,0,0,0,0,0,0,0,0,0,0,0,7,0,1,0,0
571,INC2013-107,Release of Substance,7/8/2013,Slave Lake,NOVA Gas Transmission Ltd.,Closed,55.29782,0,Natural Gas - Sweet,Gas,No,2013,2013-07-08,2013/07/08 02:00:00 PM Mountain,,,Operation,Employee / Contractor (Onsite),7/6/2017,No,No,Natural Gas - Sweet,0,No,No,,,,,,,,,,,0,OPR,PAUL LAKE CROSSOVER (PHASE II) - NPS 30,762,57.04868864,Natural Gas,,,,,Canada,No,No,Yes,No,3,Legal Subdivision NW6-73-24-W4,Level I,Standard Review - 168 days,No,INC2013-146,,,,,,,,,,,,,,,,,,,,,,,,,,,,No,,,No,,,No,No,,,No,-113.69498,1,1,0,0,0,0,0,0,0,0,0,1,0,0,0,0,0,0,0,0,0,0,0,0,0,0,0,0,0,7,0,1,0,0
572,INC2013-110,"Fire, Release of Substance",7/5/2013,Fort Nelson,"Westcoast Energy Inc., carrying on business as Spectra Energy Transmission",Closed,58.653246,20500,Natural Gas - Sour,Gas,Yes,2013,2013-06-21,2013/06/21 09:28:00 AM Mountain,,,Operation,,4/6/2017,Yes,No,Natural Gas - Sour,20500,No,No,,Other Event (Nature or 3rd Party),,,,,,,,,0,PPR,WEI - Fort Nelson Gas Plant,,,,,,,,Canada,No,No,No,No,0,,Level I,Standard Review - 168 days,No,,,,,,,,,,,,,,,,,,,,,,,,,,,,,No,,,No,,,No,No,,,No,-122.684823,1,0,0,1,0,0,0,0,0,0,0,1,0,0,0,0,0,0,0,0,0,0,0,0,0,0,0,0,0,6,0,1,0,0
573,INC2013-111,Release of Substance,7/12/2013,Fredericton,Maritimes & Northeast Pipeline Management Ltd.,Closed,45.9627,0.0001,Natural Gas - Sweet,Gas,No,2013,2013-07-12,2013/07/12 09:10:00 PM Eastern,,,Operation,Employee / Contractor (Onsite),8/21/2015,Yes,No,Natural Gas - Sweet,0.0001,No,No,,,,,,,,,,,0,OPR,Waasic MS,,,,,,,,Canada,Yes,No,No,No,0,,Level I,Standard Review - 168 days,No,INC2013-103,"Station/Facility, Metering, Receiving, Valve, Ball, Thread",,,,,,,,,,,,,,,,,,,,,,,,,,,No,,,Yes,,,No,Yes,,,No,-66.6432,1,0,0,0,0,0,1,0,0,0,0,1,0,0,0,0,0,0,0,0,0,0,0,0,0,0,0,0,0,7,0,1,0,0
574,INC2013-112,Release of Substance,7/17/2013,Ile des Chnes,TransCanada PipeLines Limited,Closed,49.720115,1.9,Lube Oil,Liquid,No,2013,2013-07-17,2013/07/17 12:00:00 AM Mountain,,,Operation,Employee / Contractor (Onsite),9/1/2017,Yes,No,Lube Oil,1.9,No,No,,,,,,,,,,,0,OPR,TCPL - Station 41 (Ile des Chenes Compressor Stn),,,,,,,,Canada,Yes,No,No,No,0,,Level I,Standard Review - 168 days,No,,,,,,,,,,,,,,,,,,,,,,,,,,,,,No,,,No,,,No,No,,,No,-96.983862,1,0,1,0,0,0,0,0,0,0,0,1,0,0,0,0,0,0,0,0,0,0,0,0,0,0,0,0,0,7,0,1,0,0
575,INC2013-113,Release of Substance,7/22/2013,Kerrobert,Enbridge Pipelines Inc.,Closed,51.865344,0,Natural Gas Liquids,Gas,No,2013,2013-07-22,2013/07/22 06:30:00 AM Mountain,,,Operation,Employee / Contractor (Onsite),9/29/2014,Yes,No,Natural Gas Liquids,0,No,No,,,,,,,,,,,0,OPR,Line 1,"508.00000000, 864.00000000",1255.999121,Crude Oil,,,,,Canada,Yes,No,No,No,0,,Level I,Standard Review - 168 days,No,,"Station/Facility, Pumping, Valve",,,,,,,,,,,,,,,,,,,,,,,,,,,No,,,No,,,No,No,,,No,-109.026045,1,0,0,0,1,0,0,0,0,0,0,1,0,0,0,0,0,0,0,0,0,0,0,0,0,0,0,0,0,7,0,1,0,0
576,INC2013-114,Release of Substance,7/24/2013,Coaldale,NOVA Gas Transmission Ltd.,Closed,49.634728,0,Natural Gas - Sweet,Gas,No,2013,2013-07-23,2013/07/23 08:00:00 PM Mountain,,,Operation,3rd Party / Other Company,10/15/2014,Yes,No,Natural Gas - Sweet,0,Yes,No,,,,,,,,,,,0,OPR,,,,,,,,,Canada,No,No,Yes,No,0,,Level I,Standard Review - 168 days,No,,"Pipeline, Pipe, Body",,,,,,,,,,,,,,,,,,,,,,,,,,,No,,,No,,,No,No,,,No,-112.476416,1,1,0,0,0,0,0,0,0,0,0,1,0,0,0,0,0,0,0,0,0,0,0,0,0,0,0,0,0,7,0,1,0,0
577,INC2013-115,Operation Beyond Design Limits,7/24/2013,Fort St. John,"Westcoast Energy Inc., carrying on business as Spectra Energy Transmission",Closed,56.943843,0,Not Applicable,Not Applicable,No,2013,2013-07-23,2013/07/24 10:10:00 AM Pacific,,,Maintenance,Employee / Contractor (Onsite),1/29/2015,No,No,,,,No,,,,,,,,,Over Pressure,,0,OPR,"12"" Alaska Highway Trunk Pipeline",323.9,15.54809329,Natural Gas Sour,,,,,Canada,No,No,Yes,No,0,,Level I,Standard Review - 168 days,No,,"Pipeline, Pipe, Body",,NPS 12,,,,,,,1000,,1013,,,,,,,,,,,,,,,,No,,,No,,,No,No,,,No,-122.074441,0,0,0,1,0,0,0,0,0,0,0,1,0,0,0,0,0,0,0,0,0,0,0,0,0,0,0,0,0,7,0,1,0,0
578,INC2013-117,Fire,7/25/2013,Not specified,Kinder Morgan Cochin ULC,Closed,53.499634,0,Not Applicable,Not Applicable,No,2013,2013-07-25,2013/07/25 06:45:00 PM Central,,,Maintenance,Employee / Contractor (Onsite),1/22/2018,No,No,,,,No,,Welding or Cutting,,,,,,,,,0,OPR,Vegreville Pump Station,,,,,,,,Canada,Yes,No,No,No,0,,Level I,Standard Review - 168 days,No,,,,,,,,,,,,,,,,,,,,,,,,,,,,,No,,,No,,,No,No,,,No,-112.081524,0,1,0,0,0,0,0,0,0,0,0,1,0,0,0,0,0,0,0,0,0,0,0,0,0,0,0,0,0,7,0,1,0,0
579,INC2013-118,Release of Substance,7/29/2013,Kerrobert,Enbridge Pipelines Inc.,Closed,51.865344,0.0001,Natural Gas Liquids,Gas,No,2013,2013-07-28,2013/07/28 07:45:00 AM Mountain,,,Operation,Employee / Contractor (Onsite),9/1/2017,Yes,No,Natural Gas Liquids,0.0001,No,No,,,,,,,,,,,0,OPR,Line 1,"508.00000000, 864.00000000",1255.999121,Crude Oil,,,,,Canada,Yes,No,No,No,0,,Level I,Standard Review - 168 days,No,,,,,,,,,,,,,,,,,,,,,,,,,,,,,No,,,No,,,No,No,,,No,-109.026045,1,0,0,0,1,0,0,0,0,0,0,1,0,0,0,0,0,0,0,0,0,0,0,0,0,0,0,0,0,7,0,1,0,0
580,INC2013-119,Release of Substance,8/3/2013,Cromer,Enbridge Pipelines Inc.,Closed,49.753998,0,Natural Gas Liquids,Gas,No,2013,2013-08-03,2013/08/03 01:00:00 PM Mountain,,,Operation,Employee / Contractor (Onsite),12/3/2018,Yes,No,Natural Gas Liquids,0,No,No,,,,,,,,,,,0,OPR,EPI - Cromer Terminal,,,,,,,,Canada,Yes,No,No,No,0,Mile Post 596.1,Level I,Standard Review - 168 days,No,,"Station/Facility, Pumping, Flange, Gasket/O-ring",,,,,,,,,,,,,,,,,,,,,,,,,,,No,,,No,,,No,No,,,No,-101.238688,1,0,1,0,0,0,0,0,0,0,0,1,0,0,0,0,0,0,0,0,0,0,0,0,0,0,0,0,0,8,0,1,0,0
581,INC2013-120,Release of Substance,8/4/2013,Kerrobert,Enbridge Pipelines Inc.,Closed,51.865344,0.0001,Natural Gas Liquids,Gas,No,2013,2013-08-04,2013/08/04 08:30:00 AM Mountain,,,Operation,Employee / Contractor (Onsite),9/1/2017,Yes,No,Natural Gas Liquids,0.0001,No,No,,,,,,,,,,,0,OPR,EPI - Kerrobert Terminal,,,,,,,,Canada,Yes,No,No,No,0,,Level I,Standard Review - 168 days,No,,"Station/Facility, Metering, Delivering, Flange, Gasket/O-ring",,,,,,,,,,,,,,,,,,,,,,,,,,,No,,,No,,,No,No,,,No,-109.026045,1,0,0,0,1,0,0,0,0,0,0,1,0,0,0,0,0,0,0,0,0,0,0,0,0,0,0,0,0,8,0,1,0,0
582,INC2013-123,Fire,8/17/2013,Taber,NOVA Gas Transmission Ltd.,Closed,49.78485,0,Not Applicable,Not Applicable,No,2013,2013-08-17,2013/08/17 01:30:00 PM Mountain,,,Maintenance,Employee / Contractor (Onsite),1/31/2014,No,No,,,,Yes,,Other Event (Nature or 3rd Party),,,,,,,,,0,OPR,,,,,,,,,Canada,Yes,Yes,No,No,3,,Level I,Standard Review - 168 days,No,,,,,,,,,,,,,,,,,,,,,,,,,,,,,No,,,No,,,No,No,,,No,-112.15107,0,1,0,0,0,0,0,0,0,0,0,1,0,0,0,0,0,0,0,0,0,0,0,0,0,0,0,0,0,8,0,1,0,0
583,INC2013-124,Release of Substance,8/20/2013,Not specified,Maritimes & Northeast Pipeline Management Ltd.,Closed,45.27405,0,Natural Gas - Sweet,Gas,No,2013,2013-08-17,2013/08/17 11:55:00 AM Atlantic,,,Operation,Employee / Contractor (Onsite),10/15/2014,Yes,No,Natural Gas - Sweet,0,No,No,,,,,,,,,,,0,OPR,,,,,,,,,Canada,No,No,Yes,No,0,Mainline Valve + Offset (km) 009,Level I,Standard Review - 168 days,No,,"Pipeline, Fitting, Plug, Thread",,,,,,,,,,,,,,,,,,,,,,,,,,,No,,,No,,,No,No,,,No,-66.02748,1,0,0,0,0,0,1,0,0,0,0,1,0,0,0,0,0,0,0,0,0,0,0,0,0,0,0,0,0,8,0,1,0,0
584,INC2013-125,Fire,8/21/2013,Taylor,"Westcoast Energy Inc., carrying on business as Spectra Energy Transmission",Closed,56.146303,0,Not Applicable,Not Applicable,No,2013,2013-08-19,2013/08/19 11:30:00 PM Pacific,,,Maintenance,,11/28/2017,No,No,,,,No,,Other Event (Nature or 3rd Party),,,,,,,,,0,PPR,,,,,,,,,Canada,No,No,No,No,0,,Level I,Standard Review - 168 days,No,,,,,,,,,,,,,,,,,,,,,,,,,,,,,No,,,No,,,No,No,,,No,-120.669169,0,0,0,1,0,0,0,0,0,0,1,1,0,0,0,0,0,0,0,0,0,0,0,0,0,0,0,0,0,8,0,1,0,0
585,INC2013-126,Operation Beyond Design Limits,8/28/2013,Cromer,Enbridge Pipelines Inc.,Closed,49.753998,0,Not Applicable,Not Applicable,No,2013,2013-08-28,2013/08/28 08:00:00 AM Mountain,,,Operation,Employee / Contractor (Onsite),11/13/2013,Yes,No,,,,Yes,,,,,,,,,Over Pressure,,0,OPR,,,,,,Valve,,,Canada,No,No,Yes,No,4,,Level I,Standard Review - 168 days,No,"INC2013-177, INC2013-178, INC2013-179, INC2013-180, INC2013-181, INC2013-182, INC2013-183, INC2013-184, INC2013-185, INC2013-186, INC2013-187, INC2013-188, INC2013-189, INC2013-190, INC2013-191, INC2013-192, INC2013-193, INC2013-194, INC2013-195, INC2013-196, INC2013-197, INC2013-198, INC2013-199, INC2013-200, INC2013-201",,,,,,,,,,,,,,,,,,,,,,,,,,,,No,,,No,,,No,No,,,No,-101.238688,0,0,1,0,0,0,0,0,0,0,0,1,0,0,0,0,0,0,0,0,0,0,0,0,0,0,0,0,0,8,0,1,0,0
586,INC2013-129,Operation Beyond Design Limits,9/6/2013,Chetwynd,"Westcoast Energy Inc., carrying on business as Spectra Energy Transmission",Closed,55.569092,0,Not Applicable,Not Applicable,No,2013,2013-09-03,2013/09/03 02:06:00 PM Pacific,,,Maintenance,,2/12/2015,Yes,No,,,,No,,,,,,,,,Inappropriate Product,,0,PPR,,,,,,,,,Canada,Yes,No,No,No,0,Legal Subdivision C85D96P12,Level I,Standard Review - 168 days,No,,,,,,,,,,,,,,,,,,,,,,,,,,,,,No,,,No,,,No,No,,,No,-121.944662,0,0,0,1,0,0,0,0,0,0,0,1,0,0,0,0,0,0,0,0,0,0,0,0,0,0,0,0,0,9,0,0,1,0
587,INC2013-131,Release of Substance,9/12/2013,Edson,NOVA Gas Transmission Ltd.,Closed,54.09296,0,Natural Gas - Sweet,Gas,No,2013,,2013/09/12 11:00:00 AM Mountain,,,Operation,Employee / Contractor (Onsite),9/1/2017,Yes,No,Natural Gas - Sweet,0,No,No,,,,,,,,,,,0,OPR,NGTL - Kaybob South #3 Meter Station,,,,,,,,Canada,Yes,No,No,No,0,,Level I,Standard Review - 168 days,No,,,,,,,,,,,,,,,,,,,,,,,,,,,,,No,,,No,,,No,No,,,No,-116.62308,1,1,0,0,0,0,0,0,0,0,0,1,0,0,0,0,0,0,0,0,0,0,0,0,0,0,0,0,0,9,0,0,1,0
588,INC2013-133,Release of Substance,9/16/2013,Not specified,NOVA Gas Transmission Ltd.,Closed,54.08577,0,Natural Gas - Sweet,Gas,No,2013,2013-09-13,2013/09/13 12:00:00 PM Mountain,,,Operation,Employee / Contractor (Onsite),10/15/2014,Yes,No,Natural Gas - Sweet,0,No,No,,,,,,,,,,,0,OPR,,,,,,,,,Canada,No,No,Yes,No,0,,Level I,Standard Review - 168 days,No,,"Station/Facility, Metering, Delivering, Fitting",,,,,,,,,,,,,,,,,,,,,,,,,,,No,,,No,,,No,No,,,No,-116.64156,1,1,0,0,0,0,0,0,0,0,0,1,0,0,0,0,0,0,0,0,0,0,0,0,0,0,0,0,0,9,0,0,1,0
589,INC2013-136,Release of Substance,9/22/2013,Strome,Enbridge Pipelines Inc.,Closed,52.930153,0,Natural Gas Liquids,Gas,No,2013,,2013/09/22 02:00:00 PM Mountain,,,Operation,Employee / Contractor (Onsite),9/1/2017,Yes,No,Natural Gas Liquids,0,No,No,,,,,,,,,,,0,OPR,EPI - Strome Pump Station,,,,,,,,Canada,No,No,Yes,No,0,,Level I,Standard Review - 168 days,No,,,,,,,,,,,,,,,,,,,,,,,,,,,,,No,,,No,,,No,No,,,No,-112.073468,1,1,0,0,0,0,0,0,0,0,0,1,0,0,0,0,0,0,0,0,0,0,0,0,0,0,0,0,0,9,0,0,1,0
590,INC2013-137,Release of Substance,9/23/2013,Fort Nelson,"Westcoast Energy Inc., carrying on business as Spectra Energy Transmission",Closed,58.6535,0,Natural Gas - Sweet,Gas,No,2013,2013-09-23,2013/09/23 05:10:00 PM Pacific,,,Operation,,9/22/2014,Yes,No,Natural Gas - Sweet,0,No,Yes,,,,,,,,,,,0,PPR,WEI - Fort Nelson Gas Plant,,,,,,,,Canada,No,No,No,No,0,Mile Post 285,Level I,Standard Review - 168 days,No,,"Processing Plant, Cooling",,,,,,,,,,,,,,,,,,,,,,,,,,,No,,,No,,,No,No,,,No,-122.68519,1,0,0,1,0,0,0,0,0,0,0,1,0,0,0,0,0,0,0,0,0,0,0,0,0,0,0,0,0,9,0,0,1,0
591,INC2013-142,Release of Substance,10/6/2013,Slave Lake,NOVA Gas Transmission Ltd.,Closed,55.26395,0,Natural Gas - Sweet,Gas,No,2013,2013-10-06,2013/10/06 09:00:00 AM Mountain,,Transmission,Operation,Employee / Contractor (Onsite),5/11/2017,Yes,No,Natural Gas - Sweet,,No,No,,,,,,,,,,,0,OPR,,,,,,,,,Canada,No,No,Yes,No,0,,Level I,Standard Review - 168 days,No,,,,,,,,,,,,,,,,,,,,,,,,,,,,,No,,,No,,,No,No,,,No,-114.601007,1,1,0,0,0,0,0,0,0,0,0,1,0,0,0,0,0,0,0,0,0,0,0,0,0,0,0,0,0,10,0,0,1,0
592,INC2013-139,Release of Substance,9/26/2013,Slave Lake,NOVA Gas Transmission Ltd.,Closed,55.26619,0,Natural Gas - Sweet,Gas,No,2013,2013-09-26,2013/09/26 10:30:00 AM Mountain,,Transmission,Maintenance,Employee / Contractor (Onsite),5/11/2017,Yes,No,Natural Gas - Sweet,0,No,No,,,,,,,,,,,0,OPR,,,,,,,,,Canada,No,No,Yes,No,0,NE30724W5M,Level II,Category B,No,,,,,,,,,,,,,,,,,,,,,,,,,,,,,No,,,No,,,No,No,,,No,-114.60103,1,1,0,0,0,0,0,0,0,0,0,1,0,0,0,0,0,0,0,0,0,0,0,0,0,0,0,0,0,9,0,0,1,0
593,INC2013-141,Release of Substance,9/28/2013,Smokey Lake,NOVA Gas Transmission Ltd.,Closed,53.97323,0,Natural Gas - Sweet,Gas,No,2013,2013-09-26,2013/09/28 10:30:00 AM Mountain,,Transmission,Operation,Landowner,5/11/2017,Yes,No,Natural Gas - Sweet,0,No,No,,,,,,,,,,,0,OPR,,,,,,,,,Canada,No,No,Yes,No,0,,Level II,Category B,No,,,,,,,,,,,,,,,,,,,,,,,,,,,,,No,,,No,,,No,No,,,No,-112.22835,1,1,0,0,0,0,0,0,0,0,0,1,0,0,0,0,0,0,0,0,0,0,0,0,0,0,0,0,0,9,0,0,1,0
594,INC2013-146,Release of Substance,10/17/2013,Fort McMurray,NOVA Gas Transmission Ltd.,Closed,56.514327,16500000,Natural Gas - Sweet,Gas,Yes,2013,2013-10-17,2013/10/17 04:30:00 AM Mountain,,,Operation,Employee / Contractor (Onsite),3/15/2016,Yes,Yes,Natural Gas - Sweet,16500000,Yes,No,,,,,,,,,,,0,OPR,NORTH CENTRAL CORRIDOR LOOP (BUFFALO CREEK WEST SECTION) - NPS 36,914,53.55816421,Natural Gas,,,,,Canada,No,No,Yes,No,3,Legal Subdivision SE-01-87-24-W4M,Level II,Category B,Yes,"INC2013-107, INC2013-147, INC2020-047","Pipeline, Pipe, Body",CSA Z662-07,NPS 36,Carbon Steel,550 - X80,,19.0 mm = 0.750 in,,15.9,9930,,8960,,,2008,2009,2009,,,,,,,Epoxy,Intact,,,No,,,Yes,,,No,Yes,,,No,-113.679868,1,1,0,0,0,0,0,0,0,0,0,0,1,0,0,0,0,0,0,0,0,0,0,0,0,0,0,0,0,10,0,0,1,0
595,INC2013-147,Operation Beyond Design Limits,10/17/2013,Fort McMurray,NOVA Gas Transmission Ltd.,Closed,56.51516,0,Not Applicable,Not Applicable,No,2013,,2013/10/17 02:30:00 PM Mountain,,Transmission,Operation,Employee / Contractor (Onsite),6/15/2017,Yes,No,,,,No,,,,,,,,,Outside Temperature Range,,0,OPR,NORTH CENTRAL CORRIDOR LOOP (BUFFALO CREEK WEST SECTION) - NPS 36,914,53.55816421,Natural Gas,,,,,Canada,No,No,Yes,No,3,Legal Subdivision,Level I,Standard Review - 168 days,No,INC2013-146,"Pipeline, Pipe, Bend, Body",CSA Z662-07,NPS 36,Carbon Steel,483 - X70,,,11.8,,9930,,8960,,,2008,2009,2009,,,,,,,,,,,No,Replacement,11/12/2013,No,3/14/2013,Visual,Yes,Yes,,,No,-113.65075,0,1,0,0,0,0,0,0,0,0,1,1,0,0,0,0,0,0,0,0,0,0,0,0,0,0,0,0,0,10,0,0,1,0
596,INC2013-148,Release of Substance,10/20/2013,Gadsby,NOVA Gas Transmission Ltd.,Closed,52.3882,0,Natural Gas - Sweet,Gas,No,2013,,2013/10/20 02:30:00 PM Mountain,,,Maintenance,Employee / Contractor (Onsite),5/11/2017,Yes,No,Natural Gas - Sweet,0,Yes,No,,,,,,,,,,,0,OPR,,,,,,,,,Canada,No,No,Yes,No,0,Legal Subdivision NE-27-39-16-W4M,Level I,Standard Review - 168 days,No,,,,,,,,,,,,,,,,,,,,,,,,,,,,,No,,,No,,,No,No,,,No,-112.2162,1,1,0,0,0,0,0,0,0,0,0,1,0,0,0,0,0,0,0,0,0,0,0,0,0,0,0,0,0,10,0,0,1,0
597,INC2013-152,Release of Substance,10/29/2013,Saint John,Maritimes & Northeast Pipeline Management Ltd.,Closed,45.273315,5.7,Natural Gas - Sweet,Gas,No,2013,,2013/10/29 10:00:00 AM Atlantic,,,Operation,Employee / Contractor (Onsite),2/26/2014,Yes,No,Natural Gas - Sweet,5.7,No,No,,,,,,,,,,,0,OPR,Mainline,"762.00000000, 863.60000000",574.8807991,Natural Gas,,,,,Canada,Yes,No,No,No,5,,Level I,Standard Review - 168 days,No,,"Station/Facility, Metering, Delivering, Valve",,NPS 1/2,,,,,,,0,,,,,,,,,,,,,,,,,,No,,,No,,,No,No,,,No,-66.063308,1,0,0,0,0,0,1,0,0,0,0,1,0,0,0,0,0,0,0,0,0,0,0,0,0,0,0,0,0,10,0,0,1,0
598,INC2013-150,Release of Substance,10/23/2013,Burstall,TransCanada PipeLines Limited,Closed,50.676806,0,Natural Gas - Sweet,Gas,No,2013,,2013/10/23 11:00:00 AM Mountain,,,Operation,3rd Party / Other Company,3/14/2018,Yes,No,Natural Gas - Sweet,0,Yes,No,,,,,,,,,,,0,OPR,Line 100-4,1066.8,1422.828067,Natural Gas,,,,,Canada,No,No,Yes,No,0,Mainline Valve + Offset (km) 2+3.3 km,Level I,Standard Review - 168 days,No,,"Pipeline, Pipe, Girth weld",,NPS 42,Stainless Steel,448 - X65,,,9.4,9.4,6065,,4637,,,,197,,,Girth (Circumferential),Straight,,,External,Fusion Bonded Epoxy (FBE),Intact,Field Applied,1999,No,Replacement,11/13/2013,No,,,No,No,,,No,-109.929667,1,0,0,0,1,0,0,0,0,0,0,1,0,0,0,0,0,0,0,0,0,0,0,0,0,0,0,0,0,10,0,0,1,0
599,INC2013-153,Fire,10/31/2013,Edmonton,Enbridge Pipelines Inc.,Closed,53.547403,0,Not Applicable,Not Applicable,No,2013,,2013/10/31 05:30:00 PM Mountain,,,Maintenance,Employee / Contractor (Onsite),1/14/2014,No,No,,,,Yes,,Welding or Cutting,,,,,,,,,0,OPR,EPI - Edmonton Terminal,,,,,,,,Canada,Yes,No,No,No,0,,Level I,Standard Review - 168 days,No,,,,,,,,,,,,,,,,,,,,,,,,,,,,,No,,,No,,,No,No,,,No,-113.355714,0,1,0,0,0,0,0,0,0,0,0,1,0,0,0,0,0,0,0,0,0,0,0,0,0,0,0,0,0,10,0,0,1,0
600,INC2013-154,Release of Substance,11/2/2013,Vermilion Bay,TransCanada PipeLines Limited,Closed,49.82512,0,Natural Gas - Sweet,Gas,No,2013,,2013/11/02 10:00:00 AM Mountain,,,Operation,Employee / Contractor (Onsite),3/12/2018,No,No,Natural Gas - Sweet,,No,No,,,,,,,,,,,0,OPR,TCPL - Station 52 (Vermillion Bay Compressor Stn),,,,,,,,Canada,Yes,No,No,No,0,,Level I,Standard Review - 168 days,No,,,,,,,,,,,,,,,,,,,,,,,,,,,,,No,,,No,,,No,No,,,No,-93.627265,1,0,0,0,0,1,0,0,0,0,0,1,0,0,0,0,0,0,0,0,0,0,0,0,0,0,0,0,0,11,0,0,1,0
601,INC2013-155,Release of Substance,11/16/2013,Saint John,Maritimes & Northeast Pipeline Management Ltd.,Closed,45.273315,500,Natural Gas - Sweet,Gas,No,2013,2013-11-16,2013/11/16 04:30:00 PM Eastern,,,Operation,Employee / Contractor (Onsite),2/26/2014,Yes,No,Natural Gas - Sweet,500,No,No,,,,,,,,,,,0,OPR,,,,,,,,,Canada,Yes,No,No,No,5,,Level I,Standard Review - 168 days,No,,"Station/Facility, Compression, Valve",,,,,,,,,0,,,,,,,,,,,,,,,,,,No,,,No,,,No,No,,,No,-66.063308,1,0,0,0,0,0,1,0,0,0,0,1,0,0,0,0,0,0,0,0,0,0,0,0,0,0,0,0,0,11,0,0,1,0
602,INC2013-157,Release of Substance,11/21/2013,Fort Nelson,"Westcoast Energy Inc., carrying on business as Spectra Energy Transmission",Closed,58.653246,0.0001,Natural Gas - Sweet,Gas,No,2013,,2013/11/19 12:00:00 AM Mountain,,,Operation,,2/12/2015,Yes,No,Natural Gas - Sweet,0.0001,No,No,,,,,,,,,,,0,PPR,WEI - Fort Nelson Gas Plant,,,,,,,,Canada,No,No,No,No,0,,Level I,Standard Review - 168 days,No,,"Processing Plant, Dehydration",,,,,,,,,,,,,,,,,,,,,,,,,,,No,,,No,,,No,No,,,No,-122.684823,1,0,0,1,0,0,0,0,0,0,0,1,0,0,0,0,0,0,0,0,0,0,0,0,0,0,0,0,0,11,0,0,1,0
603,INC2013-158,Fire,11/22/2013,Saint Leon,Enbridge Pipelines Inc.,Closed,49.362856,0,Not Applicable,Not Applicable,No,2013,2013-11-22,2013/11/22 09:15:00 AM Central,,,Maintenance,Employee / Contractor (Onsite),12/23/2013,No,No,,,,Yes,,Equipment & Electrical,,,,,,,,,0,OPR,,,,,,,,,Canada,No,No,Yes,No,0,Mile Post 718.7015,Level I,Standard Review - 168 days,No,,,,,,,,,,,,,,,,,,,,,,,,,,,,,No,,,No,,,No,No,,,No,-98.590633,0,0,1,0,0,0,0,0,0,0,0,1,0,0,0,0,0,0,0,0,0,0,0,0,0,0,0,0,0,11,0,0,1,0
604,INC2013-159,Operation Beyond Design Limits,11/22/2013,Fort Saskatchewan,Cochin Pipe Lines Ltd.,Closed,53.700716,0,Not Applicable,Not Applicable,No,2013,2013-11-22,2013/11/22 02:57:00 PM Central,,,Operation,Employee / Contractor (Onsite),2/12/2015,Yes,No,,,,No,,,,,,,,,Over Pressure,,0,OPR,,,,,,Valve,,,Canada,No,No,Yes,No,0,,Level I,Standard Review - 168 days,No,,"Pipeline, Pipe, Girth weld;Pipeline, Pipe, Body;Pipeline, Pipe, Seam weld;Pipeline, Valve, Pressure relief, Other (please explain)",,,,,,,,,,,,,,,,,,,,,,,,,,,No,,,No,,,No,No,,,No,-113.209466,0,1,0,0,0,0,0,0,0,0,0,1,0,0,0,0,0,0,0,0,0,0,0,0,0,0,0,0,0,11,0,0,1,0
605,INC2013-160,Release of Substance,11/24/2013,Fort Nelson,"Westcoast Energy Inc., carrying on business as Spectra Energy Transmission",Closed,58.653246,0,Natural Gas - Sour,Gas,Yes,2013,,2013/11/23 06:00:00 PM Pacific,,,Operation,,10/19/2016,Yes,No,Natural Gas - Sour,0,No,No,,,,,,,,,,,0,PPR,WEI - Fort Nelson Gas Plant,,,,,,,,Canada,No,No,No,No,0,,Level I,Standard Review - 168 days,No,,,,,,,,,,,,,,,,,,,,,,,,,,,,,No,,,No,,,No,No,,,No,-122.684823,1,0,0,1,0,0,0,0,0,0,0,1,0,0,0,0,0,0,0,0,0,0,0,0,0,0,0,0,0,11,0,0,1,0
606,INC2013-161,Release of Substance,11/25/2013,Edmonton,Enbridge Pipelines Inc.,Closed,53.307156,2.25,Crude Oil - Sweet,Liquid,No,2013,2013-11-25,2013/11/25 11:40:00 AM Mountain,,,Operation,Employee / Contractor (Onsite),3/12/2018,Yes,No,Crude Oil - Sweet,2.25,Yes,No,,,,,,,,,,,0,OPR,Edmonton Terminal,,,,,,,,Canada,Yes,No,No,No,0,Legal Subdivision,Level I,Standard Review - 168 days,No,,,,,,,,,,,,,,,,,,,,,,,,,,,,,No,,,No,,,No,No,,,No,-113.511011,1,1,0,0,0,0,0,0,0,0,0,1,0,0,0,0,0,0,0,0,0,0,0,0,0,0,0,0,0,11,0,0,1,0
607,INC2013-162,Release of Substance,11/27/2013,Boyle,NOVA Gas Transmission Ltd.,Closed,54.50936,4300000,Natural Gas - Sweet,Gas,Yes,2013,2013-11-26,2013/11/26 11:24:00 PM Mountain,,,Operation,Employee / Contractor (Onsite),3/29/2016,Yes,Yes,Natural Gas - Sweet,4300000,No,No,,,,,,,,,,,0,OPR,FLAT LAKE LATERAL LOOP - NPS 16,406.4,53.31541245,Natural Gas,,,,,Canada,No,No,Yes,No,3,,Level II,Category B,Yes,INC2015-016,"Pipeline, Pipe, Body",CSA Z662,NPS 16,Carbon Steel,359 - X52,,6.0 mm = 0.237 in,,,8453,,8200,,,,1976,1976,,,,,,External,Polyethylene Tape Wrap,Disbonded,Field Applied,,No,,,Yes,,,No,Yes,,,No,-112.64735,1,1,0,0,0,0,0,0,0,0,0,0,1,0,0,0,0,0,0,0,0,0,0,0,0,0,0,0,0,11,0,0,1,0
608,INC2013-165,Operation Beyond Design Limits,12/2/2013,Regina,Enbridge Pipelines Inc.,Closed,50.477608,0,Not Applicable,Not Applicable,No,2013,2013-12-01,2013/12/01 03:00:00 PM Mountain,,,Operation,Employee / Contractor (Onsite),4/8/2014,Yes,No,,,,Yes,,,,,,,,,Over Pressure,,0,OPR,EPI - Regina Terminal,,,,,,,,Canada,No,No,Yes,No,0,,Level I,Standard Review - 168 days,No,,"Pipeline, Flange, Gasket/O-ring",ASME,,Carbon Steel,,,,,,0,,,,,,,,,,,,,,,,,,No,,,No,,,No,No,,,No,-104.569525,0,0,0,0,1,0,0,0,0,0,0,1,0,0,0,0,0,0,0,0,0,0,0,0,0,0,0,0,0,12,0,0,0,1
609,INC2013-164,Release of Substance,12/1/2013,Sherwood Park,Trans Mountain Pipeline ULC,Closed,53.544543,12,Crude Oil - Sweet,Liquid,Yes,2013,2013-12-01,2013/12/01 09:50:00 AM Mountain,,Transmission,Construction,Employee / Contractor (Onsite),4/16/2019,Yes,No,Crude Oil - Sweet,12,No,Yes,,,,,,,,,,,0,OPR,,,,,,Valve,,,Canada,Yes,No,No,No,4,,Level I,Standard Review - 168 days,No,REM2019-012,"Storage, Tank, Aboveground",,,,,,,,,,,,,,,,,,,,,,,,,,,No,,,No,,,No,No,,,No,-113.360195,1,1,0,0,0,0,0,0,0,0,0,0,0,1,0,0,0,0,0,0,0,0,0,0,0,0,0,0,0,12,0,0,0,1
610,INC2013-167,Fire,12/5/2013,Monchy,Foothills Pipe Lines (Saskatchewan) Ltd.,Closed,49.017155,0,Not Applicable,Not Applicable,No,2013,2013-12-05,2013/12/05 09:00:00 AM Mountain,,,Operation,Employee / Contractor (Onsite),11/6/2014,Yes,No,,,,No,,Equipment & Electrical,,,,,,,,,0,OPR,Foothills - Monchy Compressor Stn,,,,,,,,Canada,Yes,No,No,No,0,,Level I,Standard Review - 168 days,No,,"Station/Facility, Compression, Valve",,,,,,,,,0,,,,,,,,,,,,,,,,,,No,,,No,,,No,No,,,No,-107.831853,0,0,0,0,1,0,0,0,0,0,0,1,0,0,0,0,0,0,0,0,0,0,0,0,0,0,0,0,0,12,0,0,0,1
611,INC2013-168,Release of Substance,12/5/2013,Dryden,TransCanada PipeLines Limited,Closed,49.7951,0.017,Natural Gas - Sweet,Gas,No,2013,2013-12-05,2013/12/05 01:00:00 AM Eastern,,,Operation,Employee / Contractor (Onsite),2/12/2015,Yes,No,Natural Gas - Sweet,0.017,No,No,,,,,,,,,,,0,OPR,Dryden Comprssor Station #55,,,,,,,,Canada,Yes,No,No,No,0,,Level I,Standard Review - 168 days,No,,"Station/Facility, Compression, Valve",,,Stainless Steel,,,,,,,,,,,,,,,,,,,,,,,,No,,,No,,,No,No,,Replacement,No,-92.762674,1,0,0,0,0,1,0,0,0,0,0,1,0,0,0,0,0,0,0,0,0,0,0,0,0,0,0,0,0,12,0,0,0,1
612,INC2013-169,Release of Substance,12/9/2013,Moncton,Maritimes & Northeast Pipeline Management Ltd.,Closed,46.112702,0.3,Natural Gas - Sweet,Gas,No,2013,,2013/12/09 11:00:00 AM Atlantic,,,Operation,Employee / Contractor (Onsite),1/28/2015,Yes,No,Natural Gas - Sweet,0.3,No,No,,,,,,,,,,,0,OPR,Moncton lateral,219.1,12.44337836,Natural Gas,,,,,Canada,Yes,No,No,No,0,,Level I,Standard Review - 168 days,No,,"Pipeline, Valve, Pressure relief, Other (please explain)",,,,,,,,,,,,,,,,,,,,,,,,,,,No,Rebuilt,,No,,,No,No,,Repair,No,-64.714397,1,0,0,0,0,0,1,0,0,0,0,1,0,0,0,0,0,0,0,0,0,0,0,0,0,0,0,0,0,12,0,0,0,1
613,INC2013-170,Release of Substance,12/11/2013,Goldboro,Maritimes & Northeast Pipeline Management Ltd.,Closed,45.182385,2000,Natural Gas - Sweet,Gas,No,2013,,2013/12/11 07:30:00 AM Atlantic,,,Operation,Employee / Contractor (Onsite),2/26/2014,Yes,No,Natural Gas - Sweet,2000,No,No,,,,,,,,,,,0,OPR,Mainline,"762.00000000, 863.60000000",574.8807991,Natural Gas,,,,,Canada,No,No,Yes,No,0,,Level I,Standard Review - 168 days,No,,"Station/Facility, Metering, Delivering, Valve",,NPS 1/2,,,,,,,4600,,,,,,,,,,,,,,,,,,No,,,No,,,No,No,,,No,-61.652361,1,0,0,0,0,0,0,1,0,0,0,1,0,0,0,0,0,0,0,0,0,0,0,0,0,0,0,0,0,12,0,0,0,1
614,INC2013-175,Release of Substance,12/16/2013,Elko,Foothills Pipe Lines Ltd.,Closed,49.28487,1500,Natural Gas - Sweet,Gas,No,2013,2013-12-15,2013/12/15 04:15:00 AM Mountain,,,Operation,Employee / Contractor (Onsite),6/27/2016,Yes,No,Natural Gas - Sweet,1500,No,No,,,,,,,,,,,0,OPR,"Foothills - Elko, BC Compressor Station",,,,,,,,Canada,Yes,No,No,No,0,Kilometer Post 75.4,Level I,Standard Review - 168 days,No,,"Station/Facility, Compression, Piping, Body",,NPS 1,Carbon Steel,,80,,,,,,,,,,,,,,,,,,,,,,No,,,No,,,No,No,,,No,-115.17704,1,0,0,1,0,0,0,0,0,0,0,1,0,0,0,0,0,0,0,0,0,0,0,0,0,0,0,0,0,12,0,0,0,1
615,INC2013-177,Operation Beyond Design Limits,10/10/2013,Cromer,Enbridge Pipelines Inc.,Closed,49.753998,0,Not Applicable,Not Applicable,No,2013,2013-08-22,2013/10/10 12:00:00 AM Mountain,,,Operation,,4/13/2015,No,No,,,,Yes,,,,,,,,,Over Pressure,,0,OPR,Cromer Terminal,,,,,,,,Canada,No,No,Yes,No,4,,Level I,Standard Review - 168 days,No,INC2013-126,,,,,,,,,,,,,,,,,,,,,,,,,,,,No,,,No,,,No,No,,,No,-101.238688,0,0,0,0,1,0,0,0,0,0,0,1,0,0,0,0,0,0,0,0,0,0,0,0,0,0,0,0,0,8,0,1,0,0
616,INC2013-178,Operation Beyond Design Limits,10/10/2013,Cromer,Enbridge Pipelines Inc.,Closed,49.753998,0,Not Applicable,Not Applicable,No,2013,2013-07-14,2013/10/10 12:00:00 AM Mountain,,,Operation,,4/13/2015,No,No,,,,Yes,,,,,,,,,Over Pressure,,0,OPR,Cromer Terminal,,,,,,,,Canada,No,No,Yes,No,4,,Level I,Standard Review - 168 days,No,INC2013-126,,,,,,,,,,,,,,,,,,,,,,,,,,,,No,,,No,,,No,No,,,No,-101.238688,0,0,0,0,1,0,0,0,0,0,0,1,0,0,0,0,0,0,0,0,0,0,0,0,0,0,0,0,0,7,0,1,0,0
617,INC2013-179,Operation Beyond Design Limits,10/10/2013,Cromer,Enbridge Pipelines Inc.,Closed,49.753998,0,Not Applicable,Not Applicable,No,2013,2013-04-12,2013/10/10 12:00:00 AM Mountain,,,Operation,,4/13/2015,No,No,,,,Yes,,,,,,,,,Over Pressure,,0,OPR,Cromer Terminal,,,,,,,,Canada,No,No,Yes,No,4,,Level I,Standard Review - 168 days,No,INC2013-126,,,,,,,,,,,,,,,,,,,,,,,,,,,,No,,,No,,,No,No,,,No,-101.238688,0,0,0,0,1,0,0,0,0,0,0,1,0,0,0,0,0,0,0,0,0,0,0,0,0,0,0,0,0,4,1,0,0,0
618,INC2013-180,Operation Beyond Design Limits,10/10/2013,Cromer,Enbridge Pipelines Inc.,Closed,49.753998,0,Not Applicable,Not Applicable,No,2013,2013-03-28,2013/10/10 12:00:00 AM Mountain,,,Operation,,4/13/2015,No,No,,,,Yes,,,,,,,,,Over Pressure,,0,OPR,Cromer Terminal,,,,,,,,Canada,No,No,Yes,No,4,,Level I,Standard Review - 168 days,No,INC2013-126,,,,,,,,,,,,,,,,,,,,,,,,,,,,No,,,No,,,No,No,,,No,-101.238688,0,0,0,0,1,0,0,0,0,0,0,1,0,0,0,0,0,0,0,0,0,0,0,0,0,0,0,0,0,3,1,0,0,0
619,INC2013-181,Operation Beyond Design Limits,10/10/2013,Cromer,Enbridge Pipelines Inc.,Closed,49.753998,0,Not Applicable,Not Applicable,No,2013,2013-02-23,2013/10/10 12:00:00 AM Mountain,,,Operation,,4/13/2015,No,No,,,,Yes,,,,,,,,,Over Pressure,,0,OPR,Cromer Terminal,,,,,,,,Canada,No,No,Yes,No,4,,Level I,Standard Review - 168 days,No,INC2013-126,,,,,,,,,,,,,,,,,,,,,,,,,,,,No,,,No,,,No,No,,,No,-101.238688,0,0,0,0,1,0,0,0,0,0,0,1,0,0,0,0,0,0,0,0,0,0,0,0,0,0,0,0,0,2,0,0,0,1
620,INC2013-182,Operation Beyond Design Limits,10/10/2013,Cromer,Enbridge Pipelines Inc.,Closed,49.753998,0,Not Applicable,Not Applicable,No,2013,2013-02-19,2013/10/10 12:00:00 AM Mountain,,,Operation,,4/13/2015,No,No,,,,Yes,,,,,,,,,Over Pressure,,0,OPR,Cromer Terminal,,,,,,,,Canada,No,No,Yes,No,4,,Level I,Standard Review - 168 days,No,INC2013-126,,,,,,,,,,,,,,,,,,,,,,,,,,,,No,,,No,,,No,No,,,No,-101.238688,0,0,0,0,1,0,0,0,0,0,0,1,0,0,0,0,0,0,0,0,0,0,0,0,0,0,0,0,0,2,0,0,0,1
621,INC2013-183,Operation Beyond Design Limits,10/10/2013,Cromer,Enbridge Pipelines Inc.,Closed,49.753998,0,Not Applicable,Not Applicable,No,2013,2013-02-15,2013/10/10 12:00:00 AM Mountain,,,Operation,,4/13/2015,No,No,,,,Yes,,,,,,,,,Over Pressure,,0,OPR,Cromer Terminal,,,,,,,,Canada,No,No,Yes,No,4,,Level I,Standard Review - 168 days,No,INC2013-126,,,,,,,,,,,,,,,,,,,,,,,,,,,,No,,,No,,,No,No,,,No,-101.238688,0,0,0,0,1,0,0,0,0,0,0,1,0,0,0,0,0,0,0,0,0,0,0,0,0,0,0,0,0,2,0,0,0,1
622,INC2013-184,Operation Beyond Design Limits,10/10/2013,Cromer,Enbridge Pipelines Inc.,Closed,49.753998,0,Not Applicable,Not Applicable,No,2013,2013-01-19,2013/10/10 12:00:00 AM Mountain,,,Operation,,4/13/2015,No,No,,,,Yes,,,,,,,,,Over Pressure,,0,OPR,Cromer Terminal,,,,,,,,Canada,No,No,Yes,No,4,,Level I,Standard Review - 168 days,No,INC2013-126,,,,,,,,,,,,,,,,,,,,,,,,,,,,No,,,No,,,No,No,,,No,-101.238688,0,0,0,0,1,0,0,0,0,0,0,1,0,0,0,0,0,0,0,0,0,0,0,0,0,0,0,0,0,1,0,0,0,1
623,INC2013-185,Operation Beyond Design Limits,10/10/2013,Cromer,Enbridge Pipelines Inc.,Closed,49.753998,0,Not Applicable,Not Applicable,No,2013,2013-01-09,2013/10/10 12:00:00 AM Mountain,,,Operation,,4/13/2015,No,No,,,,Yes,,,,,,,,,Over Pressure,,0,OPR,Cromer Terminal,,,,,,,,Canada,No,No,Yes,No,4,,Level I,Standard Review - 168 days,No,INC2013-126,,,,,,,,,,,,,,,,,,,,,,,,,,,,No,,,No,,,No,No,,,No,-101.238688,0,0,0,0,1,0,0,0,0,0,0,1,0,0,0,0,0,0,0,0,0,0,0,0,0,0,0,0,0,1,0,0,0,1
624,INC2013-186,Operation Beyond Design Limits,10/10/2013,Cromer,Enbridge Pipelines Inc.,Closed,49.753998,0,Not Applicable,Not Applicable,No,2013,2013-01-04,2013/10/10 12:00:00 AM Mountain,,,Operation,,4/13/2015,No,No,,,,Yes,,,,,,,,,Over Pressure,,0,OPR,Cromer Terminal,,,,,,,,Canada,No,No,Yes,No,4,,Level I,Standard Review - 168 days,No,INC2013-126,,,,,,,,,,,,,,,,,,,,,,,,,,,,No,,,No,,,No,No,,,No,-101.238688,0,0,0,0,1,0,0,0,0,0,0,1,0,0,0,0,0,0,0,0,0,0,0,0,0,0,0,0,0,1,0,0,0,1
625,INC2013-187,Operation Beyond Design Limits,10/10/2013,Cromer,Enbridge Pipelines Inc.,Closed,49.753998,0,Not Applicable,Not Applicable,No,2013,2012-12-31,2013/10/10 12:00:00 AM Mountain,,,Operation,,4/13/2015,No,No,,,,Yes,,,,,,,,,Over Pressure,,0,OPR,Cromer Terminal,,,,,,,,Canada,No,No,Yes,No,4,,Level I,Standard Review - 168 days,No,INC2013-126,,,,,,,,,,,,,,,,,,,,,,,,,,,,No,,,No,,,No,No,,,No,-101.238688,0,0,0,0,1,0,0,0,0,0,0,1,0,0,0,0,0,0,0,0,0,0,0,0,0,0,0,0,0,12,0,0,0,1
626,INC2013-188,Operation Beyond Design Limits,10/10/2013,Cromer,Enbridge Pipelines Inc.,Closed,49.753998,0,Not Applicable,Not Applicable,No,2013,2012-12-22,2013/10/10 12:00:00 AM Mountain,,,Operation,,4/13/2015,No,No,,,,Yes,,,,,,,,,Over Pressure,,0,OPR,Cromer Terminal,,,,,,,,Canada,No,No,Yes,No,4,,Level I,Standard Review - 168 days,No,INC2013-126,,,,,,,,,,,,,,,,,,,,,,,,,,,,No,,,No,,,No,No,,,No,-101.238688,0,0,0,0,1,0,0,0,0,0,0,1,0,0,0,0,0,0,0,0,0,0,0,0,0,0,0,0,0,12,0,0,0,1
627,INC2013-189,Operation Beyond Design Limits,10/10/2013,Cromer,Enbridge Pipelines Inc.,Closed,49.753998,0,Not Applicable,Not Applicable,No,2013,2012-12-17,2013/10/10 12:00:00 AM Mountain,,,Operation,,4/13/2015,No,No,,,,Yes,,,,,,,,,Over Pressure,,0,OPR,Cromer Terminal,,,,,,,,Canada,No,No,Yes,No,4,,Level I,Standard Review - 168 days,No,INC2013-126,,,,,,,,,,,,,,,,,,,,,,,,,,,,No,,,No,,,No,No,,,No,-101.238688,0,0,0,0,1,0,0,0,0,0,0,1,0,0,0,0,0,0,0,0,0,0,0,0,0,0,0,0,0,12,0,0,0,1
628,INC2013-190,Operation Beyond Design Limits,10/10/2013,Cromer,Enbridge Pipelines Inc.,Closed,49.753998,0,Not Applicable,Not Applicable,No,2013,2012-11-12,2013/10/10 12:00:00 AM Mountain,,,Operation,,4/13/2015,No,No,,,,Yes,,,,,,,,,Over Pressure,,0,OPR,Cromer Terminal,,,,,,,,Canada,No,No,Yes,No,4,,Level I,Standard Review - 168 days,No,INC2013-126,,,,,,,,,,,,,,,,,,,,,,,,,,,,No,,,No,,,No,No,,,No,-101.238688,0,0,0,0,1,0,0,0,0,0,0,1,0,0,0,0,0,0,0,0,0,0,0,0,0,0,0,0,0,11,0,0,1,0
629,INC2013-191,Operation Beyond Design Limits,10/10/2013,Cromer,Enbridge Pipelines Inc.,Closed,49.753998,0,Not Applicable,Not Applicable,No,2013,2012-11-03,2013/10/10 12:00:00 AM Mountain,,,Operation,,4/14/2015,No,No,,,,Yes,,,,,,,,,Over Pressure,,0,OPR,Cromer Terminal,,,,,,,,Canada,No,No,Yes,No,4,,Level I,Standard Review - 168 days,No,INC2013-126,,,,,,,,,,,,,,,,,,,,,,,,,,,,No,,,No,,,No,No,,,No,-101.238688,0,0,0,0,1,0,0,0,0,0,0,1,0,0,0,0,0,0,0,0,0,0,0,0,0,0,0,0,0,11,0,0,1,0
630,INC2013-192,Operation Beyond Design Limits,10/10/2013,Cromer,Enbridge Pipelines Inc.,Closed,49.753998,0,Not Applicable,Not Applicable,No,2013,2012-10-10,2013/10/10 12:00:00 AM Mountain,,,Operation,,4/13/2015,No,No,,,,Yes,,,,,,,,,Over Pressure,,0,OPR,Cromer Terminal,,,,,,,,Canada,No,No,Yes,No,4,,Level I,Standard Review - 168 days,No,INC2013-126,,,,,,,,,,,,,,,,,,,,,,,,,,,,No,,,No,,,No,No,,,No,-101.238688,0,0,0,0,1,0,0,0,0,0,0,1,0,0,0,0,0,0,0,0,0,0,0,0,0,0,0,0,0,10,0,0,1,0
631,INC2013-193,Operation Beyond Design Limits,10/10/2013,Cromer,Enbridge Pipelines Inc.,Closed,49.753998,0,Not Applicable,Not Applicable,No,2013,2012-10-07,2013/10/10 12:00:00 AM Mountain,,,Operation,,4/13/2015,No,No,,,,Yes,,,,,,,,,Over Pressure,,0,OPR,Cromer Terminal,,,,,,,,Canada,No,No,Yes,No,4,,Level I,Standard Review - 168 days,No,INC2013-126,,,,,,,,,,,,,,,,,,,,,,,,,,,,No,,,No,,,No,No,,,No,-101.238688,0,0,0,0,1,0,0,0,0,0,0,1,0,0,0,0,0,0,0,0,0,0,0,0,0,0,0,0,0,10,0,0,1,0
632,INC2013-194,Operation Beyond Design Limits,10/10/2013,Cromer,Enbridge Pipelines Inc.,Closed,49.753998,0,Not Applicable,Not Applicable,No,2013,2012-09-27,2013/10/10 12:00:00 AM Mountain,,,Operation,,4/13/2015,No,No,,,,Yes,,,,,,,,,Over Pressure,,0,OPR,Cromer Terminal,,,,,,,,Canada,No,No,Yes,No,4,,Level I,Standard Review - 168 days,No,INC2013-126,,,,,,,,,,,,,,,,,,,,,,,,,,,,No,,,No,,,No,No,,,No,-101.238688,0,0,0,0,1,0,0,0,0,0,0,1,0,0,0,0,0,0,0,0,0,0,0,0,0,0,0,0,0,9,0,0,1,0
633,INC2013-195,Operation Beyond Design Limits,10/10/2013,Cromer,Enbridge Pipelines Inc.,Closed,49.753998,0,Not Applicable,Not Applicable,No,2013,2012-08-22,2013/10/10 12:00:00 AM Mountain,,,Operation,,4/14/2015,No,No,,,,Yes,,,,,,,,,Over Pressure,,0,OPR,Cromer Terminal,,,,,,,,Canada,No,No,Yes,No,4,,Level I,Standard Review - 168 days,No,INC2013-126,,,,,,,,,,,,,,,,,,,,,,,,,,,,No,,,No,,,No,No,,,No,-101.238688,0,0,0,0,1,0,0,0,0,0,0,1,0,0,0,0,0,0,0,0,0,0,0,0,0,0,0,0,0,8,0,1,0,0
634,INC2013-196,Operation Beyond Design Limits,10/10/2013,Cromer,Enbridge Pipelines Inc.,Closed,49.753998,0,Not Applicable,Not Applicable,No,2013,2012-06-15,2013/10/10 12:00:00 AM Mountain,,,Operation,,4/13/2015,No,No,,,,Yes,,,,,,,,,Over Pressure,,0,OPR,Cromer Terminal,,,,,,,,Canada,No,No,Yes,No,4,,Level I,Standard Review - 168 days,No,INC2013-126,,,,,,,,,,,,,,,,,,,,,,,,,,,,No,,,No,,,No,No,,,No,-101.238688,0,0,0,0,1,0,0,0,0,0,0,1,0,0,0,0,0,0,0,0,0,0,0,0,0,0,0,0,0,6,0,1,0,0
635,INC2013-197,Operation Beyond Design Limits,10/10/2013,Cromer,Enbridge Pipelines Inc.,Closed,49.753998,0,Not Applicable,Not Applicable,No,2013,2012-05-08,2013/10/10 12:00:00 AM Mountain,,,Operation,,4/13/2015,No,No,,,,Yes,,,,,,,,,Over Pressure,,0,OPR,Cromer Terminal,,,,,,,,Canada,No,No,Yes,No,4,,Level I,Standard Review - 168 days,No,INC2013-126,,,,,,,,,,,,,,,,,,,,,,,,,,,,No,,,No,,,No,No,,,No,-101.238688,0,0,0,0,1,0,0,0,0,0,0,1,0,0,0,0,0,0,0,0,0,0,0,0,0,0,0,0,0,5,1,0,0,0
636,INC2013-198,Operation Beyond Design Limits,10/10/2013,Cromer,Enbridge Pipelines Inc.,Closed,49.753998,0,Not Applicable,Not Applicable,No,2013,2012-04-26,2013/10/10 12:00:00 AM Mountain,,,Operation,,4/13/2015,No,No,,,,Yes,,,,,,,,,Over Pressure,,0,OPR,Cromer Terminal,,,,,,,,Canada,No,No,Yes,No,4,,Level I,Standard Review - 168 days,No,INC2013-126,,,,,,,,,,,,,,,,,,,,,,,,,,,,No,,,No,,,No,No,,,No,-101.238688,0,0,0,0,1,0,0,0,0,0,0,1,0,0,0,0,0,0,0,0,0,0,0,0,0,0,0,0,0,4,1,0,0,0
637,INC2013-199,Operation Beyond Design Limits,10/10/2013,Cromer,Enbridge Pipelines Inc.,Closed,49.753998,0,Not Applicable,Not Applicable,No,2013,2012-02-10,2013/10/10 12:00:00 AM Mountain,,,Operation,,4/13/2015,No,No,,,,Yes,,,,,,,,,Over Pressure,,0,OPR,Cromer Terminal,,,,,,,,Canada,No,No,Yes,No,4,,Level I,Standard Review - 168 days,No,INC2013-126,,,,,,,,,,,,,,,,,,,,,,,,,,,,No,,,No,,,No,No,,,No,-101.238688,0,0,0,0,1,0,0,0,0,0,0,1,0,0,0,0,0,0,0,0,0,0,0,0,0,0,0,0,0,2,0,0,0,1
638,INC2013-200,Operation Beyond Design Limits,10/10/2013,Cromer,Enbridge Pipelines Inc.,Closed,49.753998,0,Not Applicable,Not Applicable,No,2013,2011-11-19,2013/10/10 12:00:00 AM Mountain,,,Operation,,4/13/2015,No,No,,,,Yes,,,,,,,,,Over Pressure,,0,OPR,Cromer Terminal,,,,,,,,Canada,No,No,Yes,No,4,,Level I,Standard Review - 168 days,No,INC2013-126,,,,,,,,,,,,,,,,,,,,,,,,,,,,No,,,No,,,No,No,,,No,-101.238688,0,0,0,0,1,0,0,0,0,0,0,1,0,0,0,0,0,0,0,0,0,0,0,0,0,0,0,0,0,11,0,0,1,0
639,INC2013-201,Operation Beyond Design Limits,10/10/2013,Cromer,Enbridge Pipelines Inc.,Closed,49.753998,0,Not Applicable,Not Applicable,No,2013,2011-09-17,2013/10/10 12:00:00 AM Mountain,,,Operation,,4/13/2015,No,No,,,,Yes,,,,,,,,,Over Pressure,,0,OPR,Cromer Terminal,,,,,,,,Canada,No,No,Yes,No,4,,Level I,Standard Review - 168 days,No,INC2013-126,,,,,,,,,,,,,,,,,,,,,,,,,,,,No,,,No,,,No,No,,,No,-101.238688,0,0,0,0,1,0,0,0,0,0,0,1,0,0,0,0,0,0,0,0,0,0,0,0,0,0,0,0,0,9,0,0,1,0
640,INC2013-202,Operation Beyond Design Limits,7/25/2013,Montreal,Trans-Northern Pipelines Inc.,Closed,45.625321,0,Not Applicable,Not Applicable,No,2013,2013-03-20,2013/07/25 12:00:00 AM Mountain,,,Operation,,2/27/2015,No,No,,,,Yes,,,,,,,,,Over Pressure,,0,OPR,Mainline,273.1,635.0188165,Refined Products-Aviation,,,,,Canada,Yes,No,No,No,0,.3 mile from Montreal st,Level I,Standard Review - 168 days,No,"INC2013-101, INC2013-203, INC2015-002, INC2016-008",,,,,,,,,,,,,,,,,,,,,,,,,,,,No,,,No,,,No,No,,,No,-73.537743,0,0,0,0,0,0,0,0,1,0,0,1,0,0,0,0,0,0,0,0,0,0,0,0,0,0,0,0,0,3,1,0,0,0
641,INC2013-203,Operation Beyond Design Limits,7/25/2013,Montreal,Trans-Northern Pipelines Inc.,Closed,45.625321,0,Not Applicable,Not Applicable,No,2013,2012-09-04,2013/07/25 12:00:00 AM Mountain,,,Operation,,2/27/2015,No,No,,,,Yes,,,,,,,,,Over Pressure,,0,OPR,Mainline,273.1,635.0188165,Refined Products-Aviation,,,,,Canada,Yes,No,No,No,0,.3 mile from Montreal st,Level I,Standard Review - 168 days,No,"INC2013-101, INC2013-202, INC2015-002, INC2016-008",,,,,,,,,,,,,,,,,,,,,,,,,,,,No,,,No,,,No,No,,,No,-73.537743,0,0,0,0,0,0,0,0,1,0,0,1,0,0,0,0,0,0,0,0,0,0,0,0,0,0,0,0,0,9,0,0,1,0
642,INC2014-003,Release of Substance,1/8/2014,Moncton,Maritimes & Northeast Pipeline Management Ltd.,Closed,46.112702,0,Natural Gas - Sweet,Gas,No,2014,2014-01-08,2014/01/08 02:00:00 PM Atlantic,,,Operation,Employee / Contractor (Onsite),9/29/2014,Yes,No,Natural Gas - Sweet,0,No,No,,,,,,,,,,,0,OPR,MNE - Moncton Pressure Regulating Station,,,,,,,,Canada,No,No,Yes,No,0,,Level I,Standard Review - 168 days,No,,"Station/Facility, Metering, Delivering, Valve, Pressure relief, Seat",,,,,,,,,0,,,,,,,,,,,,,,,,,,No,,,No,,,No,No,,,No,-64.714397,1,0,0,0,0,0,1,0,0,0,0,1,0,0,0,0,0,0,0,0,0,0,0,0,0,0,0,0,0,1,0,0,0,1
643,INC2014-004,Release of Substance,1/9/2014,Chetwynd,"Westcoast Energy Inc., carrying on business as Spectra Energy Transmission",Closed,55.569092,0.3,Hydrogen Sulphide,Miscellaneous,Yes,2014,2014-01-06,2014/01/06 12:00:00 AM Mountain,,,Operation,,4/13/2017,Yes,No,Hydrogen Sulphide,0.3,Yes,No,,,,,,,,,,,0,PPR,,,,,,,,,Canada,No,No,No,No,0,,Level I,Standard Review - 168 days,No,,,,,,,,,,,,,,,,,,,,,,,,,,,,,No,,,No,,,No,No,,,No,-121.944662,1,0,0,1,0,0,0,0,0,0,0,1,0,0,0,0,0,0,0,0,0,0,0,0,0,0,0,0,0,1,0,0,0,1
644,INC2014-006,"Fire, Release of Substance",1/11/2014,Ile des Chnes,TransCanada PipeLines Limited,Closed,49.716512,2,Lube Oil,Liquid,No,2014,2014-01-11,2014/01/11 12:15:00 AM Mountain,,,Operation,Employee / Contractor (Onsite),2/24/2017,No,No,Lube Oil,2,No,No,,Equipment & Electrical,,,,,,,,,0,OPR,TCPL - Station 41 (Ile des Chenes Compressor Stn),,,,,,,,Canada,Yes,No,No,No,0,,Level I,Standard Review - 168 days,No,,,,,,,,,,,,,,,,,,,,,,,,,,,,,No,,,No,,,No,No,,,No,-96.976655,1,0,1,0,0,0,0,0,0,0,0,1,0,0,0,0,0,0,0,0,0,0,0,0,0,0,0,0,0,1,0,0,0,1
645,INC2014-007,Release of Substance,1/11/2014,Dawson Creek,"Westcoast Energy Inc., carrying on business as Spectra Energy Transmission",Closed,55.793058,1.78,Propane,Gas,No,2014,2014-01-11,2014/01/11 12:01:00 AM Mountain,,,Operation,,8/28/2017,Yes,No,Propane,1.78,No,No,,,,,,,,,,,0,PPR,WEI - Dawson Creek Gas Plant,,,,,,,,Canada,No,No,No,No,0,,Level I,Standard Review - 168 days,No,,Vehicle / mobile equipment,,,,,,,,,,,,,,,,,,,,,,,,,,,No,,,No,,,No,No,,,No,-120.52672,1,0,0,1,0,0,0,0,0,0,0,1,0,0,0,0,0,0,0,0,0,0,0,0,0,0,0,0,0,1,0,0,0,1
646,INC2014-008,Release of Substance,1/12/2014,Bowden,NOVA Gas Transmission Ltd.,Closed,51.911918,1,Natural Gas - Sweet,Gas,No,2014,2014-01-12,2014/01/12 12:00:00 AM Mountain,,Transmission,Operation,Employee / Contractor (Onsite),6/15/2017,Yes,No,Natural Gas - Sweet,1,No,No,,,,,,,,,,,0,OPR,,,,,,,,,Canada,No,No,Yes,No,3,,Level I,Standard Review - 168 days,No,,"Pipeline, Valve, Ball, Body;Pipeline, Valve, Ball, Seat;Pipeline, Valve, Ball, Thread",,NPS 24,,,,,,,,,5700,,,,,,,,,,,,,,,,No,Replacement,1/14/2014,Yes,,,No,Yes,,,No,-113.664358,1,1,0,0,0,0,0,0,0,0,1,1,0,0,0,0,0,0,0,0,0,0,0,0,1,0,0,0,0,1,0,0,0,1
647,INC2014-012,Fire,1/15/2014,Edmonton,Enbridge Pipelines Inc.,Closed,53.5474,0,Not Applicable,Not Applicable,No,2014,2014-01-14,2014/01/14 09:55:00 PM Mountain,,,Construction,Employee / Contractor (Onsite),3/25/2014,No,No,,,,Yes,,Equipment & Electrical,,,,,,,,,0,OPR,EPI - Edmonton Tank Farm,,,,,,,,Canada,No,No,Yes,No,0,,Level I,Standard Review - 168 days,No,INC2014-156,,,,,,,,,,,,,,,,,,,,,,,,,,,,No,,,No,,,No,No,,,No,-113.35582,0,1,0,0,0,0,0,0,0,0,0,1,0,0,0,0,0,0,0,0,0,0,0,0,0,0,0,0,0,1,0,0,0,1
648,INC2014-013,Release of Substance,1/15/2014,Fort Nelson,"Westcoast Energy Inc., carrying on business as Spectra Energy Transmission",Closed,58.653246,190,Natural Gas - Sweet,Gas,No,2014,2014-01-15,2014/01/15 03:40:00 PM Pacific,,,Operation,,10/20/2016,Yes,No,Natural Gas - Sweet,190,No,No,,,,,,,,,,,0,PPR,WEI - Fort Nelson Gas Plant,,,,,,,,Canada,No,No,No,No,0,,Level I,Standard Review - 168 days,No,,,,,,,,,,,,,,,,,,,,,,,,,,,,,No,,,No,,,No,No,,,No,-122.684823,1,0,0,1,0,0,0,0,0,0,0,1,0,0,0,0,0,0,0,0,0,0,0,0,0,0,0,0,0,1,0,0,0,1
649,INC2014-014,Release of Substance,1/16/2014,Norman Wells,Enbridge Pipelines (NW) Inc.,Closed,65.286034,0.0001,Natural Gas - Sweet,Gas,No,2014,2014-01-16,2014/01/16 08:33:00 AM Mountain,,,Maintenance,Employee / Contractor (Onsite),3/4/2015,Yes,No,Natural Gas - Sweet,0.0001,No,No,,,,,,,,,,,0,OPR,EPI (Norman Wells) (NWT),,,,,,,,Canada,Yes,No,No,No,0,,Level I,Standard Review - 168 days,No,,"Station/Facility, Pumping, Flange",,,,,,,,,,,,,,,,,,,,,,,,,,,No,,,No,,,No,No,,,No,-126.887048,1,0,0,0,0,0,0,0,0,1,0,1,0,0,0,0,0,0,0,0,0,0,0,0,0,0,0,0,0,1,0,0,0,1
650,INC2014-015,Release of Substance,1/16/2014,Saint John,Maritimes & Northeast Pipeline Management Ltd.,Closed,45.273315,2,Natural Gas - Sweet,Gas,No,2014,2014-01-16,2014/01/16 07:30:00 PM Atlantic,,,Operation,Employee / Contractor (Onsite),9/18/2014,Yes,No,Natural Gas - Sweet,2,No,No,,,,,,,,,,,0,OPR,MNE - St. John Lateral Pressure Regulating Station,,,,,,,,Canada,No,No,Yes,No,0,,Level I,Standard Review - 168 days,No,INC2016-011,"Station/Facility, Metering, Delivering, Fitting",,,,,,,,,,,,,,,,,,,,,,,,,,,No,,,No,,,No,No,,,No,-66.063308,1,0,0,0,0,0,1,0,0,0,0,1,0,0,0,0,0,0,0,0,0,0,0,0,0,0,0,0,0,1,0,0,0,1
651,INC2014-016,Release of Substance,1/18/2014,Regina,Enbridge Pipelines Inc.,Closed,50.392646,20,Crude Oil - Synthetic,Liquid,Yes,2014,2014-01-18,2014/01/18 10:51:00 AM Mountain,,,Operation,Employee / Contractor (Onsite),9/18/2014,Yes,No,Crude Oil - Synthetic,20,No,No,,,,,,,,,,,0,OPR,EPI Clipper - Rowatt Pump Station,,,,,,,,Canada,Yes,Yes,No,No,0,SW 33 16 19 W2M,Level II,Category B,Yes,,"Station/Facility, Pumping, Piping",,,,,,,,,,,,,,,,,,,,,,,,,,,No,,,No,,,No,No,,,No,-104.569717,1,0,0,0,1,0,0,0,0,0,0,1,0,0,0,0,0,0,0,0,0,0,0,0,0,0,0,0,0,1,0,0,0,1
652,INC2014-024,Release of Substance,2/7/2014,Fredericton,Maritimes & Northeast Pipeline Management Ltd.,Closed,45.96376,0.01,Natural Gas - Sweet,Gas,No,2014,2014-02-07,2014/02/07 04:30:00 PM Atlantic,,,Operation,Employee / Contractor (Onsite),3/3/2015,Yes,No,Natural Gas - Sweet,0.01,No,No,,,,,,,,,,,0,OPR,Mainline,"762.00000000, 863.60000000",574.8807991,Natural Gas,,,,,Canada,Yes,No,No,No,6,Kilometer Post 463 (approx),Level I,Standard Review - 168 days,No,,"Station/Facility, Metering, Delivering, Valve",,,,,,,,,,,,,,,,,,,,,,,,,,,No,Rebuilt,2/7/2014,No,,,No,No,2/7/2014,Repair,No,-66.6432,1,0,0,0,0,0,1,0,0,0,0,1,0,0,0,0,0,0,0,0,0,0,0,0,0,0,0,0,0,2,0,0,0,1
653,INC2014-017,Release of Substance,1/22/2014,Wildrose,Trans Mountain Pipeline ULC,Closed,53.5990003,17,Crude Oil - Sweet,Liquid,No,2014,2014-01-22,2014/01/22 10:24:00 AM Mountain,,,Maintenance,Employee / Contractor (Onsite),8/28/2017,Yes,No,Crude Oil - Sweet,17,No,Yes,,,,,,,,,,,0,OPR,Chip Lake Pump Station,,,,,,,,Canada,Yes,No,No,No,3,Kilometer Post 137,Level I,Standard Review - 168 days,No,REM-TBD,"Station/Facility, Pigging, Launching, Fitting, Nipple, Body",,,,,,,,,,,,,,,,,,,,,,,,,,,No,,,No,,,No,No,,,No,-115.451183,1,1,0,0,0,0,0,0,0,0,0,1,0,0,0,0,0,0,0,0,0,0,0,0,0,0,0,0,0,1,0,0,0,1
654,INC2014-025,Fire,2/10/2014,Hardisty,Enbridge Pipelines Inc.,Closed,52.635343,0,Not Applicable,Not Applicable,No,2014,,2014/02/08 10:30:00 AM Mountain,,,Operation,Employee / Contractor (Onsite),3/26/2014,No,No,,,,Yes,,Equipment & Electrical,,,,,,,,,0,OPR,EPI - Hardisty Terminal,,,,,,,,Canada,Yes,No,No,No,0,,Level I,Standard Review - 168 days,No,,,,,,,,,,,,,,,,,,,,,,,,,,,,,No,,,No,,,No,No,,,No,-111.267485,0,1,0,0,0,0,0,0,0,0,1,1,0,0,0,0,0,0,0,0,0,0,0,0,1,0,0,0,0,2,0,0,0,1
655,INC2014-031,Release of Substance,2/16/2014,Edmonton,Enbridge Pipelines Inc.,Closed,53.547403,5,Crude Oil - Sweet,Liquid,No,2014,,2014/02/16 07:45:00 AM Mountain,,,Operation,Employee / Contractor (Onsite),4/9/2014,No,No,Crude Oil - Sweet,5,No,Yes,,,,,,,,,,,0,OPR,EPI - Edmonton Terminal,,,,,,,,Canada,Yes,No,No,No,0,,Level I,Standard Review - 168 days,No,REM2014-031,,,,,,,,,,,,,,,,,,,,,,,,,,,,No,,,No,,,No,No,,,No,-113.355714,1,1,0,0,0,0,0,0,0,0,0,1,0,0,0,0,0,0,0,0,0,0,0,0,0,0,0,0,0,2,0,0,0,1
656,INC2014-033,Release of Substance,2/18/2014,Rocky Mountain House,NOVA Gas Transmission Ltd.,Closed,52.49217,30001,Natural Gas - Sweet,Gas,Yes,2014,,2014/02/18 05:10:00 AM Mountain,,,Operation,Employee / Contractor (Onsite),1/29/2016,Yes,Yes,Natural Gas - Sweet,30001,Yes,No,,,,,,,,,,,0,OPR,,,,,FERRIER NORTH,,52.49217267,-114.9881648,Canada,No,No,Yes,Yes,0,,Level III,Category C,Yes,,"Pipeline, Pipe, Body",,NPS 18,Carbon Steel,359 - X52,,7.8 mm = 0.307 in,7.9,7.9,6280,,,,,,,,,,Spiral,Double Submerged Arc Welding,,External,Polyethylene Tape Wrap,Wrinkled,Field Applied,,No,Replacement,,No,,,No,No,,,No,-114.98816,1,1,0,0,0,0,0,0,0,0,0,1,0,0,0,0,0,0,0,0,0,0,0,0,0,0,0,0,0,2,0,0,0,1
657,INC2014-038,Fire,2/25/2014,Saint-Eustache,Enbridge Pipelines Inc.,Closed,45.55837,0,Not Applicable,Not Applicable,No,2014,2014-02-25,2014/02/25 08:15:00 AM Eastern,,,Maintenance,Employee / Contractor (Onsite),4/15/2014,No,No,,,,Yes,,Welding or Cutting,,,,,,,,,0,OPR,Line 9,"508.00000000, 762.00000000",859.7003376,Crude Oil,,,,,Canada,No,No,Yes,No,0,Mile Post 2218.6607,Level I,Standard Review - 168 days,No,,,,,,,,,,,,,,,,,,,,,,,,,,,,,No,,,No,,,No,No,,,No,-73.89573,0,0,0,0,0,0,0,0,1,0,0,1,0,0,0,0,0,0,0,0,0,0,0,0,0,0,0,0,0,2,0,0,0,1
658,INC2014-040,Adverse Environmental Effects,3/13/2014,Maple,TransCanada PipeLines Limited,Closed,43.8734742,0,Not Applicable,Not Applicable,Yes,2014,2014-03-12,2014/03/12 03:18:00 PM Mountain,,,Maintenance,Employee / Contractor (Onsite),2/18/2015,Yes,No,,,,Yes,,,,,,,,,,Release of Toxic Substance,0,OPR,TCPL - Station 130 (Maple Compressor Station),,,,,,,,Canada,Yes,No,No,No,0,,Level I,Standard Review - 168 days,No,,"Pipeline, Pipe, Body",,NPS 8,,,,,,,0,,,,,,,,,,,,,,,,,,No,,,No,,,No,No,,,No,-79.579834,0,0,0,0,0,1,0,0,0,0,1,1,0,0,0,0,0,0,0,0,0,0,1,0,0,0,0,0,0,3,1,0,0,0
659,INC2014-041,Fire,3/13/2014,Edenwold,Enbridge Pipelines Inc.,Closed,53.547403,0,Not Applicable,Not Applicable,No,2014,2014-03-13,2014/03/13 09:45:00 AM Mountain,,,Operation,Employee / Contractor (Onsite),5/14/2014,No,No,,,,Yes,,Housekeeping,,,,,,,,,0,OPR,Edmonton Terminal,,,,,,,,Canada,Yes,No,No,No,0,,Level I,Standard Review - 168 days,No,,,,,,,,,,,,,,,,,,,,,,,,,,,,,No,,,No,,,No,No,,,No,-113.355714,0,1,0,0,0,0,0,0,0,0,0,1,0,0,0,0,0,0,0,0,0,0,0,0,0,0,0,0,0,3,1,0,0,0
660,INC2014-042,Release of Substance,3/13/2014,Saint John,Maritimes & Northeast Pipeline Management Ltd.,Closed,45.25073225,500,Natural Gas - Sweet,Gas,No,2014,2014-03-12,2014/03/12 09:00:00 AM Atlantic,,,Operation,Employee / Contractor (Onsite),5/6/2014,Yes,No,Natural Gas - Sweet,500,No,No,,,,,,,,,,,0,OPR,,,,,,,,,Canada,Yes,No,No,No,0,,Level I,Standard Review - 168 days,No,,"Pipeline, Valve, Pressure relief, Seat",,,,,,,,,,,,,,,,,,,,,,,,,,,No,Replacement,,No,,,No,No,,Replacement,No,-66.0979223,1,0,0,0,0,0,1,0,0,0,0,1,0,0,0,0,0,0,0,0,0,0,0,0,0,0,0,0,0,3,1,0,0,0
661,INC2014-043,Release of Substance,3/14/2014,Hardisty,Enbridge Pipelines Inc.,Closed,52.635343,0.001,Natural Gas - Sweet,Gas,No,2014,2014-03-14,2014/03/14 01:32:00 AM Mountain,,,Operation,Employee / Contractor (Onsite),7/2/2014,Yes,No,Natural Gas - Sweet,0.001,No,No,,,,,,,,,,,0,OPR,Line 1,"508.00000000, 864.00000000",1255.999121,Crude Oil,,,,,Canada,Yes,No,No,No,0,,Level I,Standard Review - 168 days,No,,"Station/Facility, Pumping, Pump",,,,,,,,,0,,,,,,,,,,,,,,,,,,No,Replacement,,No,,,No,No,,Replacement,No,-111.267485,1,1,0,0,0,0,0,0,0,0,0,1,0,0,0,0,0,0,0,0,0,0,0,0,0,0,0,0,0,3,1,0,0,0
662,INC2014-044,Release of Substance,3/17/2014,Midale,Enbridge Pipelines Inc.,Closed,49.450607,1.75,Crude Oil - Sweet,Liquid,No,2014,2014-03-15,2014/03/15 03:00:00 PM Mountain,,,Maintenance,Employee / Contractor (Onsite),12/16/2015,No,No,Crude Oil - Sweet,1.75,No,No,,,,,,,,,,,0,OPR,EPI- Midale Terminal,,,,,,,,Canada,Yes,No,No,No,3,Mainline Valve + Offset (km),Level I,Standard Review - 168 days,No,,,,,,,,,,,,,,,,,,,,,,,,,,,,,No,,,No,,,No,No,,,No,-103.338728,1,0,0,0,1,0,0,0,0,0,0,1,0,0,0,0,0,0,0,0,0,0,0,0,0,0,0,0,0,3,1,0,0,0
663,INC2014-045,Release of Substance,3/23/2014,Fort Nelson,"Westcoast Energy Inc., carrying on business as Spectra Energy Transmission",Closed,58.65351,6.3,Mixed HVP Hydrocarbons,Gas,No,2014,2014-03-22,2014/03/22 11:59:00 AM Pacific,,,Operation,Employee / Contractor (Onsite),1/6/2015,Yes,No,Mixed HVP Hydrocarbons,6.3,No,No,,,,,,,,,,,0,OPR,"24"" Beaver River Pipeline","609.60000000, 610.00000000",173.4713372,Natural Gas Sour,,,,,Canada,No,No,Yes,No,3,Mainline Valve + Offset (km),Level I,Standard Review - 168 days,No,,"Pipeline, Valve, Gate, Seal/Packing",,,,,,,,,,,,,,,,,,,,,,,,,,,No,,,No,6/15/2013,Visual,Yes,No,6/15/2013,Testing of Functionality,Yes,-122.68466,1,0,0,1,0,0,0,0,0,0,0,1,0,0,0,0,0,0,0,0,0,0,0,0,0,0,0,0,0,3,1,0,0,0
664,INC2014-047,Release of Substance,3/25/2014,Wainwright,Kinder Morgan Cochin ULC,Closed,52.922575,0,Mixed HVP Hydrocarbons,Gas,No,2014,2014-03-25,2014/03/25 08:00:00 AM Mountain,,,Operation,Employee / Contractor (Onsite),9/29/2014,Yes,No,Mixed HVP Hydrocarbons,0,No,No,,,,,,,,,,,0,OPR,Cochin - Fabyan Pump Station,,,,,,,,Canada,Yes,No,No,No,0,,Level I,Standard Review - 168 days,No,,"Station/Facility, Pumping, Valve",,,,,,,,,,,,,,,,,,,,,,,,,,,No,,,No,,,No,No,,,No,-110.96759,1,1,0,0,0,0,0,0,0,0,0,1,0,0,0,0,0,0,0,0,0,0,0,0,0,0,0,0,0,3,1,0,0,0
665,INC2014-067,Release of Substance,5/2/2014,Irma,Alliance Pipeline Ltd.,Closed,53.031216,0,Natural Gas - Sweet,Gas,No,2014,2014-04-29,2014/04/29 12:00:00 AM Mountain,,,Construction,Employee / Contractor (Onsite),6/10/2014,No,No,Natural Gas - Sweet,,No,Yes,,,,,,,,,,,0,OPR,MAINLINE,"1067.00000000, 914.00000000",1551.609274,Natural Gas,,,,,Canada,Yes,No,No,No,0,,Level I,Standard Review - 168 days,No,,,,,,,,,,,,,,,,,,,,,,,,,,,,,No,,,No,,,No,No,,,No,-111.221509,1,1,0,0,0,0,0,0,0,0,0,1,0,0,0,0,0,0,0,0,0,0,0,0,0,0,0,0,0,4,1,0,0,0
666,INC2014-048,Release of Substance,3/27/2014,Bassano,NOVA Gas Transmission Ltd.,Closed,50.78931,1110,Natural Gas - Sweet,Gas,No,2014,,2014/03/27 05:00:00 PM Mountain,Short-term interruption,,Operation,Employee / Contractor (Onsite),1/30/2017,Yes,No,Natural Gas - Sweet,1110,No,No,,,,,,,,,,,0,OPR,,,,,,,,,Canada,No,No,Yes,No,0,,Level I,Standard Review - 168 days,No,,"Station/Facility, Metering",,,,,,,,,,,,,,,,,,,,,,,,,,,No,,,No,,,No,No,,,No,-112.46998,1,1,0,0,0,0,0,0,0,0,1,1,0,0,0,0,0,0,0,0,0,0,1,0,0,0,0,0,0,3,1,0,0,0
667,INC2014-050,Release of Substance,4/1/2014,Edmonton,Enbridge Pipelines Inc.,Closed,53.542908,2.5,Crude Oil - Sour,Liquid,Yes,2014,,2014/03/31 03:30:00 AM Mountain,,,Maintenance,Employee / Contractor (Onsite),2/6/2015,Yes,No,Crude Oil - Sour,2.5,No,Yes,,,,,,,,,,,0,OPR,Line 2,"1219.00000000, 609.40000000, 610.00000000",1282.304863,Crude Oil,,Meter,,,Canada,No,No,Yes,No,0,,Level I,Standard Review - 168 days,No,REM-0284,"Pipeline, Valve, Gate, Body",,,,,40,,,,0,,,,,1972,1972,,,,,,,,,,,,No,Removal,4/1/2014,No,,,No,No,4/1/2014,Repair,No,-113.36445,1,1,0,0,0,0,0,0,0,0,1,0,0,1,0,0,0,0,0,0,0,0,0,0,1,0,0,0,0,3,1,0,0,0
668,INC2014-052,Release of Substance,4/7/2014,Elbow,Kinder Morgan Cochin ULC,Closed,51.17738,0,Propane,Gas,No,2014,2014-04-07,2014/04/07 03:30:00 PM Central,,,Maintenance,Employee / Contractor (Onsite),11/12/2014,Yes,No,Propane,0,No,No,,,,,,,,,,,0,OPR,Elbow Pump Station Sask,,,,,,,,Canada,Yes,No,No,No,0,Mainline Valve + Offset (km),Level I,Standard Review - 168 days,No,,"Station/Facility, Pumping, Fitting",,,,,,,,,,,,,,,,,,,,,,,,,,,No,,,No,,,No,No,,,No,-106.588176,1,0,0,0,1,0,0,0,0,0,0,1,0,0,0,0,0,0,0,0,0,0,0,0,0,0,0,0,0,4,1,0,0,0
669,INC2014-053,Fire,4/9/2014,Hardisty,Enbridge Pipelines Inc.,Closed,52.641345,0,Not Applicable,Not Applicable,No,2014,2014-04-09,2014/04/09 04:00:00 PM Mountain,,,Operation,Employee / Contractor (Onsite),11/2/2015,No,No,,,,No,,Housekeeping,,,,,,,,,0,OPR,Hardisty terminal,,,,,,,,Canada,Yes,No,No,No,0,Pump Station,Level I,Standard Review - 168 days,No,,,,,,,,,,,,,,,,,,,,,,,,,,,,,No,,,No,,,No,No,,,No,-111.270617,0,1,0,0,0,0,0,0,0,0,0,1,0,0,0,0,0,0,0,0,0,0,0,0,0,0,0,0,0,4,1,0,0,0
670,INC2014-055,Release of Substance,4/10/2014,Saint John,Maritimes & Northeast Pipeline Management Ltd.,Closed,45.273315,1,Natural Gas - Sweet,Gas,No,2014,2014-04-10,2014/04/10 09:00:00 AM Atlantic,,,Operation,Landowner,9/2/2014,Yes,No,Natural Gas - Sweet,1,No,No,,,,,,,,,,,0,OPR,Egbert Strret Meter Station,,,,,,,,Canada,Yes,Yes,No,No,0,,Level I,Standard Review - 168 days,No,,"Station/Facility, Metering, Delivering, Valve, Gate, Seat",,,,,,,,,,,,,,,,,,,,,,,,,,,No,,,No,,,No,No,,,No,-66.063308,1,0,0,0,0,0,1,0,0,0,0,1,0,0,0,0,0,0,0,0,0,0,0,0,0,0,0,0,0,4,1,0,0,0
671,INC2014-056,"Release of Substance, Adverse Environmental Effects",4/10/2014,Chetwynd,"Westcoast Energy Inc., carrying on business as Spectra Energy Transmission",Closed,55.569092,3,Crude Oil - Sweet,Liquid,Yes,2014,2014-04-10,2014/04/10 11:15:00 AM Mountain,,,Operation,,3/30/2016,No,No,Crude Oil - Sweet,3,No,No,,,,,,,,,,Other Pollution (Contamination),0,PPR,,,,,,,,,Canada,Yes,No,No,No,0,,Level I,Standard Review - 168 days,No,,,,,,,,,,,,,,,,,,,,,,,,,,,,,No,,,No,,,No,No,,,No,-121.944662,1,0,0,1,0,0,0,0,0,0,0,1,0,0,0,0,0,0,0,0,0,0,0,0,0,0,0,0,0,4,1,0,0,0
672,INC2014-058,Release of Substance,4/13/2014,Savona,"Westcoast Energy Inc., carrying on business as Spectra Energy Transmission",Closed,50.749343,1522790,Natural Gas - Sweet,Gas,Yes,2014,2014-04-13,2014/04/13 04:00:00 PM Pacific,,,Operation,Employee / Contractor (Onsite),7/25/2016,Yes,No,Natural Gas - Sweet,1522790,No,No,,,,,,,,,,,0,OPR,,,,,,,,,Canada,Yes,No,No,No,0,,Level I,Standard Review - 168 days,No,,"Station/Facility, Compression, Valve, Pressure relief, Other (please explain)",,,,,,,,,,,,,,,,,,,,,,,,,,,No,,,No,,,No,No,,,No,-120.857245,1,0,0,1,0,0,0,0,0,0,0,1,0,0,0,0,0,0,0,0,0,0,0,0,0,0,0,0,0,4,1,0,0,0
673,INC2014-059,Release of Substance,4/18/2014,Edmonton,Enbridge Pipelines Inc.,Closed,53.547403,15,Crude Oil - Sweet,Liquid,No,2014,,2014/04/18 04:30:00 PM Mountain,,Transmission,Operation,Employee / Contractor (Onsite),4/22/2015,Yes,No,Crude Oil - Sweet,15,No,Yes,,,,,,,,,,,0,OPR,,,,,,Valve,,,Canada,Yes,No,No,No,0,,Level I,Standard Review - 168 days,No,,"Storage, Tank, Aboveground",,,,,,,,,,,,,,,,,,,,,,,,,,,No,,,No,,,No,No,,,No,-113.355714,1,1,0,0,0,0,0,0,0,0,1,0,0,1,0,0,0,0,0,0,0,0,0,1,0,0,0,0,0,4,1,0,0,0
674,INC2014-060,Release of Substance,4/19/2014,Sunnybrae,Maritimes & Northeast Pipeline Management Ltd.,Closed,45.375146,56,Natural Gas - Sweet,Gas,No,2014,,2014/04/19 06:00:00 PM Atlantic,,,Operation,Employee / Contractor (Onsite),6/9/2014,Yes,No,Natural Gas - Sweet,56,No,No,,,,,,,,,,,0,OPR,Mainline,"762.00000000, 863.60000000",574.8807991,Natural Gas,,,,,Canada,Yes,No,No,No,3,Kilometer Post 76,Level I,Standard Review - 168 days,No,,"Pipeline, Valve, Pressure relief, Other (please explain)",,NPS 1/2,,,,,,,0,,,,,,2001,,,,,,,,,,,,No,Rebuilt,12/15/2014,No,,,No,No,12/15/2014,Repair,No,-62.452544,1,0,0,0,0,0,0,1,0,0,0,1,0,0,0,0,0,0,0,0,0,0,0,0,0,0,0,0,0,4,1,0,0,0
675,INC2014-061,Release of Substance,4/24/2014,Mattice,TransCanada PipeLines Limited,Closed,49.586667,0.0001,Natural Gas - Sweet,Gas,No,2014,2014-04-24,2014/04/24 11:00:00 AM Eastern,,Transmission,Operation,Employee / Contractor (Onsite),11/10/2016,Yes,No,Natural Gas - Sweet,0.0001,No,No,,,,,,,,,,,0,OPR,TCPL - Station 92 (Mattice Compressor Station),,,,,,,,Canada,Yes,No,No,No,0,,Level I,Standard Review - 168 days,No,,"Station/Facility, Compression, Piping, Body",,,,,,,,,,,,,,,,,,,,,,,,,,,No,,,No,,,No,No,,,No,-83.159167,1,0,0,0,0,1,0,0,0,0,1,1,0,0,0,0,0,0,0,0,0,0,1,0,0,0,0,0,0,4,1,0,0,0
676,INC2014-062,Release of Substance,4/28/2014,Conklin,NOVA Gas Transmission Ltd.,Closed,55.569186,0.001,Natural Gas - Sweet,Gas,No,2014,2014-04-28,2014/04/28 03:20:00 PM Mountain,Short-term interruption,Transmission,Construction,Employee / Contractor (Onsite),2/22/2017,No,No,Natural Gas - Sweet,0.001,No,No,,,,,,,,,,,0,OPR,GRAHAM LATERAL LOOP - NPS 12,323.9,56.36135218,Natural Gas,,,,,Canada,No,No,Yes,No,0,,Level I,Standard Review - 168 days,No,,,,,,,,,,,,,,,,,,,,,,,,,,,,,No,,,No,,,No,No,,,No,-110.720302,1,1,0,0,0,0,0,0,0,0,0,1,0,0,0,0,0,0,0,0,0,0,0,0,0,0,0,0,0,4,1,0,0,0
677,INC2014-064,"Release of Substance, Adverse Environmental Effects",5/1/2014,Fort Nelson,"Westcoast Energy Inc., carrying on business as Spectra Energy Transmission",Closed,58.653246,6.5,Amine,Miscellaneous,Yes,2014,2014-04-30,2014/04/30 11:20:00 AM Pacific,,,Maintenance,,3/25/2019,No,No,Amine,6.5,No,No,,,,,,,,,,,0,PPR,Fort Nelson Gas Plant,,,,,,,,Canada,No,No,No,No,0,,Level I,Standard Review - 168 days,No,,,,,,,,,,,,,,,,,,,,,,,,,,,,,No,,,No,,,No,No,,,No,-122.684823,1,0,0,1,0,0,0,0,0,0,0,1,0,0,0,0,0,0,0,0,0,0,0,0,0,0,0,0,0,4,1,0,0,0
678,INC2014-065,Release of Substance,5/1/2014,Penhold,NOVA Gas Transmission Ltd.,Closed,52.173034,148,Natural Gas - Sweet,Gas,No,2014,2014-04-30,2014/04/30 04:30:00 PM Mountain,No pipeline interruption,Transmission,Operation,Employee / Contractor (Onsite),3/1/2017,Yes,No,Natural Gas - Sweet,148,No,No,,,,,,,,,,,0,OPR,NGTL - Joffre Sales Lateral NPS-10,,,,,,,,Canada,No,No,Yes,No,0,,Level I,Standard Review - 168 days,No,,"Station/Facility, Compression, Fitting, Nipple, Thread;Station/Facility, Compression, Valve, Gate, Stem",1987,NPS 1/2,Carbon Steel,,80,,,,7500,,,,1,,1987,1987,,,,,,,,,,,No,,,No,4/30/2014,Non-destructive examination (NDE),Yes,No,4/30/2014,Testing of Functionality,Yes,-113.83314,1,1,0,0,0,0,0,0,0,0,1,1,0,0,0,0,0,0,0,0,0,0,1,0,0,0,0,0,0,4,1,0,0,0
679,INC2014-068,Release of Substance,5/6/2014,Dartmouth,Maritimes & Northeast Pipeline Management Ltd.,Closed,44.665206,30,Natural Gas - Sweet,Gas,No,2014,2014-05-05,2014/05/05 10:00:00 AM Atlantic,,,Maintenance,Employee / Contractor (Onsite),10/1/2014,Yes,No,Natural Gas - Sweet,30,No,No,,,,,,,,,,,0,OPR,,,,,,,,,Canada,No,No,Yes,No,0,,Level I,Standard Review - 168 days,No,,"Pipeline, Valve, Gate, Seal/Packing",,,,,,,,,,,,,,,,,,,,,,,,,,,No,,,No,,,No,No,,,No,-63.567743,1,0,0,0,0,0,0,1,0,0,0,1,0,0,0,0,0,0,0,0,0,0,0,0,0,0,0,0,0,5,1,0,0,0
680,INC2014-071,Release of Substance,5/14/2014,Not specified,"Westcoast Energy Inc., carrying on business as Spectra Energy Transmission",Closed,56.146303,0,Natural Gas - Sweet,Gas,No,2014,,2014/05/12 12:00:00 AM Mountain,,,Operation,,3/26/2019,No,No,Natural Gas - Sweet,,No,No,,,,,,,,,,,0,PPR,WEI - McMahon Gas Plant (Taylor Gas Plant),,,,,,,,Canada,No,No,No,No,0,,Level I,Standard Review - 168 days,No,,,,,,,,,,,,,,,,,,,,,,,,,,,,,No,,,No,,,No,No,,,No,-120.669169,1,0,0,1,0,0,0,0,0,0,0,1,0,0,0,0,0,0,0,0,0,0,0,0,0,0,0,0,0,5,1,0,0,0
681,INC2014-074,Release of Substance,5/26/2014,Vegreville,NOVA Gas Transmission Ltd.,Closed,53.522635,1114,Natural Gas - Sweet,Gas,No,2014,2014-05-26,2014/05/26 05:00:00 PM Mountain,,Transmission,Operation,Landowner,2/22/2017,Yes,No,Natural Gas - Sweet,1114,Yes,No,,,,,,,,,,,0,OPR,NORTH LATERAL EXTENSION LOOP - NPS 20,508,40.08068498,Natural Gas,,,,,Canada,No,No,Yes,Yes,3,Legal Subdivision NE 25 52 15 W4,Level I,Standard Review - 168 days,No,,,,,,,,,,,,,,,,,,,,,,,,,,,,,No,,,No,,,No,No,,,No,-112.075565,1,1,0,0,0,0,0,0,0,0,0,0,0,0,1,0,0,0,0,0,0,0,0,0,0,0,0,0,0,5,1,0,0,0
682,INC2014-076,Release of Substance,5/28/2014,Not specified,TransCanada PipeLines Limited,Closed,49.911934,0,Natural Gas - Sweet,Gas,No,2014,2014-05-27,2014/05/27 04:10:00 PM Mountain,,,Operation,Landowner,8/15/2017,Yes,No,Natural Gas - Sweet,,No,No,,,,,,,,,,,0,OPR,Line 100-4,1066.8,1422.828067,Natural Gas,,,,,Canada,Yes,Yes,No,No,0,,Level I,Standard Review - 168 days,No,,,,,,,,,,,,,,,,,,,,,,,,,,,,,No,,,No,,,No,No,,,No,-98.517574,1,0,1,0,0,0,0,0,0,0,0,1,0,0,0,0,0,0,0,0,0,0,0,0,0,0,0,0,0,5,1,0,0,0
683,INC2014-078,Release of Substance,6/2/2014,Morinville,Alliance Pipeline Ltd.,Closed,53.818798,160000,Natural Gas - Sweet,Gas,Yes,2014,2014-06-01,2014/06/02 11:50:00 PM Mountain,,Transmission,Operation,Landowner,2/20/2017,Yes,No,Natural Gas - Sweet,160000,No,No,,,,,,,,,,,0,OPR,Alliance - Morinville Compressor Station,,,,,,,,Canada,Yes,Yes,No,No,5,Legal Subdivision 3-12-56-25-W4,Level I,Standard Review - 168 days,No,,"Station/Facility, Compression, Valve, Pressure relief, Flange, Gasket/O-ring",,,,,,,,,,,,,,,,,,,,,,,,,,,No,,,No,,,No,No,,,No,-113.584867,1,1,0,0,0,0,0,0,0,0,0,1,0,0,0,0,0,0,0,0,0,0,0,0,0,0,0,0,0,6,0,1,0,0
684,INC2014-079,Fire,6/2/2014,Saint-Andr?Est,Enbridge Pipelines Inc.,Closed,45.562805,0,Not Applicable,Not Applicable,No,2014,2014-05-30,2014/06/02 02:20:00 PM Eastern,,,Operation,Employee / Contractor (Onsite),3/3/2015,No,No,,,,No,,Other Event (Nature or 3rd Party),,,,,,,,,0,OPR,Line 9,"508.00000000, 762.00000000",859.7003376,Crude Oil,,,,,Canada,Yes,No,No,No,4,Mile Post 2209-9477,Level I,Standard Review - 168 days,No,,,,,,,,,,,,,,,,,,,,,,,,,,,,,No,,,No,,,No,No,,,No,-74.336053,0,0,0,0,0,0,0,0,1,0,1,1,0,0,0,0,0,0,0,0,0,0,0,0,0,0,0,0,0,5,1,0,0,0
685,INC2014-080,Operation Beyond Design Limits,6/2/2014,Oakville,Trans-Northern Pipelines Inc.,Closed,43.39419228,0,Not Applicable,Not Applicable,No,2014,2014-05-31,2014/05/31 11:54:00 PM Eastern,Short-term interruption,Transmission,Operation,Employee / Contractor (Onsite),10/12/2016,Yes,No,,,,No,,,,,,,,,Over Pressure,,0,OPR,Mainline,273.1,635.0188165,Refined Products-Aviation,OAKVILLE STATION,,43.39419228,-79.73731816,Canada,Yes,Yes,No,No,0,,Level I,Standard Review - 168 days,No,"INC2015-002, INC2016-008","Station/Facility, Pumping, Instrumentation and controls;Pipeline, Instrumentation and controls",,NPS 10,,,,,,,,6447,7368.5,,,,,,,,,,,,,,,,No,,,Yes,,,No,Yes,,,No,-79.73731816,0,0,0,0,0,1,0,0,0,0,0,1,0,0,0,0,0,0,0,0,0,0,0,0,0,0,0,0,0,5,1,0,0,0
686,INC2014-081,Release of Substance,6/3/2014,"Killam, AB",NOVA Gas Transmission Ltd.,Closed,52.92871,322,Natural Gas - Sweet,Gas,No,2014,2014-06-02,2014/06/02 07:45:00 PM Mountain,No pipeline interruption,Transmission,Operation,Landowner,2/22/2017,Yes,No,Natural Gas - Sweet,322,Yes,No,,,,,,,,,,,0,OPR,KILLAM NORTH LATERAL - NPS 6,168.3,15.68988187,Natural Gas,,,,,Canada,No,No,Yes,Yes,0,Legal Subdivision SW 32 45 13 W4,Level I,Standard Review - 168 days,No,,,,,,,,,,,,,,,,,,,,,,,,,,,,,No,,,No,,,No,No,,,No,-111.88764,1,1,0,0,0,0,0,0,0,0,0,1,0,0,0,0,0,0,0,0,0,0,0,0,0,0,0,0,0,6,0,1,0,0
687,INC2014-082,Release of Substance,6/5/2014,Kerrobert,Enbridge Pipelines Inc.,Closed,51.868264,0.0001,Natural Gas Liquids,Gas,No,2014,2014-06-04,2014/06/04 09:39:00 PM Mountain,,,Operation,Employee / Contractor (Onsite),8/12/2014,No,No,Natural Gas Liquids,0.0001,No,Yes,,,,,,,,,,,0,OPR,Kerrobert Terminal,,,,,,,,Canada,Yes,No,No,No,0,Legal Subdivision At station,Level I,Standard Review - 168 days,No,,,,,,,,,,,,,,,,,,,,,,,,,,,,,No,,,No,,,No,No,,,No,-109.036068,1,0,0,0,1,0,0,0,0,0,0,1,0,0,0,0,0,0,0,0,0,0,0,0,0,0,0,0,0,6,0,1,0,0
688,INC2014-083,Fire,6/10/2014,Dawson Creek,"Westcoast Energy Inc., carrying on business as Spectra Energy Transmission",Closed,55.814038,0,Not Applicable,Not Applicable,No,2014,2014-06-10,2014/06/10 12:00:00 PM Pacific,,,Operation,Employee / Contractor (Onsite),12/2/2014,Yes,No,,,,No,,Equipment & Electrical,,,,,,,,,0,OPR,Sunset Compressor Site,,,,,,,,Canada,Yes,No,No,No,0,5 kms from Dawson City,Level I,Standard Review - 168 days,No,,"Station/Facility, Compression, Auxiliary power unit",,,,,,,,,,,,,,,,,,,,,,,,,,,No,Replacement,,No,,,No,No,,Replacement,No,-120.869412,0,0,0,1,0,0,0,0,0,0,0,1,0,0,0,0,0,0,0,0,0,0,0,0,0,0,0,0,0,6,0,1,0,0
689,INC2014-084,Release of Substance,6/11/2014,Grande Prairie,NOVA Gas Transmission Ltd.,Closed,55.24345,0.0001,Natural Gas - Sweet,Gas,No,2014,2014-06-11,2014/06/11 09:45:00 AM Mountain,,Transmission,Maintenance,Employee / Contractor (Onsite),11/10/2016,Yes,No,Natural Gas - Sweet,0.0001,Yes,No,,,,,,,,,,,0,OPR,Goodfare M/S,,,,,,,,Canada,Yes,No,No,No,3,Legal Subdivision 4-19-72-11-W6,Level I,Standard Review - 168 days,No,,"Station/Facility, Metering, Receiving, Valve, Gate, Other (please explain)",,,,,,,,,,,,,,,,,,,,,,,,,,,No,,,No,,,No,No,,,No,-119.69047,1,1,0,0,0,0,0,0,0,0,1,1,0,0,0,0,0,0,0,0,0,0,1,0,0,0,0,0,0,6,0,1,0,0
690,INC2014-086,Operation Beyond Design Limits,6/13/2014,Fort Nelson,"Westcoast Energy Inc., carrying on business as Spectra Energy Transmission",Closed,58.65309,0,Not Applicable,Not Applicable,No,2014,2014-06-12,2014/06/12 11:00:00 PM Pacific,,Processing,Operation,,4/13/2017,Yes,No,,,,No,,,,,,,,,Over Pressure,,0,PPR,Fort Nelson Gas Plant,,,,,,,,Canada,No,No,No,No,5,,Level I,Standard Review - 168 days,No,,,,,,,,,,,,,,,,,,,,,,,,,,,,,No,,,No,,,No,No,,,No,-122.68472,0,0,0,1,0,0,0,0,0,0,0,1,0,0,0,0,0,0,0,0,0,0,0,0,0,0,0,0,0,6,0,1,0,0
691,INC2014-087,Fire,6/13/2014,Prophet River,"Westcoast Energy Inc., carrying on business as Spectra Energy Transmission",Closed,58.09092,0,Not Applicable,Not Applicable,No,2014,2014-06-13,2014/06/13 12:00:00 PM Pacific,,,Operation,Employee / Contractor (Onsite),11/12/2014,No,No,,,,No,,Other Event (Nature or 3rd Party),,,,,,,,,0,OPR,Compressor Station N2,,,,,,,,Canada,Yes,No,No,No,0,,Level I,Standard Review - 168 days,No,,"Station/Facility, Pigging, Launching, Fitting",,,,,,,,,,,,,,,,,,,,,,,,,,,No,,,No,,,No,No,,,No,-122.70921,0,0,0,1,0,0,0,0,0,0,1,1,0,0,0,0,0,0,0,0,0,0,0,0,0,0,0,0,0,6,0,1,0,0
692,INC2014-089,Release of Substance,6/18/2014,Geraldton,TransCanada PipeLines Limited,Closed,49.80158,0.001,Natural Gas - Sweet,Gas,No,2014,2014-06-18,2014/06/18 01:30:00 PM Mountain,,Transmission,Operation,Employee / Contractor (Onsite),12/8/2016,Yes,No,Natural Gas - Sweet,0.001,Yes,No,,,,,,,,,,,0,OPR,TCPL - Station 80 (Geraldton Compressor Station),,,,,,,,Canada,Yes,No,No,No,0,,Level I,Standard Review - 168 days,No,,"Pipeline, Pipe, Body",,,,,,,,,,,,,,,,,,,,,,,,,,,No,,,No,,,No,No,,,No,-86.7605,1,0,0,0,0,1,0,0,0,0,0,1,0,0,0,0,0,0,0,0,0,0,0,0,0,0,0,0,0,6,0,1,0,0
693,INC2014-090,Fire,6/20/2014,Kerrobert,Enbridge Pipelines Inc.,Closed,51.868264,0,Not Applicable,Not Applicable,No,2014,2014-06-20,2014/06/20 10:30:00 AM Mountain,,,Maintenance,Employee / Contractor (Onsite),9/29/2014,Yes,No,,,,No,,Equipment & Electrical,,,,,,,,,0,OPR,EPI - Kerrobert Terminal,,,,,,,,Canada,Yes,No,No,No,0,,Level I,Standard Review - 168 days,No,,Vehicle / mobile equipment,,,,,,,,,,,,,,,,,,,,,,,,,,,No,,,No,,,No,No,,,No,-109.036068,0,0,0,0,1,0,0,0,0,0,0,1,0,0,0,0,0,0,0,0,0,0,0,0,0,0,0,0,0,6,0,1,0,0
694,INC2014-091,Release of Substance,6/21/2014,Geraldton,TransCanada PipeLines Limited,Closed,49.80132,40,Natural Gas - Sweet,Gas,No,2014,2014-06-20,2014/06/20 12:00:00 PM Mountain,No pipeline interruption,Gathering,Operation,Employee / Contractor (Onsite),3/1/2017,Yes,No,Natural Gas - Sweet,40,No,No,,,,,,,,,,,0,OPR,,,,,,Meter,,,Canada,Yes,No,No,No,3,MLV 80+0.0,Level I,Standard Review - 168 days,No,,"Station/Facility, Compression, Fitting, Nipple, Thread",1981,NPS 1/2,Carbon Steel,,80,,,,,,,,,,1981,1981,,,,,,,,,,,No,,,No,6/20/2014,Visual,Yes,Yes,,,No,-86.7603,1,0,0,0,0,1,0,0,0,0,0,0,0,1,0,0,0,0,0,0,0,0,0,0,0,0,0,0,0,6,0,1,0,0
695,INC2014-093,Release of Substance,6/27/2014,Grande Prairie,Alliance Pipeline Ltd.,Closed,54.528731,0,Natural Gas - Sweet,Gas,No,2014,2014-05-25,2014/05/25 08:00:00 PM Mountain,,,Operation,Employee / Contractor (Onsite),11/12/2014,Yes,No,Natural Gas - Sweet,0,No,No,,,,,,,,,,,0,OPR,,,,,,,,,Canada,Yes,No,No,No,0,,Level I,Standard Review - 168 days,No,,"Station/Facility, Metering, Receiving, Valve, Pressure relief, Other (please explain)",,,,,,,,,,,,,,,,,,,,,,,,,,,No,Replacement,5/25/2014,No,,,No,No,5/25/2014,Replacement,No,-118.154622,1,1,0,0,0,0,0,0,0,0,0,1,0,0,0,0,0,0,0,0,0,0,0,0,0,0,0,0,0,5,1,0,0,0
696,INC2014-095,Release of Substance,7/3/2014,Arnprior,TransCanada PipeLines Limited,Closed,45.30533,0.0001,Natural Gas - Sweet,Gas,No,2014,2014-07-03,2014/07/03 07:30:00 AM Eastern,,,Operation,Employee / Contractor (Onsite),2/20/2017,Yes,No,Natural Gas - Sweet,0.0001,No,No,,,,,,,,,,,0,OPR,TCPL - MLV 1216,,,,,,,,Canada,Yes,No,No,No,0,,Level I,Standard Review - 168 days,No,,"Station/Facility, Compression, Fitting, Nipple, Thread",,,,,,,,,,,,,,,,,,,,,,,,,,,No,,,No,,,No,No,,,No,-76.20745,1,0,0,0,0,1,0,0,0,0,0,1,0,0,0,0,0,0,0,0,0,0,0,0,0,0,0,0,0,7,0,1,0,0
697,INC2014-096,Release of Substance,7/6/2014,Crossfield,NOVA Gas Transmission Ltd.,Closed,51.40375331,2,Natural Gas - Sweet,Gas,No,2014,2014-07-06,2014/07/06 10:00:00 AM Mountain,,Transmission,Operation,3rd Party / Other Company,5/17/2016,Yes,No,Natural Gas - Sweet,2,No,No,,,,,,,,,,,0,OPR,,,,,,,,,Canada,No,No,Yes,No,0,,Level I,Standard Review - 168 days,No,,"Pipeline, Flange, Gasket/O-ring",,NPS 8,,,,,,,6895,,5645,,,,2008,,,,,,,,,,,,No,,7/8/2014,Yes,,,No,Yes,,,No,-114.0339696,1,1,0,0,0,0,0,0,0,0,1,1,0,0,0,0,0,0,0,0,0,0,0,0,0,1,0,0,0,7,0,1,0,0
698,INC2014-097,Fire,7/18/2014,Not specified,"Westcoast Energy Inc., carrying on business as Spectra Energy Transmission",Closed,55.93969,0,Not Applicable,Not Applicable,No,2014,2014-07-18,2014/07/18 01:30:00 PM Pacific,,,Operation,Employee / Contractor (Onsite),2/17/2016,No,No,,,,No,,Equipment & Electrical,,,,,,,,,0,OPR,"26"" Alberta Mainline",660.4,57.94913728,Natural Gas Sweet,,,,,Canada,Yes,No,No,No,0,17.3,Level I,Standard Review - 168 days,No,INC2014-128,,,,,,,,,,,,,,,,,,,,,,,,,,,,No,,,No,,,No,No,,,No,-120.16184,0,0,0,1,0,0,0,0,0,0,0,1,0,0,0,0,0,0,0,0,0,0,0,0,0,0,0,0,0,7,0,1,0,0
699,INC2014-101,Release of Substance,8/1/2014,Maple,TransCanada PipeLines Limited,Closed,43.873742,0,Natural Gas - Sweet,Gas,No,2014,2014-07-31,2014/07/31 11:00:00 AM Eastern,,,Operation,Employee / Contractor (Onsite),5/11/2017,No,No,Natural Gas - Sweet,0,No,No,,,,,,,,,,,0,OPR,,,,,,,,,Canada,Yes,No,No,No,6,,Level I,Standard Review - 168 days,No,,,,,,,,,,,,,,,,,,,,,,,,,,,,,No,,,No,,,No,No,,,No,-79.579834,1,0,0,0,0,1,0,0,0,0,0,1,0,0,0,0,0,0,0,0,0,0,0,0,0,0,0,0,0,7,0,1,0,0
700,INC2014-104,Release of Substance,8/6/2014,"23 km SW of Chetwynd, BC ","Westcoast Energy Inc., carrying on business as Spectra Energy Transmission",Closed,55.569092,63,Sulphur,Miscellaneous,No,2014,2014-08-04,2014/08/04 09:51:00 PM Pacific,No pipeline interruption,,Operation,Employee / Contractor (Onsite),10/18/2016,No,No,Sulphur,63,No,No,,,,,,,,,,,0,PPR,Grizzly Pipeline,"273.10000000, 508.00000000, 610.00000000",160.6451852,"Natural Gas Sour, Natural Gas Sweet",,,,,Canada,Yes,No,No,No,0,,Level I,Standard Review - 168 days,No,,,,,,,,,,,,,,,,,,,,,,,,,,,,,No,,,No,,,No,No,,,No,-121.944662,1,0,0,1,0,0,0,0,0,0,0,0,0,1,0,0,0,0,0,0,0,0,0,0,0,0,0,0,0,8,0,1,0,0
701,INC2014-105,Fire,8/11/2014,Edmonton,Enbridge Pipelines Inc.,Closed,53.547403,0,Not Applicable,Not Applicable,No,2014,2014-08-11,2014/08/11 03:30:00 PM Mountain,,,Operation,Employee / Contractor (Onsite),11/25/2014,Yes,No,,,,No,,Equipment & Electrical,,,,,,,,,0,OPR,EPI - Edmonton Terminal,,,,,,,,Canada,Yes,No,No,No,0,,Level I,Standard Review - 168 days,No,,Vehicle / mobile equipment,,,,,,,,,,,,,,,,,,,,,,,,,,,No,,,No,,,No,No,,,No,-113.355714,0,1,0,0,0,0,0,0,0,0,0,1,0,0,0,0,0,0,0,0,0,0,0,0,0,0,0,0,0,8,0,1,0,0
702,INC2014-110,Release of Substance,8/24/2014,Not Specified,"Westcoast Energy Inc., carrying on business as Spectra Energy Transmission",Closed,55.56909171,8.25,Sulphur,Miscellaneous,No,2014,2014-08-24,2014/08/24 02:00:00 PM Pacific,,,Operation,,8/23/2017,No,No,Sulphur,8.25,No,No,,,,,,,,,,,0,PPR,,,,,,,,,Canada,Yes,No,No,No,0,,Level I,Standard Review - 168 days,No,,,,,,,,,,,,,,,,,,,,,,,,,,,,,No,,,No,,,No,No,,,No,-121.9446616,1,0,0,1,0,0,0,0,0,0,0,1,0,0,0,0,0,0,0,0,0,0,0,0,0,0,0,0,0,8,0,1,0,0
703,INC2014-106,Release of Substance,8/13/2014,Edmonton,Enbridge Pipelines Inc.,Closed,53.547403,0.0001,Natural Gas Liquids,Gas,No,2014,2014-08-13,2014/08/13 05:00:00 AM Mountain,,,Operation,Employee / Contractor (Onsite),2/5/2015,Yes,No,Natural Gas Liquids,0.0001,No,No,,,,,,,,,,,0,OPR,Line 1,"508.00000000, 864.00000000",1255.999121,Crude Oil,,Meter,,,Canada,Yes,No,No,No,0,0,Level I,Standard Review - 168 days,No,,"Station/Facility, Metering, Receiving, Fitting",,,,,,,,,,,,,,,,,,,,,,,,,,,No,,,No,,,No,No,,,No,-113.355714,1,1,0,0,0,0,0,0,0,0,0,1,0,0,0,0,0,0,0,0,0,0,0,0,0,0,0,0,0,8,0,1,0,0
704,INC2014-111,Fatality,9/2/2014,Taylor,"Westcoast Energy Inc., carrying on business as Spectra Energy Transmission",Closed,56.146303,0,Not Applicable,Not Applicable,Yes,2014,2014-09-02,2014/09/02 03:32:00 PM Pacific,No pipeline interruption,Processing,Operation,Employee / Contractor (Onsite),6/30/2016,No,No,,,,No,,,Vehicle Accident,1,,,,,,,0,PPR,,,,,,,,,Canada,Yes,No,No,No,6,,Level III,Category C,No,,,,,,,,,,,,,,,,,,,,,,,,,,,,,No,,,No,,,No,No,,,No,-120.669169,0,0,0,1,0,0,0,0,0,0,0,1,0,0,0,0,0,0,0,0,0,0,0,0,0,0,0,0,0,9,0,0,1,0
705,INC2014-112,Fire,9/8/2014,"Manning, Alberta",NOVA Gas Transmission Ltd.,Closed,57.191516,0,Not Applicable,Not Applicable,No,2014,,2014/09/08 02:30:00 PM Mountain,No pipeline interruption,,Operation,Employee / Contractor (Onsite),4/25/2017,Yes,No,,,,No,,Under Investigation or Unknown,,,,,,,,,0,OPR,,,,,,Meter,,,Canada,Yes,No,No,No,0,,Level I,Standard Review - 168 days,No,,"Station/Facility, Compression, Valve, Pressure relief, Seal/Packing",,,,,,,,,,,,,,,,,,,,,,,,,,,No,,,Yes,,,No,Yes,,,No,-118.194326,0,1,0,0,0,0,0,0,0,0,0,1,0,0,0,0,0,0,0,0,0,0,0,0,0,0,0,0,0,9,0,0,1,0
706,INC2014-120,Release of Substance,9/19/2014,Chitwan,"Westcoast Energy Inc., carrying on business as Spectra Energy Transmission",Closed,55.569092,0,Sulphur,Miscellaneous,No,2014,,2014/09/19 12:00:00 AM Mountain,,,Operation,,8/15/2017,No,No,Sulphur,,No,No,,,,,,,,,,,0,PPR,,,,,,,,,Canada,Yes,No,No,No,0,,Level I,Standard Review - 168 days,No,,,,,,,,,,,,,,,,,,,,,,,,,,,,,No,,,No,,,No,No,,,No,-121.944662,1,0,0,1,0,0,0,0,0,0,0,1,0,0,0,0,0,0,0,0,0,0,0,0,0,0,0,0,0,9,0,0,1,0
707,INC2014-121,Release of Substance,9/22/2014,Flume Ridge,Maritimes & Northeast Pipeline Management Ltd.,Closed,45.461,0.3,Natural Gas - Sweet,Gas,No,2014,2014-09-22,2014/09/22 09:30:00 AM Atlantic,,,Maintenance,Employee / Contractor (Onsite),3/11/2015,Yes,No,Natural Gas - Sweet,0.3,No,No,,,,,,,,,,,0,OPR,Mainline,"762.00000000, 863.60000000",574.8807991,Natural Gas,,,,,Canada,Yes,No,No,No,6,518,Level I,Standard Review - 168 days,No,,"Station/Facility, Pigging, Launching, Closure",,,,,,,,,,,,,,,,,,,,,,,,,,,No,,,No,,,No,No,,,No,-66.99757,1,0,0,0,0,0,1,0,0,0,0,1,0,0,0,0,0,0,0,0,0,0,0,0,0,0,0,0,0,9,0,0,1,0
708,INC2014-123,Operation Beyond Design Limits,9/29/2014,Not specified,Trans-Northern Pipelines Inc.,Closed,43.69319,0,Not Applicable,Not Applicable,No,2014,2014-09-29,2014/09/29 11:34:00 AM Eastern,,,Operation,Employee / Contractor (Onsite),5/4/2015,Yes,No,,,,No,,,,,,,,,Over Pressure,,0,OPR,,,,,,,,,Canada,Yes,No,No,No,0,,Level I,Standard Review - 168 days,No,"INC2015-002, INC2016-008","Station/Facility, Metering, Receiving, Piping",,,,,,,,,6619,,7433,,,,,,,,,,,,,,,,No,,,Yes,,,No,Yes,,,No,-79.60875,0,0,0,0,0,1,0,0,0,0,0,1,0,0,0,0,0,0,0,0,0,0,0,0,0,0,0,0,0,9,0,0,1,0
709,INC2014-124,Release of Substance,10/2/2014,Chetwynd,"Westcoast Energy Inc., carrying on business as Spectra Energy Transmission",Closed,55.5724,0.382,Sulphur,Miscellaneous,No,2014,2014-10-02,2014/10/02 03:50:00 AM Mountain,,,Operation,,6/16/2017,Yes,No,Sulphur,0.382,No,No,,,,,,,,,,,0,PPR,,,,,,,,,Canada,Yes,No,No,No,3,Legal Subdivision,Level I,Standard Review - 168 days,No,,"Processing Plant, Sulphur plant",,,,,,,,,,,,,,,,,,,,,,,,,,,No,,,Yes,,,No,Yes,,,No,-121.9442,1,0,0,1,0,0,0,0,0,0,0,1,0,0,0,0,0,0,0,0,0,0,0,0,0,0,0,0,0,10,0,0,1,0
710,INC2014-126,Serious Injury (CER or TSB),10/2/2014,Camrose,Enbridge Pipelines Inc.,Closed,53.00696,0,Not Applicable,Not Applicable,Yes,2014,2014-10-02,2014/10/02 07:00:00 AM Mountain,,Transmission,Operation,Employee / Contractor (Onsite),12/2/2014,Yes,No,,,,No,,,,,Fracture,2,,No,,,0,OPR,,,,,,,,,Canada,Yes,No,Yes,No,0,Legal Subdivision,Level II,Category B,No,,Vehicle / mobile equipment,,,,,,,,,,,,,,,,,,,,,,,,,,,No,,,No,,,No,No,,,No,-112.82689,0,1,0,0,0,0,0,0,0,0,0,1,0,0,0,0,0,0,0,0,0,0,0,0,0,0,0,0,0,10,0,0,1,0
711,INC2014-127,Release of Substance,10/3/2014,Chetwynd,"Westcoast Energy Inc., carrying on business as Spectra Energy Transmission",Closed,55.56909171,0,Natural Gas - Sweet,Gas,No,2014,2014-10-02,2014/10/02 01:00:00 PM Mountain,,,Maintenance,,12/22/2014,No,No,Natural Gas - Sweet,,No,Yes,,,,,,,,,,,0,PPR,,,,,PINE RIVER GAS PLANT (PRGP),,55.56909171,-121.9446616,Canada,Yes,No,No,No,3,Legal Subdivision,Level I,Standard Review - 168 days,No,,,,,,,,,,,,,,,,,,,,,,,,,,,,,No,,,No,,,No,No,,,No,-121.9446616,1,0,0,1,0,0,0,0,0,0,0,1,0,0,0,0,0,0,0,0,0,0,0,0,0,0,0,0,0,10,0,0,1,0
712,INC2014-128,Fire,10/16/2014,Fort Simpson,Enbridge Pipelines (NW) Inc.,Closed,61.86168,0,Not Applicable,Not Applicable,No,2014,2014-10-16,2014/10/16 02:15:00 PM Mountain,Short-term interruption,,Operation,SCADA,10/25/2016,Yes,No,,,,No,,Under Investigation or Unknown,,,,,,,,,0,OPR,Line 21,"305.00000000, 323.90000000",989.5584688,Crude Oil,,Meter,,,Canada,Yes,No,Yes,No,0,494,Level I,Standard Review - 168 days,No,"INC1997-057, INC2014-097","Pipeline, Valve, Ball, Other (please explain);Station/Facility, Power Generation",,,,,,,,,,,,,,2014,2014,2014,,,,,,,,,,,No,,,No,,,No,No,,,No,-121.34796,0,0,0,0,0,0,0,0,0,1,0,1,0,0,0,0,0,0,0,0,0,0,0,0,0,0,0,0,0,10,0,0,1,0
713,INC2014-129,Serious Injury (CER or TSB),10/17/2014,Sherwood Park,Enbridge Pipelines Inc.,Closed,53.54267,0,Not Applicable,Not Applicable,Yes,2014,2014-10-16,2014/10/16 11:20:00 AM Mountain,,Transmission,Maintenance,Employee / Contractor (Onsite),12/8/2014,No,No,,,,No,,,,,Fracture,1,,No,,,0,OPR,,,,,,,,,Canada,Yes,No,No,No,0,,Level I,Standard Review - 168 days,No,,,,,,,,,,,,,,,,,,,,,,,,,,,,,No,,,No,,,No,No,,,No,-113.35517,0,1,0,0,0,0,0,0,0,0,0,1,0,0,0,0,0,0,0,0,0,0,0,0,0,0,0,0,0,10,0,0,1,0
714,INC2014-131,Operation Beyond Design Limits,10/22/2014,Fox Creek,Alliance Pipeline Ltd.,Closed,54.41803,0,Not Applicable,Not Applicable,No,2014,,2014/10/22 12:00:00 AM Mountain,,Transmission,Operation,Scheduled Patrol,2/4/2016,Yes,No,,,,No,,,,,,,,,Slope Movements,,0,OPR,BIGSTONE LATERAL,219.1,33.81470272,Natural Gas,,,,,Canada,Yes,No,Yes,No,0,13.3,Level I,Standard Review - 168 days,No,,"Pipeline, Pipe, Body",,,,,,,,,,,,,,,,,,,,,,,,,,,No,,,Yes,,,No,Yes,,,No,-117.14534,0,1,0,0,0,0,0,0,0,0,1,1,0,0,0,0,0,0,0,0,0,0,0,0,0,0,0,0,0,10,0,0,1,0
715,INC2014-130,Release of Substance,10/19/2014,Chetwynd,"Westcoast Energy Inc., carrying on business as Spectra Energy Transmission",Closed,55.56909171,0.0003,Hydrogen Sulphide,Miscellaneous,Yes,2014,2014-10-18,2014/10/18 10:30:00 AM Pacific,,,Operation,,9/26/2017,No,No,Hydrogen Sulphide,0.0003,No,No,,,,,,,,,,,0,PPR,,,,,PINE RIVER GAS PLANT (PRGP),,55.56909171,-121.9446616,Canada,Yes,No,No,No,3,Legal Subdivision,Level I,Standard Review - 168 days,No,INC2015-005,"Processing Plant, Sulphur plant",,,,,,,,,,,,,,,,,,,,,,,,,,,No,,,No,10/18/2014,Visual,No,No,10/18/2014,Testing of Functionality,No,-121.9446616,1,0,0,1,0,0,0,0,0,0,0,1,0,0,0,0,0,0,0,0,0,0,0,0,0,0,0,0,0,10,0,0,1,0
716,INC2014-132,Release of Substance,10/23/2014,Irma,Alliance Pipeline Ltd.,Closed,53.03122,0.01,Natural Gas - Sweet,Gas,No,2014,,2014/10/20 02:38:00 PM Mountain,No pipeline interruption,,Operation,Employee / Contractor (Onsite),12/2/2016,Yes,No,Natural Gas - Sweet,0.01,No,No,,,,,,,,,,,0,OPR,MAINLINE,"1067.00000000, 914.00000000",1551.609274,Natural Gas,IRMA,,,,Canada,Yes,No,No,No,0,,Level I,Standard Review - 168 days,No,INC2014-147,"Station/Facility, Compression, Instrumentation and controls",,,,,,,,,,,,,,,,,,,,,,,,,,,No,,,Yes,,,No,Yes,,,No,-111.2215,1,1,0,0,0,0,0,0,0,0,0,1,0,0,0,0,0,0,0,0,0,0,0,0,0,0,0,0,0,10,0,0,1,0
717,INC2014-134,Release of Substance,11/4/2014,Deux Rivieres,TransCanada PipeLines Limited,Closed,46.23981,101000,Natural Gas - Sweet,Gas,Yes,2014,2014-11-03,2014/11/03 07:00:00 AM Eastern,No pipeline interruption,,Operation,Employee / Contractor (Onsite),12/6/2016,Yes,No,Natural Gas - Sweet,101000,No,No,,,,,,,,,,,0,OPR,Deux Rivieres Loop,1067,29.83448227,Natural Gas,STN 1206 - DEUX RIVIERES,,46.23981203,-78.1325835,Canada,Yes,No,No,No,0,1206,Level I,Standard Review - 168 days,No,"INC2015-031, INC2015-049, INC2015-055","Station/Facility, Compression, Instrumentation and controls",,NPS 3/8,Stainless Steel,,,,,,,,,,,,,,,,,,,,,,,,No,,,Yes,,,No,Yes,,,No,-78.13258,1,0,0,0,0,1,0,0,0,0,0,1,0,0,0,0,0,0,0,0,0,0,0,0,0,0,0,0,0,11,0,0,1,0
718,INC2014-136,Release of Substance,11/10/2014,Saint John,Maritimes & Northeast Pipeline Management Ltd.,Closed,45.27322,0.01,Natural Gas - Sweet,Gas,No,2014,2014-11-10,2014/11/10 05:20:00 PM Atlantic,,,Operation,3rd Party / Other Company,1/29/2015,Yes,No,Natural Gas - Sweet,0.01,No,No,,,,,,,,,,,0,OPR,Saint John lateral,406.4,104.6217048,Natural Gas,,,,,Canada,Yes,No,No,No,0,,Level I,Standard Review - 168 days,No,,"Station/Facility, Metering, Delivering, Valve",,,,,,,,,,,,,,,,,,,,,,,,,,,No,,,No,,,No,No,,,No,-66.06481,1,0,0,0,0,0,1,0,0,0,0,1,0,0,0,0,0,0,0,0,0,0,0,0,0,0,0,0,0,11,0,0,1,0
719,INC2014-137,Release of Substance,11/12/2014,Bentley,NOVA Gas Transmission Ltd.,Closed,52.46696,0.001,Natural Gas - Sweet,Gas,No,2014,,2014/11/12 02:30:00 PM Mountain,,,Maintenance,Employee / Contractor (Onsite),1/22/2015,Yes,No,Natural Gas - Sweet,0.001,No,No,,,,,,,,,,,0,OPR,,,,,GILBY SOUTH PACIFIC,,52.46695947,-114.2987031,Canada,Yes,No,No,No,0,,Level I,Standard Review - 168 days,No,,,,,,,,,,,,,,,,,,,,,,,,,,,,,No,,,No,,,No,No,,,No,-114.2987,1,1,0,0,0,0,0,0,0,0,0,1,0,0,0,0,0,0,0,0,0,0,0,0,0,0,0,0,0,11,0,0,1,0
720,INC2014-139,Release of Substance,11/15/2014,Taylor,"Westcoast Energy Inc., carrying on business as Spectra Energy Transmission",Closed,56.14633,0,Natural Gas - Sweet,Gas,No,2014,2014-11-15,2014/11/15 05:00:00 AM Pacific,,,Operation,,9/12/2017,No,No,Natural Gas - Sweet,,No,No,,,,,,,,,,,0,PPR,,,,,,,,,Canada,Yes,No,No,No,0,,Level I,Standard Review - 168 days,No,,,,,,,,,,,,,,,,,,,,,,,,,,,,,No,,,No,,,No,No,,,No,-120.66918,1,0,0,1,0,0,0,0,0,0,0,1,0,0,0,0,0,0,0,0,0,0,0,0,0,0,0,0,0,11,0,0,1,0
721,INC2014-146,Release of Substance,11/27/2014,Chetwynd,"Westcoast Energy Inc., carrying on business as Spectra Energy Transmission",Closed,55.56909171,9000,Sulphur Dioxide,Miscellaneous,No,2014,2014-11-27,2014/11/27 12:00:00 AM Mountain,,,Operation,,11/9/2017,No,No,Sulphur Dioxide,9000,No,Yes,,,,,,,,,,,0,PPR,,,,,PINE RIVER GAS PLANT (PRGP),,55.56909171,-121.9446616,Canada,Yes,No,No,No,4,,Level I,Standard Review - 168 days,No,EF2015-001,,,,,,,,,,,,,,,,,,,,,,,,,,,,No,,,No,,,No,No,,,No,-121.9446616,1,0,0,1,0,0,0,0,0,0,0,1,0,0,0,0,0,0,0,0,0,0,0,0,0,0,0,0,0,11,0,0,1,0
722,INC2014-147,Release of Substance,12/3/2014,Irma,Alliance Pipeline Ltd.,Closed,53.032311,0.01,Natural Gas - Sweet,Gas,No,2014,,2014/12/03 08:07:00 AM Mountain,No pipeline interruption,,Operation,Employee / Contractor (Onsite),3/17/2015,No,No,Natural Gas - Sweet,0.01,No,No,,,,,,,,,,,0,OPR,MAINLINE,"1067.00000000, 914.00000000",1551.609274,Natural Gas,IRMA,,,,Canada,Yes,No,No,No,0,,Level I,Standard Review - 168 days,No,INC2014-132,"Station/Facility, Compression, Valve",,,,,,,,,,,,,,,,,,,,,,,,,,,No,,,No,,,No,No,,,No,-111.221031,1,1,0,0,0,0,0,0,0,0,0,1,0,0,0,0,0,0,0,0,0,0,0,0,0,0,0,0,0,12,0,0,0,1
723,INC2014-148,Release of Substance,12/4/2014,Kenora,TransCanada PipeLines Limited,Closed,49.79171,0.01,Natural Gas - Sweet,Gas,No,2014,2014-12-04,2014/12/04 11:00:00 AM Central,No pipeline interruption,,Operation,Employee / Contractor (Onsite),3/11/2015,Yes,No,Natural Gas - Sweet,0.01,No,No,,,,,,,,,,,0,OPR,LINE 100-1,"508.00000000, 762.00000000, 863.60000000",2595.724534,Natural Gas,STN 49 - KENORA,,49.79171203,-94.49432202,Canada,Yes,No,No,No,0,,Level I,Standard Review - 168 days,No,,"Station/Facility, Compression, Pipe",,NPS 3/8,,,,,,,,,,,,,,,,,,,,,,,,,No,,,No,,,No,No,,,No,-94.49432,1,0,0,0,0,1,0,0,0,0,0,1,0,0,0,0,0,0,0,0,0,0,0,0,0,0,0,0,0,12,0,0,0,1
724,INC2014-149,Release of Substance,12/4/2014,Chetwynd,"Westcoast Energy Inc., carrying on business as Spectra Energy Transmission",Closed,55.56909171,3175,Sulphur Dioxide,Miscellaneous,No,2014,2014-12-03,2014/12/04 07:05:00 AM Mountain,,,Operation,,9/26/2017,Yes,No,Sulphur Dioxide,3175,No,No,,,,,,,,,,,0,PPR,,,,,PINE RIVER GAS PLANT (PRGP),,55.56909171,-121.9446616,Canada,Yes,No,No,No,0,,Level I,Standard Review - 168 days,No,,"Processing Plant, Flare",,,,,,,,,,,,,,,,,,,,,,,,,,,No,,,Yes,,,No,Yes,,,No,-121.9446616,1,0,0,1,0,0,0,0,0,0,0,1,0,0,0,0,0,0,0,0,0,0,0,0,0,0,0,0,0,12,0,0,0,1
725,INC2014-154,Release of Substance,12/23/2014,Saint John,Maritimes & Northeast Pipeline Management Ltd.,Closed,45.25902,100,Natural Gas - Sweet,Gas,No,2014,2014-12-23,2014/12/23 04:15:00 AM Atlantic,,,Operation,,4/21/2015,Yes,No,Natural Gas - Sweet,100,No,No,,,,,,,,,,,0,OPR,Saint John lateral,406.4,104.6217048,Natural Gas,,,,,Canada,Yes,No,Yes,No,5,Mainline Valve + Offset (km),Level I,Standard Review - 168 days,No,,"Station/Facility, Metering, Receiving, Valve",,,,,,,,,,,,,,,,,,,,,,,,,,,No,,,Yes,,,No,Yes,,,No,-66.094405,1,0,0,0,0,0,1,0,0,0,0,1,0,0,0,0,0,0,0,0,0,0,0,0,0,0,0,0,0,12,0,0,0,1
726,INC2014-150,Fire,12/5/2014,Lloydminster,Cochin Pipe Lines Ltd.,Closed,52.405926,0,Not Applicable,Not Applicable,No,2014,2014-12-05,2014/12/05 03:00:00 PM Mountain,,,Construction,,6/2/2015,No,No,,,,No,,Welding or Cutting,,,,,,,,,0,OPR,,,,,,,,,Canada,Yes,No,No,No,0,,Level I,Standard Review - 168 days,No,,,,,,,,,,,,,,,,,,,,,,,,,,,,,No,,,No,,,No,No,,,No,-110.026224,0,1,0,0,0,0,0,0,0,0,1,1,0,0,0,0,0,0,0,0,0,0,0,0,1,0,0,0,0,12,0,0,0,1
727,INC2014-151,Operation Beyond Design Limits,12/9/2014,Atmore,NOVA Gas Transmission Ltd.,Closed,54.836647,0,Not Applicable,Not Applicable,No,2014,2014-12-08,2014/12/08 10:22:00 PM Mountain,,,Maintenance,,9/28/2016,No,No,,,,No,,,,,,,,,Over Pressure,,0,OPR,ATMORE LATERAL - NPS 12,323.9,19.99927397,Natural Gas,,,,,Canada,Yes,No,Yes,No,0,,Level I,Standard Review - 168 days,No,,,,,,,,,,,,,,,,,,,,,,,,,,,,,No,,,No,,,No,No,,,No,-112.551304,0,1,0,0,0,0,0,0,0,0,0,1,0,0,0,0,0,0,0,0,0,0,0,0,0,0,0,0,0,12,0,0,0,1
728,INC2014-153,Release of Substance,12/17/2014,Regina,Enbridge Pipelines Inc.,Closed,50.482408,173.6,Crude Oil - Sweet,Liquid,No,2014,,2014/12/16 10:42:00 PM Mountain,,Transmission,Operation,3rd Party / Other Company,10/9/2015,Yes,No,Crude Oil - Sweet,173.6,No,No,,,,,,,,,,,0,OPR,Line 4,"1219.00000000, 864.00000000, 914.00000000",1248.909872,Crude Oil,,Meter,,,Canada,Yes,No,No,No,0,MP 437,Level I,Standard Review - 168 days,Yes,REM-0336,"Station/Facility, Pumping, Valve",,,,,,,,,,,,,,,,,,,,,,,,,,,No,,,Yes,,,No,Yes,,,No,-104.575209,1,0,0,0,1,0,0,0,0,0,0,1,0,0,0,0,0,0,0,0,0,0,0,0,0,0,0,0,0,12,0,0,0,1
729,INC2014-155,Release of Substance,12/23/2014,Kenora,TransCanada PipeLines Limited,Closed,49.79171,0.01,Natural Gas - Sweet,Gas,No,2014,2014-12-23,2014/12/23 06:00:00 AM Eastern,No pipeline interruption,,Operation,Employee / Contractor (Onsite),12/5/2016,Yes,No,Natural Gas - Sweet,0.01,No,No,,,,,,,,,,,0,OPR,LINE 100-1,"508.00000000, 762.00000000, 863.60000000",2595.724534,Natural Gas,STN 49 - KENORA,,49.79171203,-94.49432202,Canada,Yes,No,Yes,No,4,Mainline Valve + Offset (km),Level I,Standard Review - 168 days,No,,"Station/Facility, Compression, Auxiliary device(s) (please explain)",,,,,,,,,,,,,,,,,,,,,,,,,,,No,,,No,,,No,No,,,No,-94.49432,1,0,0,0,0,1,0,0,0,0,0,1,0,0,0,0,0,0,0,0,0,0,0,0,0,0,0,0,0,12,0,0,0,1
730,INC2015-001,Release of Substance,1/9/2015,St.George,Maritimes & Northeast Pipeline Management Ltd.,Closed,45.2022834,1,Natural Gas - Sweet,Gas,No,2015,2015-01-08,2015/01/08 05:30:00 PM Atlantic,No pipeline interruption,Transmission,Operation,Inspection Site Visit,2/21/2017,No,No,Natural Gas - Sweet,1,Yes,No,,,,,,,,,,,0,OPR,Saint John lateral,406.4,104.6217048,Natural Gas,,,,,Canada,Yes,No,No,No,3,SJLT KP 40,Level I,Standard Review - 168 days,No,,"Pipeline, Valve, Pressure relief, Seal/Packing",CSA Z662,NPS 1/2,Stainless Steel,,,,,,,,,,,,,,,,,,,,,,,,No,,,No,12/17/2014,Visual,Yes,No,12/12/2014,Testing of Functionality,Yes,-66.6866022,1,0,0,0,0,0,1,0,0,0,1,0,1,0,0,0,0,0,0,0,0,0,0,0,1,0,0,0,0,1,0,0,0,1
731,INC2015-002,Operation Beyond Design Limits,1/9/2015,Bowmanville,Trans-Northern Pipelines Inc.,Closed,43.94536,0,Not Applicable,Not Applicable,No,2015,2015-01-09,2015/01/09 01:30:00 PM Eastern,Short-term interruption,Transmission,Operation,Other Control System,1/10/2017,No,No,,,,No,,,,,,,,,Over Pressure,,0,OPR,Mainline,273.1,635.0188165,Refined Products-Aviation,,Meter,,,Canada,Yes,No,Yes,No,3,471.54,Level I,Standard Review - 168 days,No,"INC2011-012, INC2011-129, INC2012-054, INC2013-101, INC2013-202, INC2013-203, INC2014-080, INC2014-123, INC2015-034, INC2016-008","Pipeline, Pipe, Body",ASAB31.1-1951,NPS 10,Carbon Steel,317 - X46,30,7.8 mm = 0.307 in,,,8274,6619,7509,,,,1952,1952,,,Straight,Electric Resistance Welded,,External,Polyethylene Tape Wrap,,Plant Applied,,No,,,No,1/7/2015,,Yes,No,1/8/2015,Testing of Functionality,Yes,-78.661769,0,0,0,0,0,1,0,0,0,0,0,0,0,0,1,0,0,0,0,0,0,0,0,0,0,0,0,0,0,1,0,0,0,1
732,INC2015-006,Fire,1/16/2015,Edmonton,Enbridge Pipelines Inc.,Closed,53.5421,0,Not Applicable,Not Applicable,No,2015,2015-01-14,2015/01/14 12:50:00 PM Mountain,No pipeline interruption,Transmission,Construction,Employee / Contractor (Onsite),4/20/2018,No,No,,,,No,,Welding or Cutting,,,,,,,,,0,OPR,,,,,,Valve,,,Canada,No,No,No,No,3,0,Level I,Standard Review - 168 days,No,,,,,,,,,,,,,,,,,,,,,,,,,,,,,No,,,No,,,No,No,,,No,-113.3584,0,1,0,0,0,0,0,0,0,0,0,0,0,1,0,0,0,0,0,0,0,0,0,0,0,0,0,0,0,1,0,0,0,1
733,INC2015-010,Release of Substance,1/26/2015,"Mattice, Ontario",TransCanada PipeLines Limited,Closed,49.58574,0.01,Natural Gas - Sweet,Gas,No,2015,,2015/01/25 02:45:00 PM Mountain,No pipeline interruption,Transmission,Operation,Employee / Contractor (Onsite),5/1/2017,Yes,No,Natural Gas - Sweet,0.01,No,No,,,,,,,,,,,0,OPR,,,,,STN 92 - MATTICE,,49.58573804,-83.16673903,Canada,Yes,No,No,No,3,,Level I,Standard Review - 168 days,No,,"Station/Facility, Compression, Piping, Body",,NPS 2,Carbon Steel,,,,,,,,,0.3,,,,,,,,,,,,,,,No,,,No,1/23/2015,Visual,Yes,Yes,,,No,-83.16674,1,0,0,0,0,1,0,0,0,0,1,0,0,1,0,0,0,0,0,0,0,0,1,0,0,0,0,0,0,1,0,0,0,1
734,INC2015-013,Release of Substance,1/31/2015,Dartmouth,Maritimes & Northeast Pipeline Management Ltd.,Closed,44.719151,1,Fuel Gas,Gas,No,2015,2015-01-31,2015/01/31 01:45:00 PM Atlantic,No pipeline interruption,Transmission,Operation,Employee / Contractor (Onsite),1/19/2017,Yes,No,Fuel Gas,1,No,No,,,,,,,,,,,0,OPR,Halifax Lateral,323.9,126.1401343,Natural Gas,,Meter,,,Canada,Yes,No,No,No,3,118,Level I,Standard Review - 168 days,No,,"Station/Facility, Metering, Delivering, Valve, Pressure relief, Other (please explain)",CSA Z662-11,,,,,,,,3447,,3240,,,,2012,2012,,,,,,,,,,,No,,,No,12/18/2014,Visual,No,No,12/18/2014,Repair,No,-63.583774,1,0,0,0,0,0,0,1,0,0,0,0,0,1,0,0,0,0,0,0,0,0,0,0,0,0,0,0,0,1,0,0,0,1
735,INC2015-014,Operation Beyond Design Limits,2/4/2015,Edmonton,Enbridge Pipelines Inc.,Closed,53.54305555,0,Not Applicable,Not Applicable,No,2015,2015-02-01,2015/02/01 05:00:00 PM Mountain,No pipeline interruption,Transmission,Operation,SCADA,1/26/2017,Yes,No,,,,No,,,,,,,,,Over Pressure,,0,OPR,,,,,,,,,Canada,Yes,No,No,No,5,KP 0,Level I,Standard Review - 168 days,No,,"Station/Facility, Pumping, Valve, Pressure relief, Other (please explain)",,,,,,,,,,,,,,,,,,,,,,,,,,,No,,,No,4/17/2014,Visual,Yes,Yes,,,No,-113.3541667,0,1,0,0,0,0,0,0,0,0,0,0,0,1,0,0,0,0,0,0,0,0,0,0,0,0,0,0,0,2,0,0,0,1
736,INC2015-016,Release of Substance,2/8/2015,Boyle,NOVA Gas Transmission Ltd.,Closed,54.524331,0.06,Natural Gas - Sweet,Gas,No,2015,,2015/02/08 02:00:00 PM Mountain,Short-term interruption,Transmission,Operation,Scheduled Patrol,5/10/2016,Yes,No,Natural Gas - Sweet,0.06,Yes,No,,,,,,,,,,,0,OPR,FLAT LAKE LATERAL LOOP - NPS 16,406.4,53.31541245,Natural Gas,,,,,Canada,No,Yes,Yes,No,3,,Level I,Standard Review - 168 days,No,INC2013-162,"Pipeline, Pipe, Girth weld",CSA Z245.1,NPS 16,Carbon Steel,359 - X52,,6.0 mm = 0.237 in,,,8453,,,,,,,,,Girth (Circumferential),Straight,Electric Resistance Welded,,External,Polyethylene Tape Wrap,Disbonded,Field Applied,1976,No,Replacement,2/10/2015,No,2/28/2015,Inline Inspection (ILI),No,Yes,,,No,-112.665961,1,1,0,0,0,0,0,0,0,0,0,0,0,0,0,1,0,0,0,0,0,0,0,0,0,0,0,0,0,2,0,0,0,1
737,INC2015-018,Release of Substance,2/15/2015,Taylor,"Westcoast Energy Inc., carrying on business as Spectra Energy Transmission",Closed,56.1447,70,Water,Miscellaneous,No,2015,2015-02-13,2015/02/13 10:00:00 AM Mountain,No pipeline interruption,Processing,Operation,Employee / Contractor (Onsite),10/17/2016,No,No,Water,70,No,Yes,,,,,,,,,,,0,PPR,"12"" Milligan-Peejay Pipeline",323.9,50.94683691,Natural Gas Sour,,,,,Canada,Yes,No,No,No,3,51.79,Level I,Standard Review - 168 days,No,,,,,,,,,,,,,,,,,,,,,,,,,,,,,No,,,No,,,No,No,,,No,-120.6686,1,0,0,1,0,0,0,0,0,0,1,0,0,0,0,0,1,0,0,0,0,0,0,0,0,0,1,0,0,2,0,0,0,1
738,INC2015-035,Operation Beyond Design Limits,4/2/2015,Edmonton,Enbridge Pipelines Inc.,Closed,53.544257,0,Not Applicable,Not Applicable,No,2015,2015-04-02,2015/04/02 11:14:00 AM Mountain,No pipeline interruption,Transmission,Operation,SCADA,2/20/2017,Yes,No,,,,No,,,,,,,,,Over Pressure,,0,OPR,,,,,Edmonton,,,,Canada,Yes,No,No,No,5,0,Level I,Standard Review - 168 days,No,,"Station/Facility, Pumping, Piping, Body",,,,,,,,,,,,,,,,,,,,,,,,,,,No,,,No,,,No,No,,,No,-113.35606,0,1,0,0,0,0,0,0,0,0,0,0,0,1,0,0,0,0,0,0,0,0,0,0,0,0,0,0,0,4,1,0,0,0
739,INC2015-020,Release of Substance,2/26/2015,Goldboro,ExxonMobil Canada Properties,Closed,45.17170605,396,Natural Gas - Sweet,Gas,No,2015,2015-02-24,2015/02/24 07:20:00 PM Atlantic,No pipeline interruption,,Operation,Scheduled Patrol,2/7/2017,Yes,No,Natural Gas - Sweet,396,No,No,,,,,,,,,,,0,PPR,Sable Offshore Energy Project,"1362.40000000, 219.10000000, 304.80000000, 457.20000000, 660.00000000",416.613585,Natural Gas,GOLDBORO GAS PLANT,,45.17170605,-61.61267605,Canada,Yes,No,No,No,3,,Level I,Standard Review - 168 days,No,,"Processing Plant, Cooling",,,,,,,,,,,,,,,,,,,,,,,,,,,No,,,No,9/19/2014,Visual,Yes,No,1/27/2013,Repair,No,-61.61267605,1,0,0,0,0,0,0,1,0,0,0,0,0,0,0,1,0,0,0,0,0,0,0,0,0,0,0,0,0,2,0,0,0,1
740,INC2015-021,Release of Substance,2/28/2015,Grand Prairie,NOVA Gas Transmission Ltd.,Closed,55.0045,0.1,Natural Gas - Sweet,Gas,No,2015,2015-02-27,2015/02/27 05:50:00 PM Mountain,Short-term interruption,Transmission,Maintenance,Employee / Contractor (Onsite),11/1/2018,Yes,No,Natural Gas - Sweet,0.1,Yes,No,,,,,,,,,,,0,OPR,GRANDE PRAIRIE MAINLINE LOOP,"1067.00000000, 610.00000000, 762.00000000, 914.00000000",368.2235257,"Natural Gas, Natural Gas Sweet",,,,,Canada,Yes,No,No,No,3,,Level I,Standard Review - 168 days,No,,"Pipeline, Pipe, Body",1981,NPS 24,Carbon Steel,483 - X70,,6.6 mm = 0.258 in,0,6.8,7584,,5725,1.2,0,1981,1981,1981,-1257,,Spiral,,,External,Polyethylene Tape Wrap,Disbonded,Field Applied,1981,No,Removal,,No,2/18/2015,Inline Inspection (ILI),Yes,No,2/27/2015,Repair,Yes,-119.472,1,1,0,0,0,0,0,0,0,0,0,0,0,1,0,0,0,0,0,0,0,0,0,0,0,0,0,0,0,2,0,0,0,1
741,INC2015-022,Explosion,3/2/2015,"Milden, Saskatchewan",Enbridge Pipelines Inc.,Closed,51.446646,0,Not Applicable,Not Applicable,No,2015,2015-02-27,2015/02/27 04:00:00 PM Mountain,Short-term interruption,Transmission,Operation,Employee / Contractor (Onsite),2/3/2016,Yes,No,,,,No,Equipment & Electrical,,,,,,,,,,0,OPR,Line 4,"1219.00000000, 864.00000000, 914.00000000",1248.909872,Crude Oil,,Meter,,,Canada,Yes,No,No,No,3,KP 475,Level I,Standard Review - 168 days,No,"INC2012-174, INC2015-022, INC2015-097, INC2016-003, INC2016-122, INC2017-006","Station/Facility, Pumping, Auxiliary device(s) (please explain)",,,,,,,,,,,,,,,,,,,,,,,,,,,No,,,Yes,,,No,Yes,,,No,-107.387472,0,0,0,0,1,0,0,0,0,0,0,0,0,0,1,0,0,0,0,0,0,0,0,0,0,0,0,0,0,2,0,0,0,1
742,INC2015-023,Release of Substance,3/3/2015,Glenboro,Enbridge Pipelines Inc.,Closed,49.539039,0.015,Natural Gas Liquids,Gas,No,2015,2015-03-03,2015/03/03 09:14:00 AM Mountain,Short-term interruption,Transmission,Maintenance,Employee / Contractor (Onsite),11/17/2016,No,No,Natural Gas Liquids,0.015,No,No,,,,,,,,,,,0,OPR,Line 1,"508.00000000, 864.00000000",1255.999121,Crude Oil,,Meter,,,Canada,Yes,No,No,No,3,,Level I,Standard Review - 168 days,No,,,,,,,,,,,,,,,,,,,,,,,,,,,,,No,,,No,,,No,No,,,No,-99.288393,1,0,1,0,0,0,0,0,0,0,0,0,0,1,0,0,0,0,0,0,0,0,0,0,0,0,0,0,0,3,1,0,0,0
743,INC2015-024,Fire,3/4/2015,Hardisty,Enbridge Pipelines Inc.,Closed,52.49245275,0,Not Applicable,Not Applicable,No,2015,2015-03-04,2015/03/04 09:30:00 AM Mountain,No pipeline interruption,Transmission,Maintenance,Employee / Contractor (Onsite),4/20/2018,No,No,,,,No,,Equipment & Electrical,,,,,,,,,0,OPR,,,,,,,,,Canada,No,No,Yes,No,3,MP129.9235,Level I,Standard Review - 168 days,No,,,,,,,,,,,,,,,,,,,,,,,,,,,,,No,,,No,,,No,No,,,No,-110.8520296,0,1,0,0,0,0,0,0,0,0,0,0,0,0,1,0,0,0,0,0,0,0,0,0,0,0,0,0,0,3,1,0,0,0
744,INC2015-025,Fire,3/6/2015,Regina,Enbridge Pipelines Inc.,Closed,50.4837281,0,Not Applicable,Not Applicable,No,2015,2015-03-05,2015/03/05 02:45:00 PM Central,No pipeline interruption,Transmission,Construction,Employee / Contractor (Onsite),4/20/2018,No,No,,,,No,,Equipment & Electrical,,,,,,,,,0,OPR,,,,,,Valve,,,Canada,No,No,No,No,3,,Level I,Standard Review - 168 days,No,,,,,,,,,,,,,,,,,,,,,,,,,,,,,No,,,No,,,No,No,,,No,-104.59147,0,0,0,0,1,0,0,0,0,0,0,0,0,1,0,0,0,0,0,0,0,0,0,0,0,0,0,0,0,3,1,0,0,0
745,INC2015-026,Release of Substance,3/9/2015,Chetwynd,"Westcoast Energy Inc., carrying on business as Spectra Energy Transmission",Closed,55.573,2,Contaminated Water,Miscellaneous,No,2015,2015-03-09,2015/03/09 12:00:00 PM Mountain,No pipeline interruption,Processing,Maintenance,Employee / Contractor (Onsite),8/24/2017,Yes,No,Contaminated Water,2,No,Yes,,,,,,,,,,,0,PPR,Grizzly Pipeline,"273.10000000, 508.00000000, 610.00000000",160.6451852,"Natural Gas Sour, Natural Gas Sweet",,,,,Canada,Yes,No,No,No,3,,Level I,Standard Review - 168 days,No,,"Processing Plant, Sweetening (desulfurization)",,,,,,,,,,,,,,,,,,,,,,,,,,,No,,,No,,,No,No,,,No,-121.941,1,0,0,1,0,0,0,0,0,0,0,0,0,1,0,0,0,0,0,0,0,0,0,0,0,0,0,0,0,3,1,0,0,0
746,INC2015-027,Release of Substance,3/9/2015,Taylor,"Westcoast Energy Inc., carrying on business as Spectra Energy Transmission",Closed,56.1497,6.94,Propane,Gas,No,2015,2015-03-09,2015/03/09 06:00:00 PM Mountain,No pipeline interruption,Distribution,Operation,Other Control System,1/11/2017,Yes,No,Propane,6.94,No,No,,,,,,,,,,,0,PPR,"20"" ALASKA HIGHWAY TRUNK PIPELINE",508,28.69664024,Natural Gas Sour,,,,,Canada,Yes,No,No,No,4,,Level I,Standard Review - 168 days,No,,"Processing Plant, Storage",,,,,,,,,,,,,,,,,,,,,,,,,,,No,,,Yes,,,No,Yes,,,No,-120.6724,1,0,0,1,0,0,0,0,0,0,0,0,0,1,0,0,0,0,0,0,0,0,0,0,0,0,0,0,0,3,1,0,0,0
747,INC2015-028,Release of Substance,3/13/2015,Hardisty,TransCanada Keystone Pipeline GP Ltd.,Closed,52.65396,2.3,Crude Oil - Sweet,Liquid,No,2015,2015-01-16,2015/01/16 07:00:00 PM Mountain,No pipeline interruption,Transmission,Construction,Employee / Contractor (Onsite),2/3/2017,Yes,No,Crude Oil - Sweet,2.3,No,Yes,,,,,,,,,,,0,OPR,,,,,KEYSTONE HARDISTY TANK TERMINAL,,52.65395901,-111.2684694,Canada,Yes,No,No,No,3,0,Level I,Standard Review - 168 days,No,REM-0346,"Pipeline, Valve, Gate, Body;Station/Facility, Pumping, Valve, Ball, Seal/Packing;Station/Facility, Pumping, Valve, Gate, Seal/Packing",CSA Z662-2011,NPS 30,Carbon Steel,448 - X65,40,9.5 mm = 0.375 in,,9.5,1900,,1427,,,2014,2014,2015,,Girth (Circumferential),,,,External,,Intact,Plant Applied,2014,No,,,No,1/16/2015,Visual,No,No,,,No,-111.26847,1,1,0,0,0,0,0,0,0,0,0,0,0,1,0,0,0,0,0,0,0,0,0,0,0,0,0,0,0,1,0,0,0,1
748,INC2015-029,Release of Substance,3/17/2015,Plum Coulee,Enbridge Pipelines Inc.,Closed,51.45,0.0005,Natural Gas Liquids,Gas,No,2015,2015-03-17,2015/03/17 01:35:00 PM Central,Short-term interruption,Transmission,Operation,Employee / Contractor (Onsite),12/20/2016,No,No,Natural Gas Liquids,0.0005,No,No,,,,,,,,,,,0,OPR,Line 1,"508.00000000, 864.00000000",1255.999121,Crude Oil,,Meter,,,Canada,No,No,No,No,3,MP 762.43,Level I,Standard Review - 168 days,No,,,,,,,,,,,,,,,,,,,,,,,,,,,,,No,,,No,,,No,No,,,No,-107.3861111,1,0,1,0,0,0,0,0,0,0,1,0,0,0,1,0,0,0,0,0,0,0,0,0,0,0,1,0,0,3,1,0,0,0
749,INC2015-030,Adverse Environmental Effects,3/20/2015,edmundston,Twin Rivers Paper Company Inc.,Closed,47.361505,0,Not Applicable,Not Applicable,Yes,2015,2015-03-19,2015/03/20 01:30:00 AM Atlantic,Short-term interruption,Transmission,Operation,3rd Party / Other Company,8/24/2017,No,No,,,,No,,,,,,,,,,Release of Toxic Substance,0,OPR,BLEACHED WHITE WATER RETURN,508,1.7214524,White Water,,,,,Canada,No,Yes,No,No,3,,Level II,Category B,No,,"Pipeline, Valve, Pressure relief, Flange, Gasket/O-ring",,NPS 20,Stainless Steel,,,,,,,,,,,,,,,,,,,,,,,,No,Replacement,3/20/2015,No,9/25/2014,Visual,No,No,9/25/2014,Replacement,No,-68.32824,0,0,0,0,0,0,1,0,0,0,0,0,0,1,0,0,0,0,0,0,0,0,0,0,0,0,0,0,0,3,1,0,0,0
750,INC2015-031,Release of Substance,3/30/2015,"Dryden, Ontario",TransCanada PipeLines Limited,Closed,49.78942,0.1,Natural Gas - Sweet,Gas,No,2015,,2015/03/30 07:30:00 AM Mountain,No pipeline interruption,Transmission,Operation,Employee / Contractor (Onsite),11/10/2016,Yes,No,Natural Gas - Sweet,0.1,No,No,,,,,,,,,,,0,OPR,,,,,STN 55 - DRYDEN,,49.78941703,-92.76551503,Canada,Yes,No,No,No,3,,Level I,Standard Review - 168 days,No,"INC2014-134, INC2015-036, INC2015-055","Station/Facility, Compression, Fitting, Other (please explain)",CSA Z662 1994,NPS 1/2,Stainless Steel,,,,,,,,6790,,,2012,2012,2012,,,,,,,,,,,No,,,No,3/30/2015,Visual,Yes,No,3/30/2015,Replacement,Yes,-92.76552,1,0,0,0,0,1,0,0,0,0,0,0,0,1,0,0,0,0,0,0,0,0,0,0,0,0,0,0,0,3,1,0,0,0
751,INC2015-032,Release of Substance,3/30/2015,Wonowon BC,"Westcoast Energy Inc., carrying on business as Spectra Energy Transmission",Closed,56.708689,2.4,Natural Gas - Sour,Gas,Yes,2015,2015-03-27,2015/03/27 05:00:00 PM Pacific,No pipeline interruption,Gathering,Operation,Other Control System,7/29/2015,Yes,No,Natural Gas - Sour,2.4,No,No,,,,,,,,,,,0,OPR,"20"" ALASKA HIGHWAY TRUNK PIPELINE",508,28.69664024,Natural Gas Sour,,,,,Canada,Yes,No,No,No,3,29.12,Level I,Standard Review - 168 days,No,,"Station/Facility, Pigging, Receiving, Valve, Ball, Ball",,,,,,,,,,,,,,,,,,,,,,,,,,,No,,,No,,,No,No,,,No,-121.766112,1,0,0,1,0,0,0,0,0,0,0,0,0,1,0,0,0,0,0,0,0,0,0,0,0,0,0,0,0,3,1,0,0,0
752,INC2015-034,Operation Beyond Design Limits,3/31/2015,Cornwall,Trans-Northern Pipelines Inc.,Closed,45.03715,0,Not Applicable,Not Applicable,No,2015,2015-03-31,2015/03/31 12:35:00 PM Eastern,Short-term interruption,Transmission,Maintenance,Other Control System,2/21/2017,No,No,,,,No,,,,,,,,,Over Pressure,,0,OPR,,,,,CORNWALL STATION,,45.03715172,-74.71837876,Canada,Yes,Yes,No,No,5,117.6 - 123.9,Level I,Standard Review - 168 days,No,"INC2015-002, INC2016-008","Pipeline, Pipe, Body",API 5LX  1948?,NPS 10,Carbon Steel,317 - X46,30,7.8 mm = 0.307 in,,,6895,,7660,0.6,0.9,1952,1952,1952,1180,Girth (Circumferential),Straight,Electric Resistance Welded,,External,Polyethylene Tape Wrap,,Field Applied,1973,No,,,No,8/28/2013,Inline Inspection (ILI),Yes,No,,,No,-74.71838,0,0,0,0,0,1,0,0,0,0,0,0,0,1,0,0,0,0,0,0,0,0,0,0,0,0,0,0,0,3,1,0,0,0
753,INC2015-036,Release of Substance,4/7/2015,"Dryden, Ontario",TransCanada PipeLines Limited,Closed,49.78942,1,Natural Gas - Sweet,Gas,No,2015,2015-04-07,2015/04/07 06:20:00 AM Mountain,No pipeline interruption,Transmission,Operation,SCADA,11/10/2016,Yes,No,Natural Gas - Sweet,1,No,No,,,,,,,,,,,0,OPR,,,,,STN 55 - DRYDEN,,49.78941703,-92.76551503,Canada,Yes,No,No,No,3,,Level I,Standard Review - 168 days,No,"INC2015-031, INC2015-055","Station/Facility, Compression, Fitting, Other (please explain)",CSA Z662 1994,NPS 1/2,Stainless Steel,,,,,,,,6790,,,2012,2012,2012,,,,,,,,,,,No,,,No,3/30/2015,Visual,Yes,No,3/30/2015,Replacement,Yes,-92.76552,1,0,0,0,0,1,0,0,0,0,0,0,0,1,0,0,0,0,0,0,0,0,0,0,0,0,0,0,0,4,1,0,0,0
754,INC2015-037,Fire,4/10/2015,"Rapid City, Manitoba",TransCanada Keystone Pipeline GP Ltd.,Closed,50.076253,0,Not Applicable,Not Applicable,No,2015,2015-04-09,2015/04/09 01:00:00 PM Mountain,No pipeline interruption,Transmission,Maintenance,Employee / Contractor (Onsite),2/21/2017,No,No,,,,No,,Equipment & Electrical,,,,,,,,,0,OPR,Keystone Line 100-1 Conversion,,,,PS23 - Rapid City,,,,Canada,Yes,No,No,No,3,,Level I,Standard Review - 168 days,No,,"Station/Facility, Pumping, Auxiliary device(s) (please explain)",,,,,,,,,,,,,,,,,,,,,,,,,,,No,,,Yes,,,No,Yes,,,No,-100.001452,0,0,1,0,0,0,0,0,0,0,0,0,0,1,0,0,0,0,0,0,0,0,0,0,0,0,0,0,0,4,1,0,0,0
755,INC2015-038,Operation Beyond Design Limits,4/16/2015,Cromer,Enbridge Pipelines Inc.,Closed,49.752741,0,Not Applicable,Not Applicable,No,2015,2015-04-14,2015/04/15 04:10:00 PM Mountain,No pipeline interruption,Transmission,Operation,Employee / Contractor (Onsite),3/1/2017,Yes,No,,,,No,,,,,,,,,Over Pressure,,0,OPR,,,,,Cromer,,,,Canada,Yes,No,No,No,3,0,Level I,Standard Review - 168 days,No,INC2015-058,,,,,,,,,,,,,,,,,,,,,,,,,,,,No,,,No,,,No,No,,,No,-101.238774,0,0,1,0,0,0,0,0,0,0,0,0,0,1,0,0,0,0,0,0,0,0,0,0,0,0,0,0,0,4,1,0,0,0
756,INC2015-041,Fire,4/19/2015,Spirit River,Pembina Energy Services Inc.,Closed,55.786645,0,Not Applicable,Not Applicable,No,2015,2015-04-18,2015/04/18 04:45:00 PM Mountain,No pipeline interruption,Transmission,Construction,Employee / Contractor (Onsite),1/13/2016,No,No,,,,No,,Under Investigation or Unknown,,,,,,,,,0,OPR,,,,,,Meter,,,Canada,Yes,No,No,No,3,,Level I,Standard Review - 168 days,No,,,,,,,,,,,,,,,,,,,,,,,,,,,,,No,,,No,,,No,No,,,No,-118.9348,0,1,0,0,0,0,0,0,0,0,0,0,0,1,0,0,0,0,0,0,0,0,0,0,0,0,0,0,0,4,1,0,0,0
757,INC2015-042,Release of Substance,4/20/2015,Taylor,"Westcoast Energy Inc., carrying on business as Spectra Energy Transmission",Closed,56.1463,268,Water,Miscellaneous,No,2015,2015-04-13,2015/04/13 04:00:00 AM Pacific,No pipeline interruption,Processing,Operation,Employee / Contractor (Onsite),7/29/2015,No,No,Water,268,No,No,,,,,,,,,,,0,PPR,,,,,MCMAHON GAS PLANT (MCMAHON),,56.14630285,-120.6691693,Canada,Yes,No,No,No,5,,Level I,Standard Review - 168 days,No,,"Processing Plant, Water treatment",,,,,,,,,,,,,,,,,,,,,,,,,,,No,,,No,,,No,No,,,No,-120.66917,1,0,0,1,0,0,0,0,0,0,0,0,0,1,0,0,0,0,0,0,0,0,0,0,0,0,0,0,0,4,1,0,0,0
758,INC2015-043,Serious Injury (CER or TSB),4/21/2015,Jasper,Trans Mountain Pipeline ULC,Closed,53.010185,0,Not Applicable,Not Applicable,Yes,2015,2015-04-21,2015/04/21 04:03:00 PM Mountain,No pipeline interruption,Transmission,Construction,Employee / Contractor (Onsite),5/27/2015,No,No,,,,No,,,,,Fracture,1,0,Yes,,,1,OPR,MAINLINE LOOP: JASPER SECTION,762,80.40097879,Crude Oil,,,,,Canada,No,No,Yes,No,3,360.5,Level I,Standard Review - 168 days,No,,,,,,,,,,,,,,,,,,,,,,,,,,,,,No,,,No,,,No,No,,,No,-118.100442,0,1,0,0,0,0,0,0,0,0,0,0,1,0,0,0,0,0,0,0,0,0,0,0,0,0,0,0,0,4,1,0,0,0
759,INC2015-044,Release of Substance,4/22/2015,Taylor,"Westcoast Energy Inc., carrying on business as Spectra Energy Transmission",Closed,56.14630285,2.5,Amine,Miscellaneous,No,2015,2015-03-20,2015/03/25 06:17:00 PM Mountain,No pipeline interruption,Processing,Maintenance,Employee / Contractor (Onsite),12/16/2015,No,No,Amine,2.5,No,Yes,,,,,,,,,,,0,PPR,"16"" Boundary Lake Pipeline",406.4,49.55772514,"Natural Gas, Natural Gas Sweet",MCMAHON GAS PLANT (MCMAHON),,56.14630285,-120.6691693,Canada,Yes,No,No,No,3,50.55,Level I,Standard Review - 168 days,No,,,,,,,,,,,,,,,,,,,,,,,,,,,,,No,,,No,,,No,No,,,No,-120.6691693,1,0,0,1,0,0,0,0,0,0,0,0,0,1,0,0,0,0,0,0,0,0,0,0,0,0,0,0,0,3,1,0,0,0
760,INC2015-045,Release of Substance,4/28/2015,Grand Pointe,Plains Midstream Canada ULC,Closed,42.469356,1.82,Mixed HVP Hydrocarbons,Gas,No,2015,2015-04-23,2015/04/24 09:00:00 AM Eastern,No pipeline interruption,Transmission,Operation,Inspection Site Visit,6/20/2016,Yes,No,Mixed HVP Hydrocarbons,1.82,No,No,,,,,,,,,,,0,OPR,Windsor-Sarnia Pipeline,323.9,139.7698817,"NGL-HVP (Propane,Butane)",,Meter,,,Canada,Yes,No,No,No,3,,Level I,Standard Review - 168 days,No,,"Station/Facility, Pumping, Valve, Pressure relief, Other (please explain)",,,,,,,,,,,,,,,,,,,,,,,,,,,No,,,No,12/28/2015,Visual,Yes,No,3/11/2015,Testing of Functionality,Yes,-82.369772,1,0,0,0,0,1,0,0,0,0,0,0,0,1,0,0,0,0,0,0,0,0,0,0,0,0,0,0,0,4,1,0,0,0
761,INC2015-046,Release of Substance,5/4/2015,Cold Lake,NOVA Gas Transmission Ltd.,Closed,54.69512814,41380,Natural Gas - Sweet,Gas,Yes,2015,,2015/05/03 10:00:00 AM Mountain,No pipeline interruption,Transmission,Operation,3rd Party / Other Company,2/22/2017,Yes,No,Natural Gas - Sweet,41380,Yes,No,,,,,,,,,,,0,OPR,LEMING LAKE SALES LATERAL - NPS 16,406.4,99.68490441,Natural Gas,MARGUERITE LAKE SALES,,54.69512814,-110.727294,Canada,Yes,No,No,No,3,,Level I,Standard Review - 168 days,No,,"Station/Facility, Metering",,,,,,,,,,,,,,,,,,,,,,,,,,,No,,,No,,,No,No,,,No,-110.727294,1,1,0,0,0,0,0,0,0,0,0,0,0,1,0,0,0,0,0,0,0,0,0,0,0,0,0,0,0,5,1,0,0,0
762,INC2015-050,Release of Substance,5/9/2015,Salisbury,Maritimes & Northeast Pipeline Management Ltd.,Closed,46.16167,10374,Natural Gas - Sweet,Gas,No,2015,2014-05-08,2015/05/09 11:10:00 AM Atlantic,No pipeline interruption,Transmission,Operation,SCADA,9/2/2015,Yes,No,Natural Gas - Sweet,10374,No,No,,,,,,,,,,,0,OPR,Mainline,"762.00000000, 863.60000000",574.8807991,Natural Gas,,,,,Canada,Yes,No,No,No,3,344,Level I,Standard Review - 168 days,No,,"Station/Facility, Metering, Receiving, Valve, Pressure relief, Spring",CSA Z662-07,,,,,,,,,,,,,2006,2007,2007,,,,,,,,,,,No,,,No,5/23/2014,Visual,Yes,Yes,,,No,-65.34959,1,0,0,0,0,0,1,0,0,0,0,0,1,0,0,0,0,0,0,0,0,0,0,0,0,0,0,0,0,5,1,0,0,0
763,INC2015-049,Release of Substance,5/6/2015,"Spririt River, Alberta",NOVA Gas Transmission Ltd.,Closed,55.81518,0.1,Natural Gas - Sweet,Gas,No,2015,,2015/05/06 08:10:00 AM Mountain,No pipeline interruption,Transmission,Operation,Employee / Contractor (Onsite),3/1/2017,Yes,No,Natural Gas - Sweet,0.1,No,No,,,,,,,,,,,1,OPR,GORDONDALE LATERAL LOOP - NPS 20,508,23.64412691,Natural Gas,SADDLE HILLS,,55.81517695,-119.3657945,Canada,Yes,No,No,No,3,,Level I,Standard Review - 168 days,No,INC2014-134,"Station/Facility, Compression, Piping, Thread",,,,,,,,,,,,,,,,,,,,,,,,,,,No,,,No,4/27/2015,Visual,Yes,Yes,,,No,-119.36579,1,1,0,0,0,0,0,0,0,0,0,0,0,0,0,1,0,0,0,0,0,0,0,0,0,0,0,0,0,5,1,0,0,0
764,INC2015-051,Release of Substance,5/9/2015,Taylor,"Westcoast Energy Inc., carrying on business as Spectra Energy Transmission",Closed,56.146,262,Butane,Gas,No,2015,2015-05-09,2015/05/09 02:25:00 PM Pacific,No pipeline interruption,Processing,Operation,Employee / Contractor (Onsite),4/7/2016,No,No,Butane,262,No,No,,,,,,,,,,,350,PPR,,,,,,,,,Canada,Yes,No,No,No,5,,Level II,Category B,No,INC2017-192,,,,,,,,,,,,,,,,,,,,,,,,,,,,No,,,No,,,No,No,,,No,-120.671,1,0,0,1,0,0,0,0,0,0,0,0,0,1,0,0,0,0,0,0,0,0,0,0,0,0,0,0,0,5,1,0,0,0
765,INC2015-052,Fire,5/9/2015,Rosetown,Enbridge Pipelines Inc.,Closed,51.586,0,Not Applicable,Not Applicable,No,2015,2015-05-09,2015/05/09 05:38:00 PM Mountain,No pipeline interruption,Transmission,Operation,3rd Party / Other Company,7/29/2015,No,No,,,,No,,Other Event (Nature or 3rd Party),,,,,,,,,0,OPR,Line 1,"508.00000000, 864.00000000",1255.999121,Crude Oil,,,,,Canada,No,Yes,Yes,No,3,Between kilometre post 444.2 and 445.8,Level II,Category B,No,,,,,,,,,,,,,,,,,,,,,,,,,,,,,No,,,No,,,No,No,,,No,-107.959,0,0,0,0,1,0,0,0,0,0,0,0,0,0,1,0,0,0,0,0,0,0,0,0,0,0,0,0,0,5,1,0,0,0
766,INC2015-053,Fire,5/11/2015,Glenboro Manitoba,Enbridge Pipelines Inc.,Closed,49.538348,0,Not Applicable,Not Applicable,No,2015,2015-05-08,2015/05/08 09:20:00 AM Central,No pipeline interruption,Transmission,Maintenance,Employee / Contractor (Onsite),2/21/2017,No,No,,,,No,,Equipment & Electrical,,,,,,,,,0,OPR,Line 4,"1219.00000000, 864.00000000, 914.00000000",1248.909872,Crude Oil,,,,,Canada,Yes,No,No,No,3,685.55,Level I,Standard Review - 168 days,No,,,,,,,,,,,,,,,,,,,,,,,,,,,,,No,,,No,,,No,No,,,No,-99.289286,0,0,1,0,0,0,0,0,0,0,0,0,0,1,0,0,0,0,0,0,0,0,0,0,0,0,0,0,0,5,1,0,0,0
767,INC2015-054,Release of Substance,5/11/2015,"Quesnel, BC","Westcoast Energy Inc., carrying on business as Spectra Energy Transmission",Closed,52.640194,1,Natural Gas - Sweet,Gas,No,2015,2015-05-10,2015/05/10 11:37:00 AM Pacific,No pipeline interruption,Transmission,Operation,Public,5/24/2016,Yes,No,Natural Gas - Sweet,1,No,No,,,,,,,,,,,0,OPR,"SPECTRA - 36"" LOOP","508.00000000, 762.00000000, 914.40000000",1105.13746,Natural Gas,,Meter,,,Canada,No,No,Yes,No,3,,Level I,Standard Review - 168 days,No,,"Pipeline, Fitting, Cap, Thread",,NPS 36,Carbon Steel,,,,,,,,,,,,,,,,,,,,,,,,No,,,No,,,No,No,,,No,-122.447333,1,0,0,1,0,0,0,0,0,0,0,0,1,0,0,0,0,0,0,0,0,0,0,0,0,0,0,0,0,5,1,0,0,0
768,INC2015-057,Fire,5/13/2015,Edmonton,Enbridge Pipelines Inc.,Closed,53.537622,0,Not Applicable,Not Applicable,No,2015,2015-05-12,2015/05/12 01:50:00 PM Mountain,No pipeline interruption,Transmission,Construction,Employee / Contractor (Onsite),1/13/2016,No,No,,,,No,,Welding or Cutting,,,,,,,,,0,OPR,,,,,Edmonton Terminal South,,,,Canada,No,No,Yes,Yes,3,0,Level I,Standard Review - 168 days,No,,,,,,,,,,,,,,,,,,,,,,,,,,,,,No,,,No,,,No,No,,,No,-113.368289,0,1,0,0,0,0,0,0,0,0,0,0,0,0,0,0,0,1,0,0,0,0,0,0,0,0,0,0,0,5,1,0,0,0
769,INC2015-055,Release of Substance,5/12/2015,Dryden,TransCanada PipeLines Limited,Closed,49.78942,0.1,Natural Gas - Sweet,Gas,No,2015,2015-05-11,2015/05/11 10:30:00 AM Mountain,No pipeline interruption,Transmission,Operation,Employee / Contractor (Onsite),11/10/2016,Yes,No,Natural Gas - Sweet,0.1,No,No,,,,,,,,,,,0,OPR,,,,,STN 55 - DRYDEN,,49.78941703,-92.76551503,Canada,Yes,No,No,No,4,,Level I,Standard Review - 168 days,No,"INC2014-134, INC2015-031, INC2015-036","Station/Facility, Compression, Valve, Check, Other (please explain)",,,,,,,,,,,,,,,,,,,,,,,,,,,No,,,No,5/11/2015,Visual,No,Yes,,,No,-92.76552,1,0,0,0,0,1,0,0,0,0,0,0,0,1,0,0,0,0,0,0,0,0,0,0,0,0,0,0,0,5,1,0,0,0
770,INC2015-056,Release of Substance,5/12/2015,"Medicine Hat, Alberta",NOVA Gas Transmission Ltd.,Closed,50.16626,3400000,Natural Gas - Sweet,Gas,Yes,2015,2015-05-11,2015/05/11 11:00:00 PM Mountain,Short-term interruption,Transmission,Operation,SCADA,11/29/2018,Yes,Yes,Natural Gas - Sweet,3400000,Yes,No,,,,,,,,,,,0,OPR,SUFFIELD LATERAL - NPS 12,323.9,63.37841961,Natural Gas,,,,,Canada,No,Yes,Yes,No,3,KP 31.110,Level II,Category B,No,OM2015-204,"Pipeline, Pipe, Body",1972,NPS 12,Carbon Steel,317 - X46,20,6.3 mm = 0.250 in,,6.2,8450,,5290,,4.5,,1972,1972,-1002,,Straight,Electric Resistance Welded,11 o'clock,External,Polyethylene Tape Wrap,Disbonded,Field Applied,1972,No,Replacement,8/23/2015,No,9/30/2014,Inline Inspection (ILI),Yes,Yes,,,No,-110.59318,1,1,0,0,0,0,0,0,0,0,1,0,0,0,0,1,0,0,0,0,0,0,0,0,0,1,0,0,0,5,1,0,0,0
771,INC2015-058,Operation Beyond Design Limits,5/13/2015,Edmonton,Enbridge Pipelines Inc.,Closed,53.551922,0,Not Applicable,Not Applicable,No,2015,2015-05-13,2015/05/13 09:17:00 AM Mountain,No pipeline interruption,Transmission,Maintenance,SCADA,3/2/2017,No,No,,,,No,,,,,,,,,Over Pressure,,0,OPR,,,,,Edmonton,,,,Canada,Yes,No,No,No,5,0,Level I,Standard Review - 168 days,No,INC2015-038,,,NPS 36,Carbon Steel,241 - B,20,9.5 mm = 0.375 in,,,1896,,2137,,,,,,,,,,,,,,,,No,,,No,,,No,No,,,No,-113.351563,0,1,0,0,0,0,0,0,0,0,0,0,0,1,0,0,0,0,0,0,0,0,0,0,0,0,0,0,0,5,1,0,0,0
772,INC2015-059,Fire,5/20/2015,Burnaby BC,Trans Mountain Pipeline ULC,Closed,49.29045,0,Not Applicable,Not Applicable,No,2015,2015-05-20,2015/05/20 08:45:00 AM Pacific,No pipeline interruption,Transmission,Maintenance,Employee / Contractor (Onsite),2/22/2016,Yes,No,,,,No,,Equipment & Electrical,,,,,,,,,0,OPR,Westridge Delivery Line,610,3.68992897,Crude Oil,,,,,Canada,Yes,No,No,No,3,,Level I,Standard Review - 168 days,No,,Vehicle / mobile equipment,This section is not applicable,,,,,,,,,,,,,,,,,,,,,,,,,,No,,,No,,,No,No,,,No,-122.95047,0,0,0,1,0,0,0,0,0,0,0,0,0,1,0,0,0,0,0,0,0,0,0,0,0,0,0,0,0,5,1,0,0,0
773,INC2015-060,Release of Substance,5/22/2015,"Nipigon, Ontario",TransCanada PipeLines Limited,Closed,49.29537,2,Lube Oil,Liquid,No,2015,2015-05-18,2015/05/18 06:45:00 AM Mountain,No pipeline interruption,Transmission,Operation,Employee / Contractor (Onsite),9/17/2018,Yes,No,Lube Oil,2,No,Yes,,,,,,,,,,,0,OPR,,,,,STN 75 - NIPIGON,,49.29537352,-88.10128251,Canada,Yes,No,No,No,3,MLV 75,Level I,Standard Review - 168 days,No,,"Station/Facility, Compression, Fitting, Nipple",,NPS 1/2,Carbon Steel,,160,,,,8274,,7584,,,,1994,1994,,,,,,,,,,,No,,,No,5/8/2015,Visual,Yes,Yes,,,No,-88.10128,1,0,0,0,0,1,0,0,0,0,0,0,0,1,0,0,0,0,0,0,0,0,0,0,0,0,0,0,0,5,1,0,0,0
774,INC2015-061,Fire,5/22/2015,Hardisty,Enbridge Pipelines Inc.,Closed,52.63188,0,Not Applicable,Not Applicable,No,2015,2015-05-21,2015/05/21 03:05:00 PM Mountain,No pipeline interruption,Transmission,Construction,Employee / Contractor (Onsite),1/13/2016,No,No,,,,No,,Welding or Cutting,,,,,,,,,0,OPR,HARDISTY TERMINAL PIPING - LINE 67,914,0.12071388,Crude Oil,,Valve,,,Canada,Yes,No,No,No,3,0,Level I,Standard Review - 168 days,No,,,,,,,,,,,,,,,,,,,,,,,,,,,,,No,,,No,,,No,No,,,No,-111.282521,0,1,0,0,0,0,0,0,0,0,0,0,0,1,0,0,0,0,0,0,0,0,0,0,0,0,0,0,0,5,1,0,0,0
775,INC2015-062,Fire,5/25/2015,Regina,Enbridge Pipelines Inc.,Closed,50.483487,0,Not Applicable,Not Applicable,No,2015,2015-05-22,2015/05/22 11:20:00 PM Mountain,No pipeline interruption,Transmission,Construction,Employee / Contractor (Onsite),1/13/2016,No,No,,,,No,,Welding or Cutting,,,,,,,,,0,OPR,,,,,REGINA TERMINAL,,,,Canada,Yes,No,No,No,3,0,Level I,Standard Review - 168 days,No,,,,,,,,,,,,,,,,,,,,,,,,,,,,,No,,,No,,,No,No,,,No,-104.587856,0,0,0,0,1,0,0,0,0,0,0,0,0,1,0,0,0,0,0,0,0,0,0,0,0,0,0,0,0,5,1,0,0,0
776,INC2015-063,Release of Substance,5/25/2015,Dawson Creek,"Westcoast Energy Inc., carrying on business as Spectra Energy Transmission",Closed,55.79306,2,Propane,Gas,No,2015,2015-05-25,2015/05/25 01:30:00 PM Pacific,No pipeline interruption,Processing,Operation,Other Control System,5/24/2016,Yes,No,Propane,2,No,No,,,,,,,,,,,0,PPR,,,,,DAWSON PROCESSING PLANT,,55.79305809,-120.5231165,Canada,Yes,No,No,No,3,,Level I,Standard Review - 168 days,No,,"Pipeline, Valve, Pressure relief, Spring",,,,,,,,,,,,,,,,,,,,,,,,,,,No,,,No,,,No,No,,,No,-120.52312,1,0,0,1,0,0,0,0,0,0,0,0,0,0,1,0,0,0,0,0,0,0,0,0,0,0,0,0,0,5,1,0,0,0
777,INC2015-074,Release of Substance,7/1/2015,"Chetwynd, BC","Westcoast Energy Inc., carrying on business as Spectra Energy Transmission",Closed,55.572,526,Natural Gas - Sour,Gas,Yes,2015,2015-07-01,2015/07/01 10:12:00 AM Pacific,No pipeline interruption,Processing,Operation,Employee / Contractor (Onsite),5/16/2017,Yes,No,Natural Gas - Sour,526,No,No,,,,,,,,,,,0,PPR,,,,,,,,,Canada,Yes,No,No,No,3,,Level I,Standard Review - 168 days,No,,"Station/Facility, Pigging, Launching, Auxiliary device(s) (please explain)",,,,,,,,,,,,,,,,,,,,,,,,,,,No,,,No,,,No,No,,,No,-121.944,1,0,0,1,0,0,0,0,0,0,0,0,1,0,0,0,0,0,0,0,0,0,0,0,0,0,0,0,0,7,0,1,0,0
778,INC2015-064,Release of Substance,5/26/2015,Taylor,"Westcoast Energy Inc., carrying on business as Spectra Energy Transmission",Closed,56.145,41,Contaminated Water,Miscellaneous,No,2015,2015-05-26,2015/05/26 07:00:00 AM Pacific,No pipeline interruption,Processing,Operation,Employee / Contractor (Onsite),9/17/2018,No,No,Contaminated Water,41,No,Yes,,,,,,,,,,,0,PPR,"30"" Fort St. John Mainline",,,,762 mm OD FSJ Mainline Pigging Barrel - Sending,,,,Canada,Yes,No,No,No,3,0,Level I,Standard Review - 168 days,No,,,,,,,,,,,,,,,,,,,,,,,,,,,,,No,,,No,,,No,No,,,No,-120.67,1,0,0,1,0,0,0,0,0,0,0,0,0,1,0,0,0,0,0,0,0,0,0,0,0,0,0,0,0,5,1,0,0,0
779,INC2015-070,Release of Substance,6/18/2015,"Regina, Saskatchewan",Alliance Pipeline Ltd.,Closed,50.2520045,1,Natural Gas - Sweet,Gas,No,2015,2015-06-16,2015/06/16 08:00:00 AM Mountain,No pipeline interruption,Transmission,Maintenance,Employee / Contractor (Onsite),3/29/2016,Yes,No,Natural Gas - Sweet,1,No,No,,,,,,,,,,,0,OPR,MAINLINE,"1067.00000000, 914.00000000",1551.609274,Natural Gas,ESTLIN,,,,Canada,Yes,No,No,No,3,1306.81,Level I,Standard Review - 168 days,No,,"Station/Facility, Compression, Valve, Ball, Ball",,,,,,,,,,,,,,,,,,,,,,,,,,,No,,,No,,,No,No,,,No,-104.408497,1,0,0,0,1,0,0,0,0,0,0,0,0,1,0,0,0,0,0,0,0,0,0,0,0,0,0,0,0,6,0,1,0,0
780,INC2015-071,Release of Substance,6/19/2015,Taylor,"Westcoast Energy Inc., carrying on business as Spectra Energy Transmission",Closed,56.14630285,2,Waste Oil,Liquid,No,2015,2015-06-15,2015/06/17 10:00:00 AM Mountain,No pipeline interruption,Processing,Operation,Employee / Contractor (Onsite),12/16/2015,Yes,No,Waste Oil,2,Yes,No,,,,,,,,,,,0,PPR,,,,,MCMAHON GAS PLANT (MCMAHON),,56.14630285,-120.6691693,Canada,Yes,No,No,No,4,,Level I,Standard Review - 168 days,No,INC2015-110,"Station/Facility, Compression, Piping, Body",,,,,,,,,,,,,,,,,,,,,,,,,,,No,,,No,,,No,No,,,No,-120.6691693,1,0,0,1,0,0,0,0,0,0,0,0,0,1,0,0,0,0,0,0,0,0,0,0,0,0,0,0,0,6,0,1,0,0
781,INC2015-073,Release of Substance,6/27/2015,Hardisty,Express Pipeline Ltd.,Closed,52.63471,16,Crude Oil - Sweet,Liquid,No,2015,2015-06-27,2015/06/27 09:30:00 AM Mountain,Short-term interruption,Transmission,Operation,3rd Party / Other Company,2/10/2016,No,No,Crude Oil - Sweet,16,No,Yes,,,,,,,,,,,0,OPR,,,,,HARDISTY,,,,Canada,Yes,No,No,No,3,,Level I,Standard Review - 168 days,No,,,,,,,,,,,,,,,,,,,,,,,,,,,,,No,,,No,,,No,No,,,No,-111.2641,1,1,0,0,0,0,0,0,0,0,1,0,0,1,0,0,0,0,0,0,0,0,0,0,0,0,0,0,0,6,0,1,0,0
782,INC2015-075,Fire,7/3/2015,"Taylor, BC","Westcoast Energy Inc., carrying on business as Spectra Energy Transmission",Closed,56.1441,0,Not Applicable,Not Applicable,No,2015,2015-07-03,2015/07/03 05:00:00 PM Pacific,No pipeline interruption,Gathering,Operation,Employee / Contractor (Onsite),1/13/2016,Yes,No,,,,No,,Equipment & Electrical,,,,,,,,,0,PPR,,,,,TAYLOR (STN 1) (STN 1),,56.14410425,-120.6639331,Canada,Yes,No,No,No,5,,Level I,Standard Review - 168 days,No,INC2015-077,"Processing Plant, Flare",,,,,,,,,,,,,,,,,,,,,,,,,,,No,,,No,,,No,No,,,No,-120.66393,0,0,0,1,0,0,0,0,0,0,0,0,0,1,0,0,0,0,0,0,0,0,0,0,0,0,0,0,0,7,0,1,0,0
783,INC2015-078,Adverse Environmental Effects,7/10/2015,Chetwynd,"Westcoast Energy Inc., carrying on business as Spectra Energy Transmission",Closed,55.56909171,0,Not Applicable,Not Applicable,Yes,2015,2015-07-09,2015/07/09 02:30:00 PM Pacific,No pipeline interruption,Processing,Operation,Employee / Contractor (Onsite),1/19/2016,No,No,,,,Yes,,,,,,,,,,Release of Toxic Substance,0,PPR,,,,,PINE RIVER GAS PLANT (PRGP),,55.56909171,-121.9446616,Canada,Yes,No,No,No,3,,Level I,Standard Review - 168 days,No,,,,,,,,,,,,,,,,,,,,,,,,,,,,,No,,,No,,,No,No,,,No,-121.9446616,0,0,0,1,0,0,0,0,0,0,0,0,0,0,0,0,0,0,1,0,0,0,0,0,0,0,0,0,0,7,0,1,0,0
784,INC2015-077,Fire,7/10/2015,Chetwynd,"Westcoast Energy Inc., carrying on business as Spectra Energy Transmission",Closed,55.56909171,0,Not Applicable,Not Applicable,No,2015,2015-07-09,2015/07/09 02:30:00 PM Pacific,No pipeline interruption,Processing,Operation,Employee / Contractor (Onsite),1/13/2016,Yes,No,,,,No,,Other Event (Nature or 3rd Party),,,,,,,,,0,PPR,,,,,PINE RIVER GAS PLANT (PRGP),,55.56909171,-121.9446616,Canada,Yes,No,No,No,3,,Level I,Standard Review - 168 days,No,INC2015-075,"Processing Plant, Flare",,,,,,,,,,,,,,,,,,,,,,,,,,,No,,,No,,,No,No,,,No,-121.9446616,0,0,0,1,0,0,0,0,0,0,0,0,0,0,0,0,0,0,1,0,0,0,0,0,0,0,0,0,0,7,0,1,0,0
785,INC2015-079,Operation Beyond Design Limits,7/10/2015,"Savona, BC","Westcoast Energy Inc., carrying on business as Spectra Energy Transmission",Closed,50.749402,0,Not Applicable,Not Applicable,No,2015,2015-05-29,2015/05/29 10:30:00 AM Pacific,No pipeline interruption,Transmission,Maintenance,Employee / Contractor (Onsite),3/29/2016,No,No,,,,No,,,,,,,,,Over Pressure,,0,OPR,"SPECTRA - 30"" MAINLINE","168.30000000, 762.00000000",1274.364117,"Natural Gas, Natural Gas Sweet",,Meter,,,Canada,Yes,No,No,No,4,,Level I,Standard Review - 168 days,No,,,,,,,,,,,,,,,,,,,,,,,,,,,,,No,,,No,,,No,No,,,No,-120.856615,0,0,0,1,0,0,0,0,0,0,0,0,0,0,0,0,1,0,0,0,0,0,0,0,0,0,0,0,0,5,1,0,0,0
786,INC2015-080,Release of Substance,7/13/2015,Karr Receipt Point is approximately 95 km SE of Grande Prairie,Alliance Pipeline Ltd.,Closed,54.61366745,1,Natural Gas - Sweet,Gas,No,2015,2015-07-09,2015/07/09 11:01:00 AM Mountain,No pipeline interruption,Transmission,Maintenance,Employee / Contractor (Onsite),8/15/2017,Yes,No,Natural Gas - Sweet,1,No,No,,,,,,,,,,,0,OPR,KARR LATERAL,219.1,2.36584822,Natural Gas,KARR,,,,Canada,No,No,Yes,No,3,Lateral KP 2.48,Level I,Standard Review - 168 days,No,,"Station/Facility, Metering, Receiving, Valve, Pressure relief, Other (please explain)",,NPS 1,Carbon Steel,,,,,,9930,8275,8275,,,,,,,,,,,,,Intact,,,No,,,No,,,No,No,,,No,-118.2116069,1,1,0,0,0,0,0,0,0,0,0,0,1,0,0,0,0,0,0,0,0,0,0,0,0,0,0,0,0,7,0,1,0,0
787,INC2015-081,Operation Beyond Design Limits,7/13/2015,"Grande Prairie, Alberta",NOVA Gas Transmission Ltd.,Closed,54.830119,0,Not Applicable,Not Applicable,No,2015,2015-07-10,2015/07/10 01:40:00 PM Mountain,No pipeline interruption,Transmission,Operation,SCADA,3/29/2016,Yes,No,,,,No,,,,,,,,,Over Pressure,,0,OPR,GRANDE PRAIRIE MAINLINE LATERAL LOOP,762,32.88459159,Natural Gas,,,,,Canada,Yes,No,No,No,3,,Level I,Standard Review - 168 days,No,,,,,,,,,,,,,,,,,,,,,,,,,,,,,No,,,No,,,No,No,,,No,-118.646961,0,1,0,0,0,0,0,0,0,0,0,0,0,0,1,0,0,0,0,0,0,0,0,0,0,0,0,0,0,7,0,1,0,0
788,INC2015-082,Release of Substance,7/14/2015,Chetwynd,"Westcoast Energy Inc., carrying on business as Spectra Energy Transmission",Closed,55.56909171,1.8,Sulphur,Miscellaneous,No,2015,2015-07-10,2015/07/10 12:00:00 PM Pacific,No pipeline interruption,Processing,Operation,Employee / Contractor (Onsite),5/11/2017,Yes,No,Sulphur,1.8,No,Yes,,,,,,,,,,,0,PPR,,,,,PINE RIVER GAS PLANT (PRGP),,55.56909171,-121.9446616,Canada,Yes,No,No,No,3,,Level I,Standard Review - 168 days,No,,"Processing Plant, Sulphur plant",,,,,,,,,,,,,,,,,,,,,,,,,,,No,,,No,,,No,No,,,No,-121.9446616,1,0,0,1,0,0,0,0,0,0,0,0,0,1,0,0,0,0,0,0,0,0,0,0,0,0,0,0,0,7,0,1,0,0
789,INC2015-083,Release of Substance,7/16/2015,"Fort Nelson, BC","Westcoast Energy Inc., carrying on business as Spectra Energy Transmission",Closed,58.654643,13.4,Natural Gas - Sour,Gas,Yes,2015,2015-07-03,2015/07/03 12:00:00 PM Pacific,No pipeline interruption,Gathering,Operation,Employee / Contractor (Onsite),3/1/2017,Yes,No,Natural Gas - Sour,13.4,No,No,,,,,,,,,,,0,OPR,"24"" Beaver River Pipeline","609.60000000, 610.00000000",173.4713372,Natural Gas Sour,,,,,Canada,Yes,No,No,No,3,,Level I,Standard Review - 168 days,No,,"Station/Facility, Pigging, Receiving, Flange, Gasket/O-ring",,,,,,,,,,,,,,,,,,,,,,,,,,,No,,,No,,,No,No,,,No,-122.68924,1,0,0,1,0,0,0,0,0,0,0,0,1,0,0,0,0,0,0,0,0,0,0,0,0,0,0,0,0,7,0,1,0,0
790,INC2015-084,Release of Substance,7/20/2015,"Regina, Saskatchewan",Enbridge Pipelines Inc.,Closed,50.482934,0.0001,Natural Gas Liquids,Gas,No,2015,2015-07-20,2015/07/20 06:25:00 AM Central,No pipeline interruption,Transmission,Operation,SCADA,11/9/2017,Yes,No,Natural Gas Liquids,0.0001,No,No,,,,,,,,,,,0,OPR,Line 1,"508.00000000, 864.00000000",1255.999121,Crude Oil,,,,,Canada,Yes,No,No,No,4,704.201,Level I,Standard Review - 168 days,No,,"Station/Facility, Pumping, Pump",,,,,,,,,,,,,,,,,,,,,,,,,,,No,,,No,,,No,No,,,No,-104.586279,1,0,0,0,1,0,0,0,0,0,0,0,0,1,0,0,0,0,0,0,0,0,0,0,0,0,0,0,0,7,0,1,0,0
791,INC2015-085,Release of Substance,7/23/2015,"Kerrobert Station is approximately 4km NW of the town of Kerrobert, Saskatchewan",Alliance Pipeline Ltd.,Closed,51.94,28,Natural Gas - Sweet,Gas,No,2015,2015-07-22,2015/07/22 05:58:00 PM Mountain,No pipeline interruption,Transmission,Operation,Other Control System,1/13/2016,Yes,No,Natural Gas - Sweet,28,No,No,,,,,,,,,,,0,OPR,MAINLINE,"1067.00000000, 914.00000000",1551.609274,Natural Gas,KERROBERT,,,,Canada,Yes,No,No,No,3,913.3,Level I,Standard Review - 168 days,No,,"Station/Facility, Compression, Valve, Pressure relief, Rupture disk",,,,,,,,,,,,,,,,,,,,,,,,,,,No,,,No,,,No,No,,,No,-109.18,1,0,0,0,1,0,0,0,0,0,1,0,0,1,0,0,0,0,0,0,0,0,0,0,0,0,0,0,1,7,0,1,0,0
792,INC2015-087,Release of Substance,7/24/2015,Taylor BC,"Westcoast Energy Inc., carrying on business as Spectra Energy Transmission",Closed,56.14512,20,Produced Water,Miscellaneous,No,2015,2015-07-23,2015/07/23 06:40:00 PM Pacific,No pipeline interruption,Processing,Operation,Employee / Contractor (Onsite),2/28/2017,Yes,No,Produced Water,20,Yes,Yes,,,,,,,,,,,0,PPR,,,,,Taylor Complex,,,,Canada,Yes,No,No,No,3,,Level I,Standard Review - 168 days,No,,"Processing Plant, Water treatment",,,,,,,,,,,,,,,,,,,,,,,,,,,No,,,No,,,No,No,,,No,-120.66429,1,0,0,1,0,0,0,0,0,0,0,0,0,1,0,0,0,0,0,0,0,0,0,0,0,0,0,0,0,7,0,1,0,0
793,INC2015-088,Operation Beyond Design Limits,7/30/2015,"Grand Prairie, Alberta",NOVA Gas Transmission Ltd.,Closed,54.830119,0,Not Applicable,Not Applicable,No,2015,2015-07-30,2015/07/30 02:56:00 PM Mountain,No pipeline interruption,Transmission,Operation,SCADA,3/29/2016,Yes,No,,,,No,,,,,,,,,Over Pressure,,0,OPR,GRANDE PRAIRIE MAINLINE LATERAL LOOP,762,32.88459159,Natural Gas,,,,,Canada,Yes,No,No,No,3,,Level I,Standard Review - 168 days,No,,,,,,,,,,,,,,,,,,,,,,,,,,,,,No,,,No,,,No,No,,,No,-118.646961,0,1,0,0,0,0,0,0,0,0,0,0,0,0,1,0,0,0,0,0,0,0,0,0,0,0,0,0,0,7,0,1,0,0
794,INC2015-090,Operation Beyond Design Limits,8/6/2015,Valleyview,Alliance Pipeline Ltd.,Closed,54.4245,0,Not Applicable,Not Applicable,No,2015,2015-08-05,2015/08/05 09:00:00 AM Mountain,Short-term interruption,Transmission,Operation,Other Control System,3/29/2016,No,No,,,,No,,,,,,,,,Inappropriate Product,,0,OPR,SIMONETTE LATERAL,406.4,2.01143158,Natural Gas Sweet,SIMONETTE,,,,Canada,Yes,No,No,No,3,,Level II,Category B,No,,,,,,,,,,,,,,,,,,,,,,,,,,,,,No,,,No,,,No,No,,,No,-117.75955,0,1,0,0,0,0,0,0,0,0,0,0,0,1,0,0,0,0,0,0,0,0,0,0,0,0,0,0,0,8,0,1,0,0
795,INC2015-091,Release of Substance,8/17/2015,Chetwynd BC,"Westcoast Energy Inc., carrying on business as Spectra Energy Transmission",Closed,55.57,164,Natural Gas - Sour,Gas,Yes,2015,2015-08-16,2015/08/17 12:00:00 PM Mountain,No pipeline interruption,Processing,Operation,Employee / Contractor (Onsite),3/29/2016,Yes,No,Natural Gas - Sour,164,Yes,No,,,,,,,,,,,0,PPR,Grizzly Pipeline,"273.10000000, 508.00000000, 610.00000000",160.6451852,"Natural Gas Sour, Natural Gas Sweet",,,,,Canada,Yes,No,No,No,3,149.8,Level I,Standard Review - 168 days,No,,"Processing Plant, Sweetening (desulfurization)",,,,,,,,,,,,,,,,,,,,,,,,,,,No,,,No,,,No,No,,,No,-121.94,1,0,0,1,0,0,0,0,0,0,0,0,0,1,0,0,0,0,0,0,0,0,0,0,0,0,0,0,0,8,0,1,0,0
796,INC2015-092,Release of Substance,8/18/2015,Brockville,TransCanada PipeLines Limited,Closed,44.682404,0.01,Natural Gas - Sweet,Gas,No,2015,2015-04-22,2015/04/22 11:30:00 AM Mountain,No pipeline interruption,Transmission,Operation,Employee / Contractor (Onsite),2/28/2017,Yes,No,Natural Gas - Sweet,0.01,No,No,,,,,,,,,,,0,OPR,Line 100-2 (Montreal),,,,,Meter,,,Canada,Yes,No,No,No,4,15,Level I,Standard Review - 168 days,No,,"Station/Facility, Compression, Valve, Ball, Other (please explain)",1967,NPS 1/2,Carbon Steel,241 - B,160,,,,,,,,0.91,,1967,1967,,,,,,,,,,,No,,,No,4/22/2015,Visual,Yes,No,4/22/2015,Testing of Functionality,Yes,-75.622458,1,0,0,0,0,1,0,0,0,0,1,0,0,1,0,0,0,0,0,0,0,0,1,0,0,0,0,0,0,4,1,0,0,0
797,INC2015-093,Release of Substance,8/18/2015,Dawson Creek,"Westcoast Energy Inc., carrying on business as Spectra Energy Transmission",Closed,55.791,2.118,Propane,Gas,No,2015,2015-08-16,2015/08/16 02:03:00 PM Mountain,No pipeline interruption,Processing,Operation,Employee / Contractor (Onsite),3/29/2016,No,No,Propane,2.118,No,No,,,,,,,,,,,0,PPR,Willowbrook Pipeline,406.4,4.15341339,Natural Gas Sour,,,,,Canada,Yes,No,No,No,3,0,Level I,Standard Review - 168 days,No,,,,,,,,,,,,,,,,,,,,,,,,,,,,,No,,,No,,,No,No,,,No,-120.526,1,0,0,1,0,0,0,0,0,0,0,0,0,1,0,0,0,0,0,0,0,0,0,0,0,0,0,0,0,8,0,1,0,0
798,INC2015-095,Release of Substance,8/19/2015,"Fort St. John, B.C.",NOVA Gas Transmission Ltd.,Closed,56.337317,2366,Natural Gas - Sweet,Gas,No,2015,,2015/08/19 09:30:00 AM Mountain,No pipeline interruption,Transmission,Operation,Scheduled Patrol,4/4/2017,Yes,No,Natural Gas - Sweet,2366,Yes,No,,,,,,,,,,,0,OPR,,,,,,,,,Canada,No,No,Yes,No,3,kP 73.6,Level I,Standard Review - 168 days,No,"INC2015-104, INC2015-107, INC2015-127","Pipeline, Pipe, Body",CSA Z245.1 - 1990,NPS 16,Carbon Steel,359 - X52,,6.0 mm = 0.237 in,,6.1,8450,7000,,,1.3,,,1992,-1112,,Straight,Electric Resistance Welded,1 o'clock,External,Polyethylene Tape Wrap,Disbonded,Field Applied,1991,No,Replacement,1/15/2016,Yes,,,No,No,,Replacement,No,-119.910103,1,1,0,0,0,0,0,0,0,0,0,0,1,0,0,0,0,0,0,0,0,0,0,0,0,0,0,0,0,8,0,1,0,0
799,INC2015-096,Release of Substance,8/21/2015,"Beiseker, AB",NOVA Gas Transmission Ltd.,Closed,51.32322,0.001,Natural Gas - Sweet,Gas,No,2015,,2015/08/21 12:00:00 PM Mountain,No pipeline interruption,Transmission,Operation,Employee / Contractor (Onsite),3/8/2016,Yes,No,Natural Gas - Sweet,0.001,No,No,,,,,,,,,,,0,OPR,,,,,ATUSIS CREEK SALES,,51.32321549,-113.3774265,Canada,Yes,No,No,No,3,,Level I,Standard Review - 168 days,No,,"Station/Facility, Metering, Delivering, Auxiliary device(s) (please explain)",,,,,,,,,6205,,5200,,,,,,,,,,,,,,,,No,,,No,8/21/2015,Visual,Yes,No,8/27/2015,Repair,Yes,-113.37743,1,1,0,0,0,0,0,0,0,0,0,0,0,0,1,0,0,0,0,0,0,0,0,0,0,0,0,0,0,8,0,1,0,0
800,INC2015-109,Release of Substance,9/16/2015,"Cromer, MB",Enbridge Pipelines Inc.,Closed,49.749362,0.0076,Natural Gas Liquids,Gas,No,2015,2015-09-16,2015/09/16 07:53:00 AM Mountain,Short-term interruption,Transmission,Operation,Other Control System,2/28/2017,Yes,No,Natural Gas Liquids,0.0076,No,No,,,,,,,,,,,0,OPR,Line 1,"508.00000000, 864.00000000",1255.999121,Crude Oil,,Valve,,,Canada,Yes,No,No,No,4,960.27,Level I,Standard Review - 168 days,No,,"Station/Facility, Pumping, Valve, Ball, Stem",,NPS 10,Carbon Steel,,,,,,,,,,,,1988,1988,,,,,,,,,,,No,,,No,10/24/2013,Visual,Yes,No,11/13/2008,Testing of Functionality,Yes,-101.244345,1,0,1,0,0,0,0,0,0,0,0,0,0,1,0,0,0,0,0,0,0,0,0,0,0,0,0,0,0,9,0,0,1,0
801,INC2015-097,"Explosion, Fire",8/24/2015,"Hardisty, Alberta",Enbridge Pipelines Inc.,Closed,52.639314,0,Not Applicable,Not Applicable,No,2015,2015-08-19,2015/08/19 08:20:00 PM Mountain,No pipeline interruption,Transmission,Operation,SCADA,6/16/2016,Yes,No,,,,No,Equipment & Electrical,Equipment & Electrical,,,,,,,,,0,OPR,,,,,,Meter,,,Canada,Yes,No,No,No,3,175.451,Level II,Category B,No,"INC2012-174, INC2015-022, INC2016-003, INC2016-122, INC2017-006","Station/Facility, Pumping, Electrical power system apparatus",,,,,,,,,,,,,,,,,,,,,,,,,,,No,,,Yes,,,No,Yes,,,No,-111.27931,0,1,0,0,0,0,0,0,0,0,0,0,0,1,0,0,0,0,0,0,0,0,0,0,0,0,0,0,0,8,0,1,0,0
802,INC2015-098,Release of Substance,8/24/2015,Fort Nelson,"Westcoast Energy Inc., carrying on business as Spectra Energy Transmission",Closed,58.65324554,135,Natural Gas - Sour,Gas,Yes,2015,2015-07-10,2015/07/10 12:00:00 PM Pacific,,Processing,Operation,Employee / Contractor (Onsite),4/7/2016,Yes,No,Natural Gas - Sour,135,No,No,,,,,,,,,,,0,PPR,,,,,FORT NELSON GAS PLANT (FNGP),,58.65324554,-122.6848231,Canada,Yes,No,No,No,3,,Level I,Standard Review - 168 days,No,,"Processing Plant, Inlet",,,,,,,,,,,,,,,,,,,,,,,,,,,No,,,No,,,No,No,,,No,-122.6848231,1,0,0,1,0,0,0,0,0,0,0,0,0,1,0,0,0,0,0,0,0,0,0,0,0,0,0,0,0,7,0,1,0,0
803,INC2015-100,Release of Substance,8/27/2015,Iroquois,TransCanada PipeLines Limited,Closed,44.889561,0.01,Natural Gas - Sweet,Gas,No,2015,2015-08-25,2015/08/25 08:00:00 AM Mountain,No pipeline interruption,Transmission,Operation,Employee / Contractor (Onsite),2/10/2016,Yes,No,Natural Gas - Sweet,0.01,No,No,,,,,,,,,,,0,OPR,Line 100-2 (Montreal),,,,,Meter,,,Canada,Yes,No,No,No,3,,Level I,Standard Review - 168 days,No,,"Pipeline, Fitting, Nipple, Thread",90-92,NPS 1/2,Carbon Steel,241 - B,80,3.7 mm = 0.146 in,,3.7,6895,,6895,,,,,2012,,,,,,,,,,,No,,,No,7/3/2014,Visual,Yes,No,8/28/2015,Testing of Functionality,Yes,-75.295674,1,0,0,0,0,1,0,0,0,0,0,0,0,1,0,0,0,0,0,0,0,0,0,0,0,0,0,0,0,8,0,1,0,0
804,INC2015-101,Fire,8/28/2015,Smoky Lake,NOVA Gas Transmission Ltd.,Closed,54.095881,0,Not Applicable,Not Applicable,No,2015,2015-08-28,2015/08/28 07:15:00 AM Mountain,No pipeline interruption,Transmission,Operation,Employee / Contractor (Onsite),2/28/2017,Yes,No,,,,No,,Other Event (Nature or 3rd Party),,,,,,,,,0,OPR,FLAT LAKE LOOP #2 (SMOKY LAKE SECTION) - NPS 20,508,27.77458198,Natural Gas,,Meter,,,Canada,Yes,No,No,No,3,,Level I,Standard Review - 168 days,No,,"Station/Facility, Compression, Valve, Plug, Seal/Packing",,NPS 3,Carbon Steel,,,,,,,,,,,,1994,1994,,,,,,,,,,,No,,,No,10/1/2014,Visual,Yes,No,10/1/2014,Testing of Functionality,Yes,-112.305035,0,1,0,0,0,0,0,0,0,0,0,0,0,0,0,0,1,0,0,0,0,0,0,0,0,0,0,0,0,8,0,1,0,0
805,INC2015-102,Explosion,8/30/2015,Chetwynd,"Westcoast Energy Inc., carrying on business as Spectra Energy Transmission",Closed,55.6499,0,Not Applicable,Not Applicable,No,2015,2015-08-30,2015/08/30 07:30:00 AM Mountain,No pipeline interruption,Transmission,Operation,Employee / Contractor (Onsite),6/20/2017,Yes,No,,,,No,Under Investigation or Unknown,,,,,,,,,,0,OPR,"SPECTRA - 30"" MAINLINE","168.30000000, 762.00000000",1274.364117,"Natural Gas, Natural Gas Sweet",WILLOW FLATS (STN 2) (2),,55.64990496,-122.2072164,Canada,Yes,No,No,No,3,,Level I,Standard Review - 168 days,No,,"Station/Facility, Compression, Auxiliary device(s) (please explain)",,,,,,,,,,,,,,,,,,,,,,,,,,,No,,,No,,,No,No,,,No,-122.20722,0,0,0,1,0,0,0,0,0,0,0,0,0,1,0,0,0,0,0,0,0,0,0,0,0,0,0,0,0,8,0,1,0,0
806,INC2015-103,Release of Substance,8/31/2015,"Mackenzie, BC","Westcoast Energy Inc., carrying on business as Spectra Energy Transmission",Closed,55.42619,92300,Natural Gas - Sweet,Gas,Yes,2015,2015-08-29,2015/08/29 01:00:00 AM Pacific,No pipeline interruption,Transmission,Operation,Employee / Contractor (Onsite),4/7/2016,Yes,No,Natural Gas - Sweet,92300,No,No,,,,,,,,,,,0,OPR,"SPECTRA - 30"" MAINLINE","168.30000000, 762.00000000",1274.364117,"Natural Gas, Natural Gas Sweet",AZOUZETTA (2B),,55.42618861,-122.6765754,Canada,No,Yes,No,No,3,,Level I,Standard Review - 168 days,No,,"Station/Facility, Compression, Electrical power system apparatus",,,,,,,,,,,,,,,,,,,,,,,,,,,No,,,No,,,No,No,,,No,-122.67658,1,0,0,1,0,0,0,0,0,0,0,0,1,0,0,0,0,0,0,0,0,0,0,0,0,0,0,0,0,8,0,1,0,0
807,INC2015-104,Release of Substance,9/6/2015,"St.Paul, Alberta",NOVA Gas Transmission Ltd.,Closed,53.914064,9510,Natural Gas - Sweet,Gas,No,2015,,2015/09/06 10:00:00 AM Mountain,Short-term interruption,Transmission,Operation,Scheduled Patrol,8/2/2017,Yes,No,Natural Gas - Sweet,9510,Yes,No,,,,,,,,,,,0,OPR,SADDLE LAKE WEST LATERAL - NPS 6,168.3,13.39145112,Natural Gas,,,,,Canada,No,No,Yes,No,3,4.16 km,Level I,Standard Review - 168 days,No,"INC2015-095, INC2015-107, INC2015-127","Pipeline, Pipe, Body",,NPS 6,Carbon Steel,,,3.2 mm = 0.126 in,,3.1,8270,5897,6770,,1.6,,1976,1976,-1677,,Straight,Electric Resistance Welded,,External,Polyethylene Tape Wrap,Disbonded,Field Applied,1976,No,Replacement,9/12/2015,Yes,,,No,Yes,,,No,-111.700742,1,1,0,0,0,0,0,0,0,0,0,0,0,0,0,0,0,1,0,0,0,0,0,0,0,0,0,0,0,9,0,0,1,0
808,INC2015-105,Release of Substance,9/11/2015,Goldboro,EnCana Corporation,Closed,45.177234,198,Natural Gas - Sweet,Gas,No,2015,,2015/09/09 10:30:00 AM Atlantic,No pipeline interruption,Transmission,Operation,Inspection Site Visit,3/30/2016,Yes,No,Natural Gas - Sweet,198,No,No,,,,,,,,,,,0,OPR,Deep Panuke,610,183.0652053,Natural Gas,,,,,Canada,Yes,No,No,No,3,,Level I,Standard Review - 168 days,No,,"Pipeline, Auxiliary device(s) (please explain)",,,,,,,,,14400,,,,,2009,2010,2013,,,,,,,,,,,No,Replacement,9/22/2015,Yes,,,No,Yes,,,No,-61.62299574,1,0,0,0,0,0,0,1,0,0,0,0,0,0,0,1,0,0,0,0,0,0,0,0,0,0,0,0,0,9,0,0,1,0
809,INC2015-107,Release of Substance,9/13/2015,Bruce,NOVA Gas Transmission Ltd.,Closed,53.195074,9744,Natural Gas - Sweet,Gas,No,2015,,2015/09/13 03:06:00 PM Mountain,No pipeline interruption,Transmission,Operation,Scheduled Patrol,12/7/2016,Yes,No,Natural Gas - Sweet,9744,Yes,No,,,,,,,,,,,0,OPR,VIKING WEST LATERAL - NPS 6,168.3,8.09255576,Natural Gas,,,,,Canada,No,No,Yes,No,3,KP 8.16,Level I,Standard Review - 168 days,No,"INC2015-095, INC2015-104, INC2015-127, INC2016-149","Pipeline, Pipe, Body",CSA Z245.3 Gr. 46 (1972),NPS 6,Carbon Steel,317 - X46,,3.2 mm = 0.126 in,,3.1,8613,,7720,,,,1973,1974,-688,Long Seam (Longitudinal),Straight,Electric Resistance Welded,11 o'clock,External,Poly Vinyl Chloride (PVC),Disbonded,Field Applied,1973,No,Replacement,9/19/2015,Yes,,,No,No,,Replacement,No,-111.90868,1,1,0,0,0,0,0,0,0,0,0,0,0,0,1,0,0,0,0,0,0,0,0,0,0,0,0,0,0,9,0,0,1,0
810,INC2015-108,Release of Substance,9/14/2015,City of Regina,Enbridge Pipelines Inc.,Closed,50.482928,0.0001,Natural Gas Liquids,Gas,No,2015,2015-09-14,2015/09/14 12:50:00 AM Central,Short-term interruption,Transmission,Operation,Other Control System,11/9/2017,Yes,No,Natural Gas Liquids,0.0001,No,No,,,,,,,,,,,0,OPR,Line 1,"508.00000000, 864.00000000",1255.999121,Crude Oil,,Meter,,,Canada,Yes,No,No,No,4,704.200654,Level I,Standard Review - 168 days,No,,"Station/Facility, Pumping, Valve, Ball, Other (please explain)",,,,,,,,,,,,,,,,,,,,,,,,,,,No,,,No,,,No,No,,,No,-104.586263,1,0,0,0,1,0,0,0,0,0,0,0,0,1,0,0,0,0,0,0,0,0,0,0,0,0,0,0,0,9,0,0,1,0
811,INC2015-110,Release of Substance,9/18/2015,Fort Nelson,"Westcoast Energy Inc., carrying on business as Spectra Energy Transmission",Closed,58.65324554,11.611,Natural Gas - Sour,Gas,Yes,2015,2015-09-16,2015/09/16 11:00:00 PM Pacific,,Processing,Maintenance,Employee / Contractor (Onsite),12/14/2015,Yes,No,Natural Gas - Sour,11.611,No,No,,,,,,,,,,,0,PPR,,,,,FORT NELSON GAS PLANT (FNGP),,58.65324554,-122.6848231,Canada,Yes,No,No,No,3,,Level I,Standard Review - 168 days,No,INC2015-071,"Processing Plant, Flare",,,,,,,,,,,,,,,,,,,,,,,,,,,No,,,No,,,No,No,,,No,-122.6848231,1,0,0,1,0,0,0,0,0,0,0,0,0,0,0,0,0,0,1,0,0,0,0,0,0,0,0,0,0,9,0,0,1,0
812,INC2015-112,Release of Substance,9/24/2015,"Moncton, NB",Maritimes & Northeast Pipeline Management Ltd.,Closed,46.11317,0.0001,Odourant,Miscellaneous,No,2015,2015-09-22,2015/09/22 01:34:00 AM Atlantic,No pipeline interruption,Transmission,Operation,3rd Party / Other Company,10/23/2015,Yes,No,Odourant,0.0001,No,No,,,,,,,,,,,0,OPR,Moncton lateral,219.1,12.44337836,Natural Gas,,,,,Canada,No,No,No,No,4,12,Level I,Standard Review - 168 days,No,,"Station/Facility, Metering, Delivering, Valve, Ball, Stem",,,,,,,,,,,,,,,,,,,,,,,,,,,No,,,No,,,No,No,,,No,-64.71534,1,0,0,0,0,0,1,0,0,0,0,0,0,0,0,0,0,0,0,1,0,0,0,0,0,0,0,0,0,9,0,0,1,0
813,INC2015-113,Release of Substance,9/29/2015,"Hasler BC , Chetwynd BC","Westcoast Energy Inc., carrying on business as Spectra Energy Transmission",Closed,55.571,32.6,Natural Gas - Sour,Gas,Yes,2015,2015-09-28,2015/09/28 03:55:00 PM Pacific,,Processing,Operation,Employee / Contractor (Onsite),5/16/2017,Yes,No,Natural Gas - Sour,32.6,Yes,No,,,,,,,,,,,0,PPR,,,,,,,,,Canada,Yes,No,No,No,3,0,Level I,Standard Review - 168 days,No,SO2015-013,"Processing Plant, Sulphur plant",,,,,,,,,,,,,,,,,,,,,,,,,,,No,,,No,,,No,No,,,No,-121.94,1,0,0,1,0,0,0,0,0,0,0,0,0,1,0,0,0,0,0,0,0,0,0,0,0,0,0,0,0,9,0,0,1,0
814,INC2015-114,Release of Substance,10/1/2015,"Alameda, Saskatchewan",Alliance Pipeline Ltd.,Closed,49.325059,1,Natural Gas - Sweet,Gas,No,2015,2015-09-30,2015/09/30 06:40:00 PM Mountain,No pipeline interruption,Transmission,Operation,Employee / Contractor (Onsite),5/18/2016,Yes,No,Natural Gas - Sweet,1,No,No,,,,,,,,,,,0,OPR,MAINLINE,"1067.00000000, 914.00000000",1551.609274,Natural Gas,ALAMEDA,,49.32403226,-102.2963632,Canada,Yes,No,No,No,3,1494.1,Level I,Standard Review - 168 days,No,,"Station/Facility, Compression, Valve, Pressure relief, Other (please explain)",CSA Z245.13 - 1996,NPS 3/8,Stainless Steel,,,,,,12017,,,,,,2000,2000,,,,,,,,,,,No,,,No,,,No,No,,,No,-102.297403,1,0,0,0,1,0,0,0,0,0,0,0,0,1,0,0,0,0,0,0,0,0,0,0,0,0,0,0,0,9,0,0,1,0
815,INC2015-115,Release of Substance,10/9/2015,"Alameda, Saskatchewan",Alliance Pipeline Ltd.,Closed,49.325059,1,Natural Gas - Sweet,Gas,No,2015,2015-10-08,2015/10/08 06:00:00 AM Mountain,No pipeline interruption,Transmission,Operation,Other Control System,5/18/2016,Yes,No,Natural Gas - Sweet,1,No,No,,,,,,,,,,,0,OPR,MAINLINE,"1067.00000000, 914.00000000",1551.609274,Natural Gas,ALAMEDA,,49.32403226,-102.2963632,Canada,Yes,No,No,No,3,1494.11,Level I,Standard Review - 168 days,No,,"Station/Facility, Compression, Fitting, Nipple, Thread",ASME B31.3-2014,NPS 1/2,Carbon Steel,241 - B,160,4.8 mm = 0.188 in,,,4516,,,,,,2015,2015,,,,,,,,,,,No,,,No,,,No,No,,,No,-102.297403,1,0,0,0,1,0,0,0,0,0,0,0,0,1,0,0,0,0,0,0,0,0,0,0,0,0,0,0,0,10,0,0,1,0
816,INC2015-116,Fire,10/14/2015,Sarnia,Enbridge Pipelines Inc.,Closed,42.95261483,0,Not Applicable,Not Applicable,No,2015,2015-10-14,2015/10/14 12:15:00 PM Eastern,No pipeline interruption,Transmission,Maintenance,Employee / Contractor (Onsite),2/22/2016,No,No,,,,No,,Equipment & Electrical,,,,,,,,,0,OPR,Line 6,762,2.06289138,Crude Oil,SARNIA TANK TERMINAL,,42.95261483,-82.37432685,Canada,Yes,No,No,No,3,2803.383,Level I,Standard Review - 168 days,No,,,,,,,,,,,,,,,,,,,,,,,,,,,,,No,,,No,,,No,No,,,No,-82.37432685,0,0,0,0,0,1,0,0,0,0,0,0,0,1,0,0,0,0,0,0,0,0,0,0,0,0,0,0,0,10,0,0,1,0
817,INC2015-118,Release of Substance,10/16/2015,"Cromer, MB",Enbridge Pipelines Inc.,Closed,49.752443,30,Crude Oil - Sweet,Liquid,No,2015,2015-10-15,2015/10/15 09:15:00 AM Mountain,Short-term interruption,Transmission,Maintenance,Employee / Contractor (Onsite),1/21/2016,No,No,Crude Oil - Sweet,30,No,No,,,,,,,,,,,0,OPR,,,,,,Valve,,,Canada,Yes,No,No,No,3,915.942,Level I,Standard Review - 168 days,No,,,,,,,,,,,,,,,,,,,,,,,,,,,,,No,,,No,,,No,No,,,No,-101.241633,1,0,1,0,0,0,0,0,0,0,0,0,0,1,0,0,0,0,0,0,0,0,0,0,0,0,0,0,0,10,0,0,1,0
818,INC2015-119,Serious Injury (CER or TSB),10/21/2015,"Vibank, Saskatchewan",Enbridge Pipelines Inc.,Closed,50.362699,0,Not Applicable,Not Applicable,Yes,2015,2015-10-17,2015/10/17 11:20:00 AM Mountain,No pipeline interruption,Transmission,Maintenance,Public,2/22/2016,Yes,No,,,,No,,,,,Fracture,1,,Yes,,,0,OPR,Line 4,"1219.00000000, 864.00000000, 914.00000000",1248.909872,Crude Oil,,,,,Canada,No,Yes,No,No,3,,Level I,Standard Review - 168 days,No,,Vehicle / mobile equipment,,,,,,,,,,,,,,,,,,,,,,,,,,,No,,,No,,,No,No,,,No,-104.045302,0,0,0,0,1,0,0,0,0,0,0,0,0,0,1,0,0,0,0,0,0,0,0,0,0,0,0,0,0,10,0,0,1,0
819,INC2015-120,Adverse Environmental Effects,10/25/2015,Fort McKay,NOVA Gas Transmission Ltd.,Closed,57.340222,0,Not Applicable,Not Applicable,Yes,2015,2015-10-23,2015/10/23 03:50:00 PM Mountain,No pipeline interruption,Transmission,Construction,Employee / Contractor (Onsite),9/17/2018,No,No,,,,No,,,,,,,,,,Frac Out into Water Body,0,OPR,ELLS RIVER EXTENSION - NPS 24,610,18.64514007,Natural Gas,,,,,Canada,No,No,Yes,Yes,3,0+600,Level I,Standard Review - 168 days,No,INC2015-125,,,,,,,,,,,,,,,,,,,,,,,,,,,,No,,,No,,,No,No,,,No,-111.671137,0,1,0,0,0,0,0,0,0,0,1,0,0,0,0,0,0,0,0,0,1,0,0,0,0,0,0,0,0,10,0,0,1,0
820,INC2015-121,Release of Substance,10/27/2015,Grande Prairie,NOVA Gas Transmission Ltd.,Closed,54.830122,1.22,Natural Gas - Sweet,Gas,No,2015,2015-10-26,2015/10/26 03:30:00 PM Mountain,Short-term interruption,Transmission,Operation,Employee / Contractor (Onsite),8/3/2017,Yes,No,Natural Gas - Sweet,1.22,No,No,,,,,,,,,,,2,OPR,GRANDE PRAIRIE MAINLINE LATERAL LOOP #2,914,31.31326365,Natural Gas,,Meter,,,Canada,Yes,No,No,No,3,,Level I,Standard Review - 168 days,No,,"Station/Facility, Compression, Valve, Ball, Other (please explain)",1978,NPS 36,Carbon Steel,241 - B,80,3.7 mm = 0.146 in,,,,,,,,,1978,1978,1182,,,,,,,,,,No,,,No,6/9/2014,Non-destructive examination (NDE),Yes,No,6/2/2014,Testing of Functionality,Yes,-118.645459,1,1,0,0,0,0,0,0,0,0,0,0,1,0,0,0,0,0,0,0,0,0,0,0,0,0,0,0,0,10,0,0,1,0
821,INC2015-122,Release of Substance,10/27/2015,Regina,Plains Midstream Canada ULC,Closed,50.481964,4,Crude Oil - Sweet,Liquid,No,2015,2015-10-27,2015/10/27 09:30:00 AM Central,Short-term interruption,Transmission,Maintenance,Employee / Contractor (Onsite),3/7/2017,No,No,Crude Oil - Sweet,4,No,No,,,,,,,,,,,0,OPR,Wascana (Regina/Poplar),323.9,173.2261665,Crude Oil,,,,,Canada,Yes,No,No,No,5,,Level I,Standard Review - 168 days,No,,,,,,,,,,,,,,,,,,,,,,,,,,,,,No,,,No,,,No,No,,,No,-104.568289,1,0,0,0,1,0,0,0,0,0,0,0,0,1,0,0,0,0,0,0,0,0,0,0,0,0,0,0,0,10,0,0,1,0
822,INC2015-123,Release of Substance,10/29/2015,Fort Mackay,NOVA Gas Transmission Ltd.,Closed,57.3426,1,Natural Gas - Sweet,Gas,No,2015,,2015/10/29 02:00:00 PM Mountain,No pipeline interruption,Transmission,Operation,Employee / Contractor (Onsite),5/16/2017,No,No,Natural Gas - Sweet,1,Yes,No,,,,,,,,,,,0,OPR,ELLS RIVER EXTENSION - NPS 24,610,18.64514007,Natural Gas,HORIZON SALES,,57.34260039,-111.7433668,Canada,Yes,No,No,No,3,,Level I,Standard Review - 168 days,No,,,,,,,,,,,,,,,,,,,,,,,,,,,,,No,,,No,,,No,No,,,No,-111.74337,1,1,0,0,0,0,0,0,0,0,0,0,1,0,0,0,0,0,0,0,0,0,0,0,0,0,0,0,0,10,0,0,1,0
823,INC2015-132,Release of Substance,11/17/2015,Chetwynd,"Westcoast Energy Inc., carrying on business as Spectra Energy Transmission",Closed,55.56909171,770,Hydrogen Sulphide,Miscellaneous,Yes,2015,2015-11-17,2015/11/17 10:36:00 AM Mountain,No pipeline interruption,Processing,Maintenance,Employee / Contractor (Onsite),6/16/2017,Yes,No,Hydrogen Sulphide,770,No,No,,,,,,,,,,,0,PPR,,,,,PINE RIVER GAS PLANT (PRGP),,55.56909171,-121.9446616,Canada,Yes,No,No,No,3,,Level I,Standard Review - 168 days,No,,"Processing Plant, Controls",,,,,,,,,,,,,,,,,,,,,,,,,,,No,,,Yes,,,No,Yes,,,No,-121.9446616,1,0,0,1,0,0,0,0,0,0,0,0,0,1,0,0,0,0,0,0,0,0,0,0,0,0,0,0,0,11,0,0,1,0
824,INC2015-124,Release of Substance,10/31/2015,Fort Nelson,"Westcoast Energy Inc., carrying on business as Spectra Energy Transmission",Closed,58.655,3.527,Potassium Carbonate,Miscellaneous,No,2015,2015-10-30,2015/10/30 01:30:00 AM Pacific,No pipeline interruption,Processing,Operation,Other Control System,9/17/2018,Yes,No,Potassium Carbonate,3.527,No,No,,,,,,,,,,,0,PPR,,,,,,,,,Canada,Yes,No,No,No,3,"Mile 285, Alaska Highway",Level I,Standard Review - 168 days,No,,"Processing Plant, Controls",,,,,,,,,,,,,,,,,,,,,,,,,,,No,,,No,,,No,No,,,No,-122.6899,1,0,0,1,0,0,0,0,0,0,0,0,0,1,0,0,0,0,0,0,0,0,0,0,0,0,0,0,0,10,0,0,1,0
825,INC2015-125,Adverse Environmental Effects,11/2/2015,Fort McKay ,NOVA Gas Transmission Ltd.,Closed,57.340222,0,Not Applicable,Not Applicable,Yes,2015,2015-11-01,2015/11/01 01:00:00 PM Mountain,No pipeline interruption,Transmission,Construction,Employee / Contractor (Onsite),4/11/2017,No,No,,,,No,,,,,,,,,,Frac Out into Water Body,0,OPR,ELLS RIVER EXTENSION - NPS 24,610,18.64514007,Natural Gas,,,,,Canada,No,No,Yes,Yes,3,0+600 ,Level I,Standard Review - 168 days,No,"INC2015-120, INC2015-128, INC2015-129, INC2015-130",,,,,,,,,,,,,,,,,,,,,,,,,,,,No,,,No,,,No,No,,,No,-111.677683,0,1,0,0,0,0,0,0,0,0,1,0,0,0,0,0,0,0,0,0,1,0,0,0,0,0,0,0,0,11,0,0,1,0
826,INC2015-126,Operation Beyond Design Limits,11/6/2015,"Gretna, MB",Enbridge Pipelines Inc.,Closed,49.015601,0,Not Applicable,Not Applicable,No,2015,,2015/11/05 09:05:00 PM Mountain,No pipeline interruption,Transmission,Operation,Employee / Contractor (Onsite),5/2/2017,No,No,,,,No,,,,,,,,,Over Pressure,,0,OPR,Line 3,"610.00000000, 864.00000000, 914.00000000, 914.40000000",2334.948756,Crude Oil,,,,,Canada,Yes,No,Yes,No,3,KP 1242.397 to KP 1245.182,Level I,Standard Review - 168 days,No,,,,,,,,,,,,,,,,,,,,,,,,,,,,,No,,,No,,,No,No,,,No,-97.554021,0,0,1,0,0,0,0,0,0,0,0,0,0,0,1,0,0,0,0,0,0,0,0,0,0,0,0,0,0,11,0,0,1,0
827,INC2015-127,Release of Substance,11/9/2015,CFB Wainwright,NOVA Gas Transmission Ltd.,Closed,52.61406,14075,Natural Gas - Sweet,Gas,No,2015,2015-11-08,2015/11/08 10:00:00 PM Mountain,No pipeline interruption,Transmission,Operation,Landowner,1/25/2017,Yes,No,Natural Gas - Sweet,14075,Yes,No,,,,,,,,,,,0,OPR,WAINWRIGHT LATERAL - NPS 10,273.1,35.73063204,Natural Gas,,,,,Canada,No,No,Yes,No,3,KP 6.8,Level I,Standard Review - 168 days,No,"INC2015-095, INC2015-104, INC2015-107, OM2016-033, OM2016-124","Pipeline, Pipe, Body",CSA Z245.3 Gr.52 (1972) ,NPS 10,Carbon Steel,359 - X52,,,4.1,4.2,8641,340,7135,,1.3,1972,1972,1973,-1146,,Straight,Electric Resistance Welded,6 o'clock,External,Polyethylene Tape Wrap,Disbonded,Field Applied,1972,No,Replacement,4/9/2016,Yes,,,No,Yes,,,No,-110.96464,1,1,0,0,0,0,0,0,0,0,0,0,0,0,1,0,0,0,0,0,0,0,0,0,0,0,0,0,0,11,0,0,1,0
828,INC2015-128,Adverse Environmental Effects,11/10/2015,Fort McKay,NOVA Gas Transmission Ltd.,Closed,57.34,0,Not Applicable,Not Applicable,Yes,2015,2015-11-07,2015/11/07 10:30:00 AM Mountain,No pipeline interruption,Transmission,Construction,Employee / Contractor (Onsite),4/11/2017,No,No,,,,No,,,,,,,,,,Frac Out into Water Body,0,OPR,ELLS RIVER EXTENSION - NPS 24,610,18.64514007,Natural Gas,,,,,Canada,No,No,Yes,Yes,3,0+600 ,Level I,Standard Review - 168 days,No,INC2015-125,,,,,,,,,,,,,,,,,,,,,,,,,,,,No,,,No,,,No,No,,,No,-111.68,0,1,0,0,0,0,0,0,0,0,1,0,0,0,0,0,0,0,0,0,1,0,0,0,0,0,0,0,0,11,0,0,1,0
829,INC2015-129,Adverse Environmental Effects,11/10/2015,Fort McKay,NOVA Gas Transmission Ltd.,Closed,57.3,0,Not Applicable,Not Applicable,Yes,2015,2015-11-09,2015/11/09 12:55:00 PM Mountain,No pipeline interruption,Transmission,Construction,Employee / Contractor (Onsite),4/11/2017,No,No,,,,No,,,,,,,,,,Frac Out into Water Body,0,OPR,ELLS RIVER EXTENSION - NPS 24,610,18.64514007,Natural Gas,,,,,Canada,No,No,Yes,Yes,3, 0+600 ,Level I,Standard Review - 168 days,No,"INC2015-125, INC2015-130",,,,,,,,,,,,,,,,,,,,,,,,,,,,No,,,No,,,No,No,,,No,-111.68,0,1,0,0,0,0,0,0,0,0,1,0,0,0,0,0,0,0,0,0,1,0,0,0,0,0,0,0,0,11,0,0,1,0
830,INC2015-130,Adverse Environmental Effects,11/10/2015,Fort McKay,NOVA Gas Transmission Ltd.,Closed,57.3,0,Not Applicable,Not Applicable,Yes,2015,2015-11-09,2015/11/09 02:30:00 PM Mountain,No pipeline interruption,Transmission,Construction,Employee / Contractor (Onsite),4/11/2017,No,No,,,,No,,,,,,,,,,Other Pollution (Contamination),0,OPR,ELLS RIVER EXTENSION - NPS 24,610,18.64514007,Natural Gas,,,,,Canada,No,No,Yes,Yes,3, 0+600 ,Level I,Standard Review - 168 days,No,"INC2015-125, INC2015-129",,,,,,,,,,,,,,,,,,,,,,,,,,,,No,,,No,,,No,No,,,No,-111.68,0,1,0,0,0,0,0,0,0,0,1,0,0,0,0,0,0,0,0,0,1,0,0,0,0,0,0,0,0,11,0,0,1,0
831,INC2015-133,Release of Substance,11/20/2015,Wonowon BC,"Westcoast Energy Inc., carrying on business as Spectra Energy Transmission",Closed,56.393465,0.001,Natural Gas - Sour,Gas,Yes,2015,2015-11-20,2015/11/20 03:00:00 PM Mountain,No pipeline interruption,Gathering,Operation,3rd Party / Other Company,3/1/2017,No,No,Natural Gas - Sour,0.001,No,No,,,,,,,,,,,0,OPR,"6"" Cache Creek Pipeline",168.3,11.6626029,Natural Gas Sour,,,,,Canada,Yes,No,No,No,3,0,Level I,Standard Review - 168 days,No,,,,,,,,,,,,,,,,,,,,,,,,,,,,,No,,,No,,,No,No,,,No,-121.3719,1,0,0,1,0,0,0,0,0,0,0,0,0,1,0,0,0,0,0,0,0,0,0,0,0,0,0,0,0,11,0,0,1,0
832,INC2015-138,Release of Substance,11/26/2015,"Chetwynd, BC","Westcoast Energy Inc., carrying on business as Spectra Energy Transmission",Closed,55.571824,2000,Amine,Miscellaneous,No,2015,2015-11-26,2015/11/26 11:22:00 AM Mountain,,Processing,Operation,Employee / Contractor (Onsite),6/20/2017,Yes,No,Amine,2000,No,No,,,,,,,,,,,55,PPR,,,,,,,,,Canada,Yes,No,No,No,3,,Level II,Category B,No,,"Processing Plant, Controls",,,,,,,,,,,,,,,,,,,,,,,,,,,No,,,Yes,,,No,Yes,,,No,-121.942698,1,0,0,1,0,0,0,0,0,0,0,0,0,1,0,0,0,0,0,0,0,0,0,0,0,0,0,0,0,11,0,0,1,0
833,INC2015-135,Release of Substance,11/23/2015,Fort Nelson,"Westcoast Energy Inc., carrying on business as Spectra Energy Transmission",Closed,58.66,58,Sulphur,Miscellaneous,No,2015,2015-11-23,2015/11/23 05:30:00 AM Mountain,No pipeline interruption,Processing,Operation,Employee / Contractor (Onsite),5/9/2017,No,No,Sulphur,58,No,No,,,,,,,,,,,0,PPR,,,,,,,,,Canada,Yes,No,No,No,3,Alaska Highway Mile 285,Level I,Standard Review - 168 days,No,,,,,,,,,,,,,,,,,,,,,,,,,,,,,No,,,No,,,No,No,,,No,-122.69,1,0,0,1,0,0,0,0,0,0,0,0,0,1,0,0,0,0,0,0,0,0,0,0,0,0,0,0,0,11,0,0,1,0
834,INC2015-136,Release of Substance,11/24/2015,Hazler,"Westcoast Energy Inc., carrying on business as Spectra Energy Transmission",Closed,55.56909171,0.075,Sulphur,Miscellaneous,No,2015,2015-11-23,2015/11/23 01:00:00 PM Mountain,,Processing,Operation,Employee / Contractor (Onsite),5/18/2016,Yes,No,Sulphur,0.075,No,No,,,,,,,,,,,0,PPR,,,,,PINE RIVER GAS PLANT (PRGP),,55.56909171,-121.9446616,Canada,Yes,No,No,No,3,,Level I,Standard Review - 168 days,No,,"Processing Plant, Sulphur plant",,,,,,,,,,,,,,,,,,,,,,,,,,,No,,,No,,,No,No,,,No,-121.9446616,1,0,0,1,0,0,0,0,0,0,0,0,0,1,0,0,0,0,0,0,0,0,0,0,0,0,0,0,0,11,0,0,1,0
835,INC2015-137,Fire,11/26/2015,Fox Creek,NOVA Gas Transmission Ltd.,Closed,54.445071,0,Not Applicable,Not Applicable,No,2015,2015-11-24,2015/11/24 11:40:00 PM Mountain,No pipeline interruption,Transmission,Construction,Employee / Contractor (Onsite),4/12/2016,Yes,No,,,,No,,Equipment & Electrical,,,,,,,,,0,OPR,,,,,,,,,Canada,No,Yes,Yes,No,3,17.5 km,Level I,Standard Review - 168 days,No,,Vehicle / mobile equipment,,,,,,,,,,,,,,,,,,,,,,,,,,,No,,,No,,,No,No,,,No,-117.697381,0,1,0,0,0,0,0,0,0,0,0,0,1,0,0,0,0,0,0,0,0,0,0,0,0,0,0,0,0,11,0,0,1,0
836,INC2015-139,Release of Substance,12/1/2015,Wilkesport,Plains Midstream Canada ULC,Closed,42.714906,0.3,Propane,Gas,No,2015,2015-12-01,2015/12/01 09:00:00 AM Eastern,Short-term interruption,Distribution,Operation,Other Control System,7/21/2016,Yes,No,Propane,0.3,No,No,,,,,,,,,,,0,OPR,Eastern Delivery System North (EDS-N) - Windsor-Sarnia,"273.10000000, 323.90000000",139.3459365,"Natural Gas Liquids, NGL-HVP (Propane,Butane)",,,,,Canada,Yes,No,Yes,No,3,,Level I,Standard Review - 168 days,No,,"Station/Facility, Pigging, Launching, Valve, Check, Seal/Packing",,,,,,,,,,,,,,,,,,,,,,,,,,,No,,,No,,,No,No,,,No,-82.358961,1,0,0,0,0,1,0,0,0,0,0,0,0,0,1,0,0,0,0,0,0,0,0,0,0,0,0,0,0,12,0,0,0,1
837,INC2015-140,Fire,12/4/2015,Fort McMurray,NOVA Gas Transmission Ltd.,Closed,55.9773,0,Not Applicable,Not Applicable,No,2015,2015-12-03,2015/12/03 09:43:00 AM Mountain,No pipeline interruption,Transmission,Construction,Employee / Contractor (Onsite),4/12/2016,Yes,No,,,,No,,Equipment & Electrical,,,,,,,,,0,OPR,,,,,,,,,Canada,No,No,No,No,3,5+200,Level I,Standard Review - 168 days,No,,Vehicle / mobile equipment,,,,,,,,,,,,,,,,,,,,,,,,,,,No,,,No,,,No,No,,,No,-112.0273,0,1,0,0,0,0,0,0,0,0,0,0,1,0,0,0,0,0,0,0,0,0,0,0,0,0,0,0,0,12,0,0,0,1
838,INC2015-141,Fire,12/4/2015,Fort McMurray,NOVA Gas Transmission Ltd.,Closed,56.0207,0,Not Applicable,Not Applicable,No,2015,2015-12-02,2015/12/02 08:45:00 PM Mountain,No pipeline interruption,Transmission,Construction,Employee / Contractor (Onsite),2/22/2016,Yes,No,,,,No,,Housekeeping,,,,,,,,,0,OPR,,,,,,,,,Canada,No,Yes,No,No,3,,Level I,Standard Review - 168 days,No,,Vehicle / mobile equipment,,,,,,,,,,,,,,,,,,,,,,,,,,,No,,,No,,,No,No,,,No,-112.18207,0,1,0,0,0,0,0,0,0,0,0,0,1,0,0,0,0,0,0,0,0,0,0,0,0,0,0,0,0,12,0,0,0,1
839,INC2015-142,Fire,12/5/2015,Fort McMurray,NOVA Gas Transmission Ltd.,Closed,55.9788,0,Not Applicable,Not Applicable,No,2015,2015-12-02,2015/12/02 02:30:00 PM Mountain,No pipeline interruption,Transmission,Construction,Employee / Contractor (Onsite),6/22/2016,No,No,,,,No,,Welding or Cutting,,,,,,,,,0,OPR,,,,,,,,,Canada,No,No,No,No,3,KP 1+000,Level I,Standard Review - 168 days,No,,,,,,,,,,,,,,,,,,,,,,,,,,,,,No,,,No,,,No,No,,,No,-111.98153,0,1,0,0,0,0,0,0,0,0,0,0,1,0,0,0,0,0,0,0,0,0,0,0,0,0,0,0,0,12,0,0,0,1
840,INC2015-143,Fire,12/10/2015,Brampton,TransCanada PipeLines Limited,Closed,43.746944,0,Not Applicable,Not Applicable,No,2015,2015-12-09,2015/12/09 11:20:00 AM Eastern,No pipeline interruption,Transmission,Construction,Employee / Contractor (Onsite),4/10/2017,Yes,No,,,,No,,Equipment & Electrical,,,,,,,,,0,OPR,,,,,,,,,Canada,No,No,Yes,No,3,KP 0+700,Level I,Standard Review - 168 days,No,,Vehicle / mobile equipment,,,,,,,,,,,,,,,,,,,,,,,,,,,No,,,No,,,No,No,,,No,-79.637222,0,0,0,0,0,1,0,0,0,0,0,0,1,0,0,0,0,0,0,0,0,0,0,0,0,0,0,0,0,12,0,0,0,1
841,INC2015-144,Release of Substance,12/11/2015,Ile Des Chene,TransCanada PipeLines Limited,Closed,49.72011504,1,Natural Gas - Sweet,Gas,No,2015,,2015/12/11 10:00:00 AM Central,No pipeline interruption,Transmission,Operation,Employee / Contractor (Onsite),11/10/2016,Yes,No,Natural Gas - Sweet,1,No,No,,,,,,,,,,,0,OPR,LINE 100-1,"508.00000000, 762.00000000, 863.60000000",2595.724534,Natural Gas,STN 41 - ILE DES CHENES,,49.72011504,-96.98386154,Canada,Yes,No,No,No,3,70.2 Meters,Level I,Standard Review - 168 days,No,,"Pipeline, Fitting, Branch connection, Thread","Vendor OEM part, Cooper RFBB-30 Compressor Package with RR Avon 76G Engine.",,Stainless Steel,,,,,,,,,,,,,,,,,,,,,,,,No,,,No,,,No,Yes,,,No,-96.98386154,1,0,1,0,0,0,0,0,0,0,0,0,0,0,1,0,0,0,0,0,0,0,0,0,0,0,0,0,0,12,0,0,0,1
842,INC2015-145,Operation Beyond Design Limits,12/11/2015,Hardisty AB,Enbridge Pipelines Inc.,Closed,52.637564,0,Not Applicable,Not Applicable,No,2015,2015-12-11,2015/12/11 06:57:00 PM Mountain,Short-term interruption,Transmission,Operation,SCADA,3/2/2017,Yes,No,,,,No,,,,,,,,,Over Pressure,,0,OPR,Line 2,"1219.00000000, 609.40000000, 610.00000000",1282.304863,Crude Oil,Hardisty Pump Station,,,,Canada,Yes,No,No,No,4,109.02,Level I,Standard Review - 168 days,No,INC2016-004,,,,,,,,,,,,,,,,,,,,,,,,,,,,No,,,No,,,No,No,,,No,-111.27924,0,1,0,0,0,0,0,0,0,0,0,0,0,1,0,0,0,0,0,0,0,0,0,0,0,0,0,0,0,12,0,0,0,1
843,INC2016-006,Release of Substance,1/6/2016,Fort Nelson,"Westcoast Energy Inc., carrying on business as Spectra Energy Transmission",Closed,58.65324554,2.9,Contaminated Water,Miscellaneous,No,2016,2016-01-05,2016/01/05 12:15:00 AM Mountain,,Processing,Operation,Employee / Contractor (Onsite),4/10/2017,Yes,No,Contaminated Water,2.9,No,No,,,,,,,,,,,0,PPR,,,,,FORT NELSON GAS PLANT (FNGP),,58.65324554,-122.6848231,Canada,Yes,No,No,No,3,,Level I,Standard Review - 168 days,No,,"Processing Plant, Sulphur plant",,,,,,,,,,,,,,,,,,,,,,,,,,,No,,,No,,,No,No,,,No,-122.6848231,1,0,0,1,0,0,0,0,0,0,0,0,0,1,0,0,0,0,0,0,0,0,0,0,0,0,0,0,0,1,0,0,0,1
844,INC2015-146,Operation Beyond Design Limits,12/12/2015,Rainbow Lake,NOVA Gas Transmission Ltd.,Closed,58.446355,0,Not Applicable,Not Applicable,No,2015,2015-12-11,2015/12/11 02:00:00 PM Mountain,No pipeline interruption,Transmission,Operation,SCADA,2/14/2017,Yes,No,,,,No,,,,,,,,,Inappropriate Product,,0,OPR,RAINBOW LAKE LATERAL - NPS 6,168.3,13.05985746,Natural Gas,,,,,Canada,Yes,No,No,No,3,,Level I,Standard Review - 168 days,No,,"Pipeline, Valve, Ball, Other (please explain)",CSA Standard Z662 (2002),NPS 8,Carbon Steel,241 - B,40,8.2 mm = 0.322 in,,,8450,,3880,,,,,1994,,Girth (Circumferential),Seamless,,,,,,,,No,,,No,5/1/2015,Visual,Yes,No,5/1/2016,Testing of Functionality,Yes,-119.22343,0,1,0,0,0,0,0,0,0,0,0,0,0,1,0,0,0,0,0,0,0,0,0,0,0,0,0,0,0,12,0,0,0,1
845,INC2015-147,Release of Substance,12/18/2015,"10.8 km south of Tumbler Ridge, BC","Westcoast Energy Inc., carrying on business as Spectra Energy Transmission",Closed,55.04185986,10.4,Natural Gas - Sour,Gas,Yes,2015,,2015/12/17 11:55:00 AM Mountain,No pipeline interruption,Gathering,Operation,Employee / Contractor (Onsite),5/16/2017,No,No,Natural Gas - Sour,10.4,No,No,,,,,,,,,,,0,OPR,"12"" Murray River Pipeline",323.9,16.21976901,Natural Gas,,,,,Canada,No,No,Yes,No,3,Recieving Barrel end of pipeline,Level I,Standard Review - 168 days,No,,,,,,,,,,,,,,,,,,,,,,,,,,,,,No,,,No,,,No,No,,,No,-121.0187559,1,0,0,1,0,0,0,0,0,0,0,0,1,0,0,0,0,0,0,0,0,0,0,0,0,0,0,0,0,12,0,0,0,1
846,INC2015-148,Fire,12/21/2015,Dawson Creek,"Westcoast Energy Inc., carrying on business as Spectra Energy Transmission",Closed,55.793649,0,Not Applicable,Not Applicable,No,2015,2015-12-20,2015/12/20 03:21:00 PM Mountain,No pipeline interruption,Processing,Operation,Employee / Contractor (Onsite),6/22/2016,No,No,,,,No,,Equipment & Electrical,,,,,,,,,0,PPR,,,,,,Meter,,,Canada,Yes,No,No,No,3,,Level I,Standard Review - 168 days,No,,,,,,,,,,,,,,,,,,,,,,,,,,,,,No,,,No,,,No,No,,,No,-120.522161,0,0,0,1,0,0,0,0,0,0,0,0,0,1,0,0,0,0,0,0,0,0,0,0,0,0,0,0,0,12,0,0,0,1
847,INC2015-150,Release of Substance,12/22/2015,Taylor,"Westcoast Energy Inc., carrying on business as Spectra Energy Transmission",Closed,56.146082,32,Water,Miscellaneous,No,2015,2015-12-22,2015/12/22 12:20:00 PM Mountain,No pipeline interruption,Processing,Maintenance,Employee / Contractor (Onsite),7/21/2016,Yes,No,Water,32,No,No,,,,,,,,,,,0,PPR,,,,,,,,,Canada,Yes,No,No,No,5,,Level I,Standard Review - 168 days,No,INC2016-020,"Processing Plant, Sulphur plant",,,,,,,,,,,,,,,,,,,,,,,,,,,No,,,No,,,No,No,,,No,-120.673492,1,0,0,1,0,0,0,0,0,0,0,0,0,1,0,0,0,0,0,0,0,0,0,0,0,0,0,0,0,12,0,0,0,1
848,INC2015-152,Fire,12/31/2015,Fort McMurray ,NOVA Gas Transmission Ltd.,Closed,56.04405,0,Not Applicable,Not Applicable,No,2015,2015-12-30,2015/12/30 02:45:00 PM Mountain,No pipeline interruption,Transmission,Construction,Employee / Contractor (Onsite),6/30/2016,No,No,,,,No,,Under Investigation or Unknown,,,,,,,,,0,OPR,,,,,,,,,Canada,No,Yes,No,No,3,33,Level I,Standard Review - 168 days,No,,,,,,,,,,,,,,,,,,,,,,,,,,,,,No,,,No,,,No,No,,,No,-112.43548,0,1,0,0,0,0,0,0,0,0,0,0,1,0,0,0,0,0,0,0,0,0,0,0,0,0,0,0,0,12,0,0,0,1
849,INC2016-001,Release of Substance,1/1/2016,Kingston,TransCanada PipeLines Limited,Closed,44.276915,1.21,Natural Gas - Sweet,Gas,No,2016,2016-01-01,2016/01/01 10:00:00 AM Eastern,No pipeline interruption,Transmission,Operation,Landowner,3/2/2017,Yes,No,Natural Gas - Sweet,1.21,No,No,,,,,,,,,,,0,OPR,LINE 100-1,"508.00000000, 762.00000000, 863.60000000",2595.724534,Natural Gas,,,,,Canada,Yes,No,No,No,3,MLV 140-1 + 7.415 km,Level I,Standard Review - 168 days,No,,"Station/Facility, Metering, Delivering, Valve, Ball, Body",,NPS 1,Stainless Steel,,,,,,,,,,,,,,,,,,,,,,,,No,,,No,9/29/2014,Visual,Yes,No,9/29/2014,Testing of Functionality,Yes,-76.876379,1,0,0,0,0,1,0,0,0,0,1,0,0,0,1,0,0,0,0,0,0,0,0,0,1,0,0,0,0,1,0,0,0,1
850,INC2016-002,Release of Substance,1/1/2016,"Taylor, British Columbia",Alliance Pipeline Ltd.,Closed,56.17397,72500,Natural Gas - Sweet,Gas,Yes,2016,2015-12-31,2015/12/31 04:22:00 PM Mountain,No pipeline interruption,Transmission,Operation,Landowner,5/9/2017,Yes,No,Natural Gas - Sweet,72500,No,No,,,,,,,,,,,0,OPR,FORT ST. JOHN LATERAL,610,86.59578756,Natural Gas,,Meter,,,Canada,Yes,No,No,No,3,0,Level I,Standard Review - 168 days,No,,"Station/Facility, Compression, Valve, Pressure relief, Other (please explain)",CSA Z662-07,,,,,,,,8250,,6760,,,,,,,,,,,,,,,,No,,,No,10/21/2015,Visual,Yes,No,10/21/2015,Repair,Yes,-120.60927,1,0,0,1,0,0,0,0,0,0,0,0,0,1,0,0,0,0,0,0,0,0,0,0,0,0,0,0,0,12,0,0,0,1
851,INC2016-003,Fire,1/2/2016,Sherwood Park,Enbridge Pipelines Inc.,Closed,53.54151,0,Not Applicable,Not Applicable,No,2016,2016-01-02,2016/01/02 07:30:00 AM Mountain,Short-term interruption,Transmission,Operation,Employee / Contractor (Onsite),4/19/2017,Yes,No,,,,No,,Equipment & Electrical,,,,,,,,,0,OPR,Line 1,"508.00000000, 864.00000000",1255.999121,Crude Oil,,Meter,,,Canada,Yes,No,No,No,3,0,Level I,Standard Review - 168 days,No,"INC2012-174, INC2015-022, INC2015-097, INC2016-122, INC2017-006","Station/Facility, Pumping, Electrical power system apparatus",,,,,,,,,,,,,,,,,,,,,,,,,,,No,,,Yes,,,No,Yes,,,No,-113.353867,0,1,0,0,0,0,0,0,0,0,0,0,0,1,0,0,0,0,0,0,0,0,0,0,0,0,0,0,0,1,0,0,0,1
852,INC2016-004,Operation Beyond Design Limits,1/4/2016,Edmonton,Enbridge Pipelines Inc.,Closed,53.544151,0,Not Applicable,Not Applicable,No,2016,2016-01-03,2016/01/03 07:22:00 PM Mountain,Short-term interruption,Transmission,Operation,SCADA,7/25/2016,Yes,No,,,,No,,,,,,,,,Over Pressure,,0,OPR,,,,,Edmonton,,,,Canada,Yes,No,No,No,5,,Level I,Standard Review - 168 days,No,INC2015-145,"Station/Facility, Pumping, Valve, Pressure relief",,NPS 1/2,Stainless Steel,,,,,,,,,,,2013,2014,2014,,,,,,,,,,,No,,,No,11/26/2015,Visual,Yes,Yes,,,No,-113.355103,0,1,0,0,0,0,0,0,0,0,0,0,0,1,0,0,0,0,0,0,0,0,0,0,0,0,0,0,0,1,0,0,0,1
853,INC2016-008,Operation Beyond Design Limits,1/13/2016,Oakville,Trans-Northern Pipelines Inc.,Closed,43.39419,0,Not Applicable,Not Applicable,No,2016,2016-01-13,2016/01/13 02:50:00 PM Eastern,Short-term interruption,Transmission,Operation,Other Control System,5/3/2017,Yes,No,,,,No,,,,,,,,,Over Pressure,,0,OPR,,,,,OAKVILLE STATION,,43.39419228,-79.73731816,Canada,Yes,No,No,No,5,596.3,Level I,Standard Review - 168 days,No,"INC2011-012, INC2011-129, INC2012-054, INC2013-101, INC2013-202, INC2013-203, INC2014-080, INC2014-123, INC2015-002, INC2015-034",,,,,,,,,,,,,,,,,,,,,,,,,,,,No,,,No,,,No,No,,,No,-79.73732,0,0,0,0,0,1,0,0,0,0,0,0,0,1,0,0,0,0,0,0,0,0,0,0,0,0,0,0,0,1,0,0,0,1
854,INC2016-010,Release of Substance,1/19/2016,"Manning, Alberta",NOVA Gas Transmission Ltd.,Closed,57.42235949,42,Natural Gas - Sweet,Gas,No,2016,2016-01-19,2016/01/19 10:30:00 AM Mountain,Short-term interruption,Transmission,Maintenance,Employee / Contractor (Onsite),10/20/2017,Yes,No,Natural Gas - Sweet,42,Yes,No,,,,,,,,,,,0,OPR,PEACE RIVER M/L (ZAMA LAKE TO VALLEYVIEW) - NPS 20,508,473.8243833,Natural Gas,,,,,Canada,No,No,Yes,No,3,KP 290.48,Level I,Standard Review - 168 days,No,,"Pipeline, Pipe, Girth weld", CSA Z245.3 Gr. 52 (1972) ,NPS 20,Carbon Steel,359 - X52,,5.6 mm = 0.219 in,,5.7,5650,4524,2832,,,,1973,1973,-805,Girth (Circumferential),,Electric Resistance Welded,9 o'clock,External,Polyethylene Tape Wrap,Disbonded,Field Applied,1973,No,Replacement,1/23/2016,No,6/18/2015,Inline Inspection (ILI),Yes,No,,Replacement,Yes,-118.2492217,1,1,0,0,0,0,0,0,0,0,0,0,1,0,0,0,0,0,0,0,0,0,0,0,0,0,0,0,0,1,0,0,0,1
855,INC2016-013,Fire,1/25/2016,Wabasca,NOVA Gas Transmission Ltd.,Closed,56.4861,0,Not Applicable,Not Applicable,No,2016,2016-01-21,2016/01/21 05:30:00 PM Mountain,No pipeline interruption,Transmission,Construction,Employee / Contractor (Onsite),10/20/2016,No,No,,,,No,,Welding or Cutting,,,,,,,,,0,OPR,PEERLESS LAKE LATERAL (VANDERSTEENE LAKE SECTION) - NPS 16,406.4,40.29355321,Natural Gas,WOODENHOUSE,,56.48610421,-114.117508,Canada,Yes,No,No,No,3,,Level I,Standard Review - 168 days,No,,,,,,,,,,,,,,,,,,,,,,,,,,,,,No,,,No,,,No,No,,,No,-114.11751,0,1,0,0,0,0,0,0,0,0,0,0,0,1,0,0,0,0,0,0,0,0,0,0,0,0,0,0,0,1,0,0,0,1
856,INC2016-015,Release of Substance,1/28/2016,None,"Westcoast Energy Inc., carrying on business as Spectra Energy Transmission",Closed,56.6442,15.23,Natural Gas - Sweet,Gas,No,2016,2015-12-19,2015/12/19 03:38:00 PM Mountain,No pipeline interruption,Transmission,Maintenance,Employee / Contractor (Onsite),5/18/2017,Yes,No,Natural Gas - Sweet,15.23,No,No,,,,,,,,,,,0,OPR,Rigel,,,,,,,,Canada,No,No,No,No,3,,Level I,Standard Review - 168 days,No,,"Station/Facility, Compression, Compressor",,,,,,,,,,,,,,,,,,,,,,,,,,,No,,,No,,,No,No,,,No,-120.81235,1,0,0,1,0,0,0,0,0,0,0,0,0,0,0,0,0,1,0,0,0,0,0,0,0,0,0,0,0,12,0,0,0,1
857,INC2016-019,Release of Substance,2/4/2016,Taylor,"Westcoast Energy Inc., carrying on business as Spectra Energy Transmission",Closed,56.083,6380,Natural Gas - Sweet,Gas,No,2016,2016-02-03,2016/02/03 04:30:00 PM Mountain,No pipeline interruption,Gathering,Operation,Employee / Contractor (Onsite),3/31/2017,No,No,Natural Gas - Sweet,6380,No,No,,,,,,,,,,,0,OPR,"30"" Fort Nelson Mainline",762,72.67380765,Natural Gas Sweet,,Meter,,,Canada,Yes,No,No,No,3,0,Level I,Standard Review - 168 days,No,,,,,,,,,,,,,,,,,,,,,,,,,,,,,No,,,No,,,No,No,,,No,-120.404,1,0,0,1,0,0,0,0,0,0,0,0,0,1,0,0,0,0,0,0,0,0,0,0,0,0,0,0,0,2,0,0,0,1
858,INC2016-018,Release of Substance,2/4/2016,Taylor,"Westcoast Energy Inc., carrying on business as Spectra Energy Transmission",Closed,56.146137,853,Natural Gas - Sour,Gas,Yes,2016,2016-02-03,2016/02/03 04:03:00 PM Mountain,No pipeline interruption,Processing,Operation,Employee / Contractor (Onsite),6/15/2017,Yes,No,Natural Gas - Sour,853,No,No,,,,,,,,,,,0,PPR,,,,,,,,,Canada,Yes,No,No,No,5,,Level I,Standard Review - 168 days,No,,"Processing Plant, Controls",,,,,,,,,,,,,,,,,,,,,,,,,,,No,,,Yes,,,No,Yes,,,No,-120.670787,1,0,0,1,0,0,0,0,0,0,0,0,0,1,0,0,0,0,0,0,0,0,0,0,0,0,0,0,0,2,0,0,0,1
859,INC2016-020,Release of Substance,2/5/2016,.5 km,"Westcoast Energy Inc., carrying on business as Spectra Energy Transmission",Closed,56.141402,5,Water,Miscellaneous,No,2016,2016-02-04,2016/02/04 04:00:00 AM Mountain,No pipeline interruption,Processing,Operation,Employee / Contractor (Onsite),10/18/2016,No,No,Water,5,Yes,No,,,,,,,,,,,0,PPR,"26"" BC Trunk Pipeline - Downstream",660.4,59.6331221,Natural Gas Sour,,,,,Canada,Yes,No,No,No,4,,Level I,Standard Review - 168 days,No,INC2015-150,,,,,,,,,,,,,,,,,,,,,,,,,,,,No,,,No,,,No,No,,,No,-120.669325,1,0,0,1,0,0,0,0,0,0,1,0,0,0,0,0,0,0,1,0,0,0,0,0,1,0,0,0,0,2,0,0,0,1
860,INC2016-021,Release of Substance,2/9/2016,Hasler,"Westcoast Energy Inc., carrying on business as Spectra Energy Transmission",Closed,55.569092,13.23,Natural Gas - Sour,Gas,Yes,2016,2016-02-08,2016/02/08 02:02:00 PM Mountain,No pipeline interruption,Processing,Operation,Employee / Contractor (Onsite),12/6/2017,Yes,No,Natural Gas - Sour,13.23,No,No,,,,,,,,,,,0,PPR,Grizzly Loop Pipeline,610,40.81503221,Natural Gas Sour,,,,,Canada,Yes,No,No,No,3,,Level I,Standard Review - 168 days,No,,"Processing Plant, Sulphur plant",,,,,,,,,,,,,,,,,,,,,,,,,,,No,,,No,,,No,No,,,No,-121.944662,1,0,0,1,0,0,0,0,0,0,0,0,0,1,0,0,0,0,0,0,0,0,0,0,0,0,0,0,0,2,0,0,0,1
861,INC2016-022,Release of Substance,2/10/2016,Strome,Enbridge Pipelines Inc.,Closed,52.933313,0.001,Natural Gas Liquids,Gas,No,2016,2016-02-10,2016/02/10 10:12:00 AM Mountain,Short-term interruption,Transmission,Operation,Employee / Contractor (Onsite),11/14/2016,Yes,No,Natural Gas Liquids,0.001,No,No,,,,,,,,,,,0,OPR,Line 1,"508.00000000, 864.00000000",1255.999121,Crude Oil,,Meter,,,Canada,Yes,No,No,No,3,112.187,Level I,Standard Review - 168 days,No,,"Station/Facility, Pumping, Flange, Gasket/O-ring",,,,,,,,,,,,,,,,,,,,,,,,,,,No,,,No,1/26/2016,Visual,Yes,No,1/26/2016,Replacement,Yes,-112.082122,1,1,0,0,0,0,0,0,0,0,0,0,0,0,1,0,0,0,0,0,0,0,0,0,0,0,0,0,0,2,0,0,0,1
862,INC2016-023,Release of Substance,2/12/2016,Dartmouth,Maritimes & Northeast Pipeline Management Ltd.,Closed,44.6777652,0.5,Natural Gas - Sweet,Gas,No,2016,2016-02-12,2016/02/12 02:00:00 PM Atlantic,No pipeline interruption,Transmission,Operation,Employee / Contractor (Onsite),6/21/2017,Yes,No,Natural Gas - Sweet,0.5,No,No,,,,,,,,,,,0,OPR,Halifax Lateral,323.9,126.1401343,Natural Gas,,,,,Canada,No,No,No,No,5,124.4,Level I,Standard Review - 168 days,No,,"Station/Facility, Metering, Delivering, Valve, Ball, Stem",CSA Z662-99,NPS 10,Stainless Steel,,,,,,,,,,,,,,,,,,,,,,,,No,,,No,,,No,No,,,No,-63.5970225,1,0,0,0,0,0,0,1,0,0,0,0,0,1,0,0,0,0,0,0,0,0,0,0,0,0,0,0,0,2,0,0,0,1
